Band,Lyrics,Song
Sammie,"Baby, I'm tryna step to you and be a man about it
And express myself, my pride just won't allow it
Couldn't help it for (the life of me)
Girl I was so (triflin')
I can't believe the things I did to you
I'm not here to say I'm sorry over and over
And I'm not gonna spit no game trying to get over
Girl I'm at your mercy
Do what you will with me
Before you walk away, just listen

Wish I could press rewind and take away the pain
If things were worth it then you wouldn't appreciate it
What I'm about to (do for you)
Throw myself off this (bridge for you)
I'm tripping cause I'm about to (loose my boo)
Girl I plea insanity

Baby, please forgive me
For everything that I did
I was acting just like a kid
Baby, please forgive me
I promise to tell the truth
Girl I'm gone' do right by you
Baby, please forgive me
For not answering your call
When I was out tryna 
Baby, please forgive me
All I'm asking for, asking for
Is another last chance

I know you said
The last time we tried was the final time
And if you don't believe me listen to my eyes
How can I make you (understand)
Baby Imma (changed man)
It'll kill me if you tell me that (you're through)
Been suffering and I can't take it no longer
I can't be the dude who's watching you at the alter
With another man to be
When I know it should be me, hearing you say

Wish I could press rewind and take away the pain
If things were worth it then you wouldn't appreciate it
What I'm about to (do for you)
Throw myself off this (bridge for you)
Just cause I'm about to (loose my boo)
Ooh, girl forgive me

Baby, please forgive me
For everything that I did
I was acting just like a kid
Baby, please forgive me
I promise to tell the truth
Girl I'm gone' do right by you
Baby, please forgive me
For not answering your call
When I was out tryna 
Baby, please forgive me
All I'm asking for, asking for
Is another last chance

Girl I'm sorry
For all the pain I sent your way baby
Girl I'm sorry
For sleepless nights, the teary eyes I made
Girl I'm sorry
For not answering for not catching you when you'd fallen
But I promise from this day on
Imma be the man you need
Baby please,

Baby, please forgive me
For everything that I did
I was acting just like a kid
Baby, please forgive me
I promise to tell the truth
Girl I'm gone' do right by you
Baby, please forgive me
For not answering your call
When I was out tryna 
Baby, please forgive me
All I'm asking for, asking for
Is another last chance

Baby, please forgive me
For everything that I did
I was acting just like a kid
Baby, please forgive me
I promise to tell the truth
Girl I'm gone' do right by you
Baby, please forgive me
For not answering your call
When I was out tryna 
Baby, please forgive me
All I'm asking for, asking for
Is another last chance",Another Last Chance
Sammie,"[Incomprehensible]

Ain't it funny how life goes down?
You moved away with your parents to another town
Ain't seen you since we were little kids
Now that you're back in the hood I can't believe it

We used to ride in the parking lot
Eating candy solving the world
Tryna play it out, bright lights, butterflies
That's what happen from the spot
It's been a minute since we broke up
Can we pick up where we left off?
Baby, tell me can we go?

Can we go
Back, back, back, back 2 love
Like, like we never gave it up
Can we go girl? Can we go girl?
Can we go back 2 love?

Can we go
Back, back, back, back 2 love
Like, like we never gave it up
Can we go girl? Can we go girl?
Can we go back 2 love?

Wish I've gone by the feelin' still remain
Baby girl, I've been hopin' that you feelin' the same
I'm so happy, God brought you back to me
Must be a sign baby tellin' us that we're meant to be

We used to ride in the parking lot
Eating candy solving the world
Tryna play it out, bright lights, butterflies
That's what happen from the spot
It's been a minute since we broke up
Can we pick up where we left off?
Baby, tell me can we go?

Can we go
Back, back, back, back 2 love
Like, like we never gave it up
Can we go girl? Can we go girl?
Can we go back 2 love?

Can we go
Back, back, back, back 2 love
Like, like we never gave it up
Can we go girl? Can we go girl?
Can we go back 2 love?

Baby, you can go back to
When you used to be my baby
And tell you all my secrets
How I wish you were my baby
And I'm so glad you're here with me
Baby, please tell me can we go back 2 love? Oh girl

Can we go
Back, back, back, back 2 love
Like, like we never gave it up
Can we go girl? Can we go girl?
Can we go back 2 love?

Can we go
Back, back, back, back 2 love
Like, like we never gave it up
Can we go girl? Can we go girl?
Can we go back 2 love?

Baby, baby
",Back 2 Love
Sammie,"You know what it is
This Sammie, really
Gotta turn this one up right here
Uh uh
Here's another one, oh oh
And another one
Oh oh, girl I know, yea, oh 
Listen

I ain't impressed girl
With all that talk about your man
Yea, I hear everything you're sayin but I know (I know)
That you deserve the best, girl
'cause I'm ya number one fan
I can't wait to get a ticket to your show

[Pre Chorus]
When you're out on the floor (Movin your body)
You make a playa wanna (touch your body)
You keep sayin that (you got somebody)
But I wanna be (that somebody)
Don't walk away, baby please stay
Do you like me, I just wanna play with you
But I ain't talkin' games, girl

[Chorus]
When you're ready to get down then girl choose me (choose me)
Choose me (Shawty is you choosin)
When you're ready to get down (get down) then girl choose me (choose me)
Choose me (Shawty is you choosin)

Now what's it gonna be baby
I won't stop til you say yes (say yes)
And girl I must confess that you are (you are)
That you're one of a kind baby
And I can't get enough
I can't wait til you chose me so I can show you girl what's up

[Pre Chorus]
When you're out on the floor (Movin your body)
You make a nigga wanna (touch your body)
You keep sayin that (you got somebody)
But I wanna be (that somebody, hey)
Don't walk away, baby please stay
Do you like me, I just wanna play with you
But I ain't talkin games, when you're

[Chorus]
When you're ready to get down then girl choose me (choose me)
Choose me (Shawty is you choosin, girl)
When you're ready to get down then girl choose me (you gotta choose me)
Choose me (Shawty is you choosin)

When you're ready to get down then girl choose me (hey, oh, when you ready baby, choose me)
Choose me (Shawty is you choosin, yeah)
When you're ready to get down then girl choose me (when you ready girl, oh, choose me)
Choose me (Shawty is you choosin, yeah)

Break it down

I wanna get you alone girl
I know that's what you want, girl (Is that what you want shawty)
So I can show you how I do
Go head and leave ya crew
Tell them you got betta things to do (uh huh)
Like comin with me
Shawty tell me is you choosin

Shawty is you choosin me, shawty is you choosin me
Can you handle that
Shawty is you choosin me, shawty is you choosin me
(Sing it Sammie)

[Chorus]
When you're ready to get down then girl choose me (choose me)
Choose me (Shawty is you choosin, hey)
When you're ready to get down then girl choose me (you got me sick like cancer, I won't take me for an answer, choose me, ha)
Choose me (Shawty is you choosin)

When you're ready to get down then girl choose me (are you ready to get down, choose me)
Choose me (Shawty is you choosin)
When you're ready to get down then girl choose me (are you choosin, are you choosin me, choose me)
Choose me (Shawty is you choosin, shawty)

Yeah yeah
",Choose Me (Prelude)
Sammie,"O no, no
I know you think it ain't my place
To say how I feel
But I'm gonna say it anyway
'Cause I gotta keep it real
I know you're tired of trying to make it be
Something that's truly not (truly not)
Girl, it kills me everyday to see you in tears
And it amazes me the way you put up all these years
You be tweaking, tryin' a make it work, but you keepin' in a hurt
Oh baby, listen to me

You don't have to wait
I can ease your pain
You don't have to be left out in the rain
Don't just say you're fed up, tired of love
Whatever you need, I got it; come with me
You don't have to stay up waiting by the phone
You don't have to ever feel like you're alone
Don't just say you're fed up, tired of love
Whatever you need, I got it; come with me

You're the type that always said
You don't need a man who's gonna make your heart stop over and again
And now you're telling me that you're okay
But you don't realize you're getting more pain than gain
And I ain't never been the kind to steer you wrong
If you trust me as a friend, then trust me with your heart
Girl, (trust me)
It don't take a lot to understand
You need yourself another man

You don't have to wait
I can ease your pain
You don't have to be left out in the rain
Don't just say you're fed up, tired of love
Whatever you need, I got it; come with me
You don't have to stay up waiting by the phone
You don't have to ever feel like you're alone
Don't just say you're fed up, tired of love
Whatever you need, I got it; come with me

Don't give up, girl
Don't give up, girl
Don't give up, girl
You don't have to do it, baby

Don't give up, girl
Don't give up, girl
Don't give up, girl
You don't have to do it, baby

Don't give up, girl
Don't give up, girl
Don't give up, girl
You don't have to do it, baby

Don't give up, girl
Don't give up, girl
Don't give up, girl
You don't have to do it, baby

You don't have to wait
I can ease your pain
You don't have to be left out in the rain
Don't just say you're fed up, tired of love
Whatever you need, I got it; come with me
You don't have to stay up waiting by the phone
You don't have to ever feel like you're alone
Don't just say you're fed up, tired of love
Whatever you need, I got it; come with me

Aw, baby
Don't give up on love, shorty
Because I'm here
I'm here",Come with Me
Sammie,"Shake a lil bit [x8]

I see you looking gurl
Like you know wat you want 
The way you stand from across the room

I hope you ready now
'cause I got wat it takes
2 satisfy you're every urge 2 move

[BRIDGE:]
Gurl don't be afraid to let the groove take over you
'cause we gone have some fun 2nite
Baby we can dance all night
Till the morning
I'm feeling you 
Oooh baby, Ha I know you feel it

[CHORUS:]
I know you feel it I know
Gurl I know you feelin' it
She's ready, she wants me right now
She wants to give it to me
Ha she wants to give it
I'm ready, I want her right now

Now we're on the floor
Gurl its time to show 
What you can do?
Seems like you ready now
Hope you're ready now

The way you move it slow
Lets a fella know
You know at 2 do
Dnt be afraid oooohhh
BRIDGE
Gurl Dnt be afraid to let the groove take over you
'cause we gone have some fun 2nite
Baby we can dance all night
Till the morning
I'm feeling you 
Oooh baby, Ha I know you feel it

[CHORUS:]
I kno you feel it I kno
Gurl I know you feelin' it
She's ready, she wants me right now
She wants to give it to me
Ha she wants to give it
I'm ready, I want her right now

[BRIDGE:]
Come close
I wanna run my fingers through your hair
Would you mind?
If I touch you there
I'll do whatever it takes, gurl I dnt care
Gurl I just gotta have you 
Ooooohhhhhhhhh
The way that you do wat you do
I'm lovin' the way that you move
We jus can't stop right here
Baby lets take it there
I want you, I need you

[CHORUS:]
I kno you feel it I kno
Gurl I know you feelin' it
She's ready, she wants me right now
She wants to give it to me
Ha she wants to give it
I'm ready, I want her right now

[CHORUS:]
I know you feel it I know
Gurl I know you feelin' it
She's ready, she wants me right now
She wants to give it to me
Ha she wants to give it
I'm ready, I want her right now

Ooohhh
Nonono
Nononononoooo
I want you baby 
Oooh woo hoo
Whoaaaaaaaa
Nooooooonononoooooooo
Uhhhhhhhohhhhhhhh
Ohhhhohhhh
",Feelin' It
Sammie,"For all you've done 
Lord I wanna thank you 
For all you've done (for all you've done) 
Ooo thank you for waking me up this morning (for all you've done) 
And carryin me on my merry way (I wanna thank you) 
That's why I wanna say thank you Lord 
I said thank you Lord 
Ooooooo 
I wanna thank you yea (for all you've done) 
Hey thank you for helpin me (for all you've done) 
When time get rough and I feel like I can't go on (I wanna thank you) 
You gave me strength, yea, alright 
Said I wanna say thank you Oooo 
Come on somebody, yea (for all you've done) 
Thanks for the blessings that you've given me (for all you've done) 
Alright, thank you for the unconditional love (I wanna thank you) 
I wanna say thank you
",For All You've Done (Outro)
Sammie,"Ohhhhhh ghetto sexy huh

Girl I wish I could find all the words to say
To let you know that I'm serious
And I ain't playing 
You're like an angel with wings 
Watch you float away
(Please just let me hold you)
Like the first day of April 
The start of spring 
The flowers The sun
The joy you bring
You're the music to my hears
You're like a symphony
Feels so good to know you

Something bout 
Something bout your chestnut eyes girl
Something bout
Something bout your caramel thighs
Something bout 
Something bout the way you lick your lips
Something bout 
And I love how you're working them hips girl
Something bout 
I love it how you're rocking them jeans girl
Something bout 
You're tasteful like my favorite ice cream
Something bout 
Your flavor is driving me wild 
Something bout 
I want to play in clouds

[Chorus]
How does it feel up there
Come down and let me love you
Would you take me there
Ohh you look so heavenly
I can't help but stare (and I)
Want to share everything with you
Baby I swear ohh you look so heavenly

On a scale from one to ten 
Girl you are off the Richter
If I had to describe you
You're a perfect picture
And I heard you're on the market 
So I got to get you
Girl I adore you
And I know that it sounds like
Game I'm spitting
And I swear it's from the heart
And none of this is written
Girl let me complete your puzzle
Cause I'm what you're missing
I just want to love you girl 

Something bout 
Something bout your chestnut eyes girl
Something bout
Something bout your caramel thighs
Something bout 
Something bout the way you lick your lips ha
Something bout 
And I love it when you're working them hips girl
Something bout 
Ohh the way you rock them jeans girl
Something bout 
You're tasteful like my favorite ice cream
Something bout 
Your flavor is driving me wild 
Something bout 
I want to play in clouds

[Chorus:Repeat x2]

Something bout 
Something bout your chestnut eyes girl
Something bout
Something bout your caramel thighs
Something bout 
Something bout the way you lick your lips
Something bout 
And I love how you're working them hips girl
Something bout 
I love it how you're rocking them jeans girl
Something bout 
You're tasteful like my favorite ice cream
Something bout 
Your flavor is driving me wild 
Something bout 
I want to play in clouds

I want to play in your clouds
(I want to play in your clouds)
Can we start right now
(Baby can we start right now)
Everything you need lil friend is here
Right here

[Chorus:Repeat x2]",Heavenly
Sammie,"I had a good girl,but I did her bad
Now I'm thinkin; how, I can get her back
She was my best friend, and I love her so
Hey, listen
And it's killin; me, to ever think that I,
Would ever loose my pretty baby to some other guy
Can't nobody love you like I do
I'll do anything to get wit you girl

[Chorus]
It's like a sun without shine baby
It's like a clock that don't tell time baby
No matter how I try baby
I can't I can't
You're the air that I breath baby
You're everything I need
Baby without you I'm so incomplete baby
I can't I can't

It's been 3 months 2 weeks since I felt your touch
And a brotha can't eat can't sleep 'cause I miss you so much
Somebody take this weight off my shoulder
Baby I juss wanna hold ya
It gets hard without you in it if you ain't on my team then I know I ain't winnin'

Remember when we first started holdin' hands we couldn't let go
And now that we're separated baby I'm loosin' control
I'm starin' at this dead end street my lady don't know which way to go
I'm missin' your mind your body your spirit baby girl and your soul

[Chorus: 2x]

Remember when we first started holdin' hands we couldn't let go
And now that we're separated baby I'm loosin' control
I'm starin' at this dead end street my lady don't know which way to go
I'm missin' your mind your body your spirit baby girl and your soul

[Chorus]",I Can't
Sammie,"I thought we was the same
Baby had the same mind
You and me we came
Baby at the same time
It took a while to love you
But I had to make you mine
Glad I found someone that's right
But I started hearing rumors
And I didn't like their sound
Said you had another life
Way cross town
I put a lot of honesty and trust into you
And now I'm really thinking 'bout all girls I lied to

[Chorus]
A lie don't care who tell it, baby
All the time I thought you was my lady
I try to be without but it drives me crazy
There's only one thing to do

I gotta let it ride,let it ride
Let it ride
I gotta let it ride, let it ride
That's the only thing that I can do

Maybe I jumped in too fast
Should've took my time
But I was so excited that you wanted to be mine
Girl I was straight with you
I didn't play no games stayed true
Even when my boys said that I was a fool

[Chorus]

I gotta let it ride, let it ride
Let it ride
I gotta let it ride, let it ride
Let it ride
That's the only thing that I can do
[repeat]

[Chorus:Repeat x2]",Let It Ride
Sammie,"



[Intro:]
Oh Oh Oh Woo!

Wooo-ooh. woo-ohh Woo-ooh woo-oh.
Woo-ooh woo-ooh, woo-ooh, woo-ooh, woo-ooh.
Yeah, Ooooh no. Its time I spread my wings and fly, babe. 

(Another be-cox Joint)

[Verse 1:]
Dear mama, this goes out to you 
I know its hard for you to accept what it is I do
But its you who said son follow your dreams.
Sky's the limit, the music isn't all its cracked up to be.
And I know that its hard to let go
(yeah)
But its time that I shine and I know,
That its this music that influenced me to keep on going fluently,
You don't know what it do to me.
I love you mama watch your boy shine. 

[Chorus:]
Were at the crossroads, took me as far as as you can go.
Now its time for me to grow up and be a man so.
(now) Imma spread my wings and fly this don't mean that its goodbye.
But I gotta find, gotta find my own
Way now (please understand) gotta find my own way now (im finally a man)
Gotta find my own way now (i know its hurting you so)
Gotta find my own way now (you gotta learn to let me go) gotta find my own way

[Verse 2:]
And I pray dear God, please let there come a day I can support my family and everything will be okay
Here I pray dear God,
Let me get up out this hood so brother and sister can live good and everything will be okay.
And I know that its hard to let go (yeah) 
But its time that I shine and I know, that its this music that influenced me to keep on going fluently,
You don't know what it do to me.
I love you mama watch your boy shine. 

[Chorus]

[Verse 3:]
Everything I do I owe it all to you.
Without your love and care what would I do
Can't imagine my life without you
Mama, Mama, Mama, Mama [x2]

[Chorus until fades]

[Thanks to Danielle (tru-lyph-of-a-scorpio@hotmail.com) for these lyrics]

",My Own Way [*]
Sammie,"oh
Oh
Oh no no

oh baby girl
We need to take it slow
Take it slow
Take it slow

Anything that you want
Do you not get it all
When you need me
Do I not pick up the phone and call
This ain't about the games
Or when or who lose fault
Cause they don't mean a thing
Girl I want to give you my all
But first we gotta take it

[Chorus]
Slow girl (slow girl)
Just relax your mind
Sit back and unwind ah baby
Baby take it slow girl
We don't have to rush
Good things come to those who wait
Baby take it slow girl
Baby take it easy
We goin' be together always
Baby take it slow
I'm gonna take it slow
We goin' take it slow

You may not understand but in due time
Girl I want your body but first I need your mind
Girl come follow me, take my hand, let me show you the way oh
To my lake of love, that never runs dry, you can swim all day
But first we gotta take it

[Chorus]

Slow oh oh
Slow oh oh
Slow oh oh
Slow oh oh
Slow oh oh
Slow oh oh
Slow oh oh
Slow oh oh

[Chorus]

Oh I wanna take it slowly
My baby
No
Let's make this love last
Make it last
Make it last yay
I love you
I love you yes I do
Slow girl
Slow girl
We ain't got to rush no",Slow
Sammie,"Oh, no, oh, no, I don't wanna seem like a player girl
But I gotta play my cards right
And tell you the truth about what I like
It's the simplest things

The way you walk, the way you talk
Girl you're so fly
But your girls got my eye
I think you should know that

Baby, you're so fine
What about your friend?
The one that was with you when you walked in
Girl I know you don't hear this often

Shorty, you're so fine
What about your friend?
The one that was with you when you walked in through the door
She's what I'm looking for

Baby, look on the bright side
Though you won't be with me
You can still go with the team
Girl, as long as your friend is coming

I won't rush that I know, I gotta know
What's up with this hook up girl
Her beauty's a crime
And she needs to be handcuffed, ohh

I've been feeling this feeling
For too long and I can't go on
Unless she give me her digits
For that call and we finally talk

Ooh, she's sexy
And I'd be completely satisfied
If she would only touch me
When she's ready to leave, ooh girl

You're so fine
What about your friend?
The one that was with you when you walked in
Girl, I know you don't hear this often, ohh, baby

Shorty, you're so fine
What about your friend?
The one that was with you when you walked in through the door
She's what I'm looking for

Ohh, baby, looking good but your girl look better
Ohh, no, no, no, no, no, no
She's so fine girl
I really dig your girlfriend, she's so fine girl, ooh

You're so fine
What about your friend?
The one that was with you when you walked in
I know you don't hear this often

Shorty, you're so fine
What about your friend?
The one that was with you when you walked in through the door
She's what I'm looking for

Hey, ooh, she's so fine girl
I really dig her sexy style
'Cause she so fine, yeah, ooh no, no
Please don't be mad at me but she's so sexy
Ah, nah, nah, ah, nah, nah, let it play, let it play, ah, nah, nah
",What About Your Friend
Sammie,"Ladies and gentlemen

You and me girl we could do the thang
You and me girl we could do the thang
You and me girl we could do the thang
We could do the thang
We could do the thang

I know she like me I kinda dig it
So I did my thang for her she joinin' wit me
Now we gettin' groovy hotter than jacuzzi
So shorty want you slow it down
I see them otha fellas and I ain't hatin'
They try to do it like me it ain't the same
Front to back shorty side to side and lean wit it
(You wit a solja now)

Cus you so fly gurl
You should come to my crib
But he gone flip
If he knew you were here
I know I'm trippin' but

[Chorus]
You should be my gurl gurl gurl gurl
(You should be my gurl ) (we could do the thang)
(You and me gurl)(we could do the thang) you should be my gurl gurl gurl gurl
(You should be my gurl)(we could do the thang)
(You and me gurl we could do the thang) you should be my gurl

Its all ova town and we we get into it
If that's the business
We should keep on doin' it
Oooh you so grown wit it you betta gone wit it
I luv the way you break it down
I gotta jones for you
All in my bones for you
Wakin' up three o'clock in the mone for you
I neva sweat you baby
But if you let me baby
Know that Ima put it down

Cus you so fly gurl
You should come to my crib
But he gone flip
If he knew you were here
I know I'm trippin' but

[Chorus]

You and me gurl we could do the thang
Put you in the Chevy let you grip wood grain
Put you in the range wit some apple bottom jeans
House of deron' and some channel frames
Got you on the celly got you callin' Sharmane
Got you ridin good got you poppin' champagne
Got you ridin' dirty got you throwin' up the A
Got ya lil niece callin' semi all day
Chirpin' on my Nextel on my two way
Sendin' cute messages about dat face
Said you was grown told me dat you didn't play
And every since then it's been all like A
You and me girl we could do the thang
Tell them who yo man tell 'em why you bling bling
Tell 'em that your good
Tell 'em that it ain't the same
Tell 'em Sean Paul told you money ain't a thang

Cus you so fly gurl
You should come to my crib
But he gone flip
If he knew you were here
I know I'm trippin' but

[Chorus]

Ladies and gentlemen
Ladies and gentlemen
For you
You are now tuned in to the very best
Jazze Phizzle
My man Sammie
We right back at u baby
Sean Paul
And lean wit and now snap
And lean wit and now snap
Lean wit
And lean wit and now snap
Now snap
Now snap",You Should Be My Girl
Sammie Roberts,"Ooh

Lord, dear Lord above, God almighty,
God of love, please look down and see my people through.

I believe that God put sun and moon up in the sky.
I don't mind the gray skies
'cause they're just clouds passing by.

Heaven is a goodness time. 
A brighter light on high.

Do unto others as you would have them do to you.

And have a brighter by and by.

Lord, dear Lord above, God almighty,
God of love, please look down and see my people through.

I believe God is now, was then and always will be.
With God's blessing we can make it through eternity.

Lord, dear Lord above, God almighty,
God of love, please look down and see my people through.",Come Sunday
