Band,Lyrics,Song
George Michael,"It was the third of september
That day I'll always remember, yes I will
'Cause that was the day that my daddy died

Never had a chance to see him, no
Never heard nothing but bad things about him
Mama, I'm depending on you to tell me the truth
Mama just hung her head and said

[chorus]
""papa was a rollin' stone
Wherever he laid his hat was his home
And when he died
All he left us was alone""
[repeat]

Hey, mama, is it true what they say
That papa never worked aday in his life
Some bad talk going around sayin'
Papa had three outside children
And another wife
That ain't right

Heard some talk about papa and his storefront
Preachin'
Talkin' about saving souls and all the time
Leachin'
And dealing in dirt
Stealin' in the name of the Lord

But mama she just said
[chorus]
Say I heard my papa was a jack of all trades
Is that what papa sent to an early grave?
Folks say papa would beg, borrow or steal just
To pay his bills
Hey, mama, folks say papa was never much in thinkin'
Spent most of his time chasin' women and drinkin'
But mother, I'm depending on you
To tell me the truth

But my mama she just said
[chorus (2x)]",Papa Was a Rollin' Stone [Live]
George Michael,"Can anybody find me somebody to love
Ooh, each morning I get up I die a little
Can barely stand on my feet
(Take a look at yourself) Take a look in the mirror and cry (and cry)
Lord what you're doing to me (yeah yeah)
I have spent all my years in believing you
But I just can't get no relief, Lord!
Somebody (somebody) ooh somebody (somebody)
Can anybody find me somebody to love ?

Yeah
I work hard (he works hard) every day of my life
I work till I ache in my bones
At the end (at the end of the day)
I take home my hard earned pay all on my own
I get down (down) on my knees (knees)
And I start to pray
Till the tears run down from my eyes
Lord somebody (somebody), ooh somebody
(Please) Can anybody find me somebody to love ?

(He works hard)
Everyday (everyday), I try and I try and I try
But everybody wants to put me down
They say I'm going crazy
They say I got a lot of water in my brain
Ah, got no common sense
I got nobody left to believe in
Yeah yeah yeah yeah

Oh Lord
Ooh somebody, ooh somebody
Can anybody find me somebody to love ?
(Can anybody find me someone to love)

Got no feel, I got no rhythm
I just keep losing my beat (You just keep losing and losing)
I'm OK, I'm alright (he's alright - he's alright)
I ain't gonna face no defeat (yeah yeah)
I just gotta get out of this prison cell
One day (someday) I'm gonna be free, Lord!

Find me somebody to love
Find me somebody to love
Find me somebody to love
Find me somebody to love
Find me somebody to love
Find me somebody to love
Find me somebody to love
Find me somebody to love love love
Find me somebody to love
Find me somebody to love somebody somebody somebody somebody
Somebody find me
Somebody find me somebody to love
Can anybody find me somebody to love ?
(Find me somebody to love)
Ooh
(Find me somebody to love)
Find me somebody, somebody (find me somebody to love) somebody, somebody to love
(Find me somebody to love)
Find me, find me, find me, find me, find me
Ooh - somebody to love
(Find me somebody to love)
Ooh
(Find me somebody to love)
Find me, find me, find me somebody to love
(Find me somebody to love)
Anybody, anywhere, anybody find me somebody to love love love!
Wooo somebody find me, find me love.",Somebody to Love [Live]
George Michael,"Sometimes I get to feelin'
I was back in the old days - long ago
When we were kids, when we were young
Things seemed so perfect - you know ?
The days were endless, we were crazy - we were young
The sun was always shinin' - we just lived for fun
Sometimes it seems like lately - I just don't know
The rest of my life's been - just a show
Those were the days of our lives
The bad things in life were so few
Those days are all gone now but one thing is true
When I look and I find I still love you
You can't turn back the clock, you can't turn back the tide
Ain't that a shame ?
Ooh, I'd like to go back one time on a roller coaster ride
When life was just a game
No use in sitting and thinkin' on what you did
When you can lay back and enjoy it through your kids
Sometimes it seems like lately - I just don't know
Better sit back and go - with the flow
'Cos these are the days of our lives
They've flown in the swiftness of time
These days are all gone now but some things remain
When I look and I find - no change
Those were the days of our lives yeah
The bad things in life were so few
Those days are all gone now but one thing's still true
When I look and I find, I still love you
I still love you",These Are the Days of Our Lives [Live]
George Michael,"(Gotta get up, get down
Gotta get up, get down
Gotta get up, get down
Gotta get up, get down
Gotta get up, get down
Gotta get up, get down
Gotta get up, get down
Gotta get up, get down
Ooh ooh, baby baby)

Looking for some education
Made my way into the night
All that bullshit conversation
Baby, can't you read the signs?

I won't bore you with the details, baby
I don't even wanna waste your time
Let's just say that maybe
You could help to ease my mind
Baby, I ain't Mr. Right

But if you're looking for fast love
If that's love in your eyes, it's more than enough
Had some bad love
Some fast love, is all that I've got on my mind

(Ooh ooh, baby baby)
Ooh, yeah yeah (ooh ooh, baby baby)
What's there to think about, baby?
(Ooh ooh, baby baby) hey baby, oh yeah (ooh ooh, baby baby)

Looking for some affirmation, made my way into the sun
My friends got their ladies, they're all having babies
But I just wanna have some fun

I won't bore you with the detail, baby
You gotta get there in your own sweet time
Let's just say that maybe, you could help to ease my mind
Baby, I ain't Mr. Right

But if you're looking for fast love
That's love in your eyes, it's more than enough
Had some bad love
Some fast love, is all that I've got on my mind

(Ooh ooh, baby baby)
Ooh, yeah yeah (ooh ooh, baby baby)
What's there to think about, baby?
(Ooh ooh, baby baby) get yourself some lessons (ooh ooh, baby baby)

So close I can taste it now baby
So close

In the absence of security, I made my way into the night
Stupid Cupid keeps on calling me
And I see lovin' in his eyes
I miss my baby, oh yeah
I miss my baby tonight
So why don't we make a little room in my BMW, babe
Searchin' for some peace of mind
Hey, I'll help you find it
I do believe that we are practicing the same religion

Oh, you really oughta get up now, that's right
Oh, you really oughta get up

Looking for some affirmation
(Gotta get up, get down
Gotta get up, get down
Gotta get up, get down
Gotta get up, get down
Gotta get up, get down
Gotta get up, get down","Fastlove, Pt. 1"
George Michael,"Gotta get up, get down
Ooh ooh, baby baby

Looking for some education
Made my way into the night
All that bullshit, conversation
Baby can't you read the signs?

I won't bore you with the details, baby
I don't even wannna waste your time
Let's just say that maybe
You could help to ease my mind
Baby, I ain't Mr. Right

But if you're looking for fast love
If that's love in your eyes, it's more than enough
Had some bad love
Some fast love, is all that I've got on my mind

(ooh ooh, baby baby)
Ooh, yeah yeah (ooh ooh, baby baby)
What's there to think about baby?
(ooh ooh, baby baby)
Hey baby, oh yeah (ooh ooh, baby baby)

Looking for some affirmation, made my way into the sun
My friends got their ladies, they're all having babies
But I just want to have some fun

I won't bore you with the detail baby
You gotta get there in your own sweet time
Let's just say that maybe, you could help
To ease my mind, baby, I ain't Mr. Right

But if you're looking for fast love
If that's love in your eyes, it's more than enough
Had some bad love
Some fast love, is all that I've got on my mind

So close I can taste it now baby, so close

In the absence of security, I made my way into the night
Stupid Cupid keeps on calling me
And I see lovin' in his eyes
I miss my baby, oh yeah, I miss my baby tonight
So why don't we make a little room
In my BMW, babe, searchin' for some peace of mind
Hey, I'll help you find it
I do believe that we are practicing the same religion

Oh you really oughta get up now, that's right
Oh you really oughta get up","Fastlove, Pt. 2 [Fully Extended Mix]"
George Michael,"Call me good
Call me bad
Call me anything you want to baby
But I know that you're sad
And I know I'll make you happy
With the one thing that you never had

Baby, I'm your man (don't you know that?)
Baby, I'm your man
You bet!
If you're gonna do it, do it right (right)
Do it with me
If you're gonna do it, do it right (right)
Do it with me
If you're gonna do it, do it right (right)
Do it with me
If you're gonna do it, do it right (right)
Do it with me

So good
You're divine
Wanna take you, wanna make you
But they tell me it's a crime!
Everybody knows where the good people go
But where we're going baby
Ain't no such word as no!

Baby, I'm your man (don't you know who I am?)
Baby, I'm your man
You bet!
If you're gonna do it, do it right (right)
Do it with me (come on baby)
If you're gonna do it, do it right (right)
Do it with me (ooh, take me home)
If you're gonna do it, do it right (right)
Do it with me (please don't leave me here )
If you're gonna do it, do it right
To do it on my own

First class information
Sense your inspiration
And with some stimulation
We can do it right

So why waste time
With the other guys?
When you can have mine
I ain't askin' for no sacrifice
Baby your friends do not need to know!
I've got a real nice place to go

Listen
I don't need you to care
I don't need you to understand yeah
All I want is for you to be there
And when I'm turned on
If you want me
I'm your man!
(I'm your man)

If you're gonna do it, do it right (right)
Do it with me
If you're gonna do it, do it right (right)
Do it with me
If you're gonna do it, do it right (right)
Do it with me
If you're gonna do it, do it right (right)
Do it with me

Now listen
If you're gonna do it, you know what I say?
If you're gonna do it don't throw it away
Don't throw it baby (don't throw)
Because
I'll be your boy, I'll be your man
I'll be the one who understands
I'll be your first, I'll be your last
I'll be the only one you ask
I'll be your friend, I'll be your toy
I'll be the one who brings you joy
I'll be your hope, I'll be your pearl
I'll take you halfway 'round the world!
I'll make you rich, I'll make you poor
Just don't use the door

If you're gonna do it, do it right (right)
Do it with me
If you're gonna do it, do it right (right)
Do it with me
If you're gonna do it, do it right (right)
Do it with me",I'm Your Man
George Michael,"I've had enough of danger
And people on the streets
I'm looking out for angels
Just trying to find some peace
Now I think it's time
That you let me know
So if you love me
Say you love me
But if you don't just let me go

'Cause teacher
There are things that I don't want to learn
And the last one I had
Made me cry
So I don't want to learn to
Hold you, touch you
Think that you're mine
Because it ain't no joy
For an uptown boy
Whose teacher has told him goodbye, goodbye, goodbye

When you were just a stranger
And I was at your feet
I didn't feel the danger
Now I feel the heat
That look in your eyes
Telling me no
So you think that you love me
Know that you need me
I wrote the song, I know it's wrong
Just let me go

And teacher
There are things
That I don't want to learn
Oh the last one I had
Made me cry
So I don't want to learn to
Hold you, touch you
Think that you're mine
Because it ain't no joy
For an uptown boy
Whose teacher has told him goodbye, goodbye, goodbye

So when you say that you need me
That you'll never leave me
I know you're wrong, you're not that strong
Let me go

And teacher
There are things
That I still have to learn
But the one thing I have is my pride
Oh so I don't want to learn
Hold you, touch you
Think that you're mine
Because there ain't no joy
For an uptown boy
Who just isn't willing to try

I'm so cold
Inside
Maybe just one  more try",One More Try [Live Gospel Version]
George Michael,"Five o'clock in the morning
You ain't home
I can't help thinking that's strange
Baby I just want you to know
I won't go through it again
Yes, those clouds are closing in

And I will not accept this as a part of my life
I will not live in fear
Of what may be
And the lessons I have learned
I would rather be alone than watch you
Spinning that wheel for me

You've got a thing about danger
Ain't you getting what you want from me
You've got a thing about strangers
Baby that's what we used to be
You've got a thing about danger baby
I guess the hungry just can't see
One of these days
You're gonna bring some home to me

Six o'clock in the morning
You ain't home
I can't help thinking that's strange
It seems that everybody takes their chances
These days
Oh yeah we're standing in the rain

And I will not accept this as part of my life

How can you love me
When you are playing with my life
You say give me time and I'll do better I swear
Give me time and I'll lead you back to despair
And I don't want to go back there",Spinning the Wheel
George Michael,"I'm going down 
Won't you help me
Save me from myself
I hear the sound of the memory
Maybe time will tell

Suddenly my life is like a river
Taking me places I don't want to go
But like all good men who swim too well
It takes all that I have just to cry for help
Then that voice in my head tells me no

I'm going down 
Won't you help me
Save me from myself
I hear the sound of the memory
Maybe, who can tell ?

Let me live my life beside the river
Take me to places where a child can grow
And then maybe the boy inside will forsake me
Maybe the child in me will just let me go

I'm going down 
The cold, cold water is rushing in
I'm going down
And I would beg to be forgiven

If I knew my sin",To Be Forgiven
George Michael,"(Gotta get up, get down
Gotta get up, get down
Gotta get up, get down
Gotta get up, get down
Gotta get up, get down
Gotta get up, get down
Gotta get up, get down
Gotta get up, get down
Ooh ooh, baby baby)

Looking for some education
Made my way into the night
All that bullshit conversation
Baby, can't you read the signs?

I won't bore you with the details, baby
I don't even wanna waste your time
Let's just say that maybe
You could help to ease my mind
Baby, I ain't Mr. Right

But if you're looking for fast love
If that's love in your eyes, it's more than enough
Had some bad love
Some fast love, is all that I've got on my mind

(Ooh ooh, baby baby)
Ooh, yeah yeah (ooh ooh, baby baby)
What's there to think about, baby?
(Ooh ooh, baby baby) hey baby, oh yeah (ooh ooh, baby baby)

Looking for some affirmation, made my way into the sun
My friends got their ladies, they're all having babies
But I just wanna have some fun

I won't bore you with the detail, baby
You gotta get there in your own sweet time
Let's just say that maybe, you could help to ease my mind
Baby, I ain't Mr. Right

But if you're looking for fast love
That's love in your eyes, it's more than enough
Had some bad love
Some fast love, is all that I've got on my mind

(Ooh ooh, baby baby)
Ooh, yeah yeah (ooh ooh, baby baby)
What's there to think about, baby?
(Ooh ooh, baby baby) get yourself some lessons (ooh ooh, baby baby)

So close I can taste it now baby
So close

In the absence of security, I made my way into the night
Stupid Cupid keeps on calling me
And I see lovin' in his eyes
I miss my baby, oh yeah
I miss my baby tonight
So why don't we make a little room in my BMW, babe
Searchin' for some peace of mind
Hey, I'll help you find it
I do believe that we are practicing the same religion

Oh, you really oughta get up now, that's right
Oh, you really oughta get up

Looking for some affirmation
(Gotta get up, get down
Gotta get up, get down
Gotta get up, get down
Gotta get up, get down
Gotta get up, get down
Gotta get up, get down",Fastlove
George Michael,"Freedom '90
George Michael
 
I won't let you down
I will not give you up
Gotta have some faith in the sound
It's the one good thing that I've got
I won't let you down
So please don't give me up
Because I would really, really love to stick around

Heaven knows I was just a young boy
Didn't know what I wanted to be
I was every little hungry schoolgirl's pride and joy
And I guess it was enough for me
To win the race? A prettier face!
Brand new clothes and a big fat place
On your rock and roll TV
But today the way I play the game is not the same 
No way
Think I'm gonna get me some happy

I think there's something you should know
I think it's time I told you so
There's something deep inside of me
There's someone else I've got to be
Take back your picture in a frame
Take back your singing in the rain
I just hope you understand
Sometimes the clothes do not make the man

All we have to do now
Is take these lies and make them true somehow
All we have to see
Is that I don't belong to you
And you don't belong to me
Freedom
You've gotta give for what you take
Freedom
You've gotta give for what you take

Heaven knows we sure had some fun boy
What a kick just a buddy and me
We had every big shot good-time band on the run boy
We were living in a fantasy
We won the race
Got out of the place
I went back home got a brand new face
For the boys on MTV
But today the way I play the game has got to change
Oh yeah
Now I'm gonna get myself happy

I think there's something you should know
I think it's time I stopped the show
There's something deep inside of me
There's someone I forgot to be
Take back your picture in a frame
Don't think that I'll be back again
I just hope you understand 
Sometimes the clothes do not make the man

All we have to do now
Is take these lies and make them true somehow
All we have to see
Is that I don't belong to you
And you don't belong to me
Freedom
You've gotta give for what you take
Freedom
You've gotta give for what you take

Well it looks like the road to heaven
But it feels like the road to hell
When I knew which side my bread was buttered
I took the knife as well
Posing for another picture
Everybody's got to sell
But when you shake your ass
They notice fast
And some mistakes were built to last

That's what you get

I say that's what you get

That's what you get for changing your mind

And after all this time
I just hope you understand
Sometimes the clothes
Do not make the man

I'll hold on to my freedom
May not be what you want from me
Just the way it's got to be
Lose the face now 
I've got to live",Free
George Michael,"It doesn't really matter that I loved you
How many reasons call
It doesn't really matter at all
It doesn't really matter that I failed to
Break down your father's wall
It doesn't really matter at all

Why tell me you don't understand when you do
I thought I had something to say

But it doesn't really matter at all...
I changed my name to be rid of the things that I want from you
It's strange but the name is a name and the truth is a truth

Oh, there is always, always someone there to remind me
So I learn to live with shame
I tell myself I feel no pain
But I do and if I have to tell you

Then it doesn't really matter at all...
And it's no good looking back
Because time is a thief and I believe that I'm too old for that
We're just saying the things that we have said forever

It doesn't really matter that I loved you
How many reasons fall
It's too bad
It really doesn't matter at all",It Doesn't Really Matter
George Michael,"Kindness 
In your eyes, I guess 
You heard me cry 
You smiled at me 
Like Jesus to a child 

I'm blessed 
I know 
Heaven sent 
And Heaven stole 
You smiled at me 
Like Jesus to a child 

And what have I learned 
From all this pain 
I thought I'd never feel the same 
About anyone 
Or anything again 

But now I know 
When you find your love 
When you know that it exists 
Then the lover that you miss 
Will come to you on those cold, cold nights 

When you've been loved 
When you know it holds such bliss 
Then the lover that you kissed 
Will comfort you when there's no hope in sight 

Sadness 
In my eyes 
No one guessed 
Or no one tried 
You smiled at me 
Like Jesus to a child 

Loveless and cold 
With your last breath 
You saved my soul 
You smiled at me 
Like Jesus to a child 

And what have I learned 
From all these tears 
I've waited for you all those years 
And just when it began 
He took you away 

But I still say 
When you find love 
When you know that it exists 
Then the lover that you miss 
Will come to you on those cold, cold nights 

When you've been loved 
When you know it holds such bliss 
Then the lover that you kissed 
Will comfort you when there's no hope in sight 

So the words you could not say 
I'll sing them for you 
And the love we would have made 
I'll make it for two 

For every single memory 
Has become a part of me 
You will always be 
My love 

Well, I've been loved 
So I know just what love is 
And the lover that I kissed 
Is always by my side 

Oh, the lover I still miss 
Was Jesus to a child",Jesus to a Child
George Michael,"I've been in and out of favor with lady luck
I gotta tell you
I've seen things I never wanted to see
I've got to get back on my feet
I feel like I've been sleeping
Sweet, sweet time
Has been a real good friend of mine

Waiting for that change of season
Oh the winter's been so long
Searching for that rhyme or reason
You've just got to

[Chorus]
Move on
Hold it together, move on
Life's so short, move on
Only time will set you free
You put your tears behind you
Better get yourself where you want to be
I think of all the days and nights I spent crying
And I move on

I've been in and out of favor with love
Because I gotta tell you
I've been things I never wanted to be
And then some angel called me up
He told me I was sleeping
Said ""don't waste time 'cause even angels say goodbye""

Waiting for that change of season
Oh the winter's been so long
Searching for that rhyme or reason
You've just got to

[Chorus]

And oh, there goes another season
Getting hard to find a decent sonng to play
But oh, I guess I got my reasons
Everybody thinks I'm doing a.o.k
They ought to know by now

[Chorus]

I'm gonna be luck in love someday",Move On
George Michael,"I should have known
It seemed too easy
You were there
And I was breathing blue 

Strange
Don't you think I'm looking older?
But something good has happened to me
Change is a stranger
You have yet to know 

Well you're out of time
I'm letting go
You'll be fine
Well that much I know
You're out of time
I'm letting go
I'm not the man you want 

I should have known 
It seemed so easy
You were there
I thought I needed you 

Strange 
Don't you think I'm looking older?
But something good has happened to me
Change is a strange
Who never seems to show 

Well you're out of time
I'm letting go
You'll be fine
(or maybe you won't)
You're out of time
I'm letting go 

I'm not the man that you want 

I never should hove looked back in your direction
I know that
Just the same old fights again, baby
These are wasted days without affection
I'm not that foolish anymore",Older
George Michael,"Star people
Counting your money till you soul turns green
Star people
Counting the cost of your desire to be seen

I do not count myself among you
I may be living in a dream
It's just seem to many of you
Can't help but hope
There's a difference between, you and me

You're a star
(I'm talking to you)
You're a star

Maybe your mama gave you up boy
(It's the same old same old)
Maybe your daddy didn't love you enough girl

Star people
Never forget your secret safe with me
Just look at all wonderful people
Trying to forget they had to pay for what you see

It's a dream
With a nightmare stuck in the middle
But where would you be
Without all of that attention
You'd die
I'd die
We'd die wouldn't we
(Well wouldn't we)

Big, big star
Should go far

Talk about your mother
Talk about your father
Talk about the people
Who have made you what you are
Talk about your teacher
The bully boy who beat you
Talk about the people who have paid
For that new sports car

Did you get off on a bad foot, baby
Do you have a little tale to tell
Is that why you're a star?
Is that what makes a star?
Nothing comes for nothing, baby
That fame and fortune's heaven sent
And who gives a fuck about your problems, darling
When you can pay the rent

How much is enough?",Star People
