Band,Lyrics,Song
The Iguanas,"Baby's good to me, you know,
She's happy as can be, you know,
She said so
I'm in love with her and I feel fine

Baby says she's mine, you know,
She tells me all the time, you know,
She said so
I'm in love with her and I feel fine

I'm so glad that she's my little girl
She's so glad, she's telling all the world
That here baby buys her things, you know
He buys her diamond rings, you know,
She said so
She's in love with me and I feel fine

Baby says she's mine, you know,
She tells me all the time, you know,
She said so
I'm in love with her and I feel fine

I'm so glad that she's my little girl
She's so glad, she's telling all the world
That her baby buys her things, you know
He buys her diamond rings, you know,
She said so
She's in love with me and I feel fine
She's in love with me and I feel fine",I Feel Fine
The Iguanas,"A-well-a ev'rybody's heard about the bird bird bird bird
B-bird's the word oh well-a bird bird bird
Bird is a word oh well-a bird bird bird
Well-a bird is the word oh well-a bird bird bird
B-bird's the word a-well-a bird bird
Well-a bird is a word a-well-a bird bird 
B-bird's  a-well-a bird bird bird
B-bird's a word a-well-a bird bird bird 
Well-a  bird is a word a-well-a bird bird
B-bird's the word now well-a
Don't you know 'bout the bird 
Well ev'rybody knows that the bird is a word 
Oh well-a bird bird b-birds oh word well!
 
A-well-a ev'rybody dance about the bird bird bird bird
B-bird's the word oh well-a bird bird bird
B-bird's the word a-well-a bird bird bird
B-birds the word  now when a bird bird 
B-birds a word now when -a bird bird bird 
B-bird's a word now well-a bird bird bird
B-bird's the word oh well-a bird bird bird
B-bird's the word a-well-a bird bird bird
B-bird's the word a-well-a don't you know 'bout the bird
Well ev'rybody's talkin' a-bout the bird a-well-a bird bird
B-birds the word well papa com-a mau ma-papa
Com-a ma mau papa com-a mau mau  
Papa com-a mau mau well-a don't you know 'bout the bird 
Well ev'rybody know that the bird is a word a-well-a bird bird",Surfin' Bird
The Iguanas,"Went to the fortune teller
To have my fortune read
I didn't what to tell her
I had a dizzy feeling in my head

Said she'd take a look at my palm
Said ""Son, do you feel kind of warm?""
And she looked into her crystal ball
Said ""You're in love""

Said it could not be so
Not with all the girls I know
Said when the next one arrives
Looking into her eyes

I left there in a hurry
Much to my big surprise
The next thing I discovered
The fortune teller told me lies

So I ran back to that woman
Mad as I could be
Told her I didn't see nobody
How she made a fool out of me

At last something shook me
As if it came down from above
And now the fortune teller
And I fell in love",Fortune Teller
The Iguanas,"Late at night
I'm goofy like a clown
Early in the morning
I try to live it down
Late at night
I do just like I please
Early in the morning
I'm down on my knees
Praying, Lord you got to help me
Lord you got to help me
Late at night
I held the truth in my hand
A bright shiny jewel
Early in the morning
I look in the mirror
I see the same old fool
Late at night
I'm singing with my friends
Early in the morning 
The fun never ends
Late at night
The neighbors start to call 
Early in the morning
They're beatin' down the wall
I said, Lord you got to help me
You got to help me, help me",Late at Night
The Iguanas,"Para donde vas
Para donde vas
Para donde vas, donde vas

Para donde vas
Para donde vas
Para donde vas, donde vas

Si vas al baile, baila conmigo
Si vas al carnaval quiero ir contigo
Si vas a donde quiera
No me quedo atrs
Porque quiero amarte
Ms y ms

Para donde vas
Para donde vas
Para donde vas, donde vas

Si vas al baile, baila conmigo
Si vas al carnaval quiero ir contigo
Si vas a donde quiera
No me quedo atrs
Porque quiero amarte
Ms y ms

Para donde vas
Para donde vas
Para donde vas, donde vas

Para donde vas
Para donde vas
Para donde vas, donde vas

",Para Donde Vas (Where Are You Going)
The Iguanas,"Darlin', let's give in to this night of sin
Heaven holds a place for you and me
Cause if we both give in to this night of sin
Heaven's just the place we're gonna be

Now life is much too short to weep and moan
There ain't no since in goin' home alone
So honey, let's give in to this night of sin
It ain't nobody's business but our own

Darlin', let's give in to this night of sin
Heaven holds a place for you and me
Cause if we both give in to this night of sin
Heaven's just the place we're gonna be

Now darlin', it's gettin' late, don't take a chance
On missin' out on kissin' and romance
So honey, take my hand, let's rock to the promised land
I just want to be your lovin' man

So darlin', let's give in to this night of sin
Heaven holds a place for you and me
Cause if we both give in to this night of sin
Heaven's just the place we're gonna be

I know it's been sometime since we first met
And there's certain words that we've not spoken yet
So spread your wings of love like an angel from above
I promise you won't give more than you get, so

So darlin', let's give in to this night of sin
Heaven holds a place for you and me
Cause if we both give in to this night of sin
Heaven's just the place we're gonna be
Cause if we both give in to this night of sin
Heaven's just the place we're gonna be",This Night of Sin
The Iguanas,"El orangutn y la orangutana
El orangutn y la orangutana

Estaba el orangutn mecindose en una rama
Estaba el orangutn mecindose en una rama
Y paso la orangutana comindose una banana

El orangutn y la orangutana
El orangutn y la orangutana

De pronto el orangutn le dijo a la orangutana
De pronto el orangutn le dijo a la orangutana
Termina ya tu banana te invito a pasear en liana

El orangutn y la orangutana
El orangutn y la orangutana

El orangutn y la orangutana
El orangutn y la orangutana

Se fueron a basilar al bar de la mona Juana
Se fueron a basilar al bar de la mona Juana
Y entre cocos y jaranas volvieron por la maana

El orangutn y la orangutana
El orangutn y la orangutana

Callose el orangutn rendido sobre la rama
Callose el orangutn rendido sobre la rama
Y la pobre orangutana los pies en la palangana

El orangutn y la orangutana
El orangutn y la orangutana",El Orangutan
The Ikettes,"The sweet things you do to me
Like holding my hand
When I'm low, you let me know
You always understand

And I love the way you love
It makes me feel so fine
I love the way you love
Because I know you're all mine

I'll never do you wrong
I'll never make you cry
If you stop lovin' me
I know that I'll just die

Because I love the way you love
It makes me feel so fine
I love the way you love
Because I know you're mine, all mine

Folks tell me now and then, find somebody new
I don't care what the people may say
I'm sticking right here with you

Because I love the way you love
It makes me feel so fine
I love the way you love
Because I know you're mine, all mine

Folks tell me now and then, find somebody new
I don't care what the people may say
I'm sticking right here with you

Because I love the way you love
It makes me feel so fine
I love the way you love
Because I know you're mine, all mine


",I Love the Way You Love [Live][*]
The Ikettes,"
Sha la la la la la la sha la la la la la la la 
Sha la la la la la la la la la 

I met you for the first time last night 
When I kissed you and I held you tight 
Baby you made me feel alright 
So this is the song that I sang all night 


When you kissed me I felt so weak 
Never had so grand a treat 
Each time I see you walking down the street 
My heart starts singing to the sha la beat singing 


Sha la la say you love me too 
Sha la la say my love is true yeah 
Let's spend our lives together 
We'll be happy forever",Sha La La [#]
The Immortals,"Use your might! Kano fight
The world is at your feet
Fight! Use you might!
I'm on your side, Kano Wins

Use your might! Kano fight
The world is at your feet 
Fight! Use your might
I'm on your side
You are wanted, and you're haunted
You're the bad guy, but I feel for you
You're the danger, a fallen angel
But I like you, you're the strongest of the all

Whoo! Whoo! Ahoh!

Use your might! Kano fight!
The world is at your feet
Fight! Use your might I'm on your side
You are wanted, and you're haunted
You're the bad guy, but I feel for you
You're the danger, a fallen angel
But I like you
You're the strongest of them all

You're the danger, a fallen agent
But I like you
You're the strongest of them all, Kano wins",Kano (Use Your Might)
The Immortals,"Whoah, Chinese ninja warrior
With your heart so cold sub zero
Whoah, your life is a mystery
Why you wear the mask? Sub zero

Yeah yeah
Freezing vibrations! (Yeah)
Yeah yeah freezing vibrations! 
Yeah yeah freezing vibrations!
Here we go!
Here we go!

Whoah, Chinese ninja warrior
With your heart so cold, sub zero
Whoah, your life is a mystery
Why you wear the mask? Sub zero

Yeah yeah
Freezing vibrations! (Yeah)
Yeah yeah freezing vibrations! (Yeah)
Yeah yeah freezing vibrations!
Here we go!
Here we go!

Whoah, Chinese ninja warrior,
With your heart so cold
Sub zero
Whoah, your life is a mystery
Why you wear the mask?
Sub zero

Yeah yeah freezing vibrations!
Yeah yeah freezing vibrations!

Whoah, Chinese ninja warrior
With your heart so cold, sub zero
Whoah, your life is a mystery
Why you wear the mask?
Sub zero
Ooh ahh",Sub-Zero (Chinese Ninja Warrior)
The Imperials,"Ohh, ohh

I'd move a mountain
If you want me to
Though it's hard, so hard
It's, oh, so hard

I love you
I need you so much
(So much)

I'd swim the ocean
If you want me to
Though it's hard, so hard
It's, oh, so hard

I love you
I need you so much
(So much)

Where did you go, oh
Where did you stray
What must I do, my dear
To make you stay, oh

I pray every night, dear
For your return
For your tender kiss, dear
(My dear)
Woah, oh

I'd give you my heart
If you want me to
Yes, I will
(Yes, I will)
Yes, I will
(Yes, I will)
You know I will

'Cause I love you
I need you so much
(So much)

Oh, so much
(So much)
Oh, so, so much

",Fallin'
The Imperials,"Oh happy day (oh happy day)
Oh happy day (oh happy day)
When Jesus washed (when Jesus washed)
When Jesus washed (when Jesus washed)
When Jesus washed (when Jesus washed)
He washed my sins away (oh happy day)
Oh happy day (oh happy day)

He taught me how to watch, fight and pray, fight and pray
And live rejoicing every, everyday

Oh happy day

He taught me how

Oh happy day (oh happy day)
Oh happy day (oh happy day)
Oh happy day (oh happy day)",Oh Happy Day
The Imperials,"It came upon the midnight clear
That glorious song of old
From Angels playing near the earth
To touch their harps of gold

Peace on the earth could will two men
From Heaven's all-gracious King
The world in solemn stillness lay
To hear the Angels sing

And I hear them singing
Sing, I do hear them singing

The first Noel the Angel did say
Was to certain poor shepherds in fields as they lay
In fields where they lay, they keeping their sheep
On a cold winter's night that was so deep",It Came Upon a Midnight Clear
The Imperials,"Oh, come ye
O come ye to Bethlehem
Come and behold him
Born the King of angels
O come, let us adore him
Christ the Lord

God of God
Light of light
Lo, he abhors
Not the virgin's womb
Very God
Begotten not created
O come, let us adore him
Christ the Lord

Sing, choirs of angels
Sing in exultation
Sing, all ye citizens
Of heaven above
Glory to God
In the highest

O come
Let us adore him
Christ the Lord

See how the shepherds
Summoned to his cradle
Leaving their flocks
Draw nigh with lowly fear
We too will thither bend
Our joyful footsteps
O come, let us adore him
Christ the Lord

Yea, Lord, we greet thee
Born this happy morning
Jesus
To thee be glory given
Word of the Father
Now in flesh appearing
O come
Let us adore him
Christ the Lord",O Come All Ye Faithful
The Imperials,"What child is this?
Who meant to rest on Mary's lap is sleeping
Who angels greet with anthem sweet
While shepherds watch our keeping

This, this is Christ, the King
Whom shepherds guard and angels sing
Haste, haste to bring Him laud
The babe, the Son of Mary

So bring him incense, gold and myrrh
Come peasant King to own him
The King of kings, salvation brings
Let loving hearts enthrone Him

This, this is Christ, the King
Whom shepherds guard and angels sing
Haste, haste to bring Him laud
The babe, the Son of Mary

Nails fierce shall pierce him through
The cross be borne for me, for you
Hail, hail, the word made flesh
Obeyed the Son of Mary

This, this is Christ, the King
Whom shepherds guard and angels sing
Haste, haste to bring Him laud
The babe, the Son of Mary

Praise Him, Son of joy
Joy to the risen Lord
Praise Him, Son of joy
Joy to the risen Lord

This, this is Christ the king
Whom shepherds guard and angels sing
Haste, haste to bring Him laud
The babe, the Son of Mary",What Child Is This?
The Imperials,"Have yourself a merry little Christmas
Let your heart be light
From now on, our troubles will be out of sight
Have yourself a merry little Christmas
Make the Yuletide gay
From now on, our troubles will be miles away
Here we are as in olden days
Happy golden days of yore
Faithful friends who are dear to us
Gather near to us once more
Through the years we all will be together
If the fates allow
So hang a shining star upon the highest bough
And have yourself a merry little Christmas now
 
Have yourself a merry little Christmas
Let your heart be light
From now on, our troubles will be out of sight
Have yourself a merry little Christmas
Make the Yuletide gay

From now on, our troubles will be miles away
Here we are as in olden days
Happy golden days of yore
Faithful friends who are dear to us
Gather near to us once more
Through the years we all will be together
If the fates allow
So hang a shining star upon the highest bough
And have yourself a merry little Christmas now","Have Youreslf a Merry, Little Christmas"
The Imperials,"There is a power,
Absolute authority that you possess
For all who receive him,
Those who will just say ""yes""
Wake up!
It's time for you to realize just who you are
You're no more a stranger,
You are a shinning star

Stand by the power,
The power of his light
Now is the hour
For you to stand by the power

Greater, stronger that any strength the world can find
Greater than light
Shinning from deep inside
Rejoice! Lift your voice for victory already won
Eternal champions,
Power to overcome

Stand by the power,
The power of his light
Now is the hour
For you to stand by the power

Stand by the power, power of his light
Now is the hour for you to stand by,
Stand by, stand by the power.",Stand by the Power
The Impossibles,"Fell asleep in the van
With a crick in my neck and a yearning in my brain
Making myself homesick looking at your photograph
I do the best that I can to keep myself in check
But it's easy to complain when our home sits
On the binding of the u.s. page of the road atlas side 26
Coast to go and I'm holding my breath
Squeasin' my spider-man pillow to death
I can see your eyes when I hold mine closed so tightly

absence will make your heart grow fonder
All of my dreams will come true
And if your heart starts to falter
I will tell you what I'll do...

hold my breath all night
Clench my fists so tight
Wish with all my might
That I'll never fear
Grit my teeth too hard
Travel very far
Wish upon the stars
That I'll never...

I never feared you with
Thoughts of you near me

I camped out by the phone
Putting scratches in my notebook
And waiting up until dawn
Humming this song back and forth
Over and over again

I do the best that I can to keep myself in check
But it's easy to complain when our home sits
On the binding of the u.s. page of the road atlas

absence will make your heart grow fonder
All of my dreams will come true
And if your heart starts to falter
I will tell you what I'll do...


Hold my breath all night
Clench my fists so tight
Wish with all my might
That I'll never fear
Grit my teeth too hard
Travel very far
Wish upon the stars
That I'll never...

I never feared you with
Thoughts of you near me

I sleep as much as I can and hold my heart in my hand
It's as much as I can stand
My weakness comes out once again

hold my breath all night
Clench my fists so tight
Wish with all my might
That I'll never fear

hold my breath all night
Clench my fists so tight
Wish with all my might
That I'll never fear
Grit my teeth too hard
Travel very far
Wish upon the stars
That I'll never...



","Always Have, Always Will"
The Impossibles,"I`d explain how I felt if I thought I could
But we got an understanding and it`s well understood:
She treats me too good for my won good,
And if she jumped off a bridge, you know I would...

Oh no, you see, it`s not you (it must be me)
Oh no, I pray that i`m enough to make you stay...(no way)

I could dwell on this until I die
It`s ridiculous, but it`s the fear I hide
I get so jealous at the wrong times
I may be senseless, but i`m not blind

Everyday above ground is a good good day
Everyday you`re around it makes me believe
If i`m not six feet down then i`m well on my way
Everyday above ground i`m tired, oh everyday
Everyday above ground is a good good day",Everyday
The Impossibles,"Ben, the two of us need look no more,
We both found what we were looking for.
With a friend to call my own,
I'll never be alone, and you, my friend, will see,
You've got a friend in me.
Ben, you're always running here and there,
You feel you're not wanted anywhere.
If you ever look behind and don't like what you find
There's something you should know, you've got a place to go.
I used to say I and me, now it's us, now it's we.
I used to say I and me, now it's us, now it's we.
Ben most people would turn you away;
I don't listen to a word they say.
They don't see you as I do;
I wish they would try to'
I'm sure they'd think again if they had a friend like Ben,
A friend like Ben
(Like Ben)
Like Ben",Ben
The Impossibles,"I've got a crush and it's crushing me to death,
Smashing my mind and stealing my breath,
Switching up the music it's getting pretty loud,
Like a five foot six gorilla jumping from the crowd.

Impossible's wuss-corp,
Pick it up! take position!
We're coming in low on a top-secret mission!

Bombadeer,
Direct hit!
Kamikaze screaming fit,
My girl's taking over the pit!
Kamikaze! Kamikaze!

(x4)

Getting in the ring she's a real prize fighter,
Rosy red cheeks, pull your teeth out with pliers.
Load her up, cock her back, take aim and shoot her,
Just like kung-fu she's a bad motor scooter!

Impossible's wuss-corp,
Pick it up! take position!
We're coming in low on a top-secret mission!

Bombadeer,
Direct hit!
Kamikaze screaming fit,
My girl's taking over the pit!
Kamikaze! Kamikaze!

(x3)



",Kamikaze
The Impossibles,"Some summer Sunday
Drifting between sleep and waking
Your absence brought me to
Sick feelings filled me
Slowly remembering the bitterness of the final kiss,
Motionless
We never said goodbye
When we gave in, but we don't mind
If we never say goodbye,
There'll be no end, there'll be no end

Stream of consciousness
Leads me to drowning dreams
Looking up, you're colored baby-blue
The frustration of knowing what it's like to breathe you in,
Remember then, remember when you let me in
Hold on, hold on, we can be strong dig our fingers deep into each other



",(Never) Say Goodbye
The Impossibles,"Half-life of oxygen spent breathing homesick air
Tearing my heart apart, yours ticks without a tear
Slow down, I haven't moved at all
The cold can't kill us but we won't survive the fall

Slipping, falling away
Hold on day to day, year to year, from here to there

Poison my speaking voice with half-truths and denials
Converting oxygen by living, breathing, suffering, screaming

We can't, we can, we will, we will, we won't
Slow down



",Oxygen
The Impressions,"Amen, amen, amen, amen, amen
Sing it over
Amen, amen, amen, amen, amen
See the little baby
Wrapped in a manger on Christmas morning
Singing in a temple
Talking with the elders
Tomorrow there's wisdom

Amen, amen, amen, amen, amen
Hallelujah
Amen, amen, amen, amen, amen
Down at the Jordan
John was baptizing and saving all sinners
See him at the seaside
Talking with the fisherman
And made them disciples

Amen, amen, amen, amen, amen
Keep on pushin' now
Amen, amen, amen, amen, amen
Hallelujah now
Amen, amen, amen, amen, amen",Amen
The Impressions,"Your precious love means more to me
Than any love could ever be.
For when I wanted you,
I was so lonely and blue,
For That's what love will do
And darling, I'm so surprised,
Oh, when I first realized
That you were fooling me.
And darling, they say that our love won't grow.

But I just want to tell them they don't know.
For as long as you're in love with me,
Our love will grow wider,
Deeper than any sea.
And of all the things that I want,
In this whole wide world, is
Just for you to say that you'll be my girl.
Wanting you, I'm so lonely and blue.
That's what love will do.",For Your Precious Love
The Impressions,"From nowhere through a caravan
Around the campfire light
A lovely woman in motion
With hair as dark as night
Her eyes were like that of a cat in the dark
That hypnotized me with love

She was a gypsy woman,
She was a gypsy woman

She danced around and round to a guitar melody
From the fire her face was all aglow
How she enchanted me
Oh, how I'd like to hold her near
And kiss and forever whisper in her ear

I love you, gypsy woman
I love you, gypsy woman

All through the caravan
She was dancing with all the men
Waiting for the rising sun
Everyone was having fun
I hate to see the lady go
Knowing she'll never know
That I love her, I love her

She was a gypsy woman
A gypsy woman, a gypsy woman, a gypsy woman",Gypsy Woman
The Impressions,"He don't love you like I love you
If he did, he wouldn't break your heart
He don't love you like I love you
He's tryin' to tear us apart

Fare thee well, I know you're leavin' (I know you're leavin')
For the new love that you've found
The handsome guy that you've been dating, whoa
I got a feelin' he's gonna put you down 'cause

He don't love you like I love you
If he did, he wouldn't break your heart
He don't love you like I love you
He's tryin' to tear us apart

He uses all the great quotations
Says the things I wish I could say
Whoa, but he's has so many rehearsals
Girl, to him it's just another play but wait

When the final act is over
And you're left standing all alone
When he takes his bow and makes his exit
Girl, I'll be there to take you home

He don't love you (and he never will) like I love you
If he did, he wouldn't break your heart
Oh, he don't love you, girl, like I love you
He's tryin' to tear us apart

Whoa, he don't love you",He Will Break Your Heart
The Impressions,"Prettier than all the world
And I'm so proud (I'm so proud)
I'm so proud of you

You're only one fellow's girl
And I'm so proud (I'm so proud)
Believe me, I love you too

I'm so proud of being loved by you
And it would hurt, hurt to know
If you ever were untrue
Sweeter than the taste of a cherry so sweet
And I'm so proud (I'm so proud)
I'm so proud of you

Compliments to you from all the people we meet
Yes, and I'm so proud (I'm so proud)
Believe me, I love you too

I'm so proud of being loved by you
I'm so proud of being loved by you

And it would hurt, hurt to know
If you ever were untrue
Sweeter than the taste of a cherry so sweet
And I'm so proud (I'm so proud)
I'm so proud of you
Compliments to you from all the people we meet
Yes, and I'm so proud (I'm so proud)

Believe me, I love you too
Sweeter than the taste of a cherry so sweet
And I'm so proud (I'm so proud)
I'm so proud of you
Compliments to you from all the people we meet
Yes, and I'm so proud (I'm so proud)
Believe me, I love you too",I'm So Proud
The Impressions,"Keep on pushing
Keep on pushing

I've got to keep on pushing (mmm-hmm)
I can't stop now
Move up a little higher
Some way, somehow

'Cause I've got my strength
And it don't make sense
Not to keep on pushing

Hallelujah, hallelujah
Keep on pushing

Now maybe some day (mmm-hmm)
I'll reach that higher goal
I know I can make it
With just a little bit of soul
'Cause I've got my strength
And it don't make sense
Not to keep on pushing

Now look-a look (look-a look)
A-look-a yonder
What's that I see
A great big stone wall
Stands there ahead of me
But I've got my pride
And I'll move on aside
And keep on pushing

Hallelujah,  hallelujah
Keep on pushing

Keep on pushing, what'd I say
Keep on pushing, well it's all right
Keep on pushing",Keep on Pushing
The Impressions,"Oh, breaking up is so
Very hard to do

If you really love him
And there's nothing I can do
Don't try to spare my feelings
Just tell me that we're through

[Chorus:]
And make it easy on yourself
Make it easy on yourself
'Cause breaking up is so very hard to do

And if the way I hold him
Can't compare to his caress
No words of consolation
Will make me miss you less

My darling, if this is goodbye
I just know I'm gonna cry
So run to him
Before you start crying too

[Chorus]

Oh, baby,
It's so hard to do

[Chorus]",Make It Easy on Yourself
