Band,Lyrics,Song
MC Ren,"(Intro)
Mhhmmm
That's right
Take a voyage
Where?
All the way down
Down where?
Down where?
Down where?

(Verse 1)
Niggas be thinkin the Villain has stopped givin Compton props
Nigga you smokin off that muthafuckin stress
That your ass was chokin
CPT, I'm straight out, that's my muthafuckin heart
You can't tear me apart, they gave a nigga a start
It's crazy niggas in that bitch, plenty hoes to match
Plenty pussies to fuck, and plenty bitches to catch
Niggas be doin what they got to do, family's a need
Compton niggas hit that pussy so hard, make it bleed
Niggas hittin switches, and movin pounds of dope
So cluck-head muthafuckas got they rocks to smoke
Niggas be killin other niggas when they get in they path
White muthafuckas gives a fuck, they sit back and laugh
These undercover tight bitches be playin the tease
Got my dick hard as fuck but she want the pennies
Niggas be hatin 'cause I'm doin what the fuck they want to do
Niggas still be havin love for you (be havin love)
Uhh!

(Chorus)
Compton (he's back to you)
Compton come back to me (he's back to you)
I know, I know baby

(Verse 2)
Niggas be at the park, tryin to set the pussy up for the night
Baby you can suck this dick just as long as you don't bite
Go back to the crib, we do that soopafly scene
Fuck your ass in the tub, rub my dick with vaseline
Make my shit stretch all down your throat
Quit tryna talk with that shit in your mouth just write a note
Or use sign language if you need some air
I'll chase your ass around the room, fuck that pussy anywhere
I'm just a Compton nigga, no matter where the fuck I be
Niggas don't get high, with me, I'm just writin what I see
It's reality that's all a real nigga know
All that ""Slob/Cuzzin"" and bullshit - it gots to go
All these niggas know, Villain kickin the real
I gives a fuck how these muthafuckas feel
Niggas hate me 'cause I'm doin what the fuck they want to do
Niggas still be havin love for you (and I know)
Check it!

(Chorus)
Compton (he's back to you)
Come back, come back to me, yeah
Ohhhhh...(he's back to you)
Ohhhhh...I know, I know
(he's back to you)
Lalalalala...lalalalala
Compton, Compton (he's back to you)
Come back to me
Ohhh...no no no no...
(he's back to you)
Ohhhh...Compton...Ohhhh...
(he's back to you)
Ohhh...no no no no no...
(he's back to you)
Ohhh...Compton come back, come back to me baby
I...I want to tell you baby ohhh...no no no no...lalala...Ohhh...I...
Ohhh...Compton...come back to me
(he's back to you)",Voyage to Compton
MC Ren,"(Chorus) 2X
Nigga who the fuck got that street shit (Compton niggas)
Nigga who the fuck got that street shit (Park's niggas)
Nigga who the fuck got that street shit (LA niggas)
My nigga who the fuck got that street shit (Real niggas)

(MC Ren)
A motherfuckin fiend, before I became a teen
the villain was fuckin with bitches instead of cones or ice cream
Niggas be killing the villain like aids with whack rhymes
these niggas don't be havin no lyrics
All they talk about is nines and chronic
The villain be doing that but I can switch up
kick some unreleased shit nigga pick your bitch up
The villain be killin you niggas that's running with clicks
Ren be own em'
niggas be running with clicks cause they can't do it on they own lonesome
From CPT to NYC, I keeps it hot
bitches be worshiping a nigga with shrines and parking lots.
Ten years of damage motherfucking rap god
traded in the Dayton's on the foe with 3 tripods
The villain be travelling at the speed of light, cause I might
be uniden-tah-fied if I come whack, mothefuckers late at night
Niggas be waking up forgetting the whole thing
nigga it ain't over till the hoe sing, bitch sing it
 
(Chorus) 2X
 
(MC Ren)
Ain't shit changed, still making bitches pussy's hot
hanging with niggas from Compton carryin big glocks
Fucking em' car hops trippin off some paint and gold D'z
bitches be happy to hold these
Hanging with rap niggas like Lez and Joe Clair
niggas from Compton multiply and seen everywhere
Making your spot hot attract the feds and protest
kidnapping bitches and make the scene grotesque
Real niggas and bitches niggas hanging out
CPT dwelling shots reigning out
Selling coke, hoes taking dicks down they throat
bitch niggas coming up pissin all you find is a ransom note
New release, promotin fucking police
crooked motherfuckers hot cause I won't give em' a piece 
MC motherfuckin REN  back at cha'
niggas bit my shit the villain ain't mad at cha'
 
(Chorus) 2X
 
(MC Ren)
A nigga sittin on the curb rats catch whip lash
same hoes when I was little, fucking niggas for cash
Now they baby mommas cause they wanted niggas with dope
stuck with stretch marks and niggas names tattered by they throat
Some on they tittys, ankles and ass
every neighborhood got these stankin tricks from the past
They be at the clubs, pussy's used up
they tiitys six feet, there stomachs lookin bruised up
Real niggas turn the light out
nigga till they child's through
These hoes today be havin niggas rob you
Just to come up, so niggas can fuck em' with cheap weed
makin motherfuckers go and drop a week seed
Thinkin they max Julie fake ass macks
all the hoes shake the spot once they smoke up your chronic sack
Who's getting played nigga you or the hoe
these bitches be fuckin you and your doe
Niggas fuck it!
 
(Chorus) 2X",Who Got That Street S***
MC Ren,"A natural fact: 
That I pimp tracks and freak around 
The game got cracks in them pipes  
It's leakin' town 
My lines blow yo' mind  
Yo' senses remain puzzled 
Attacked by the weight of the bass 
In yo' chest  
Eightball  MJG  MC Ren  
Nevertheless 
'Cause we's the most 
My real ass lizards  
Let's make a toast  
And sing aloud to bustas  
And force 'em to get ghost 
And coast to coast 
We shows loves in Network, 
While some try to impress people 
And get hurt. 
Deep thoughts cloud my conscience 
As I curl, 
Up in the corner on hand, 
And then I hurl 
Call my girl 
Tell her I'm drunk 
And can't make it 
I tried to drink the whole damn bar 
And couldn't take it 
That's aiight! 
'Cause come sunrise, 
I'm still rollin' 
My nuts the only title I'm claimin' 
And still holdin' 

Now who in the fuck 
Want to come and represent? 
You bitch ass niggaz, 
Y'all be too hesitant 
I, take my black ass 
Down to the south 
Bitches want to fuck me 
While I'm in the Suave House 
Nigga, who in the fuck 
Want to come and represent? 
Oh, I know you suck that dick, 
Acting too hesitant 
We, MJG, Eightball, Villain, 
Make that straight nigga shit, 
That's how these niggaz feelin', Uh. 

Guess wo popped up, 
Straight up out the cuts 
With lyrical buckshots 
Spillin' all a nigga guts 
Touch whoever witness, 
Strays when I displays, 
A thousand different ways to get paid 
With a phrase 
Days go by, 
I be hibernatin' gettin' high 
Dreamin' 'bout L.A. 
Penetratin' somethin' fly 
Down in H-Town, 
Or somewhere in the Mound, 
All eyes on me, baby, 
'cause I get around 
We be like, connected 
Weak-ass niggaz get ejected 
Ooze like slime, 
Dig this hines when we wreck shit 
Uncut, coast to coast, 
Slangin' audio dope 
Manglin' MCs, leavin' 'em, 
Danglin' from ropes 
Boast, tryin' to be doper than most, 
In my profession 
Me and the villain, microphone killin' 
No blood spillin' 
Phat raps with much cheddar 
In the tellers, 
Eightball and MJG and MC Ren, 
Foreva! 

Now who in the fuck 
Want to come and represent? 
You bitch ass niggaz, 
Y'all be too hesitant 
I, take my black ass 
Down to the south 
Bitches want to fuck me 
While I'm in the Suave House 
Nigga, who in the fuck 
Want to come and represent? 
Oh, I know you suck that dick, 
Acting too hesitant 
We, MJG, Eightball, Villain, 
Make that straight nigga shit, 
That's how these niggaz feelin', Uh. 
 
Fuck that, bitches, the villain be 
Out in Houston, Tex., 
To fuck with them niggaz from Suave 
Who want to flex. 
Bitch niggaz got kidnapped, 
With dicks in they mouth, 
Fo' fuckin' Compton niggaz, and 
Niggaz from down South, 
Eightball, MJG, where you at, 
Space agent? 
Y'all prob'ly got all the bitches pagin' 
Suckin' 'casian. 
Writin' left nuts, 
Chapstick and lips, 
While bitch-ass niggaz spendin' chips, 
Just to see the hips 
South-West connection, 
Bitches bow tha fuck down 
Fuck how them other niggaz sound 
Villain be hated by niggaz because 
They bitches pussies throb 
Ready to slap that ho, 
Every time a head bob, niggaz be killin' me, 
Got that nigga T-Mixx, 
Pull the fuckin' remix 
If these words don't hurt you, 
Nigga, got them stones and sticks, 
And some Compton-ass niggaz 
To make you fade to black 
With some crazy Houston niggaz 
In the cut in the back 

Now who in the fuck 
Want to come and represent? 
You bitch ass niggaz, 
Y'all be too hesitant 
I, take my black ass 
Down to the south 
Bitches want to fuck me 
While I'm in the Suave House 
Nigga, who in the fuck 
Want to come and represent? 
Oh, I know you suck that dick, 
Acting too hesitant 
We, MJG, Eightball, Villain, 
Make that straight nigga shit, 
That's how these niggaz feelin', Uh.",Who in the F***
MC Sapão,"Put your hands up guys!
Put your hands up
Put your hands up
Put your hands up
Put your hands up

Put your hands up
Put your hands up
Put your hands up
Put your hands up

Você vai viajar
Explodir de prazer
Quando o som tocar
E o dia amanhecer

Everybody dancing oh oh
Everybody dancing oh oh
Everybody dancing oh oh
Everybody dancing oh oh

Você vai viajar
Explodir de prazer
Quando o som tocar
E o dia amanhecer

É só deixar o corpo balançar
É só deixar a mente viajar
É só deixar o clima acontecer
É só brincar no vai e vem, vem ver

Aqui o som é muito bom
Diretoria to tranquilão
A mulherada até o chão
Atividade e pegação

Vem gostosa, chega pra cá
Vem sem medo, pode agarrar
Vem delícia, sente a pressão
Keep calm, vem com o negão

Vem com o negão
Vem com o negão
Vem com o negão
Vem com o negão
Vem com o negão
Vem com o negão
Vem com o negão

Everybody dancing oh oh
Everybody dancing oh oh
Everybody dancing oh oh
Everybody dancing oh oh

Você vai viajar
Explodir de prazer
Quando o som tocar
E o dia amanhecer

É só deixar o corpo balançar
É só deixar a mente viajar
É só deixar o clima acontecer
É só brincar no vai e vem, vem ver

Aqui o som é muito bom
Diretoria to tranquilão
A mulherada até o chão
Atividade e pegação

Vem gostosa, chega pra cá
Vem sem medo, pode agarrar
Vem delícia, sente a pressão
Keep calm, vem com o negão

Vem com o negão oh oh

Everybody dancing oh oh
Everybody dancing oh oh
Everybody dancing oh oh
Everybody dancing oh oh
Everybody dancing
Everybody dancing oh oh
Everybody dancing oh oh

Put your hands up
Put your hands up
Put your hands up
Put your hands up

Put your hands up
Put your hands up
Put your hands up
Put your hands up

Brasil, funk music",Keep Calm
MC Serch,"[Chorus: x6]
Back to the grill again, the grill again 

[MC Serch]
You need a posse the size of the Nazis to attack this
And you're more optomistic than the Sounds of Blackness
Flip lines that rip through the chest cavity
And I keep going and going just like an Energizer battery

Flattery will get you nowhere, unless it's the derriere
And that will get you everywhere
Went to the flea market, was in the cark, parked it
Big fat blunts, if you got it then spark it

And with the fisticuffs came the fists
And you've joined Steven Segal on the Marked for Death hitlist
Went back to the 70's and brothers got on grants
'Cause they can step to some sisters and say ""Slap me some skins""

Honey dip, and take the squad to the teepee
Hit it off, smoke a cig, watch a little TV
And if there ain't no papes there's no show
I'll just chill and return to kick em in the grill

[Chorus]

[Red Hot Lover Tone]
Bust a style while I do it, if you know it oh you knew it
If you knew it then you knew it, if I catch a punk chewin
I'm a drop the flavor fluid on his head, yep I flew it
And like Aretha Franklin, your moms is jumping to it

So, so, so, where did you go, what do ya know
SO many people want to be fly like Joe
G.I., E.I., oh lots and lots
And rapper can top the Red Hot (Not!)

R&B rips hip-hop (Not!)
MC Serch is gonna flip-flop (Not!)
All my hoes look like sasquatch (Not!)
And George Bush gets nuff props

Well, anyway, Imma slay slay lay
Pull a hoe around my way and make hooker souffle
Red Hot Lover Tone would like to thank MC Serch
Yo, you're chill for making me a part of history
Kicking em in the grill

[Nas]
Finesse, keep a Tech-9 in my dresser
Lyrical professor, keep you under pressure
Mind like a computer, the inserter
Paragraphs of murder, the nightclub flirter

This is Nas, kid, you know how it runs
I'm waving automatic guns at nuns
Sticking up the preachers in the church, I'm a stone crook
Serial killer, who works by the phone book

For you I got a lot to shoot my songs in here
My rhymes are hotter than a prostitute with ghonnerea
On the mic I let vocabulary spill
(It's like that why'all) That why'all, kick em in the grill

[Chorus]

[Chubb Rock]
The Chubbsta breaks ?stabbabi? fakes, steady rate h
The panty mix the verse, looks to Serch, kick him in the grill again
Part 2, sequel of ""The Dialect, The Derelect""
The murder licks, Vanilla kicks alive on the crucifix

Coming around the mountain, when he comes to sell more record bums
Digest the lyrics then you suck on some Tums
Crumbs with the energy from the lump sums
And lips to to the mixture to the friction and then you're
Hummmmmmming, the door rings, yo I'm coming

To a theater near you, get your popcorn and your brew
And a Guinness Stout, check the clout when I'm about
'Cause YOU are a BLABBERMOUTH
A blabber, it gets no badder

Lyrics on a diet cause it gets no fatter
Like a Gewn to the Guthrien, jumping up on the scene
With the Serches with the verses
Word up, the illustrious

Rapper dapper sapper, you want us to sell out your wish
My lips have never touched the circumference of a spliff
And if you see some Coke or some spill
With some ill pill, yo kick me in the grill grill

[Chorus]

[MC Serch]
So here's a true and false, tell me if it's factable
You want to kill the Klan, shoot the fans a tractor pull
Got crazy game, so no one can stop me
But ah-yo, I'm white, I guess my game is hockey

Or basketball, football, taking papes in poker
If honeydip got a moneyclip I'm gonna stroke her
Wait a minute, chill chill, can't swing
'Cause my girl ain't my girl no more, now she got a ring

Respect my wisdom like I respect myself
To to G I'll put you in a tree like the Keebler elves
You couldn't be The Mack if you had the car, the hat, the hoe
And your shit would still be out the back like a patio

'Cause I saw you eating pig knuckles, with Frankie Knuckles
In a bar called Chuckles wearing name plate belt buckles
Goddamn your life is flimsy
Gave you enough respect, but gave it back cause I was stingy

So from the cons and pros to the pros and the cons
Call me a motherfucker I'll say ""Yeah I fucked your moms""
Until she calls back I'm gonna chill
Peace to Red Hot Lover Tone, Chubb Rock, kick em in the grill

[Chorus]",Back to the Grill
MC Serch,"Cast away all of your rhymes into a shredder
Got with my girl, the first day that I met her
Tip-toe, tip-toe, try to step light
And if you say I can't well then I might, be
All I can be without the army or the navy
'Cause aiyyo aiyyo I'm not with the service
Hurt us, no nada, nothin' I'm too thick
Called you Jimmy cause you're actin like a prick
Goody goody two-shoes, here comes the good news
Serch went solo, so do me a favor would you's
Come come come, and run out your drawers
Can you dig it?  It just hit the stores

Yeah, c'mon now, come come now
C'mon now, can you dig it?
Uh, c'mon now, come come now
C'mon now, can you dig it?

I come from no rock, so open up your lids
All up and down your spine I'll send the shivs
It's gettin' mighty nippy
Nipsey Russell I remember sellin' Jiffy
Hit me two times then hit me two times more
Hey yo chill, what'd you hit me for?
Oh yeah for the groove, but not the groovy train
I feel the vibes, but what does that pertain?
It's how I rock the hoodies with the hoods but I never did no hoodin'
And saw ""Gladiators"" cause of my man, Cuba Gooding
Jr., Sr., Mister Mister Big
Shake a leg, break a leg but stay, hip to the jig

Uh, c'mon now, come come now
C'mon now, can you dig it?
Uh uhh, c'mon now, come come now.
Yeah, c'mon now, can you dig it?

I've seen times change, watchin' the rhymes change
From good to bad to worse from worse to hearse
Why is it the hearse makes all the papes?
I know you're mad phony ya know like counterfeit tapes
Hit one, strip one, rip one to the bad boy and ya find
There ain't nothin' there no more
You're blowin' smoke up, where there ain't no sunlight
And I don't need K-F-C to show me how it's done right
I rip mics I grab mics I wreck mics until I'm hoarse
And when I can't rhyme I'll go home and read The Source
Peace to the streets the thugs the vandals and the hoods
You dig it, you dig it, you dug it? Good

Then c'mon now, come come now
You've got to c'mon now, can you dig it?
C'mon now, come come now
C'mon now uhh, can you dig it?

Diggin' the vibe cause the vibe is what I'm diggerin'
Triggerin' samples bigger sounds Serch must begin again
Did what I had to dig, a tractor-trailer and a rig
Cannot get this big; your voice is foul, stop smokin' cigs
And put your life back in order
Met Chantelle at Taco Bell and made a, run for the border
Saw all the dust and ma and pa doowops is who I trust
And some old school kid tried to come back but his lyrics were all rust
And mustard ketchup, sauerkraut and relish
Sell this crap I like to rap but hey yo that's my fetish
Kick the smooth style, I hope that y'all can get it
And if you don't you dig it you got it come on and kick it

C'mon now, come come now
C'mon now, can you dig it?
C'mon now, come come now
C'mon now, can you dig it?

I'm hip to the dig, I'm hip to the dig
I'm hip to the dig, I'm hip to the dig
I'm hip to the dig, I'm hip to the dig
I'm hip to the dig

Dumb shout out to my man Ken Kesney on the twenty-four",Can You Dig It
MC Serch,"[ VERSE 1 ]
I can be paid, and don't have to have money
Jump off a bridge, and don't have to use bungee
I like Cypress Hill, and don't have to smoke blunts
And when the beat comes in, you don't have to jump
Oh yeah, it don't have to be 'oh no'
Serch rides the rhythm, but it doesn't have to flow
You can be beefin, and not be a Tom
Go get skins, and don't have to be a John
I can raise the roof, and not have a home
Go solo, and don't have to be alone
I can be Simon, and don't have to draw
Step to the a.m. and not sit by the door
I can have pockets, and don't have to be swollen
Fat-ass beat, and it don't have to be stolen
Went a 1000 places, and didn't have to be hike that
World full of hate, and it don't have to be like that

[ CHORUS ]
	And it don't quit
	And it don't stop
	When it don't quit
	Then it don't stop
	When it don't quit
	Then it don't stop
	It keeps on and on		(2x)

[ VERSE 2 ]
I can come ghetto, and don't have to be a bastard
Hold a conversation, and don't have to have the last word
Shoot the gift swift, and not miss the street
Even - ehm - and not come off the beat
Oh yeah, be ??? without shootin at the earth
Even be gold, and not have any worth
You can beat beef, and don't need utensils
Write ruff rhymes without pens and pencils
Mad low end, and I don't have any treble
Be like rock, and it don't have to metal
Be in Detroit and don't have to be a Piston
Tell me a white lie, yo, I don't have to listen
I can walk, and I don't have the need
Catch a cut, but I don't have to bleed
Go to a club, and I don't have to sweat
Chill, time to go, but you don't have to get up yet

[ CHORUS ]

[ VERSE 3 ]
I can be the U.S., and don't have to war
I can get open, and don't need any door
I can get loud, and don't have to scream
Peace to Dr. King, and don't forget about the dream
Oh yes, oh yes, I don't have to be a yes-man
Go get married, and don't have to have a best man
I can be positive, and don't have to be a plus
If you're not gettin papes, then you're not down with Rush
I can have skills, and don't need a trade
I can be in London, don't have to like rain
Nots, nots, nots, and not have any rope
Go take a shower, but don't need any soap
Point me to the mic, I need no rehearsal
Yes, I'm the man, there'll be no role reversal
I can be blue, and don't have to be the jeans
Don't wear the X hat when you don't know what it means

[ CHORUS ]",Don't Have to Be
MC Serch,"""This is probably the most challenging record
 you have ever put on your turntable..""

[MC Serch]
The facts, the facts get fried like your eggs scrambled
truth until it falls off the ledge lays dead or vexed
Tennis feds(?) need the last price, gassed ego
He don't show or know about the last nights and days
of a brother who went for his
My land built on hatred and sent to kids
Ice Cube killed his own and it was square biz
So if I say fuck you to a jew, you know what time it is
Of my own kind but not of my own mind
Came to America but became blind
Chased from the four corners of the earth
But over here it's alright, at least your ass is white
So sit down and mingle with the devil over supper
The only difference between us and a brother is the color
Instead of hittin the last nail in the coffin try to pull it out
And find out what the hard but true is all about

[Chorus]
It's hard.. but it's true
The hard but the true
It's hard.. but it's true
The hard but the true
So hard.. but so true
The hard but the true
It's hard.. but it's true
The hard but the true

[MC Serch]
Hard, what?  Truth sometimes too hard to be true
So I'ma make it stick like glue
Too many times too many crimes get backed up
Case comes up, oops!  Switch all the facts up
Three kids rape a sister at St. John's
and become graduates, instead of cons
Instead of washin drawers or be somebody's whore
College wack buffed and polished and they kept the doors closed
Jail time (yeah?) Wasn't even fazin 'em
Probably one of the fathers gave the school a gymnasium
Korean kills a girl and claims insane, and gets a pardon?
Bring her honor to the court of Nickerson Garden
And get a lifetime sentence of the bent over
Tell a fool, tell a friend and then sent over
Hollow point slugs made of nothin but lead
The hard but true is takin you straight to the head

[Chorus]

[MC Serch]
Reggie McBride, yeah..
Asalaam alaikum to a Muslim
Shalom alaikum is the same to a Hebrew
Peace akeem, akeem peace to a Zulu
Tell me what's the difference why you riffin what's the point of view?
Universal greeting is the same
The game is three-sixty it don't matter what the slang
Gangs of thugs carry slugs use the mind as a glock 9
Wake the ones then shake the ones
then make the ones come into the daytime
And spark the mark labelled X
And knowledge the text
Use the wit not as a whip reload the clip then shoot from the hip
Cause yo!  This is some ol' next shit
One circle, one hurdle, one jump
One nation under the groove, and then over the hump
of racist dogs, that keep barkin in the street
Serch'll bring the hard but true to your feet, complete!

[Outro]
It's hard.. but it's true
The hard but the true
It's hard.. but yo, it's true
The hard but the true
It's hard.. but it's true
The hard but the true
So hard.. so true
The hard but the true

Yeah Wolf & Epic, cool
Ay you, ay you ay you, ay you ay you
Ay you, it's hard but it's true
Ay you, ay you ay you ay you
It's hard but it's true, you hebrew or you jew
Your christian, your muslim, your islam, your brother, your sister
It's hard but it's true.. peace",Hard But True
MC Serch,"So y'all thought I was comin back with some old R&B huh?
Check it...

Here it, comes!
Yo, here it is or there it was
But where was it when you need it?  Because
You fall to the waistline when you waste rhymes
Serch got it flowin when it comes to fat beats and basslines
I heard the rumors and the fables
Remove them like tumors on the tables
Boomers for the willing and the able
So turn to the next page in your manual and flim-flam, all over the jam
Chill
Lounge
Kick your ten little toes up at the end of this
Razor blade and save your spade
As the groove pummets you to another dimension
May I just mention
This is a map, it's for all made for climbin
And you're stuck to your grip like an aluminum sidin
Hiding in the back is for crumbs
Hon, here it comes!

Hit it off
Kick it off
Hit it off
Here it, comes!

be	-boys, decots will try to destroy
Delpoy the truth in black hoods and black boots
Caps get rocked only when they're fitted
Lyrics get dropped only when they're lifted
So swing time is one up, the vo-chords run amuck
Whatup?  Whatup?  I got mine and you got yours
War's a factor, we'll perspire
And someone in the crow yells fire fire
we don't need no water, let it burn yo burn yo
We don't need no water let it burn... so it burnt
Learn your lesson well, if I don't then I guess you get jelled
Swell, heads go down like the sun and here it comes

Chorus

Fiddle-fee, fiddle-fie, fiddle-foe, fiddle-fum
I smell the blood of an English
muffin, huffin and puffin
sellin his soul, J-E-L-L-O, ya know?
Roll with the squad who makes back flips stack
Hits upon this so play at your own risk
Tisk, tisk, tisky, ya shoulda used Wisk
Now you shouldn't appeal to be a Biff
Insist that your motor's on scramble
Remember the skips and enter the sample
Ample flow is created by the tears and years
Of proved and blue, perched on the front steps
Checkin for the bass loop
So the troops pulled out and the tows are paid, set and done
And here it comes...
I said here it comes!

Chorus",Here It Comes
