Band,Lyrics,Song
Norfolk Singers,"Walked with no one and talked with no one
And I had nothing but shadows
Then one morning you passed
And I brightened at last
Now I greet the day and complete the day
With the sun in my heart
All my worry blew away
When you taught me how to say

Grab your coat and get your hat
Leave your worry on the doorstep
Just direct your feet
To the sunny side of the street
Can't you hear a pitter-pat?
And that happy tune is your step
Life can be so sweet
On the sunny side of the street

I used to walk in the shade
With those blues on parade
But I'm not afraid
This Rover crossed over

If I never have a cent
I'd be rich as Rockefeller
Gold dust at my feet
On the sunny side of the street
Grab your street",On the Sunny Side of the Street
Noriega,"Linda estrella
Dibujame tu nombre
En todita las estrellas
Pues, cada vez que la lluvia cae
Siento que pierdo la cabeza
Yo por ti, dime si tu por mi
Linda estrella
Dibujame tu nombre
En todita las estrellas
Pues, cada vez que la veo pasar
Siento que pierdo la cabeza
Yo por ti, dime si tu por mi

Es que te quiero tanto why tanto
Que escribiré tu nombre en la arena
why un ""Te Amo"" en la marea
Allá en el mar del sentimiento
Porque te quiero tanto why tanto
Linda estrella, voy a pintar tu nombre
Dentro de algún hoguera
A ver si así me quema
Linda, si supieras
Que con solo pensar en ti
Algo se acelera muy dentro de mi
escribiré el bello nombre de mi estrella
En una nube de la colina La Pradera
Para que el cielo te abraze why te desnude
En un linaje bajo la luna
Por que te quiero tanto why tanto
Que escribiré tu nombre en la arena
Mas allá del firmamento
Para que al fin me creas

Todo empezó como un cuento de hadas
Donde me enamore de una modelo que sale en portadas
No despertaba, aun su imagen miraba
why que me pasa, yo como un loco un papel besaba
Haría lo que fuera por sacarte del papel
Besar tu linda boquita que me hare enloquecer
Vente conmigo, mami, pa' llenarte de placer
why dime si esto no lo quieres hacer
why embriagarnos con un vino tinto
Soy tu nene atrevido
Quiero comerte el ombligo
Niña, escápate conmigo
Pa' que pruebes sexo fino
why llegar a las estrellas
Buscar entre todas
Mi estrella mas bella

Es que te quiero tanto why tanto
Que escribiré tu nombre en la arena
why un ""Te Amo"" en la marea
Allá en el mar del sentimiento
Por que te quiero tanto why tanto
Mas allá del firmamento
Para que al fin me creas",Linda Estrella
Norm,"Hey, Venus, oh, Venus
Hey, Venus, oh, Venus
Venus, if you will
Please send a little girl for me to thrill
A girl who wants my kisses and my arms
A girl with all the charms of you
 
Venus, make her fair
A lovely girl with sunlight in her hair
And take the brightest stars up in the skies 
And place them in her eyes for me
 
Venus, goddess of love that you are
Surely the things I ask
Can't be too great a task
 
Venus, if you do
I promise that I always will be true
I'll give her all the love I have to give
As long as we both shall live
 
Hey, Venus, oh, Venus
Make my wish come true
",Venus
Norm Douglas,"I can only give you love that lasts forever,
And the promise to be near each time you call,
And the only heart I own is yours and yours alone, that's all, that's all.
I can only give you country walks in springtime,
And a hand to hold when leaves begin to fall,
And a love whose burning light to warm the winter night, that's all, that's all.
There are those I am sure who have told you,
They will give you the world for a toy.
All I ask for these arms to enfold you, and a love, time can never destroy.
If you're wond'ring what I'm asking in return, dear,
You'll be glad to know that my demands are small.
Say it's me that you'll adore for now and ever more, that's all, that's all.",That's All
Norm Kubrin,"I took a trip on a train
And I thought about you
I passed a shadowy lane
And I thought about you

Two or three cars parked under the stars
Winding stream
Moon shining down on some little town
And with each beam, the same old dream

And every stop that we made
Oh, I thought about you
And when I pulled down the shade
Then I really felt blue

I peeped through the crack
Looked at the track
Oh I'm going back to you
And what did I do, I thought about you

There were two or three cars parked under the stars
Winding stream
Moon shining down on some little town
And with each beam, the same old dream

And then I peeped through the crack
And I looked at the track
Oh I'm going back to you
And what did I do, I thought about you",I Thought About You
Norm Kubrin,"Why did I wander
Hereand there and yonder,
Wasting precious time
For no reason or rhyme?
Isn't it a pity!
Isn't it a crime!
My journey is ended,
Everything is splendid;
Meeting you today
Has given me a wonderful idea 
Here I stay!

It's a funny thing;
I look at you,
I get a thrill I never knew,
Isn't it a pity we never met before!

Here we are at last,
It's like a dream,
The two of us, a perfect team,
Isn't it a pity we never met before!

Imagine all the lonely years we've wasted,
You with the neighbours,
I at silly labours!
What joys untasted,
You readin Heine,
Me somewhere in China!

Let's forget the past, let's both agree
That I'm for you and you're for me,
And it's such a pity we never, never met before!

Imagine all the lonely years we've wasted,
Fishing for salmon,
Losing at backgammon!
What joys untasted,
My nights were sour,
Spent with Schopenhauer!

Let's forget the past, let's both agree
That I'm for you and you're for me,
And it's such a pity we never, never met before!",Isn't It a Pity?
Norm Kubrin,"Love walked right in and drove the shadows away
Love walked right in and brought my sunniest day
One magic moment and my heart seemed to know that love said hello
Though not a word was spoken

One look, and I forgot the gloom of the past
One look and I had found my future at last
One look and I had found a world completely new
When love walked in with you

One magic moment and my heart seemed to know that love said hello
Though not a word was spoken

One look and I had found a world completely new
When love walked in with you",Love Walked In
Norm Kubrin,"The man who only lives for making money
Lives a life that isn't necessarily sunny
Likewise the man who works for fame

There's no guarantee that time won't erase his name
The fact is, the only work that really brings enjoyment
Is the kind that is for girl and boy meant
Fall in love and you won't regret it
That's the best work of all, if you can get it
Holding hands at midnight

'Neath a starry sky
Nice work if you can get it
And you can get it if you try
Strolling with the one girl
Sighing sigh after sigh
Nice work if you can get it
And you can get it if you try

Just imagine someone
Waiting at the cottage door
Where two hearts become one
Who could ask for anything more?
Loving one who loves you
And then taking that vow
It's nice work if you can get it
And if you get it, won't you tell me how?""

Just imagine someone
Waiting at the cottage door
Where two hearts become one
Who could ask for anything more?
Loving one who loves you
And then taking that vow
Nice work if you can get it
And if you get it, won't you tell me how?""",Nice Work if You Can Get It
Norm Kubrin,"Summer me, winter me
And with your kisses, morning me, evening me
And as the world slips far away, a star away
Forever me with love

Wonder me, wander me
Then by a fire pleasure me, peaceful me
And in the silence quietly, whisper me
Forever me with love

And every day I'll gentle you, tender you
And, oh, the way I'll velvet you, clover you
I'll wrap you up and ribbon you, rainbow you
And shower you with shine

Suddenly, magically, we found each other
There we were, here we are
I plan to let you happy me, summer me, winter me, always

Then suddenly, magically, we found each other
There we were, here we are
I plan to let you happy me, summer me, winter me, always be mine","Summer Me, Winter Me"
Norm Kubrin,"Where do you start? How do you separate the present from the past?
How do you deal with all the thing you thought would last? That didn't last
With bits of memories scattered here and there
I look around and don't know where to start

Which books are yours?
Which tapes and dreams belong to you and which are mine?
Our lives are tangled like the branches of a vine that intertwine
So many habits that we'll have to break
And yesterday's we'll have to take apart

One day there'll be a song or something in the air again
To catch me by surprise and you'll be there again
A moment in what might have been

Where do you start? Do you allow yourself a little time to cry?
Or do you close your eyes and kiss it all goodbye? I guess you try
And though I don't know where and don't know when
I'll find myself in love again
I promise there will always be a little place no one will see
A tiny part within my heart, that stays in love with you

",Where Do You Start
Norm Kubrin,"You make me feel so young
You make me feel as though spring has sprung
And every time I see you grin
I'm such a happy in-div-dual

The moment that you speak 
I wanna go play hide and seek
I wanna go and bounce the moon
Just like a toy balloon

You and I are just like a couple of tots 
Runnin' across the meadow 
Pickin' up lots of forget me nots

You make me feel so young 
You make me feel there are songs to be sung Bells to be rung 
And a wonderful spring to be sprung
And even when I'm old and gray 
I'm gonna feel the way I do today
'Cos you make me feel so young",You Make Me Feel So Young
Norm Lewis,"Look at me
I'm as helpless as a kitten up a tree
And I feel like I'm clinging to a cloud
I can't understand
I get misty, holding your hand

Walk my way
And a thousand violins begin to play
Or it might be the sound of your hello
That music I hear
I get misty the moment you're near

You can say that you're leading me on
But it's just what I want you to do
Don't you realize how hopelessly I'm lost
That's why I'm following you

On my own
Would I wander through this wonderland alone
Never knowing my right foot from my left
My hat from my glove
I get misty, and too much in love

I'm too misty, and too much in love",Misty
Norma Eliza,"When I said I needed you
You said you would always stay
It wasn't me who changed but you and now you've gone away
Don't you see that now you've gone
And I'm left here on my own
That I have to follow you and beg you to come home

You don't have to say you love me just be close at hand
You don't have to stay forever I will understand
Believe me, believe me I can't help but love you
But believe me I'll never tie you down
Left alone with just a memory
Life seems dead and quite unreal
All that's left is loneliness there's nothing left to feel

You don't have to say you love me just be close at hand
You don't have to stay forever
I will understand believe me, believe me
You don't have to say you love me just be close at hand
You don't have to stay forever
I will understand, believe me, believe me",You Don't Have to Say You Love Me
Norma Jean,"Once I thought your love I'd win but your old flame showed up in town again
Now I know your love I lose I've got a one way ticket to the blues
I've got a one way ticket to the world that's full of tears
All my dreams and hopes are gone we built up through the years
Seems I can't win I always lose I've got a one way ticket to the blues

I've tried to find somebody new but in my heart there's only room for you
You gave me something I can't lose I've got a one way ticket to the blues
I've got a one way ticket...",One Way Ticket to the Blues
Norma Jean,"Why why why can't you understand
That golden wedding band you wear on your left hand means that you're mine
Why why why can't I make you see though you still think you're free
Your heart belongs to me till the end of time
I love you more than words can ever say my heart would break if you should go away
No one could love you like I do and I die a little more each time that you're untrue
Why why why can't you understand

Why can't you be true the way you were why do you keep running back to her
I pray each minute I'm alone that you'll forget her soon and find your way back home
Why why why can't you understand",Why
Norma Jean,"Together again my tears have stopped falling the long lonely nights are now at an end
The key to my heart you hold in your hand
And nothing else matters we're together again
[ piano - steel ]
Together again the grey skies are gone you're back in my arms darling where I belong
The love that we knew is living again
And nothing else matters we're together again
And nothing else matters now we're together again",Together Again
Norma Jean,"Tonight they're singing in the villas tomorrow you'll be gone so far
Hold me close and say you love me while Amigo plays his blue guitar
Ay ay ay ay the moon is lonely tomorrow I'll wonder where you are
Manana morning my darling I'll be blue as Amigo's guitar
[ ac.guitar ]
They've hushed their singing in the villas all is quiet beneath the stars
Amigo plays Hasta Luego upon his lonely blue guitar
Ay ay ay ay the moon is lonely...




",Amigo's Guitar
Norma Jean,"You'll hear talk around town of things I used to do
Some will try to poison your mind that my love can't be true
Many nights I lay awake dear hopin' our love will last
Wonderin' if your love is strong enough to forget about my past
I don't claim to be an angel my life's been full of sin
But when I met you darling that all came to an end
Never doubt my love dear whatever you may do
I don't claim to be an angel but my love for you is true
[ fiddle ]
I never knew what real love was till you came along
You changed my outlook on life made me regret my wrongs
Why should my past keep haunting me all through the years
I paid for my mistakes with millions of bitter tears
I don't claim to be an angel...




",I Don't Claim to Be an Angel
Norma Jean,"Searching I've spent the lifetime darling searching looking for someone like you
Dreaming in all my dreams I dream that someday I'll find someone just like you

Other loves have come my way but they were not for me
Tell me that you're here to stay don't ever set me free
Cause I've been searching I've spent the lifetime darling searching
Looking for someone just like you

Other loves have come my way",Searching
Norma Jean,"I just came in here from force of habit I don't intend to spend too much time in here
But I heard you headin' for the teardrops and if you play A-11 there'll be tears
I don't know you from Adam but if you're gonna play the jukebox
Please don't play A-11

Oh this used to be our favorite nightspot and when he was here it was heaven
It was here he first told me that he loved me and he always played A-11
I don't know you from Adam..
Please don't play A-11",A-11
Norma Jean,"For a long long time now just about every night
You found some excuse not to hold me tight
No matter what I do you sit and pout
Don't let that doorknob hit you going out

Don't let that doorknob hit you going out honey
Others lips now thrill you there's no doubt
There's no burden like the love you make me live without
Don't let that doorknob hit you going out

I've laid awake nights to two or three
So near to you but you're so far from me
The battle's done you won the fight no doubt
Don't let that doorknob hit you going out

Don't let that doorknob hit you
Don't let that doorknob hit you going out
",Don't Let That Doorknob Hit You
Norma Jean,"Oh mama I'm excited I'm almost out of breath
When I saw the light that made me run myself to death
I was on the mountain side when I looked down below
And glory be I thought I'd better come and let you know
That we got company's comin' company's comin' we got company comin' up the road
They're down the road about a mile they'll be here in a little while
There's company comin' up the road
Well Granny change your apron and Willie shine your shoes
Sally put your new dress on we got no time to lose
I'll go find a welcome mat and spread it out with cheer
I don't know yet just who they are can't pick 'em out from here
But we got company comin' company's comin' we got company comin' up the road
They're comin' up the mountain side Susie don't you run and hide
Company comin' up the road
[ fiddle - el.banjo ]
Well run out to the henhouse and wring a neck or two
We'll have chicken and dumplings and some yellow gravy too
Grandpa get your fiddle down they might want a tune
Everybody hurry cause them folks'll be here soon
Oh we got company comin' company's comin' we got company comin' up the road
Well let them all shout out aloud they'll be here in a minute now
There's company comin' up the road company's comin' up the road




",Company's Comin'
Norma Jean,"What would you do what would you do if Jesus came to spend some time with you
If Jesus came to your house to spend a day or two
If he came unexpectedly I wonder what you'd do
When you saw him comin' would you meet him at the door
With arms outstretched and welcome to your heavenly visitor

Or would you need to change some things before you'd let him in
Like to burn some magazines and put the Bible where they'd been
Oh I know you'd give your nicest room to such an honered guest
And all the food you'd serve to him would be the very best
But what about your family conversation would it keep up its normal pace

And would you find it hard each meal to say a table grace
Would you be glad to have him meet your very closest friends
Or hope that maybe they'd stay away until his visit ends
Would you be glad to have him stay forever on and on

Or sigh of great relief when finally he'd gone
You know it might be interesting to know the things you'd do
If Jesus came in person to spend some time with you
What would you do what would you do if Jesus came to spend some time with you",What Would You Do
Norma Jean,"I love my ramblin' man and my ramblin' man loves me
I know he'll be back so I'll help him pack then I'll give him a kiss and my key
I love my ramblin' ramblin' man...

Yes I love a ramblin' man don't tell me he doesn't love me
He's kind and he's sweet till he gets at your feet
Then he's wild as the wind in the trees
I love my ramblin' ramblin' man...
[ guitar ]
Well I kiss him hello when he's back and he talks of the road and the track
I cook and I sow but I know that he'll go as soon as he's stealin' the slack
I love my ramblin' ramblin' man...
I love my ramblin' ramblin' man...




",Ramblin' Man
Norma Jean,"Well mama go a tippy tippy toeing through the house
Gotta see what's the matter with the baby
It's been a bawlin' and a squallin' and a kickin' on the wall
Well I guess it's dropped its little bottle maybe
Well daddy come a running with the water and a rag
Gonna need another little diaper maybe
No need a hesitatin' or a wonderin' and a waitin'
I know what's the matter with baby we know what's the matter with the baby
Oh mama rock a baby daddy rock a baby too
It's a yawnin' and a gettin' sleepy maybe
So mama keep a rockin' daddy rock a little too and at last it's a sleepin' little baby
[ guitar ]
Well mommy tippy toeing daddy tippy toeing too gonna try to do a little sleepin' maybe
Whether it'll be a minute or an hour or two is depending entirely on the baby
Well I hear the clock a ringing just a dongin' and a dingin'
Daddy go and make a little money maybe
Mama sleep a little longer but remember while he's gone
Won't you please take care of the baby after all it's just a little baby
Oh mama rock a baby...
At last it's a sleepin' little baby at last it's a sleepin' little baby




",Tippy Toeing
Norma Jean,"Don't look me in the eyes say you love me
That's one more I don't ever wanna hear again
Cause honey just last night that you went and shamed me
You opened up your arms and you let another woman come in
Don't put your hands on me after they been on her
Don't put your lips on mine after you let 'em flirt
I know it won't be the last time and I don't guess it was the first
Don't put your hands on me after they been on her
[ guitar ]
Well they'd bet I'm such a stingy woman
But I just never did like to fuss and sharin' my man
And before you can open your mouth and say you're sorry
I'm gonna have your old ring put off of my hand
Don't put your hands on me...
Don't put your hands on me after they been on her




",Don't Put Your Hands on Me
Norma Jean,"""Good morning, sir, what'll you have?"" That's how I start my day
I spend nearly half my life in this little dim cafe
I listen to their troubles, I'd try to be their friend
But heaven help the working girl in a world that's run by men

Oh, heaven help the working girl
Then goin' gets rough in this old world
Filled with men who spend their time
Tellin' lies, breathin' sighs, gettin' wise
Havin' cries and drinkin' too much wine

Thank you, sir, you're very kind, I think I'll pass this time
We'd both be sorry if I did go home to your wife and your kids
It's just the bottle talkin', I'm familiar with that sound
Oh, heaven help the working girl till true love comes around

Oh, heaven help the working girl
Then goin' gets rough in this old world
Filled with men who spend their time
Tellin' lies, breathin' sighs, gettin' wise
Havin' cries and drinkin' too much wine
",Heaven Help the Working Girl
Norma Jean,"You were mine for just a while now you're puttin' on the style
And you've never once looked back at your home across the track
You're the gossip of the town but my heart can still be found
Where you tossed it on the ground pick me up on your way down
Pick me up on your way down when you're blue and all alone
When their glamour starts to bore you come on back where you belong
You may be their pride and joy but they'll find another toy
Then they'll take away your crown pick me up on your way down
[ fiddle ]
They have changed your attitude made you haughty and so rude
Your new friends can take the blame underneath you're still the same
When you learned these things're true I'll be waitin' here for you
As you tumble to the ground pick me up on your way down
Pick me up on your way down...




",Pick Me Up on Your Way Down
Norma Jean,"What locks the door to the world you're living in?
What kind of key do I need to get in?
I tried anything from solid gold to cent
What locks the door to the world you're living in?

You can't relive your past with the dream that's gone
You can't find love that will last in your world alone
A hurt so tall has built the wall where fate begins
What locks the door to the world you're living in?

What locks the door to the world you're living in?
What kind of key do I need to get in?
I tried anything from solid gold to cent
What locks the door to the world you're living in?
",What Locks the Door
Norma Jean,"A little bit of tenderness a little bit of love and care
And when she needs you a litle bit of bein' there
A little bit of kissin' and occasional hurt
The first thing you know you got yourself a woman in love

Now and then I share enough of good things like a beauty of a twilight hour
Now and then a little box of candy sometimes an occasional flowers
A little bit of bein' aware of what she's a thinkin' of
The first thing you know you got yourself a woman in love
To make a woman love you is easy as long as you know what to do

A little bit of bein' faithful and true a few words like I love you
A little bit of tender touchin' when you look into her eyes
A little bit of faith and trust and a little bit of not tellin' lies
A little bit of thanks giving for the good things and heaven above

The first thing you know you got yourself a woman in love
To make a woman love you...
The first thing you know you got yourself a woman in love",Woman in Love
Norma Jean,"What a beautiful thought I am thinking concerning the great speckled bird
Remember her name is recorded on the pages of God's holy word
Desiring to lower her standards they watch every move that she makes
For they long to find fault with her teaching but really they find no mistakes

I am glad I have learned of her meekness I am proud that my name's on her book
For I want to be one never fearing the face of my Savior's true look
When he comes descending from heaven on the clouds as he write in his word
I'll be joyfully carried to meet him on the wings of the great speckled bird",Great Speckled Bird
Norma Jean,"I wandered so aimless life filled with sin I wouldn't let my dear Saviour in
Then Jersus came like a stranger in the night praise the Lord I saw the light
I saw the light I saw the light no more darkness no more night
Now I'm so happy no sorrow in sight praise the Lord I saw the light
Just like a blind man I wandered along worries and fears I claimed for my own
Then like a blind man God gave back his sight praise the Lord I saw the light
I saw the light...
[ guitar ]
I was a fool to wander and stray straight is the gate and narrow's the way
Now I have traded the wrong for the right praise the Lord I saw the light
I saw the light...
I saw the light...",I Saw the Light
Norma Jean,"Precious memories unseen angels sent from somewhere to my soul
How they linger ever near me and the sacred past unfolds
Precious memories how they linger how they ever flood my soul
In the stillness of the midnight precious sacred scenes unfold
Precious father loving mother fly across the lonely years
And old home scenes of my childhood in fond memory appear
In the stillness of the midnight echoes from the past I hear
Old time singing gladness bringing from that lovely land somewhere
Precious memories how they linger",Precious Memories
