Band,Lyrics,Song
Steve Winwood,"Well, my temperature is rising, got my feet on the floor
Crazy people rocking 'cause they want to some more
Let me in baby, I don't know what you got
But you better take it easy 'cause this place is hot

And I'm so glad you made it, so glad you made it
You got to gimme some lovin', gimme, gimme some lovin'
Gimme some lovin', gimme, gimme some lovin'
Gimme some lovin' everyday

Well, I feel so good, everything's getting high
You better take it easy 'cause the place is on fire
Been a hard day and I had no work to do
Wait a minute baby, let it happen to you

And I'm so glad we made it, so glad we made it
You got to gimme some lovin', gimme, gimme some lovin'
Gimme some lovin', gimme, gimme some lovin'
Gimme some lovin' everyday, yeh

Well, I feel so good, everything's getting high
You better take it easy 'cause the place is on fire
Been a hard day nothing went too good
Now I'm gonna relax, buddy everybody should

And I'm so glad we made it, hey hey, so glad we made it
You got to gimme some lovin', gimme, gimme some lovin' woo ooo
Gimme some lovin', gimme, gimme some lovin'

Gimme, gimme, gimme some of your lovin', baby
You know I need it so bad woo ooo
Gimme some of your lovin', baby",Gimme Some Lovin'
Steve Winwood,"It's already written that today will be one to remember
The feeling's the same as being outside of the law
Had to cry today
Well, I saw your sign and I missed you there

I'm taking the chance to see the wind in your eyes while I listen
You say you can't reach me but you want every word to be free
Had to cry today
Well, I saw your sign and I missed you there
And I missed you there

Had to cry today",Had to Cry Today
Steve Winwood,"There were three men came out of the west, their fortunes for to try
And these three men made a solemn vow
John Barleycorn must die
They've plowed, they've sown, they've harrowed him in
Threw clods upon his head
And these three men made a solemn vow
John Barleycorn was dead

They've let him lie for a very long time, 'til the rains from heaven did fall
And little Sir John sprung up his head and so amazed them all
They've let him stand 'til midsummer's day 'til he looked both pale and wan
And little Sir John's grown a long long beard and so become a man
They've hired men with their scythes so sharp to cut him off at the knee
They've rolled him and tied him by the way, serving him most barbarously
They've hired men with their sharp pitchforks who've pricked him to the heart
And the loader he has served him worse than that 
For he's bound him to the cart

They've wheeled him around and around a field 'til they came onto a pond
And there they made a solemn oath on poor John Barleycorn
They've hired men with their crabtree sticks to cut him skin from bone
And the miller he has served him worse than that 
For he's ground him between two stones

And little Sir John and the nut brown bowl and his brandy in the glass
And little Sir John and the nut brown bowl proved the strongest man at last
The huntsman he can't hunt the fox nor so loudly to blow his horn
And the tinker he can't mend kettle or pots without a little barleycorn",John Barleycorn
Steve Winwood,"If you see something that looks like a star
And it's shooting up out of the ground
And your head is spinning from a loud guitar
And you just can't escape from the sound
Don't worry too much, it'll happen to you
We were children once, playing with toys
And the thing that you're hearing is only the sound of
The low spark of high-heeled boys

The percentage you're paying is too high priced
While you're living beyond all your means
And the man in the suit has just bought a new car
From the profit he's made on your dreams
But today you just read that the man was shot dead
By a gun that didn't make any noise
But it wasn't the bullet that laid him to rest was
The low spark of high-heeled boys

If you had just a minute to breathe and they granted you one final wish
Would you ask for something like another chance?
Or something similar as this? Don't worry too much
It'll happen to you as sure as your sorrows are joys
And the thing that disturbs you is only the sound of
The low spark of high-heeled boys

If I gave you everything that I owned and asked for nothing in return
Would you do the same for me as I would for you?
Or take me for a ride, and strip me of everything including my pride
But spirit is something that no one destroys
And the sound that I'm hearing is only the sound
The low spark of high-heeled boys",Low Spark of High Heeled Boys
Steve Winwood,"I bought a sequined suit from a pearly queen
And she could drink more wine than I'd ever seen
She had some gypsies' blood flowing through her feet
And when the time was right she said that I would meet
My destiny

I traveled round the world to find the sun
I couldn't stop myself from having fun
And then one day I met an Indian girl
And she made me forget this troubled world
We're living in

I had a strange dream. In my hair
I saw a pearly queen lying there
And all around her feet flowers bloomed
But they were made of silk and sequins two by two",Pearly Queen
Steve Winwood,"I looked to the sky
Where an elephant's eye
Was looking at me
From a bubblegum tree
And all that I knew
The hole in my shoe
Was letting in water (letting in water)

I walked through a field
That just wasn't real
Where 100 tin soldiers
Would shoot at my shoulder
And all that I knew
The hole in my shoe
Was letting in water (letting in water)

(I climbed on the back of a giant albatross
Which flew through a crack in the cloud
To a place where happiness reigned all year round
Where music played ever so loudly)

I started to fall
And suddenly woke
And the dew on the grass
It stuck to my coat
And all that I knew
The hole in my shoe
Was letting in water (letting in water)
",Hole in My Shoe
Steve Winwood,"If you see something that looks like a star
And it's shooting up out of the ground
And your head is spinning from a loud guitar
And you just can't escape from the sound
Don't worry too much; it'll happen to you
We were children once, playing with toys
And the thing that you're hearing is only the sound of
The low spark of high-heeled boys

The percentage you're paying is too high-priced
While you're living beyond all your means
And the man in the suit has just bought a new car 
From the profit he's made on your dreams
But today you just read that the man was shot dead 
By a gun that didn't make any noise
But it wasn't the bullet that laid him to rest 
Was the low spark of high-heeled boys

If you had just a minute to breathe and they granted you one final wish
Would you ask for something like another chance
Or something similar as this? Don't worry too much
It'll happen to you as sure as your sorrows are joys
And the thing that disturbs you is only the sound of 
The low spark of high-heeled boys

If I gave you everything that I owned and asked for nothing in return
Would you do the same for me as I would for you
Or take me for a ride, and strip me of everything including my pride?
But spirit is something that no one destroys
And the sound that I'm hearing is only the sound
The low spark of high-heeled boys",Low Spark of High-Heeled Boys
Steve Winwood,"Moving on, no abode
Through the day and night, bridle road
Turning from the thirsty day
Time is right to slip away

Cigano, it's a road to anywhere
Little old sky for shelter
Freedom, all you have to bear
Cigano, a never ending road, secret destination

Lonely fire, darkened sky
Never staying, just passing by
At the crossroads, horses fed
Guided by stars overhead

Cigano, it's a road to anywhere
Little old sky for shelter
Freedom, all you have to bear
Cigano, a never ending road, secret destination
Destiny foretold

Moving on, no abode
Through the day and night, bridle road
Turning from the thirsty day
Time is right to slip away

Cigano, it's a road to anywhere
Little old sky for shelter
Freedom, all you have to bear
Cigano, it's a never ending road
Taking his existence, destiny foretold

Cigano, a road to anywhere
Little old sky for shelter
Freedom, all you have to bear
Cigano, a never ending road, a secret destination
Destiny foretold

Cigano, Cigano, Cigano",Cigano (For the Gypsies)
Steve Winwood,"Different light
Searching for the truth I find
That I am running quite short of time
And I am no longer certain of my destiny

Different light
Things that I once thought were right
Are now reflected in a different light

And it seemed that I overlooked a part of me
I had overlooked a part of me
I was escaping my reality

Different light
Searching for the truth I find
Is that what I thought was peace of mind?
It was only me escaping my reality

I had overlooked a part of me
I was escaping my reality
I had questioned my philosophy
So that I can see the truth in me

Searching for the truth
I found out what I thought would be
Peace of mind
Things that should've stayed the same
Are prone to change
Now I've seen a little light

I had overlooked a part of me
I was escaping my reality
I have questioned my philosophy
So that I could see the truth in me
Different Light

I had overlooked a part of me
I was escaping my reality
And I have questioned my philosophy
So that I could see the truth in me",Different Light
Steve Winwood,"Six days have I labored hard
Finding help out of no man?s hand
All night as my body aches
Rest my heart 'til the morning breaks

Souls are waking the world
Is awaiting Domingo morning
Rest in the sanctuary
Six days'll pass 'till Domingo morning

Fortune, you have shone on me
Found a place where I can be free
Beauty lying in your eyes
Seventh day we will realize

Souls are waking the world
Is awaiting Domingo morning
Rest in the sanctuary
Six days'll pass 'till Domingo morning

Work hard just to help me be
Take my opportunity
Moonlight will just pass me by
Domingo

Work hard just to help me be
Hours go by with reality
Hungry just to help me see
When I get my immunity

Souls are waking the world
Is awaiting Domingo morning
Rest in the sanctuary
Six days'll pass 'till Domingo morning

Souls are waking the world
Is awaiting Domingo morning
Rest in the sanctuary
Six days'll pass 'till Domingo morning

Souls are waking the world
Is awaiting Domingo morning
Rest in the sanctuary
Six days'll pass 'till Domingo morning

Domingo morn, Domingo
Domingo morning, Domingo",Domingo Morning
Steve Winwood,"Well, you can run, run
And move away from
But you cannot hide yourself
From self possession

Well, you can run, run
And move away from
But you keep my eyes forever

And your drug will keep you up at night
And your drug will mix you up
You don't love enough

Keep my eyes open wide
Even though you're tired
While you justify
What you've self-prescribed

Well, you can run, run
And move away from
You indulge your fix
And then you're chasing another

Well, you can run, run
And move away from
But you can't deny forever

So that love can wake you up at night
So that love can heal your soul
You can love enough

Please close your eyes tonight
There's no need to cry
You can free your mind
Now that you're alive
Free your mind

Well, you can run, run
And move away from
But you cannot hide yourself
From self possession

Well, you can run, run
And move away from
But you keep my eyes forever

And your drug will keep you up at night
And your drug will mix you up
You don't love enough

Keep my eyes open wide
Even though you're tired
While you justify
What you've self-prescribed",Now That You're Alive
Steve Winwood,"See you on the avenue
And I know you're gonna be
Hearing secret harmonies, yeah, yeah
It's a very fine line, a trembling leaf
'Tween the heaven here on earth
And mystery you've witnessed in your own dreams

As the stars shine with magic illusion
And the sirens sing up from the streets

Phoenix rising, Phoenix rising, Phoenix rising
Hear the beat, feel the heat
Phoenix rising, Phoenix rising, Phoenix rising

Blue is what you make it, babe
No one else can make you cry
While seasons mark your proud beliefs, yeah
And the passion fills your eyes with sodium light
And the secrets that you hold within you
Should be mine and mine alone now, yeah

Well, it's love not illusion, that's what I want
And the music that flows from the streets at night

Phoenix rising, Phoenix rising, Phoenix rising
Hear the beat, feel the heat
Phoenix rising, Phoenix rising, Phoenix rising

Take the rhythm now
For it rolls on all through the town
Close your eyes, take your prize

Just as I stumble through the heat and I remember
As I wander through the streets, I remember ancient beats
Though the sidewalk burns my feet, I surrender

As the stars shine with magic illusion
And the sirens sing up from the street

Phoenix rising, Phoenix rising, Phoenix rising
Hear the beat, feel the heat
Phoenix rising, Phoenix rising, Phoenix rising

Take the rhythm now
For it rolls on all through the town
Close your eyes, take your prize
Find your space, take your place, yeah",Phoenix Rising
Steve Winwood,"Silvia, who is she, what is she? We wonder
Flames with praise acclaim her
Of wisdom and beauty and grace has lent her
That she might admired be

Silvia, I can see wisdom in your eyes
Silvia, love will be your cure to devise
Silvia, I was blind but saw the way clear
Silvia, with your help our whole world is here
Silvia

In a song of Silvia, then always remember
She compares to no one
Transcending every mortal being
From our earthly dwelling we bring her
Our song of love

Silvia, I can see wisdom in your eyes
Silvia, love will be your cure to devise
Silvia, I was blind but saw the way clear
Silvia, with your help our whole world is here

Silvia, I can see wisdom in your eyes
Silvia, love will be your cure to devise
Silvia, I was blind but saw the way clear
Silvia, with your help our whole world is here
Silvia, Silvia, yeah, yeah, yeah, yeah
Silvia, Silvia, yeah, yeah, yeah, yeah",Silvia (Who Is She?)
Steve Winwood,"There's a place that I know from this feeling
It keeps on getting better now
Making love, seeing faces in the clouds
Hear what they will tell me now

Out beyond the blue horizon
And in the wake of falling stars
New day dawns giving rise to reasons why
It is that I am walking on

High above looking down on me
So alive and it's flowing free
Through my veins in eternity as I walk

Open handed open-hearted lazy
Thoughts of nothing serious
Just a day in a life with another chance
To see what yet has to be seen

Placing one foot in front of the other
Feel the breeze flow through your body now
Angel on my shoulder's telling me
Keep on walking and believe

High above looking down on me
So alive and it's flowing free
Through my veins in eternity as I walk
Walkin', walkin', walkin', walkin'

High above looking down on me
So alive and it's flowing free
Through my veins in eternity as I walk

Walkin', keep on walkin, keep on
Keep on walkin' keep on
Keep on walkin', keep on walkin'
Walkin', keep on walkin', walkin'
Keep on walkin', walkin', walkin', walkin' on, walkin' on
Walkin', walkin', walkin' on, walkin' on",Walking On
Steve Winwood,"Tell me why, tell me why, tell me why
Why can't we live together?
Tell me why, tell me why
Why can't we live together?

Everybody wants to live together
Why can't we be together?

No more war, no more war, no more war
Just a little peace in this world
No more war, no more war
All we want is some peace in this world

Everybody wants to live together
Why can't we be together?

No matter, no matter what color
You are still my brother
I said, ""No matter, no matter what color, no
You are still my brother""

Everybody wants to live together
Why can't we be together?

Tell me why, tell me why, tell me why
Why can't we live together?
Tell me why, tell me why
Why can't we live together?

Everybody wants to live together
Why can't we be together?

Together
Together
Together

",Why Can't We Live Together
Steve Winwood,"Dear Mr. Fantasy play us a tune
Something to make us all happy
Do anything, take us out of this gloom
Sing a song, play guitar, make it snappy

You are the one who can make us all laugh
But doing that you break out in tears
Please don't be sad if it was a straight mind you had
We wouldn't have known you all these years

Dear Mr. Fantasy play us a tune
Something to make us all happy
Do anything, take us out of this gloom
Sing a song, play guitar, make it snappy, yeah yeah

Dear Mr. Fantasy play us a tune
Something to make us all happy
Do anything, take us out of this gloom
Sing a song, play guitar, make it snappy

You are the one who can make us all laugh
But doing that you break out in tears
Please don't be sad if it was a straight mind you had
We wouldn't have known you all these years",Dear Mr. Fantasy [DVD]
Steve Winwood,"So glad, I'm so glad
Sometimes, I'm so glad to be alive",Glad [DVD]
Steve Winwood,"Forty thousand headmen couldn't make me change my mind
If I had to take the choice between the deaf man and the blind
I know just where my feet should go and that's enough for me
I turned around and knocked them down and walked across the sea

Hadn't traveled very far when suddenly I saw
Three small ships a-sailing all towards a distant shore
So lighting up a cigarette I followed in pursuit
And found a secret cave where they obviously stashed their loot

Filling up my pockets, even stuffed it up my nose
I must have weighed a hundred tons between my head and toes
I ventured forth before the dawn had time to change its mind
And soaring high above the clouds I found a golden shrine

Laying down my treasure before the iron gate
Quickly rang the bell hoping I hadn't come too late
But someone came along and told me not to waste my time
And when I asked him who he was he said, Just look behind

So I turned around and forty thousand headmen bit the dirt
Firing twenty shotguns each and man, it really hurt
But luckily for me they had to stop and then reload
And by the time they'd done that I was heading down the road

Heading down the road
Forty thousand Headmen",(Roamin' Thro' the Gloamin' With) Forty Thousand Headman
Steve Winwood,"There were three men came out of the West,
Their fortunes for to try,
And these three men made a solemn vow:
John Barleycorn must die.

They've ploughed, they've sewn, they've harrowed him in,
Threw clods upon his head,
And these three men made a solemn vow:
John Barleycorn was dead.

They've let him lie for a very long time,
˜Till the rains from heaven did fall,
And little Sir John sprung up his head,
And so amazed them all.

They've let him stand ˜till midsummer's day,
˜Till he looked both pale and wan,
And little Sir John's grown a long, long beard,
And so become a man.

They've hired men with the scythes so sharp,
To cut him off at the knee,
They've rolled him and tied him by the way,
Serving him most barbarously.

They've hired men with the sharp pitchforks,
Who pricked him to the heart,
And the loader he has served him worse than that,
For he's bound him to the cart

They've wheeled him around and around the field,
˜Till they came unto a barn,
And there they made a solemn oath,
On poor John Barleycorn.

They've hired men with the crab-tree sticks,
To cut him skin from bone,
And the miller he has served him worse than that,
For he's ground him between two stones.

And little Sir John and the nut-brown bowl,
And he's brandy in the glass;
And little Sir John and the nut-brown bowl,
Proved the strongest man at last.

The huntsman, he can't hunt the fox,
Nor so loudly to blow his horn,
And the tinker he can't mend kettle nor pot,
Without a little Barleycorn
",John Barleycorn (Must Die)
Steve Winwood,"Well, the world's no perfect place
We're only doing what we can do
When the night comes over me
Open my eyes up to a brighter sky

[Chorus]
And the light shines above every nation
But at times we do forget about them
Like my brother who is falling down
But at times we do forget about him

Well truth is an empty word
Spoken in vain, yeah, like we all do
Blind hate the modern way
But every life has a beautiful name

[Chorus]

No regrets can save us
And only our hearts have any answer
Oh, it's you...

[Chorus]

Time to break out now
Out of the prison of our own mind
There's a rhyme where there's a reason
Everyone's dreaming of the same dream",At Times We Do Forget
Steve Winwood,"The gangster came to see by boy
When I was working nights to pay one more bill
He promised the kid a sweeter life
Said, ""Gotta understand it's dog eat dog out there""
Well I looked in his room when I got home
And underneath the covers found a loaded gun
He looked at me with empty eyes
He said, ""It's time for me to be moving on""

[Chorus]
Dirty city, this is a dirty town
Where's the pity, I can't move on up to higher ground

I spoke to my woman the other day
She said, ""I need more cash we can't pay our way""
She said, ""Everything gets really hard
And I need something sweet, don't you understand?""
The roar of the train runs by my room
And on these summer nights I can't sleep anymore
I walk in the streets to greet the dawn
Or stay at home all night and stare at the floor

[Chorus: x2]

Help me now
Move on to a higher ground
Help somehow
Make a move to a higher ground
Won't you help somehow
Make a move to a higher ground
Won't you help somehow
I need a little help

[Chorus]",Dirty City
Steve Winwood,"On a brave new morning, smiling at the sky
Every shadow of the past whispers goodbye
There is hope, if you can see
I give it all to you, you give it all to me
Every winter has the sun within its heart
And everything we think we knew we can forget
Maybe far but not apart
I know it's getting better and it will be better yet

So fly
Cause I know what you're feeling
When it turns out that way
And that emotion is healing
And we can fly...

Climbed a mountain, just to see the other side
We start with nothing, cause there's nothing left to hide
I believe in every new day
I'll never be that man who threw it all away
In the valley there's a river running through
Wherever it may take me, I will follow you
There's an answer to all the rain
It's when I turn around and hear you say my name

So fly...
And we can fly...
Oh what you're healing...
Cause there is nothing but clouds in your way
As we face the day...

So the time has come but I will say a prayer
As the day break, I know I will meet you there
By the shoreline ever-changing
I give my word to you, you gave your word to me
So the morning has a song to feed my soul
It was divided, but with you it feels whole
There's a life only we know
And there's a secret place where only we can go

So fly...
And we can fly...",Fly
Steve Winwood,"Hot desert wind
Burning sand
But this land it is my land
Wait by the well
Rain don't come
River's dry
Pray for my son

I'm just one, one more poor hungry man
Yes, I'm just one more poor hungry man

Sun in the sky
Hurts my eye
Mouth all dry
May God help me
Wait by the road
Man don't come
Rice all gone

For thirty miles
I'm just one, one more poor hungry man
I'm just one, one more poor hungry man
Yes, I'm just one more poor hungry man
I'm just one, one more poor hungry man

Shout at the truck
Passing by
No reply
Dust in my mouth
Somebody soon
Find me here
Drowning here
In baby's tears
Love in the world
Hear me soon
Save us all
And save my child
Birds in the skies
Flying low
Baby no
His tears all dry",Hungry Man
Steve Winwood,"Black night down heavy on my weary brow
Light shining in the pouring rain
Can see somehow cold comfort in the broken trees
But I won't let it bring me to my knees
I'm not flying, but I'm not drowning now

Keep driving, don't matter if the highway's lost
Keep running, never turn your head
Count the cost ghost waiting where the roads all cross
Big deal waiting when you get to meet the boss
Clouds are breaking, I'm not drowning now
Drowning now...

Flying, but I'm not drowning now...

Sad old man smiling with a shameful grin
He thinks that we never can lose
Never beat the dealer when he cuts the pack
First back to front, then deal front to back
Now I'm flying, I'm not drowning now...",I'm Not Drowning
Steve Winwood,"There'll be times at sunrise when my heart speaks your name
For you left with no warning but there's no one left to blame
All those days full of golden sun when you walked by my side
And everything that you gave to me can never be denied

[Chorus]
And sometimes the other shore is so far away
And that darker river's edge is too far away
And across the waterline is far away

On a new tomorrow cooling breeze shows a star
There can be so much sorrow, when you've traveled from afar
But there's nothing that can harm you when the night's closing in
In the bright lit heavens above us, you know we'll meet there again

[Chorus]

In the rush of our breathing there is always passing time
There is always somebody leaving, someone's always left behind
But something endures in the morning's blue light, I have you and you have me
And it'll be alright when the skies all clear, 'cause we're all born to be free

The other shore is so far way
And that darker river's edge is too far away
And across the waterline it's so far away
And sometimes the other shore is so far away
And across the river's edge is far away",Other Shore
