Band,Lyrics,Song
Merzhin,"Dehors le vent se lève
Et ranime les braises
Relève la tête, vois l'horizon briller de mille feux

Marche ou crève hurle ce monde
Un calibre sur la tempe
De la rage, la fièvre et la peur au ventre

Elle donne l'or aux innocents
Une danse sur un volcan
A feu à sang

Pars le poing levé
Au loin la liberté
Pars le poing levé
Au loin la liberté

Pour la beauté du geste
Sans quartier ni trève
Une promesse, pour les artisans de l'ombre...

Demain le jour se lève,
La couleur d'un espoir
Moins de peur, plus de coeur
Et que nul ne tombe

Là où le coeur bat,
S'unissent les voix
Entends-tu Ya Basta !

Pars le poing levé
Au loin la liberté
Pars le poing levé
Au loin la liberté

Pars le poing levé
Au loin la liberté

Pars le poing levé
Au loin la liberté",Liberté
Merzhin,"Qu'en feras-tu si je perds le nord ?
Perdu en somme, abandonné a tort
Taper aux portes, demander les réponses
Chercher encore et se donner à fond
Souffler tes mots sur le bord de l'asphalte
Suis-tu mon ombre avant qu'elle ne se glace ?
Changer les plombs pour retrouver la trame
De ton idéal isolé dans l'espace
Trouver un nom, au-delà de tes frasques
Pour gagner le pot de la reine jusqu'à l'as

Qu'en feras-tu si je perds le nord ?
Tombé de haut, abandonné à tort

Que ressens-tu à traquer mon image
Rompue aux doutes, fuyant les menaces ? 
Viens-tu jusqu'à moi, au centre de la cage ?
La route est cruelle jusqu'au coeur de la place
Cerné par mes peurs, étouffé dans la masse
Contempler le futur et sourire aux mirages
Rouler jusqu'à toi, en courant sur la vague
La route s'étale, de la reine jusqu'à l'as

Qu'en feras-tu si je perds le nord ?
Tombé de haut, abandonné à tort
Qu'en feras-tu si je perds le nord ?

Quelles peurs se ferment et retournent à la terre, en terre, en terre ?
Quels coeurs se perdent et finissent à l'envers, à l'envers, en enfer ?

Qu'en feras-tu si je perds le nord ?
Tombé de haut, abandonné à tort
Qu'en feras-tu si je perds le nord ?
Tombé de haut, abandonné à tort",Le  Nord
Merzhin,"J'ai l'accord brisé, la voix arrachée
Juste use les cordes, mes doigts écorchés
Accorde-moi, accorde-moi de vivre, accorde-moi

J'ai brûlé mon temps, au goût d'une cigarette
Empoisonné mon sang, le malt sur les lèvres
Accorde-moi de vivre...

Inspire-moi une brise, un écho
Le souffle du delta dans le dos
Change la couleur de ma peau

Sur un fil je deale à vendre mon âme
Blues intime, je signe les feuilles du diable
Sur une ligne, je deale au prix de mon âme
Dernier crime, je signe le pacte du diable

J'ai le mal au corps, j'ai croisé l'enfer
Aux douze coups sonnés, de l'ombre à la lumière
Accorde-moi de vivre...

Mon âme sera damnée, j'en ai rien à foutre
Le prix à payer quoiqu'il en coûte
Un dernier voyage, la mort aux trousses
Finir enterré au croisement des routes

Accorde-moi le temps de voir plus haut
Le souffle du delta dans le dos
Change la couleur de ma peau

Sur un fil je deale à vendre mon âme
Blues intime, je signe les feuilles du diable
Sur une ligne, je deale au prix de mon âme
Dernier crime, je signe le pacte du diable

Le pacte du diable, le pacte du diable
Le pacte du diable, le pacte du diable",Le  Pacte Du Diable
Merzhin,"Dès le lever du jour, partir à la conquête
Qu'importe le parcours, nous danserons sur les crêtes
Plus loin vers l'ouest, plus loin vers l'ouest

Qu'en dis-tu ami, le monde est si vieux
Regarde l'horizon, vers où la terre s'enfuit
Plus loin vers l'ouest, plus loin vers l'ouest

De peur d'être pris de court, amasser sans répit
Quand le sac devient lourd, nous savons que c'est fini
Que rien ne reste, que rien ne reste

Dès le lever du jour, partir à la recherche
Nous dévalerons les pentes, le corps à la renverse
Plus loin vers l'ouest, plus loin vers l'ouest

Pister le bon détour et finir sa course
Un aller sans retour, nous vivrons comme des loups
Que rien ne presse, que rien ne presse

Ne savoir où l'on va, regarder d'où l'on vient,
Qu'importe ce qu'on y trouve, seul compte le chemin
Plus loin vers l'ouest, toujours à l'ouest

Il faut juste traverser, ne pas perdre la trace
Il faut juste traverser, ne pas perdre la face

Il faut juste traverser, ne pas perdre la trace
Il faut juste traverser, ne pas perdre la face

Il faut juste traverser, ne pas perdre la trace
Il faut juste traverser, ne pas perdre la face

Il faut juste traverser, ne pas perdre la trace
Il faut juste traverser, ne pas perdre la face

Il faut juste traverser, ne pas perdre la trace
Il faut juste traverser, ne pas perdre la face

Plus loin vers l'ouest, plus loin vers l'ouest
Plus loin vers l'ouest, plus loin vers l'ouest",Plus Loin Vers L'ouest
Merzhin,"Revenu du centre et des contours, balloté par les remous 
A prendre ou à laisser, j'en perds le fruit ô mon amour 
J'ai défié l'impossible, bille en tête, je suis de retour 
Les remords en bandoulière et le coeur par en dessous 

Oui mais j'en fais le serment 
J'en fais le serment 
Suis-je aveugle ou passager du vent ? 
Sourd ou encore un enfant ? 

Le mystère est entier, mon univers de velours 
Amour, amour donne-moi le secret des meilleurs jours 
Vite, vivre lancé avant de devenir fou 
Si je m'avoue vaincu, qu'on me pende haut et court 

Oui mais j'en fais le serment 
Suis-je aveugle ou passager du vent ? 
J'en fais le serment 
Suis-je sourd ou encore un enfant ?

Oui mais j'en fais le serment 
J'en fais le serment 
Aveugle ou passager du vent ?
Sourd ou encore un enfant ?

Le serment, le serment

Oui mais j'en fais Le serment 
Oui mais j'en fais Le serment 
Suis-je aveugle ou passager du vent ? 
J'en fais Le serment 
Suis-je sourd ou encore un enfant ?

Aveugle ou passager du vent ?
Sourd ou encore un enfant ?",Le  Serment
Merzhin,"Des baraquements insalubres à l'odeur hécatombe
Te voilà enfant des rues, le feu dans les yeux
La confiance immature dans les rois de ton monde
Et le vide futur dans les blancs de tes cieux

Sur des chemins minés et sous une pluie de bombes
Au son des balles qui rugissent, ta vie se consume
De la mère au canon, du fusil à la tombe
Petit soldat de plomb dont le cœur est en plume
Petit soldat de plomb dont le cœur est en plume

Sweet baby sweet guerilla
Sweet bloody sweet guerilla

Être né pour tuer, la rançon est tragique
Une course fatale et rien ne résiste
La place est de choix dans le jardin des délices
Aux enfants innocents, couverts de cicatrices
Enfance innocence, couverte de cicatrices

Entendez-vous le cri de l'enfance enfermée dans ces murs ?
Sentez-vous la peur que rien ne rassure ?

Sweet baby sweet guerilla
Sweet bloody sweet guerilla
Sweet baby sweet guerilla
Sweet bloody sweet guerilla",Sweet Guerilla
Mes Souliers Sont Rouges,"Nous étions partis fiévreux mais debout
Provoquer la chance, défier la forêt
Nous étions partis semer nos cailloux
Retrouver l'enfance au bout du sentier

Nous voulions sans mal caresser nos peurs
Trouver le chemin qui conduit au loup
Traquer l'animal l'attraper dans l'heure
Et puis d'une main lui tordre le cou

On n'est pas sortis du bois
On s'est un peu perdus déjà
On n'est pas sortis du bois
On a même oublié pourquoi
On n'est pas sortis du bois

Nous étions partis en criant au loup
Pressés de venger la frayeur enfin
Mais jusqu'à la nuit, au vain rendez-vous
Nous avons guetté le grand méchant rien

Nous étions partis en mémoire de celles
Pour qui nos couteaux écorchaient la sève
Le chêne a vieilli nos voeux éternels
S'envolent en copeaux qui sèment nos rêves

On n'est pas sortis du bois
On s'est un peu perdus déjà
On n'est pas sortis du bois
On a même oublié pourquoi
On n'est pas sortis du bois

Sans loup ni princesse on s'est installés
Le conte achevé en courbant l'échine
Quelle printemps était-ce, quelle saison passée
Ce jour où nos pieds sont devenus racines ?

Nous étions partis fiévreux mais debout
Provoquer la chance, défier la forêt
Nous étions partis semer nos cailloux
Retrouver l'enfance au bout du sentier

On n'est pas sortis du bois
On s'est un peu perdus déjà
On n'est pas sortis du bois
On a même oublié pourquoi
On n'est pas sortis du bois",Sortis du Bois
Mes Souliers Sont Rouges,"C'était un homme, un beau un vrai
De ceux dont on fait le grand mât
Des bateaux qui s'en vont là-bas
C'était un de ces gars-là qui 
Une fois le boulot fini,
S'en allait boire un coup là-bas

Refrain :
C'était un gars comme ci, comme ça
Et il allait cahin-caha

C'était un gars qui pour un coup
Se serait passé la corde au cou
Et ça fait mal quand ça passe là
Oui c'était c'type qui dans la rue
S'enflammait à la vue de vos culs 
Et ça c'est bon quand ça passe là

Refrain (bis)

Mais dans les soirées de gala
Au p'tit musette, à la guinguette
Et même dans les bals à papa
Il s'ennuyait tout seul assis
Loin de tous, amoureux, aigri
Et rêvait d'une fille à son bras

Refrain (bis) 

Il a vécu pas mal de temps
Comme un fantôme, souvent errant
A travers les champs et les bois
Mais un matin le pauvre bougre
A eu enfin le coup de foudre
Pour une jolie poupée de bois

Refrain (bis) 
Refrain (bis)

Il l'a prise, il l'a emmenée
Pour la présenter au curé
Mais le saint homme se moqua
Pareillement monsieur le maire
Gronda qu'il n'y avait rien à faire
Pour marier ces amoureux là

Refrain (bis)

Et quand sa pauvre mère eut vent
De l'amour abracadabrant
Dans sa tombe elle se retourna
Faisant une p'tite place dans sa bière ;
Passait par ici son vieux père
Qui sans hésiter y plongea

Refrain (bis)

Désespéré, tellement blessé
Notre homme prit sa bien-aimée
Et la ramena dans les bois
C'est alors qu'elle s'est réveillée,
C'est alors qu'elle s'est transformée
L'amour a gagné pour une fois


C'est une histoire comme ci, comme ça
Tant pis si vous n'y croyez pas (bis)
C'est une histoire comme ci, comme ça
Tant pis si vous n'y croyez pas (bis)",Cahin-Caha
Mesa Hall Band,"Go out yonder, peace in the valley
Come downtown, have to rumble in the alley
Oh, you don't know the shape I'm in

Has anybody seen my lady
This living alone will drive me crazy
Oh, you don't know the shape I'm in

I'm gonna go down by the wa-ter
But I ain't gonna jump in, no, no
I'll just be looking for my mak-er
And I hear that that's where she's been? Oh!

Out of nine lives, I spent seven
Now, how in the world do you get to Heaven
Oh, you don't know the shape I'm in

I just spent sixty days in the jailhouse
For the crime of having no dough
Now here I am back out on the street
For the crime of having nowhere to go

Save your neck or save your brother
Looks like it's one or the other
Oh, you don't know the shape I'm in

Now two young kids might start a ruckus
You know they feel you trying to shuck us
Oh, you don't know the shape I'm in",Out of the Blue
Mescalito,got it,Sentence Deferred
Mescalito,"hotches
from the cold
and capted
picked them and flee
and hector
sgag from spoons
feet",Songai
Mesh,"Fragile you never were
Standing up to building up to
Anger that will never show
Your limitations in self control

I don't want you back
I can't deal with that
'Cause everybody has to have a weakness
Somewhere
But never you
I'm coming undone
You rip me up so you can?

Have it your way
See it your way
You're the one on top now
And this is your day

Words magnetise.
They fascinate and terminate
Each breath separates
what you need from what you hate
I'm not just a right to use up when you like
And I don't want you drilling through my conscience
Pleasure under your control
It's not negotiable can't you see you have to?

Have it your way
See it your way
You're the one on top now
And this is your day

And I'm so weak just like you planned
And you're too strong to understand

Fragile you never were
Standing up to building up to
Anger that will never show
Your limitations in self control

I don't want you back cause I can't deal with that
And everybody has to have a weakness somewhere
But never you I'm coming undone
You rip me up so you can...

Have it your way
See it your way
You're the one on top now
And this is your day

And I'm so weak just like you planned
And you're too strong to understand",Fragile
Mesh,"I, I needed to see how far you would take me
'Cause any further than this is a place I would rather miss

Had to move on
Almost trusted you with my love
Had to make sense of all your interest

It will only take one thing
This time to realize your state of mind
'Cause I can be used beaten and bruised
To justify your state of mind
But I won't be fooled - this time

I was the seed that grew from your treachery
And I was the taste that opened up the mouth of your mistake

It will only take one thing this time
To realize your state of mind
'Cause I can be used beaten and bruised
To justify your state of mind
But I won't be fooled - this time

From ordinary words and ordinary days
Something impossible came
Made you a liar to feed a desire
To break my heart again

It will only take one thing
This time to realize your state of mind
'Cause I can be used beaten and bruised
To justify your state of mind
But I won't be fooled - this time",State of Mind
Mesh,"Do you think I'd say anything 
Do you think I'd just come out and say what I feel 
We've had some sticky moments 
We've talked ourselves out now and everything's real 
And each passing day 
Is one day to much 
You take it out twice on the people you touch 
And each passing hour 
Is time with no end 
Is this the something we're unable to mend 
Do you think I could sit here 
And talk about the things that go on in my head 
I've sorted things out now 
Faced up to it over and over again 
And why should I explain 
If no-one else complains 
Neurotic and boring 
Reliable you 
And how can I just run 
When nothing can be done 
I don't know myself now but I can hear 
There's something wrong in something you said 
It's just a feeling this is not what I wanted 
There's something cold in the way you touch me 
It's just a feeling that you're better without me 
I just need a minute 
I just need to scrape all this filth off my hands 
Has anything changed now 
No, nothing is pure 
There's just yellow and brown 
But how am I sure 
That you lost no more 
Than family and friends over someone before
And anything now 
Is pushing my luck 
And you'll break this silence 
But I can hear 
There's something wrong in something you said 
It's just a feeling this is not what I wanted 
There's something cold in the way you touch me 
It's just a feeling that you're better without me",Something Wrong
Mesh,"Pull me 'round
And tell me that you never let me drown.
Touch me slow
Like your fingertips might never let me go.

But you know
That I'm caught between the magic
That you gave to me
And the fear that you might leave
Because it scares me

Stop this war
I wish we could leave thing at the door.
These feelings don't wash away.
I wish there was more to me,
More to say, more to say.

But you know
That I'm caught between the magic 
That you gave to me
And the fear that you might leave

Because it scares me
That you could break my heart again so easily.
Don't let us fall apart
Because it scares me
That you could break my heart again so easily.
Don't let us fall apart.

Run me through,
Then pick me up
And tell me that to do.
Cut me, then run away,
I wish there was more to this,
Flesh to kiss, flesh to kiss.

But you know
That I'm caught between the magic 
That you gave to me
And the fear that you might leave

Because it scares me
That you could break my heart again so easily.
Don't let us fall apart
Because it scares me
That you could break my heart again so easily.
Don't let us fall apart.",It Scares Me
Mesh,"I'm just somebody who's got under your skin 
Bet you never felt like that 
I pushed in my knife 
And managed to miss 
But it never happened like that 
You need somebody 
With feelings that can't get inside your head 
You need impatience 
The weight of the world in someone else's hands. 
I'll give you relief 
I'll shake your belief 
You'll settle for any part of me 
Because I'm your self healing lie 
Don't need a reason to watch you die 
I'm just a body that's dead inside. 
A self healing lie 

Don't need a reason to watch you die 
I'm just a body that's dead inside. 
Untied belief 
And feeling small 
Inside it seems like nothing at all. 
I'll give you relief 
I'll shake your belief 
You'll settle for any part of me 
Because I'm your self healing lie 
Don't need a reason to watch you die 
I'm just a body that's dead inside. 
A self healing lie 
Don't need a reason to watch you die 
I'm just a body that's dead inside.",Self Healing Lie
Mesh,"How long has it been since we spoke this way?
Has it come to this, and can you say
It's all my fault when I been sittin' 'round here
Trying to fade

All along we both still held
The pictures of a better day
So sorry you say
Your sorry isn't good enough

She's crying, she's crying now
She's reaching for the only thing
That never lets her down
And all this time has come to pass

And still it seems the same
I take steps toward you but you walk away
From the words that I can't speak to you
When you act insane

And I want to, and I need to
But I just don't feel the same
I don't feel the same
She's crying, she's crying now

She's reaching for the only thing
That never lets her down
She's crying, she's crying now
She's reaching for the only thing

That never lets her down
I can't explain a single thing that you say
Why don't you
Believe me

Believe me
Believe me
Believe me
She's crying, she's crying now

She's reaching for the only thing 
That never lets her down
She's crying, she's crying now
She's reaching for the only thing

That never lets her down",Believe Me
Mesh,"Can you give me what I need?
A dose of reality could sure cure this disease
This is how I see it, I'm lying on the floor
This scene inside my head, no, no, no, I can't be sure

Wrap me around you
Feel me inside you
Take me where you want to
And hate me if you want to

[Chorus]
Now I feel sick and diseased
And I feel contagious
And I feel so unclean
And I feel dangerous

Is this how you see me?
Hopeless, alone, and dark?
Do you think that I'm insane, mentally erased?

Wrap me around you
Feel me inside you
Take me where you want to
Hate me if you want to

[Chorus]

Wrap me around you
Feel me inside you
Take me where you want to
And hate me

[Chorus: x2]

This is how I see it [Repeat: x3]",Contagious
Mesh,"You say you won't be frightened,
And turn to your hate to rage,
But time is not a virtue that you gave me,
And I won't say it's safe but I'm in dire need.
I'm down on my knees yeah.
Who wants the love, Who wants the hate?
We just need it cause the world will never change.

And all you ever wanted, my love, 
And all you ever needed, my love, 
And all my time was wasted, 
Not today, but maybe tomorrow,
Not today, but maybe tomorrow,
Maybe tomorrow, you won't be around to let me down.

You say you won't be tortured.
You say you won't be torn,
But time is a virtue that I gave you,
And I won't say it's safe, but I'm in dire need.
I'm begging you please.
Who wants the love, Who wants the hate?
We just need it cause the world will never change.

And all you ever wanted, my love, 
And all you ever needed, my love, 
And all my time was wasted, 
Not today, but maybe tomorrow,
Not today, but maybe tomorrow,
Maybe tomorrow, you won't be around to let me down.

And all you ever wanted, my love, 
And all you ever needed, my love, 
And all you ever wanted, my love, 
And all my time was wasted, 
Not today, but maybe tomorrow,
Not today, but maybe tomorrow
Maybe tomorrow, you won't be around to let me down.
Not today, Not today,
(The world will never change)
Let me down
Not today, Not today,
(The world will never change)
Let me down
Not today, Not today,
(The world will never change)
But maybe tomorrow.",Maybe Tomorrow
Mesh,"Where's the lesson God?
You're tearing off the wings of all my unprotected dreams for nothing
I'll keep holding on
But I'm running out of nails over everything that's ever failed within me

Stop the aging soon
Because I'm running out of time at the very point I need the clock behind me
Alone in this room
When nothing should be taking from the cleanness of the break I'm making

It never falls in your hands
You get a page of the big plan
In a world that injects grey
If you still keep your head straight
In a world that protects bland
Big noise from a small band
Take the knives at the back door
And fill the clubs to the four walls

You'll fill the clubs to the four wallsâ?¦
Here's the justice God
I'm sifting through the words and re-arranging them in verse for someone
I might be alone
But I'm praying for the spark that might illuminate the dark for someone

It never falls in your hands
You get a page of the big plan
In a world that injects grey
If you still keep your head straight
In a world that protects bland
Big noise from a small band
Take the knives at the back door
And fill the clubs to the four walls

Is it really worth it?
You know it's worth the sacrifice of everything

It doesn't come to us all
You get a buzz when the track falls
In a time that expects grace
You can cry if you're first place
In a world that protects fools
From the day that you leave school
You take the bribes at the back door
And fill the clubs to the four walls

It never falls in your hands
You get a page of the big plan
In a world that injects grey
If you still keep your head straight
In a world that protects bland
Big noise from a small band
Take the knives at the back door
And fill the clubs to the four walls
You'll fill the clubs to the four walls

Is it really worth it?
You know it's worth the sacrifice of everything",Four Walls
Mesh,"I've been working real hard, trying to get my hands clean
We'll drive that dusty road from Monroe to Angeline
To buy you a gold ring and pretty dress of blue
Baby just one kiss will get these things for you
A kiss to seal our fate tonight

A kiss to prove it all night
Prove it all night
Girl there's nothing else that we can do
So prove it all night
Prove it all night
And girl I'll prove it all night for you

Everybody's got a hunger, a hunger they can't resist
There's so much that you want, you deserve much more than this
But if dreams came true, oh, wouldn't that be nice
But this ain't no dream we're living through tonight
Girl, you want it, you take it, you pay the price

Prove it all night
Prove it all night
Prove it all night girl and call the bluff
We'll prove it all night
Prove it all night
Girl I'll prove it all night for your love

Baby, tie your hair back in a long white bow
Meet me in the fields out behind the dynamo
You hear their voices telling you not to go
They've made their choices and they'll never know
What it means to steal, to cheat, to lie
What it's like to live and die

Prove it all night
Prove it all night
Girl there's nothing else that we can do
So prove it all night 
Prove it all night
And girl I'll prove it all night for you

I'll prove it all night
I'll prove it all night
I'll prove it all night
I'll prove it all night
I'll prove it all night
I'll prove it all night
I'll prove it all night
I'll prove it all night",Prove It All Night
Mesh,"See the vapors fading
As they stare into the night
Every time it's getting harder
To be buttoned up so tight

Don't do anything to us today
(You're only flesh and bone
You really never know)
There's nothing left to take away
(You're only flesh and bone
You really never know)

I know the crash is coming
Cause I smell the fuel in the morning
I hear the engine start
But I'll find my own way down

I know the crash is coming
Cause I smell the fuel in the morning
I hear the engine start
But I'll find my own way down

I hear the sleepers waking
As they stare into the skies
All our lives, the rivets breaking
As we struggle up so high

Don't do anything to us today
(You're only flesh and bone
You really never know)
There's nothing left to take away
(You're only flesh and bone
You really never know)

I know the crash is coming
Cause I smell the fuel in the morning
I hear the engine start
But I'll find my own way down

I know the crash is coming
Cause I smell the fuel in the morning
I hear the engine start
But I'll find my own way down

I see the takers taking
And relive it all again
Every time a little closer
To the truth without the pain

Don't do anything to us today
(You're only flesh and bone
You really never know)
There's nothing left to play the game
(You're only flesh and bone
You really never know)

I know the crash is coming
Cause I smell the fuel in the morning
I hear the engine start
But I'll find my own way down
(You really never know)

I know the crash is coming
Cause I smell the fuel in the morning
I hear the engine start
But I'll find my own way down

I know the crash is coming
Cause I smell the fuel in the morning
I know the crash is coming
Cause I smell the fuel in the morning

There's nothing left to take
There's no one left who wants to stay",Crash
