Band,Lyrics,Song
The Hunt,"Give it up just let it flow,
Keller's runnin' TV show.
Razor blade in action - everything is ""live"",
Scandal makes a paper ""hot"",
You may like it, you may not.
Marriage, rape, divorce, somebody's butchered wife.

Empire rise, they're built on lies,
In the children's eyes, I'll never...

Give it up, never ever give it up!

Little kid some place abroad,
Shot dead by the terror squad.
Only one? Just not enough to ring a bell!
TV preacher will love to tell you,
Pay a dime and God's for sale.
Don't get scared it's just another day in hell.

Empire's turn, they're built burn,
We'll never learn - I'll never...

Give it up, never ever give it up!",Give It Up
The Hunt,"It's all too much, It's all too much

When I look into your eyes, your love is there for me
And the more I go inside, the more there is to see

It's all too much for me to take
The love that's shining all around you
Everywhere, it's what you make
For us to take, it's all too much

Floating down the stream of time, of life to life with me
Makes no difference where you are or where you'd like to be

It's all too much for me to take
The love that's shining all around here
All the world's a birthday cake,
So take a piece but not too much

Set me on a silver sun, for I know that I'm free
Show me that I'm everywhere, and get me home for tea

It's all to much for me to see
A love that's shining all around here
The more I am, the less I know
And what I do is all too much

It's all too much for me to take
The love that's shining all around you
Everywhere, it's what you make
For us to take, it's all too much

It's too much...It's too much

Too much too much too much (fade to end)",It's All Too Much
The Hunters,"There's a story the gypsies know is true
That when your love wears golden earrings,
She belongs to you.
An old love story that's known to very few,
But if you wear those golden earrings,
Love will come to you.

By the burning fire,they will glow with ev'ry coal.
You will hear desire whisper low inside your soul.
So be my gypsy,
Make love your guiding light,
And let that pair of golden earrings
Cast their spell tonight.",Golden Earrings
The Huntingtons,"You talk about me
Like I'm not even there
You must think I'm a loser
That I don't even care

But when you smile and say
You want me to go away
That's when I know
That everything is ok

You're the only one that I'm dreaming of
And I think it's so rad
'Cause when I look at you
I know it's love of a different type
Woh-oh-yeah

You make me look so stupid
In front of all my friends
You want to make time to love me
But the fighting never ends

And when I kneel to pray
And thank god for you each day
That's when I know
That everything is ok",The Only One
The Huntingtons,"Doc you gotta help me
Get back to my place in time
My dad's a chump and my mom's screwed up
She thinks I'm Calvin Klein
We just need some plutonium
And I'll be on my way right outta here

I don't think I can stand livin' in 1955
Strickland's still a twerp and biff's still a jerk
I don't think I could survive
Get her up to 88
This nightmare will be in the past for me

Meet me at the clock tower
And doc try not to be late
I'm goin' to the dance it's my last chance
I gotta set those 2 kids straight
Doc you gotta help me get
Get me back to 1985",1985
The Huntingtons,"You're a punk but I don't know
Why you don't shower
Or change your clothes

and I don't wanna sit around with you
And I don't wanna do the things you do
You're ugly and your breath smells bad too
And I don't wanna sit around with you




",I Don't Wanna Sit Around With You
The Huntingtons,"Mom's yellin' get a job
Dad's callin' me a slob
But I don't wanna work
For no minimum wage
I was late for class again
Teacher gave me detention
And she said boy you better
Start actin' your age

I wake up every single day
Tryin' to think up a way
To get through
Without gettin' pushed around by you

and I say woh-oh-oh-oh
And you say woh-oh-oh-oh
And we just don't care about that anyway
Woh-oh-oh-oh

all the jocks think I'm a geek
They beat me up 3 times a week
And I couldn't get a girl to save my life
My neighbor says I got no taste
He thinks that my whole life is a waste
This comin' from a guy that beats his wife

parents are thinkin'
Rehabilitation
Principal wants to send me
On a long vacation
But they don't know about me
It's more than what they see
I'm not a teenage sickie
I know that 1 and 1 is not 3




",We Don't Care
The Huntingtons,"You got to pick up the pieces
Come on, sort your trash
Better pull yourself back together
Maybe you've got too much cash
Better call, call the law
When you gonna turn yourself in, yeah
You're a politician
Don't become one of Hitlers children

Bonzo goes to bitburg
Then goes out for a cup of tea
As I watched it on TV
Somehow it really bothered me
Drank in all the bars in town
For an extended foreign policy
Pick up the pieces

My brain is hanging upside down
I need something to slow me down
Ooh yeah, my brain is hanging upside down
And I need something to slow me down

Shouldn't wish you happiness
Wish her the very best
Fifty thousand dollar dress
Shaking hands with your highness
See through you like cellophane
You watch the world complain
But you do it anyway
Who am I, am I to say

If there's one thing that makes me sick
It's when someone tries to hide behind politics
I wish that time could go by fast
Somehow they manage to make it last",Bonzo Goes to Bitburg
The Huntingtons,"Oh, oh, oh
Sitting here with nothin' to do
Sitting here thinkin' only of you
But you'll never get out of there
She'll never get out of there

Texas chain saw massacre
They took my baby away from me
But she'll never get out of there
She'll never get out of there
I don't care, wohoho

When I saw her on the corner
She told me told me told me told me
She wouldn't go far
Ooh, now I know I'm so much in love
'Cause she's the only girl that I'm ever thinking of",Chainsaw
The Huntingtons,"They do their best
Do what they can
They get them ready for vietnam

From old Hanoi to east Berlin
Commando, involved again

First rule is the laws of Germany
Second rule is be nice to mommy
Third rule is don't talk to commies
Fourth rule is eat kosher salamies",Commando
The Huntingtons,"I was feeling sick
I was losing my mind
I heard about these treatments
From a good friend of mine

He was always happy
Smile on his face
He said he had a great time at the place

Gimme gimme shock treatment
Peace and love is here to stay
And now I can wake up and face the day
Happy happy happy all the time
Shock treatment, I'm doing fine",Gimme Gimme Shock Treatment
The Huntingtons,"Pt-boat on the way to Havana
I used to make a living, man
Pickin' the banana
Now I'm a guide for the CIA
Hooray for the USA!

Baby, baby, make me loco
Baby, baby, make me mambo

Sent to spy on a Cuban talent show
First stop- Havana au go-go
I used to make a living, man
Pickin' the banana
Hooray for Havana!",Havana Affair
The Huntingtons,"I used to be on an endless run
Believe in miracles 'cause I'm one
I have been blessed with the power to survive
After all these years I'm still alive

I'm out here kickin' with the band
I am no longer a solitary man
Every day my time runs out
Lived like a fool, that's what I was about

Oh, I believe in miracles
I believe in a better world for me and you
Oh, I believe in miracles
I believe in a better world for me and you

Tattooed your name on my arm
I always said my girl's my good-luck charm
If she can find a reason to forgive
Then I can find a reason to live

I used to be on an endless run
Believe in miracles 'cause I'm one
I have been blessed with the power to survive
After all these years I'm still alive

I close my eyes and think how it might be
The future's here today, it's not too late
It's not too late, oh-oh
Alright",I Believe in Miracles
The Huntingtons,"I don't care, I don't care
I don't care, I don't care
I don't care about this world
I don't care about that girl

I don't care
I don't care
About these words
I don't care",I Don't Care
The Huntingtons,"Hey, daddy-o
I don't want to go down to the basement
There's somethin' down there
I don't want to go
Hey, Romeo
There's somethin' down there
I don't want to go down to the basement",I Don't Wanna Go Down to the Basement
The Huntingtons,"I don't want to walk around with you
I don't want to walk around with you
I don't want to walk around with you
So why you want to walk around with me
I don't want to walk around with you",I Don't Wanna Walk Around With You
The Huntingtons,"I remember you
I remember lying awake at night
And thinking just of you
But things don't last forever
And somehow baby
They never really do",I Remember You
The Huntingtons,"Life's a gas, a gas, 
Oh yea
So don't be sad 
'Cause I'll be there
Don't be sad at all",Life's a Gas
The Huntingtons,"You're a loudmouth baby
You better shut it up
I'm gonna beat you up
'Cause you're a loudmouth babe",Loudmouth
The Huntingtons,"Now I want to be a good boy
I don't want to be bad
Now I want to run away from home
Now I want to be on my own

I just want to be a good boy
I don't want to be bad
Now I want to be sad alone
Now I want to be all alone
Now I want to be on my own",Now I Wanna Be a Good Boy
The Huntingtons,"Under the arc of a weather stain boards
Ancient goblins, and warlords
Come out of the ground, not making a sound
The smell of death is all around
And the night when the cold wind blows
No one cares, nobody knows

I don't want to be buried in a pet cemetery
I don't want to live my life again
I don't want to be buried in a pet cemetery
I don't want to live my life again

Follow victor to the sacred place
This ain't a dream, I can't escape
Molars and fangs, the clicking of bones
Spirits moaning among the tombstones
And the night, when the moon is bright
Someone cries, something ain't right

The moon is full, the air is still
All of a sudden I feel a chill
Victor is grinning, flesh rotting away
Skeletons dance, I curse this day
And the night when the wolves cry out
Listen close and you can hear me shout

I don't want to be buried in a pet cemetery
I don't want to live my life again
I don't want to be buried in a pet cemetery
I don't want to live my life again, oh no, oh no
I don't want to live my life again, oh no, oh oh
I don't want to live my life again, oh no no no
I don't want to live my life again, oh oh",Pet Sematary
The Huntingtons,"No one ever thought this one would survive
Helpless child, gonna walk a drum beat behind
Lock you in a dream, never let you go
Never let you laugh or smile, not you

I just want to walk right out of this world
'Cause everybody has a poison heart
I just want to walk right out of this world
'Cause everybody has a poison heart

Making friends with a homeless torn up man
He just kind of smiles, it really shakes me up
There's danger on every corner but I'm okay
Walking down the street trying to forget yesterday

You know that life really takes its toll
And a poet's gut reaction is to search his very soul
So much damn confusion before my eyes
But nothing seems to phase me and this one still survives",Poison Heart
The Huntingtons,"She's a sensation
She's a sensation
She looks a so sweet

She's a sensation
She's a sensation
Good enough a to eat

She's a sensation
Oh-oh-oh
She looks a so fine
She's a sensation
She's a sensation
I'm gonna make a her mine

No matter what you do
I give my heart to you
And oh-oh - baby
I will give to you
No matter what they say
Yeah, we can find a way
And oh-oh - baby
We can find a way

I didn't know it
Till I walked you home
That, I feel the way I do
And I don't care
What the neighbors say
I always will be true
I always will love you
Love you
A-wo-wo-wo-wo",She's a Sensation
The Huntingtons,"Walking through the crossfire heart feeling heavy and hopeless
And wonderin' how I ever will see through this darkness
Every drop of blood can be so beautiful
And I sure was bleedin' the drops by the bucketful

I have the strength to endure and all the love that's pure
I have the strength to endure because, because

I'm not afraid to tell her just how things work
Ride a hurricane through the fast lane always looking over my shoulder
She said, ""Something about you and neon lights always glow hot""
Baby we can see this through, just give me all the strength you got

I have the strength to endure and all the love so pure
I have the strength to endure because, because

I have the strength to endure and all the love so pure
I have the strength to endure because, because

I'm not afraid to tell her just how things work
Ride a hurricane through the fast lane always looking over my shoulder
She said, ""There's something about you and neon lights always glow hot""
Baby we can see this through, just give me all the strength you got

I have the strength to endure and all the love so pure
I have the strength to endure because, because

I have the strength to endure and all the love so pure
I have the strength to endure because, because",Strength to Endure
The Huntingtons,"I'm a shock trooper in a stupor
Yes I am
I'm a Nazi schatze
Why know I fight for fatherland

Little German boy
Being pushed around
Little German boy
In a German town

Today your love, tomorrow the world","Today Your Love, Tomorrow the World"
The Huntingtons,"Hey, hey, hey
Why is it always this way?

Last time I saw her alive
She was wavin', wavin' bye bye
She was contemplating suicide
Now she's lying
In a bottle of formaldehyde

And oh, I just don't know
Why I can't let her go
Oh I just don't know

Hey, hey, hey
Why is it always this way?
Last time I saw her alive
She was going to the wash and dry
She was outside hitchin' a ride
Now she's lying
In a bottle of formaldehyde",Why Is It Always This Way?
The Huntingtons,"Though you've decided that our love is wrong
And think that we should part
It seems as though I have loved you so long
You'll always be in my heart.

Is it a sin
Is it a crime
Loving you dear like I do
If it's a crime then I'm guilty
Guilty of loving you.

Maybe I'm wrong dreaming of you
Dreaming the lonely night through
If it's a crime then I'm guilty
Guilty of dreaming of you

What can I do
What can I say
After I've taken the blame?
You say we're through
You'll go your way
But I'll always feel just the same.

Maybe I'm right
Maybe I'm wrong
Loving you dear like I do
If it's a crime then I'm guilty
Guilty of loving you.",Guilty
The Huntingtons,"I don't want to see you crying anymore
I don't want to hear you whining anymore
I don't want to catch you knocking at my door
Oh no oh oh no
I'm just sitting here thinking to myself
I'd rather be at home hanging by myself
I don't think that I need any of your help
Oh no oh oh no

And oh I'm tired of the aggravation
Oh I'm sick of this dumb situation
Oh I'm trying to break out but then it's

Too late I'm talking to myself
I don't need anybody else
I'm doing just fine on my own
Nobody listens to me anyway
To anything I've got to say
So why don't you just leave me alone

I don't want to see your pictures anymore
I don't want to hear your stories anymore
I don't want to catch you sleeping on my floor
Oh no oh oh no
And I'm tired of the infatuation
Oh I'm sick of this same situation
Oh I'm trying to break out but then it's",Too Late
The Huntingtons,"Nobody likes me, nobody likes me

You tell me I'm not good enough
And my last record really sucked
And that I should just give it up oh yeah

Cause nobody likes me, nobody likes me

Build me up then drag me down
Punch kick yeah shove me around
Toss me in the lost and found oh yeah
You tell me I'm not good enough
And my next record's gonna suck
And that it's time to give it up oh yeah

Cause nobody likes me, nobody likes me
And I don't care




",Nobody Likes Me
The Huntingtons,"The first time I saw you hanging out
You were kissing by the telephone
I knew what you were all about
And knew I had to leave it alone

Cause people talk
And talk gets talked
And eventually we all know
What goes around surely comes around
Till there's no place else to go

I think you're really really cute
I think you're really really sweet
Yeah you know this much is true
But I never really really meant to fall in love with you

The first thing I heard when I said your name
Was 'that girl's trouble, stay away'
I knew all about your silly game
And knew it wasn't one I'd want to play

But I don't know
If I should go
And let my thoughts get the best of me
Or rack my brain saying it's ok
When I know that it won't be free",Really Really
The Hurt Process,"Tortured me, now you go, now you go
Leaving slowly, like the snow, like the snow
With lies you told, lies you told melted us
Lies you told, lies you told, lies you told, words that scold

Run for you know, come home, run far
From here, far from here, far from here
Run for you know, come home, run far
From here, far from here, far from here

Secrets drop, now you go, now you go
Turn away, turn away with the winds that blow
Silently, softly, softly, silent, silent, softly
Softly, silent, silent, softly

Now you go, run for you know, come home, run far
From here, far from here, far from here
Run for you know, come home, run far
From here, far from here, far from here

(Run for you know)
Take your hatred for me
(Run for you know)
Take your spreading disease
(Run for you know)
Take your hatred for me
(Run for you)

Run for you know, come home, run far
From here, far from here, far from here
Run for you know, come home, run far
From here, far from here, far from here

Far from here, far from here
(Run for you know, from here)
Far from here, far from here
Far from here, far from here

Come home, run far, come home, run far
(Run for you know, from here)
Come home, run far, far from here
Far from here, far from here

",Come Home
The Hurt Process,"February, Tuesday the twelfth
Thirteen days seem so very far away
Has it ever occurred to you
I'll be gone and you will too.

[Chorus:]
I've wanted to tell you
So let me hold you
In my arms tonight
We could be forever, be forever
Loving you girl
In my arms tonight

Friday night
Is going oh so well
Seems average, and overrated
So uncomplicated
'till you strolled over
And put your arms around me

[Chorus]

Please let me hold you
I want to stay
I will be forever
Loving you...

[Chorus]",Tuesday
The Husbands,"Tonight you're mine, completely
You give your soul so sweetly
Tonight the light of love is in your eyes
But will you love me tomorrow

Is this a lasting treasure
Or just a moment's pleasure
Can I believe the magic in your sighs
And will you still love me tomorrow

Tonight with words unspoken
You say that I'm the only one
But will my heart be broken
When the night meets the morning sun

I'd like to know if your love
Is a love I can be sure of
So tell me now and I won't ask again
Will you still love me tomorrow
Will you still love me tomorrow
Will you still love me tomorrow",Will You Still Love Me Tomorrow
The Hush Sound,"I know that you're an artist
But you're the hardest one to deal with
Everything that you conceal
Is revealed on your canvas

You find all of your ugly meanings
In all of the things I find beautiful
Do you see the fall is coming
Come, I'm falling into you

You perceive all of these things
I'd never have known
Love, will you turn off the lights
We're already home

You painted me in pastel
Colors that don't tell of any boldness
That's the way you love to see me
So delicate, so weak, so little purpose

But your eyes are drawn of charcoal
They're black, they're so cold, they're so imperfect
Because they see a sleeping world
Where waking isn't worth it

You perceive all of these things
I'd never have known
Love, will you turn off the lights
We're already home",The Artist
The Hush Sound,"Used to dream until I stopped writing fiction
All right well that's not true
Maybe it ended when I ended competition
Because I'd always lose

My therapist could never classify conditions
Alright whats wrong already
My pharmacist had better fill up my prescriptions
Here just take two of these and call me in the morning

Oh oh oh won't you carry me home
It's the last time in life that I'll ever try

The streets were flooded and in the tides were pessimists
So I just dove right in I felt at home
I felt alive I felt that I fit in
So I'll just keep dreaming

Wait for the wind to blow
Can't carry myself can't carry me home
On my own will
Wait for the wind to blow
Can't bury myself can't carry us both
On my own will",Carry Me Home
The Hush Sound,"You are the lighthouse, the seamark
The tempests created this tide
I'm pulled to the black silver ocean
Where the current and the heavens collide

You are the brick
I am so unpredictable
Led by the current away
Your solid stage is so necessary to save
All those who stray

You are the navigator who never could lead
We were lost in the silver sea
I was the ship who was too proud to ever sink.

I am your thought but the water is amnesia
My name is on the tip of your tongue
My image is slipping
But your memory is gripping it
This is my breath in your lungs

You are the navigator who never could lead
We were lost in the silver sea
I was the ship who was too proud to ever sink.

Echo, my voice is an echo
Of places I don't know
And stories I've been told

Echo. We all are connected
A lighthouse a voyage
For history's sake,
Will you please take notice?",Echo
The Hush Sound,"Let me paint you a picture
A picture that I know that you'd like
I'll let the colors run
It dries and then it's done

And we'll go to the market and sell it
It's worth more to them than it is to you
You said you'd put it on the wall
But I don't want you to
We'll go to the market and sell it

Let me build you a fortress
A fortress you can decorate
I'll find a way to pay
The bills to the estate

And we'll go to the market and sell it
It's worth more to them than it is to you
You said you weren't happy
And you won't be happy here
We'll go to the market and sell it

Let me give you some money
Some money for a daring escape
We'll find a ticket cheap
Say goodbye and you will leave

And we'll go to the market in Paris
It's worth more in francs than it is in our banks
You said you weren't happy
And you won't be happy here
We'll go to the market in Paris",The Market
The Hush Sound,"My apologies dear, for all my mistakes
And I'm sure to make more
'Cause I forget to enjoy the sunsets of dawn
The flowers of spring

Forgive yourself 'cause I took pictures
Of everything that you've been missing
Now I won't feel so bad
Forget the past and repeat it all
I'll take some pictures for myself
No, you won't feel so bad

My apologies dear, for all my mistakes
And I'm sure to make more
'Cause I forget to enjoy the small things in life
I just let them slip by

Forgive yourself 'cause I took pictures
Of everything that you've been missing
Now I won't feel so bad
Forget the past and repeat it all
I'll take some pictures for myself
No, you won't feel so bad",My Apologies
The Hush Sound,"The snow won't stick to the weeping willows 
The cold air won't blow open the windows 
You've made it through the storm this far 
You can do this, dear, it won't be hard 
The snow won't stick to the weeping willows 

There will be tomorrow 
The sun will light a sea of sorrow 
Tonight it set and took our friend 
If I could do one thing, I'd bring him back 
Snow won't stick to the weeping willows 

Summer was painted on our skin 
And those secrets hidden in our childish lips 
They would die for a kiss 

Fall was always left in your eyes 
Just a fleck of yellow light 
Like the sunrise 
Like the twilight",Weeping Willow
The Hush Sound,"Take what you need while there's time
The city will be earth in a short while
If I'm not mistaken it's been in flames
You and I will escape to the seaside

There is a storm in the distance
The wind breathing warning of its imminence
There is a lighthouse five hundred yards down
You and I will be safe there

There is a girl who haunts that lighthouse
She saved me, I was swimming
So young I almost drowned
Under the water she sang a story
Of losing her lover
She calls a warning

Love, you are foolish, you're tired
Your sleeplessness makes you a liar
The city is burning
The ocean is turning
Our only chance is the lighthouse

Her lover was a sailor
She went and she waited there
The door locked from the outside
Lover never arrived so she sings there
Soft as a siren luring the ships off their course, how alarming

We went in, we climbed up and looked out
The door locked from the outside
Three ghosts in a lighthouse",Lighthouse
