Band,Lyrics,Song
"Sammy Davis, Jr.","Who can take a sunrise, sprinkle it with dew
Cover it with choc'late and a miracle or two
The Candy Man, oh the Candy Man can
The Candy Man can 'cause he mixes it with love and makes the world taste good

Who can take a rainbow, wrap it in a sigh
Soak it in the sun and make a groovy lemon pie
The Candy Man, the Candy Man can
The Candy Man can 'cause he mixes it with love and makes the world taste good

The Candy Man makes everything he bakes satisfying and delicious
Now you talk about your childhood wishes, you can even eat the dishes
Oh, who can take tomorrow, dip it in a dream
Separate the sorrow and collect up all the cream

The Candy Man, oh the Candy Man can
The Candy Man can 'cause he mixes it with love and makes the world taste good
The Candy Man makes everything he bakes satisfying and delicious
Talk about your childhood wishes, you can even eat the dishes

Yeah, yeah, yeah
Who can take tomorrow, dip it in a dream
Separate the sorrow and collect up all the cream
The Candy Man, the Candy Man can

The Candy Man can 'cause he mixes it with love and makes the world taste good
Yes, the Candy Man can 'cause he mixes it with love and makes the world taste good

A-Candy Man, a-Candy Man, a-Candy Man
Candy Man, a-Candy Man, a-Candy Man
Candy Man, a-Candy Man, a-Candy Man",Candy Man [DVD]
"Sammy Davis, Jr.","She gets too hungry for dinner at eight 
She likes the theatre and never comes late 
She never bothers with people she'd hate 
That's why the lady is a tramp 

Doesn't like crap games with barons or earls 
Won't go to Harlem in ermine and pearls 
Won't dish the dirt with the rest of the girls 
That's why the lady is a tramp 

She likes the free, fresh wind in her hair 
Life without care 
She's broke, and it's ""ok"" 

Hates California, it's cold and it's damp 
That's why the lady is a tramp 

She gets too hungry to wait for dinner at eight 
She loves the theatre but never comes late 
She'd never bother with people she'd hate 
That's why the lady is a tramp 

She'll have no crap games with sharpies and frauds 
And she won't go to Harlem in Lincolns or Fords 
And she won't dish the dirt with the rest of the broads 
That's why the lady is a tramp 

She'd love the free, fresh wind in her hair 
Life without care 
She's broke, but it's ""ok"" 

Hates California, it's so cold and so damp 
That's why the lady 
That's why the lady 
That's why the lady is a tramp",The Lady Is a Tramp [DVD]
"Sammy Davis, Jr.","Kiss the day goodbye
The sweetness and the sorrow
We did what we had to do
And I can't regret what I did for love, what I did for love

Look my eyes are dry
And towards always tomorrow
It's as if we always knew
But I won't forget what I did for love, what I did for love

Gone, love is never gone
And we cary on, love's what we'll remember

Kiss the day goodbye
And point me toward tomorrow
And wish me luck, the same to you
Won't regret, can't forget what I did for love

What I did for love
What I did for love",What I Did for Love [DVD]
"Sammy Davis, Jr.","Driftin' Dreamin'
In an Azure mood,
Stardust gleamin' 
Thru my solitude:
Here in my seclusion, 
You're a blue illusion 
While I'm in this Azure interlude.
I'm not wanted I'm so all alone;
Always haunted
By the dreams I own;
But, though Im tormented
I must be contented 
Driftin' Dreamin' 
In an Azure mood!
Driftin' Dreamin'
In an Azure mood,
Star dust gleamin'
Thru my solitude:
Here in my seclusion, 
You're a blue illusion
While I'm in this Azure interlude!
",Azure
"Sammy Davis, Jr.","If I should write a book for you
That brought me fame and fortune too,
That book would be,
Like my heart and me,
Dedicated to you.

And if I should paint a picture too
That showed the loveliness of you,
My art would be,
Like my heart and me,
Dedicated to you.

To you,
Because your love is the beacon that lights up my way.
To you,
Because with you I know a lifetime could be just one heavenly day.

If I should find a twinkling star,
One half as wondrous as you are,
That star would be
Like my heart and me,
Dedicated to you.

To you,
Because your love is the beacon that lights up my way.
To you,
Because with you I know a lifetime could be just one heavenly day.

If I should find a twinkling star,
One half as wondrous as you are,
That star would be
Like my heart and me,
Dedicated to you.",Dedicated to You
"Sammy Davis, Jr.","Night winds, cold and melancholy,
Wave a blue finale
For my tragedy.
Life a misery,
Meant only for me,
While I linger, weary,
'Neath a willow tree.

Right here our romance was started,
Here again we parted
When I set you free.
All my thoughts are jumbled,
Everything is blurred,
All the world has crumbled,
Shattered by word.

My end has come,
My heart is numb,
'Twas like a bolt from the blue above.
I can't believe it but you're gone, darling,
And here lies love.

The sky is dark
And I hear a lark,
He sounds as sad as a mournful dove.
The dew appears like the tears of dawn, darling,
For here lies love.

All my dreams lost beyond recall,
Dreams of Spring blasted in the Fall,
You gave lips, you gave arms,
I gave all!

I ought to cry,
My eyes are dry,
There's only one thing I'm conscious of;
I only know that I can't go on, darling,
Here lies love.

My end has come,
My heart is numb,
'Twas like a bolt from the blue above.
I can't believe it but you're gone, darling,
And here lies love.

I only know that I can't go on, darling,
For here lies love.",Here Lies Love
"Sammy Davis, Jr.","There's been a sayin' goin' round
And I begin to think it's true
It's awful hard to love someone
When they don't care about you

Once I had a lovin' gal
The sweetest little thing in town
But now she's gone and left me
She done turn me down

Now I ain't got nobody, and nobody cares for me!
That's why I'm sad and lonely,
Won't somebody come and take a chance with me?

I'll sing you love songs, honey, all the time,
If you'll only say you'll be sweet gal of mine,
Oh, I ain't got nobody, nobody cares for me!

I'll sing you love songs, honey, all the time,
If you'll only say you'll be sweet gal of mine,
Oh, I ain't got nobody, nobody cares for me!",I Ain't Got Nobody
"Sammy Davis, Jr.","Wagon wheels, wagon wheels,
Keep on a-turnin', wagon wheels,
Roll along, sing your song,
Carry me over the hill.

Go 'long, mule, there's a steamer at the landin',
Waitin' for the cotton to load,
Go 'long mule, the boss is understandin'
There's a pasture at the end of the road.

Wagon wheels, wagon wheels,
Keep on a-turnin', wagon wheels,
Roll along, sing your song,
Wagon wheels, carry me home,
Wagon wheels, carry me home.",Wagon Wheels
"Sammy Davis, Jr.","Someday, when I'm awfully low
And the world is cold
I will feel a glow just thinking of you
And the way you look tonight

Yes, you're lovely
With your smile so warm, and your cheek so soft
There is nothing for me but to love you
Just the way you look tonight

With each word your tenderness grows
Tearing my fear apart
And that smile that wrinkles your nose
Touches my foolish heart

Lovely, never, never change
Keep that breathless charm
Won't you please arrange it, 'cause I love you
Just the way you look tonight
Just the way you look tonight",The Way You Look Tonight
"Sammy Davis, Jr.","Yours is my heart alone
And without you life holds no charm
Yours, every thought I own
Our love the theme of every dream

Love that makes life seem worthwhile
Dwells in your eyes and the spell of your smile
There is no song half so sweet to me
As your voice whispering, ""I love you, Dear""

When far away or near you
In dreams I see and hear you
And yielding to your fascination
I kneel to you in adoration dear, you alone

My queen shall reign and my heart you enchain
All day I sigh for you and I dream on the night
I live or die for you, my adored vision bright

All that makes life seem worthwhile
Was in your eyes and the spell of your smile
There is no song half so sweet to me
As your voice whispering, ""I love you, Dear""",Yours Is My Heart Alone
"Sammy Davis, Jr.","Frankie and Johnny were sweethearts,
Boy, how they could love!
Swore to be true to each other,
True as the stars above!
'Cause he was her man,
But he done her wrong!

One night Frankie happened to pass by the hotel;
Just casually glanced into a window so high,
And who did she see but her lovin' man
Lovin' up old Nellie Bligh!
She caught her man
Doin' her wrong!

Well, she went round the corner to her favourite pawn shop;
This time she didn't go there for fun!
'Cause when she left, underneath her long red kimono,
She was totin' a forty-four gun!
She was gunnin' for her man
Who was doin' her wrong!

Then back Frankie dashed to that hotel,
Started yankin' the bell!
She said, ""Stand back, you madam and floozies,
Or I'll blow each and every one of you straight to hell!
I want my man
Who's done me wrong!"".

Johnnie, in panic, mounted the staircase,
Screamin', ""Oh Frankie, don't shoot!""
Three times she pulled a trigger on a forty-four gun,
The gun went, ""Root-toot-toot!"".
She nailed her man
Who'd done her wrong!

So they put her away in a dungeon,
Way up in a dark dingy cell
In the south east corner of a jail,
Where the wind seemed to blow straight from hell!
For killin' her man
Who done her wrong!

But the day Frankie mounted the scaffold,
She was just as calm as any gal could be!
And raising her eyes to heaven she cried,
""Lord, I'm comin' to thee!
I'm sorry I killed my man
Who done me wrong!"".",Frankie & Johnny
"Sammy Davis, Jr.","It's Christmas time all over the World
It's Christmas here at home
The church bells chime wherever we roam
Sa riktig God Jul
Feliz Natal
Shenoraavor Nor Dari
Dari
To you

The snow is thick in most of the world
Childrens' eyes are wide
As old Saint Nick gets ready to ride
So Feliz Navidad
Sretan Bozic
And Happy New Year
New Year
To you

Though the customs might change
And the language is strange
This appeal we feel is real
In Holland or Hong Kong
It's Christmas time all over the World
In places near and far
And so my friend wherever you are
Ein frohliches Weihnachten
Kala Christougenna
Yoi kurisumasu
This means a very Merry Christmas
Christmas, Christmas
To you",Christmas Time All Over the World
"Sammy Davis, Jr.","Oh she may be weary
Them young girls they do get wearied
Wearing that same old miniskirt dress
But when she gets weary
You try a little tenderness

Oh man that
Un hunh
I know shes waiting
Just anticipating
The thing that you'll never never possess
No no no
But while she there waiting

Try just a little bit of tenderness
That's all you got to do
Now it might be a little bit sentimental no
But she has her greavs and care
But the soft words they are spoke so gentle
Yeah yeah yeah
And it makes it easier to bear
Oh she wont regret it

No no
Them young girls they don't forget it
Love is their whole happiness
Yeah yeah yeah
But its all so easy
All you got to do is try
Try a little tenderness
Yeah
Damn that hart (hard?)

All you got to do is know how to love her
You've got to
Hold her
Squeeze her
Never leave her
Now get to her
Got got got to try a little tenderness
Yeah yeah
Lord have mercy now

All you got to do is take my advice
You've got to hold her
Don't squeeze her
Never leave her
You've got to hold her
And never
So you got to try a little tenderness
A little tenderness
A little tenderness
A little tenderness

You've got to
Got to got to
You've gotta hold her
Don't squeeze her
Never leaver her
You got
Got got got to
Now now now
Got got got to
Try a little tenderness
Ye",Try a Little Tenderness
"Sammy Davis, Jr.","Maybe I'm old fashioned, feeling as I do
Maybe I am living in the past
But when I meet the right one
I know that I'll be true
My first love will be the last

When I fall in love it will be forever
Or I'll never fall in love
In a restless world like this is
Love is ended before it began
And too many moonlight kisses
Seem to cool in the warmth of the sun

When I give my heart it will be completely
Or I'll never, never, never give my heart
And the moment I can feel that you feel that way too
Is when I give my heart to you

And the moment I can feel that you feel that way too
Is when I give my heart to you",When I Fall in Love
"Sammy Davis, Jr.","Let me tell you 'bout a girl I know 
She is my baby and she lives next door 
Every mornin' 'fore the sun comes up 
She brings me coffee in my favorite cup 
That's why I know, yes, I know 
Hallelujah, I just love her so 

When I'm in trouble and I have no friend 
I know she'll go with me until the end 
Everybody asks me how I know 
I smile at them and say,  ""She told me so"" 
That's why I know, oh, I know 
Hallelujah, I just love her so 

Now, if I call her on the telephone 
And tell her that I'm all alone 
By the time I count from one to four 
I hear her [KNOCK-KNOCK-KNOCK-KNOCK] on my door 

In the evening when the sun goes down 
When there is nobody else around 
She kisses me and she holds me tight 
And tells me,  ""Daddy, everything's all right"" 
That's why I know, yes, I know 
Hallelujah, I just love her so 

Now, if I call her on the telephone 
And tell her that I'm all alone 
By the time I count from one to four 
I hear her [KNOCK-KNOCK-KNOCK-KNOCK] on my door 

In the evening when the sun goes down 
When there is nobody else around 
She kisses me and she holds me tight 
And tells me,  ""Daddy, everything's all right"" 
That's why I know, yes, I know 
Hallelujah, I just love her so 
Oh, hallelujah 
Don't you know, I just love her so 
She's my little woman, waitin' all this time 
Babe, I'm a little fool for you, little girl.","Hallelujah, I Love Her So"
"Sammy Davis, Jr.","There's been a sayin' goin' round
And I begin to think it's true
It's awful hard to love someone
When they don't care about you

Once I had a lovin' gal
The sweetest little thing in town
But now she's gone and left me
She done turn me down

Now I ain't got nobody, and nobody cares for me!
That's why I'm sad and lonely,
Won't somebody come and take a chance with me?

I'll sing you love songs, honey, all the time,
If you'll only say you'll be sweet gal of mine,
Oh, I ain't got nobody, nobody cares for me!

I'll sing you love songs, honey, all the time,
If you'll only say you'll be sweet gal of mine,
Oh, I ain't got nobody, nobody cares for me!",I AinT Got Nobody
"Sammy Davis, Jr.","Please don't talk about me when I'm gone
Oh honey, though our friendship ceases from now on
And listen, if you can't say anything real nice
It's better not to talk at all is my advice
We're parting, you go your way I'll go mine
It's best that we do
Here's a kiss I hope that this brings lots of luck to you
Oh makes no difference how I carry on
Remember, please don't talk about me when I'm gone
We're parting, you go your way I'll go mine
It's best that we do
Here's a kiss I hope that this brings lots of luck to you
Makes no difference how I carry on
Remember, please don't talk about me
Please don't talk about me
Please don't talk about me when I'm gone",Please DonT Talk About Me When IM Gone
"Sammy Davis, Jr.","When an irresistible force such as you
Meets an old immovable object like me
You can bet just as sure as you live

Something's gotta give
Something's gotta give
Something's gotta give

When an irrepressible smile such as yours
Warms an old implacable heart such as mine
Don't say no because I insist

Somewhere, somehow
Someone's gotta be kissed

So, en garde, who knows what the fates might have in store
From their vast mysterious sky
I'll try hard ignorin' those lips that I adore
But how long can anyone try?

Fight, fight, fight, fight, fight it with all of our might
Chances are some heavenly star-spangled night
We'll find out just as sure as we live

Something's gotta give
Something's gotta give
Something's gotta give

Fight, fight, fight it with all of your might
Chances are that some heavenly star-spangled night
We'll find out just as sure as we live

Something's gotta give
Something's gotta give
Something's gotta give

Something's gotta give
Something's gotta give

Aw, let's tear it up",Somethings Gotta Give
"Sammy Davis, Jr.","Merry Christmas
Merry Christmas
May your New Year dreams come true

Frosted window panes
Candles gleaming inside
Painted candy canes on the tree
Santa's on his way
He's filled his sleigh with things
Things for you and for me

It's that time of year
When the world falls in love
Every song you hear seems to say
Merry Christmas
May your New Year dreams come true
And this song of mine
In three-quarter time
Wishes you and yours
The same thing too

Santa's on his way
He's filled his sleigh with things
Things for you and for me

It's that time of year
When the world falls in love
Every song you hear seems to say
Merry Christmas
May your New Year dreams come true
And this song of mine
In three-quarter time
Wishes you and yours
Everyone
Merry Christmas
Merry Christmas
May your New Year dreams come true (Merry Christmas!)",The Christmas Waltz
"Sammy Davis, Jr.","The first Noel the angels did say
Was to certain poor shepherds in fields as they lay;
In fields where they lay keeping their sheep
On a cold winter's night that was so deep.

cho: Noel, Noel
Noel,Noel
Born is the King of Israel.
They looked up and saw a star

Shining in the East, beyond them far,
And to the earth it gave great light,
And so it continued, both day and night.
And by the light of that same star

Three wise men came from country far,
To seek for a King was their intent,
And to follow the star wherever it went.
This star drew nigh to the northwest;

O'er Bethlehem it took its rest.
And there it did both stop and stay,
Right over the place whcre Jesus lay.
Then they did know assuredly

Within that house, the King did lie
One entered in then for to see
And found the babe in poverty.
Then entered in those wise men three,

Full reverently, upon bended knee,
And offered there, in His presence,
Their gold and myrrh and frankincense.
If we in our time do well

We shall be free from death and hell
For God hath prepared for us all
A resting place in general.",The First Noel
"Sammy Davis, Jr.","Hark! the herald angels sing
""Glory to the new-born King
Peace on earth, and mercy mild
God and sinners reconciled"" 
Joyful, all ye nations, rise
Join the triumph of the skies
With th' angelic host proclaim
""Christ is born in Bethlehem"" 
Hark! the herald angels sing 
""Glory to the new-born King

Hark! the herald angels sing
""Glory to the new-born King
Peace on earth, and mercy mild
God and sinners reconciled"" 
Joyful, all ye nations, rise
Join the triumph of the skies
With th' angelic host proclaim
""Christ is born in Bethlehem"" 
Hark! the herald angels sing 
""Glory to the new-born King",Hark! the Herald Angels Sing
"Sammy Davis, Jr.","Have yourself a merry little Christmas
Let your heart be light
From now on, our troubles will be out of sight
Have yourself a merry little Christmas
Make the Yuletide gay
From now on, our troubles will be miles away
Here we are as in olden days
Happy golden days of yore
Faithful friends who are dear to us
Gather near to us once more
Through the years we all will be together
If the fates allow
So hang a shining star upon the highest bough
And have yourself a merry little Christmas now

Through the years we all will be together
If the fates allow
So hang a shining star upon the highest bough
And have yourself a merry little Christmas now",Have Yourself a Merry Little Christmas
"Sammy Davis, Jr.","I'll be home for Christmas
You can plan on me
Please have snow and mistletoe
And presents on the tree
Christmas Eve will find me
Where the lovelight gleams
I'll be home for Christmas
If only in my dreams
I'll be home for Christmas
You can plan on me
Please have snow and mistletoe
And presents on the tree
Christmas Eve will find me
Where the lovelight gleams
I'll be home for Christmas
If only in my dreams",I'll Be Home For Christmas (If Only In My Dreams)
"Sammy Davis, Jr.","It came upon the midnight clear
That glorious song of old
From Angels playing near the earth
To touch their harps of gold

Peace on the earth could will two men
From Heaven's all-gracious King
The world in solemn stillness lay
To hear the Angels sing

And I hear them singing
Sing, I do hear them singing

The first Noel the Angel did say
Was to certain poor shepherds in fields as they lay
In fields where they lay, they keeping their sheep
On a cold winter's night that was so deep",It Came Upon a Midnight Clear
"Sammy Davis, Jr.","Oh, by gosh, by golly
It's time for mistletoe and holly
Tasty pheasants, Christmas presents
Countrysides covered with snow

Oh, by gosh, by jingle
It's time for carols and Kris Kringle
Overeating, merry greeting
From relatives you don't know

Then comes that big night
Giving the tree the trim
You'll hear voices by starlight
Singing a yuletide hymn

Oh, by gosh, by golly
It's time for mistletoe and holly
Fancy ties an' granny's pies
An' folks stealin' a kiss or two
As they whisper, ""Merry Christmas"" to you

Then comes that big night
Giving the tree the trim
You'll hear voices by starlight
Singing a Yuletide hymn

Oh, by gosh, by golly
It's time for mistletoe and holly
Fancy ties an' granny's pies
An' folks stealin' a kiss or two
As they whisper, ""Merry Christmas"" to you",Mistletoe and Holly
"Sammy Davis, Jr.","(Wonderland, winter wonderland, wonderland)

Sleigh bells ring, are you listening?
In the lane snow is glistening
A beautiful sight, oh, we're happy tonight
Walking in a winter wonderland

Gone away is the bluebird
Here to stay is a new bird
He's singing a song as we go along
Walking in a winter wonderland

Well, in the meadow we can build a snowman
And pretend that he is Parson Brown
He'll say, ""Are you married?"" We'll say, ""No, man
But you can do the job when you're in town""

Later on we'll conspire
As we dream by the fire
To face unafraid of the plans that we made
Walking in a winter wonderland

In the meadow we can build a snowman
And pretend he's a circus clown
We'll have lots of fun with Mr. Snowman
Until the other kiddies knock him down

Oh, when it snows, ain't it filling
Though your nose gets a chilling?
We'll frolic and play the Eskimo way
Walking in a winter wonderland
(Wonderland, wonderland)",Winter Wonderland
Sammy Dee,"Embrace me, my sweet embraceable you!
Embrace me, you irreplaceable you!

Just one look at you
My heart grew tipsy in me,
You and you alone
Bring out the gypsy in me! 

I love all, the many charms about you!
Above all, I want my arms about you! 

Don't be a naughty baby,
Come to papa, come to papa, do!
My sweet embraceable you!",Embraceable You
Sammy Dee,"It had to be you, it had to be you.
I wandered around and finally found the somebody who
Could make me be true, could make me feel blue,
And even be glad just to be sad thinkin' of you.

Some others I've seen might never be mean
Might never be cross or try to be boss,
But they wouldn't do.
For nobody else gave me a thrill.
With all your faults, I love you still,
It had to be you, wonderful you,
It had to be you.

It had to be you, it had to be you.
I wandered around and finally found somebody who
Could make me be true, could make me be blue,
And even be glad just to be sad thinkin' of you.

Some others I've seen might never be mean
Might never be cross or try to be boss,
But they wouldn't do.

For nobody else gave me a thrill.
With all your faults, I love you still.

It had to be you, wonderful you

It had to be you.",It Had to Be You
Sammy Dee,"It's very clear, our love is here to stay
Not for a year but ever and a day
The radio and the telephone and the movies that we know
May just be passing fancies and in time may go

But oh, my dear, our love is here to stay
Together we're going a long, long way
In time the Rockies may crumble, Gibraltar may tumble
They're only made of clay
But our love is here to stay

In time the Rockies may crumble, Gibraltar may tumble
They're only made of clay
But our love is here to stay",Our Love Is Here to Stay
Sammy Dee,"Those fingers in my hair
That sly come hither stare
That strips my conscience bare
It's witchcraft

And I've got no defense for it
The heat is too intense for it
What good would common sense for it do

'Cause it's witchcraft, wicked witchcraft
And although, I know, it's strictly taboo

When you arouse the need in me
My heart says yes indeed in me
Proceed with what you're leading me to

It's such an ancient pitch
But one I wouldn't switch
'Cause there's no nicer witch than you

'Cause it's witchcraft, that crazy witchcraft
And although, I know, it's strictly taboo

When you arouse the need in me
My heart says yes indeed in me
Proceed with what your're leading me to

It's such an ancient pitch
But one that I'd never switch
'Cause there's no nicer witch than you",Witchcraft
