Band,Lyrics,Song
MC Lyte,"Gotta who? Gotta have a what?
Gotta what yo, gotta get a ruffneck hey!

I need a ruffneck
I need a dude with a attitude
Only needs his fingers with his food
Karl Kani saggin' timbos draggin'
Frontin' in his ride with his home boys braggin'
Lying 'bout the Lyte how he knocked boots last night
But he's a ruffneck so that's alright
Triple o baldie under the hood
Makin' noise with the boys up to no good
C-low on the down low cops come around so ruffneck front like he gotta go
Evil grin with a mouth full of gold teeth
Startin' beef is how he spells relief
Actin' like he don't care
But all I gotta do is beep him 911 and he'll be there
Right by my side with his ruffneck tactics
Ruffneck attitude,the ruffneck bastard

Hey! Gotta what? Yo gotta get a ruffneck
I need it and I want it so I gotta get a ruffneck
Gotta what yo, gotta get a ruffneck hey!
I need it and I want it so I gotta get a ruffneck

I need a ruffneck
I need a man that's quick and swift
To put out the spliff and get stiff
Boxer shorts everything is fitting large
Body ain't gotta be large to be in charge
Pumpin' in and out and out and in and here we go
He knows exactly how I want my flow and that's slow
Never questioning can he get buck wild
He's gotta smack it, lick it, swallow it up style
Drink a beer, sittin' his chair
Hands in his pants fiddlin' with his dick hairs
He's a rudeboy, a raggamuf
Ready to bag another brother that he ranks not ruff enough
Cause if it ain't ruff it ain't right
And if he ain't ruff, well then he's all wrong for the Lyte
I love my ruffneck and ain't nothing going down
Or going up if my ruffneck ain't in town

Gotta what yo, gotta get a ruffneck hey!
I need it and I want it so I gotta get a ruffneck
Gotta what yo, gotta get a ruffneck hey!
I need it and I want it so I gotta get a ruffneck

I need a ruffneck
I need a man that don't snitch like a bitch
Shed tears or switch
Doin' whatever it takes to make ends meet
But never meetin' the end cause he knows the street
Eat sleep shit fuck, eat sleep shit
Then it's back to the streets to make a buck quick
Quick to beg even though gimme gottem here
Hit'em wit a bit a skins then he's out of there
On the avenue girls are passin' thru
Too much of ruffneck so they ain't havin' you
Hard boppin' always grabbin' his jock and braggin' about his tec
Is the wannabe ruffneck
That's the kind you gotta watch out for
Just to get a rep he'll pull the plug on the tour
Pissin' in corners
Doing 80 by funeral mourners
Showing little respect
Now that's a ruffneck

Gotta what yo, gotta get a ruffneck hey!
I need it and I want it so I gotta get a ruffneck
Gotta what yo, gotta get a ruffneck hey!
I need it and I want it so I gotta get a ruffneck",Ruffneck
MC Lyte,"In comes the boom to the bam here I stands
Make 'em all understand that I got the master plan
And I'm ready to work, I go bezerk
A mention to Kid Capri, and the one Red Alert now I'm
ready for the showdown, who's the lowdown?
I'm in a rude mood honey you're goin down
Lickity split, swallow that spit, she make it a tidbit
Blows that you expected from the clique
or the group of the people that I hang with
Rather my crew, my posse, my mossie
It's a big thing when we hang cause we rip when we wreck
When we hit, what the heck? We puttin phony niggaz in check
Seek what I reap; follow you'll learn or get burned
I ain't afraid to buck and earn
my cash flow, I get ass though
Fast or slow, I got the master flow

What's my name yo?

I rip shop, I never flip-flop, I take flight
From the tip-top I rule hip-hop just how I like~!
I just want this to be well understood
I'm here to do good and not to bite on somebody's wood
Years and years gone by
I prepared to be paid for the rest of my decade
I set up investments
And never will you ever see Lyte a contestant
on a Jeapordy game show
Cause that's lame though, what's my name yo?
It's the L to the Y to the T you know the rest
I'm, truly blessed I know the route to express my
inner thoughts and now you're caught
But I'ma let you proceed, cause I'ma succeed
with or without you because I don't need
the negativity, nor do I need the bad energy
that you're tryin to give to me!

What's my name yo?

Here comes the wagon, you know I'm never braggin
So what I'm XX, my pants are still saggin
Boots still stompin, raisin 'em often
From New York umm or should I say - Compton
and back cause I'm all that
I flip a track, because I'm so damn FAT!
I get it loose, I got juice, I spread it
I'm the best, now there, I said it
Now the 4-1-1 is out
And all the hip-hoppers know just what I'm talkin about!
Underground I rock my sound
Up top I still wreck shop
So don't even talk about how I went commercial
when you need to take your ass to rehearsal
Your show is torn, done, ripped
So until you get your show down pat, don't pop no lip
Seckle that noise, don't be rowdy
Cat gotta scratch, yo Mike, I'm Audi

What's my name yo?",What's My Name Yo
MC Lyte,"To the L, to the Y and the T to the E
So get ready cause I want everybody to say this with me

[Chorus]
Now I cold rock a party in a b-girl stance
I rock on the floor make the fellas wanna dance
I be the shit and it's all good and if you understood

Would you stop scheming and trying to look hard
I'll get my bodyguard, You'll get that booty scarred,
I'm a veteran which means that I've been
In the game too long Since the days of Paper Thin
Way back when I've been putting it down
Ask your homies who's the baddest bitch on this side of town
I float like a butterfly sting like a bee,
Spectacular on the M I C,
I go for broke, Never giving it less than the best
Many years in the game at your request,
You like the rhyme bite if you dare,
I get the paper so I don't care,
Fly that's me the epitome
Of what a real MC is supposed to be,
Fucking you up every time that I drop,
Fuck a bullet baby, I done took your spot
I guide the best and I ride it well
And if you take a look it ain't hard to tell that I

Cold rock a party in a b-girl stance
I rock on the floor make the fellas wanna dance
I be the shit and it's all good and if you understood

Would you back off me and let my skin breathe,
Lyte is everlasting it's hard to believe
I shall prevail cause I'm next to none
Cause I'm claiming no set, don't plan to get down.
Just Brooklyn is where I'm from
But I'm resting in Studio City for the fun,
If you don't understand just say you don't(nah!)
And don't wait for me to explain cause I won't
You see it's in my nature to be the best,
West to East See East to West,
Ready or not I have arrived and I'm live
Showing an MC how to survive.
It's crazy how I get you captured with my tactics,
I got many witnesses who can back this
Ruffnecks from New York to LA
Been down with me since Poor Georgie.
It's '96, it's all about show and prove
And I'm about to make the ill type moves,
I guide the beat and ride it well
And if you take a look it ain't hard to tell that I

Cold rock a party in a b-girl stance
I rock on the floor make the fellas wanna dance
I be the shit and it's all good and if you understood

Would you get out my shit, please let me be,
I don't see why, you KGB
Why you gotta be all up on me like that,
Trying to get over like a fat rat,
But I understand, I'm a woman in the land of hip-hop
And the shit don't stop,
It goes on, on, on, on
You see the shit don't stop till the break of dawn
And now who makes it liver than a hip-hop, scuba diver,
Chillin with a pina colada,
Kidada hooked me up with Tommy now I got a lot of gear
From everywhere that I'd like to share (yeah right!)
But I'd rather do Kani, Don't ask why! 5001, my son gets shit
Done
All on the catwalk, what they've ever done for you
You betta get down with your real crew,
Cause I ride the beat and I ride it well
And if you take a look it ain't hard to tell that I

Cold rock a party in a b-girl stance
I rock on the floor make the fellas wanna dance
I be the shit and it's all good and if you understood

To the L, to the Y, and the T, to the E
Rock a party and rock a party and rock a
Party int the B- girl stance.",Cold Rock a Party
MC Lyte,"Got a new gig, here you come again kid
Fresh out the dog, done did your bid
But you can't stay here no more
Not in this crib

Not with the foul way that you used to live
I remember you would take long trips on the first of the month
Not giving a fuck about what I want
Break, uh! Breathe Lyte! Breathe!

The day that you left I spent mad dough trying to get shit fixed
'Cause of your fucking death wish
Broken glass everywhere, 
'Cause a motherfucka' like you just didn't care
Got my shit shot up, 
Had to buy a new body for my Benz, 
'Cause of your wild ass friends

Years ago when you started on the scene, 
Back and forth smuggling shit from Caribbean
It was you and your boy Dunn, making them suicide runs
But it was all in fun till Dunn tried to run with half of your cut
Now your boss is looking at you saying ""What the fuck is up?""

What's up? But you say, ""Fuck him"" 
You could start your own ring and things
Besides you get a lot of peeps to swing
Now you got eight men working 7 days a week
2 be the runners, 5 on the street

1 be the side kick,, the right hand, 
You know the one that ride shotgun thinking he the man
They'd kill to be where you are, oh yeah! 
The drug lord superstar
You got a new crib, new truck, new car
Trying to fit in, 
Throwing parties for them big type rap stars

But on the other side of town, 
Shit is getting hot, 
Your man got shot
And they blew up your tree spot, 
On 125th and St. Nick, 
Shit is getting thick
Your boy got caught in St. Martin with a brick, 
Now he's exile
You down to 6 motherfuckas 
And three of them motherfuckas is nothing but suckas

I got feds at my door want to know do I know a black
Now I ain't never called ya no shit like that, I'm fed up
I can't take it no more, 
You see I'm blazing at the next nigga knocking at my door
I heard you're on the run now, 
D is in the penile

Ratted your ass out and gave that what, 
When and how
They'd all kill to be where you are, 
The druglord superstar
They found a boy in the sand, 
It was Poppi your man 
With his eyes dug out and you must
Be soft

Heard they shot up your car 
And ransacked your loft, now you need a get away
A place to hide, 
'cause your man done snitched on the inside
You was on the run like a slave aback in the days, 
You must have been nodding when
They said

""Crime don't pay""
I got a new gig, here you come again kid, 
Fresh out the dog
Done did your bid but you can't stay here no more, 
Not in this crib
Not with the foul way that you choose to live

Motherfucker, you know what
Just, just take your shit all right! Just take it!
Cause I'm sick of this shit, 
I can't take it no more
Just take it, 
I don't know who the fuck you think you are

Thinking you could just come back here 
And try to enter my life, like I need you
I don't
I'm through with you motherfucker
Just get out! 
You put me through too much heartache
Too much shit

I had to go through,
I can't do it no more",Druglord Superstar
MC Lyte,"Hook:
Every day I need my shit done in a special way everyday

Off the top see me and want to serve
just thinkin about what they need
ain't that some nerve, now look here 24 hours and
7 whole days, I demand my respect
I demand my praise, everyday that I wake
I gotta have everything done with no mistakes
I take it incredibly slow don't try to rush me
no means no, I never said a no that meant yes
other women get taken for granted 
I guess I got a wish list that must be fulfilled
and you gets none until I get my toes sucked
and my eyebrows pluked
I need my car waxed and floor shellac
I need my back rubbed and da bubbled in the tub
that float to the bed so that we can make love

   Hook:
Every day I need my shit done in a special way everyday
Every day I need my shit done in a special way everyday

It ain't to ask for when
i come off tour to have my truck washed 
or my body massaged, all the bills paid i send home
all my dough and you being my man it just ain't for show
all the lovey dovey yeah that is sweet 
but honey bunny yeah gotta earn your keep

but don't sleep cause I need a lot done
and cold harded yeah check out whatever is clever
and get to stepping if you know somthing better
if not then respect whatcha got
meanwhile I got a new tide at the lot 
pick it up and bring it back to the spot
this is how we do it this is how we do it everyday
I need it done in a special way baby, tell them how it goes

   Hook:
Every day I need my shit done in a special way everyday
Every day I need my shit done in a special way everyday

On the real I need an man that understands me and 
realizes the reality. I'm in the m.c. industry which
means I want to live lovely I gotta make money
listen so never ask me to give it less then what I got
if it's too hot then raise up out my spot
if it's my trade i made up the black ace of spade
alone in the world it's me ya can't fade
it's my life, I do it my way
you don't like my way, hit the highway
see I'm special not because i'm mc lyte, but because
I'm a women with the gift to bear life, it's done
yes I've rested my case now run pick up my dermalogica
for my face this is how it goes down everyday
I need it done in a special way baby

   Hook:
Every day I need my shit done in a special way everyday
Every day I need my shit done in a special way everyday",Everyday
MC Lyte,"Hook:

Have you ever, ever in long living life
seen a woman rock the mic
like the one called the Lyte
(Repeat)

As I zoom with the Z down the Avenue
Who it be, me less the crew
Why you talkin that whoopied doo whoo
I'm makin moves, that's smoother than
the cream or the sweat from a wet dream
drippin wit Vaseline
My Mabeline left a ring on the scene
I got mad peeps down with the tag team
Listen you couldn't front it you want to
Trying to escape now I'm the one that you're running to
Looking at my tag it's about that time
for you to get yours, for me to get mine
I got our shit poppin wheelies like a Ninja
The inner of my center, keeps you warm in the winter
My placenta is on high overload, my complete context
can get so complex, I might explode
on the scene, like a nuclear bomb
while the children scream, I'll yellin ring the alarm

Hook

This is going out to all the ruffnecks
and hood rats, Jermaine hit me off with the track
Yo Brat if you're wit me holla let me know where you're at
I be the stage wrecker, rhyme
mafessa, feel the pressure, coming
straight off Elektra, the shit that be
kicking is off the wall crazy
You can't see, what I can see cause you're
blind baby, born a slave die a slave
Representing from the cradle to the grave
Cause we living in the last day, coming through your TV in 3-D
It's the Lyte representing for the female species
Letting em know that they can't even

Hook

What do we have here, an impostor
Perpetrator, fake playre trying to get on the roster
I keep trying to warn em and drop it all on em
Rap my collapse, when they attack
and drop the bomb on em, blown to dust
Either roll with us, or get rushed in, in God we trust
Cause it's a must, that I kick it like I hear it
Speak it like I see it
It's the spirit, I ain't go to see it to believe it
I take the form of the rain in a storm
As I get warm, like the rays of the sun
Here I come, like a hurricane, ready to
be reborn, let me be the first to welcome
you to the terrordome, the unknown zone
A Million miles away from home
The clock is ticking, time is up, before the world destructs
or the universe erupt
I'ma be the one to lights this motherfucker up

Hook",Have U Ever
MC Lyte,"Yeah! Uh! Uh yeah! Wooh!
Smooth, better than I've ever seen him.
As I flip the Vibe Book,
He's on the front page,
Never Looking his age.
He's all that and I'm all in.
So let the games begin.
Now I'm a give ya something,
So you could get in to it.
I got the side view so
I could watch it.
You've been on my mind,
But your're so hard to find.
Hollywood's got a hold on
That behind.
I ain't ashamed to play the game.
Listen here I won't say no names.
Put your ass out;
Make your woman put your ass out.
If you Knew that I was talking to you
You would pass out 'cause
I gave you bo type of indication and
If I did I was probably on the same medication.
I got the hots for you,
Daddy, and I just begun.
Lets do this, one on one.

[Chorus]
One, one, one, one, one, one, one, one. 
I want to play that game.
One, one, one, one, one, one, one, one.
Just you and me baby, one on one.

Half way acroos the world,
I seen you at my show
Wit' your girl.
Back in italy, but you
Are still into me.
'Cause if you are,
I'm here to let ya know
You don't have to be a superstar
For me, and you to go far.
Now I ain't never lied;
You got the body of an angel.
Bango, bango.
Watch the bojangle from every angle.
I'm clocking you honey.
We could sign a prenup;
I got my own money.
I just want to get to know you
A little better in the lyte,
After dark,
On the DL,
Whatever.
I want to feel your muscle flex off your backbone.
I got the jones and I can't leave you alone.
I want to rub your deltoid down to your bicep.
Better late than never.
And I'm sorry I slept, but now I'm
Well awake and I'm ready for the fun.
Let's do this, one on one.

[Chorus]

Damn.  The only brother make me look twice;
Believe that baby.
I want to sacrifice.
I'm on it, you couldn't shake me off
If you tried.
No sleeping on the job and
I'm wide-eyed.
I like the video you got out;
The song is butter.
Try to keep a clean head and my mind
Out the gutter.
But it's hard; you bring out the best and the worst.
If you way back when I
Would've let you hit it first.
Love, its like water on the brain,
Only you can tame this runaway train.
Last time I seen ya, gleam in your eye,
You was looking fly with your girl
By your side.
Shit, I ain't trying take her place,
I just want to have your face
All up in my space.
I got the hots for ya and I just begun.
You and me baby, one on one.

[Chorus]

Ha! Yeah!
Just you baby and me,
One on one.",One on One
MC Lyte,"TRG, we making that cream.
People get fooled, it ain't easy as it seems.
You can rock on till the break of dawn,
But one by one, your ass is gone.
I got trapped in the rap game at sixteen and saw
It's no more than a craps game, know what I mean?
Like when you feel you shake 'em right, they fake roll snake
Eyes in the this industry; that's how quick niggas die.
Through my eyes its like Russian roulette;
Never do you know when you about to get wet.
So you should stay set, so you don't fall and go under.
Have people saying: ""I wonder what happened to him or her.""
It's sad when you begin to think you can be gone, but you
Can be gone in the blink of an eye, don't ask why, 'cause you try
Somebody came along that was twice as fly.
I remember when I hit the scene, it was the second faze;
Rope chains, two finger rings, those where the days.
Latin quarters, why puma suit was cool.
Now let me be caught in that and I'll be damned a fool.  Ya
Gotta change with the times like the weather.
MC's that lasts is the MC's that's clover.
You can't move too slow 'cause when
It's to time to go, you see it's no time to go.
TRG, we making that cream.
People get fooled, it ain't easy as it seems.
You can rock on till the break of dawn,
But one day, brother, your ass is gone.
TRG, we making that cream.
People get fooled, it ain't easy as it seems.
You can rock on till the break of dawn,
But one day, sister, your ass is gone.
Come back after come back; nigga came back more whack
Than the whackest wax on the rack.  What's up with
That New Jacks are coming through, taking no slack.
They hungry, and they looking for a spot to cop a squat.
You better watch the clock, it can be awfully embarrassing
To not know when it's time to let go of the rhyme.
It's about half past the monkeys ass.
You should have been gone but you
Still trying to hang on, what happens when you
Chilling at the level on the 10th floor, nobody
Knows your name anymore, aren't you?
Wait and let me think, just as quick as you
Got large, you can quickly shrink and sink into the crates and
Collect dust, don't be mad cause it happens to best of us.
TRG, we making that cream.
People get fooled, it ain't easy as it seems.
You can rock on till the break of dawn,
But one by one, your ass is gone.
TRG, we making that cream.
People get fooled, it ain't easy as it seems.
You can rock on till the break of dawn,
But one by one, your ass is gone.
To and fro, they come and go, you better change your flow
And then switch up your show, I seen some come with the
Booming ass hits, then they gone, but then they don't leave
With shit, you better tell an exec you need to be set
So when it's over, you ain't living out your Land Rover.
When you rap life dies,
And you still alive nigga, you better know how to
Survive, it ain't easy and it ain't supposed to be.
Letting niggas know what time it is
When it comes to me the L-Y-T-E,
Stronger than the ox the octane that
Knocks in your brain I sustain.
My mission is to maintain sane, know what I mean?
Keep doing my thang, you can't move too slow
'Cause when it's your time to go, you gotta go, gotta go.
TRG, we making that cream.
People get fooled, it ain't easy as it seems.
You can rock on till the break of dawn,
But one by one, your ass is gone.",TRG (The Rap Game)
MC Lyte,"be	-Boy, where the fuck you at? 
I been looking for you're ass since a quarter past. 
Hot peas and butter, baby, come and get your supper. 
Before I make you suffer That's when you had enough-a 
Can I get hot when you hit the jackpot? 
Surely I can, if you the man. 
I get loose and produce large amounts of juice. 
Can you get used to that or do you need a boost of energy to enter me ang
get it on. 
You're gettin' warm. 
I can feel you getting closer. 
Now baby, down this Mimosa. 
You better believe it's time to give a toast to. 
The woman of the decade, too bad to be played. 
Get vex and I'm bound to throw shade. 
All over your body. 
Who's body? 
You're body. 
I can rock a party like nobody. 
Leavin' time to take home the loot. 
Choosy about who I let knock my boots. 
Now let me take sight while your lovin' the Lyte. 
Life ain't all that unless you're doing it right. 

CHORUS:

Keep On' Keepin On, Cause you came and you changed my world. 
Your love so brand new. Keep on keep kickin' on. Doin it right, right,
right... Ah, ah, ah....

Beware of the stare when I step into peace. 
I come in peace but I got shit that need to be released.
Now who from the chosen shall I choose? 
Yeah, now you wish you was in his shoes. 
I found me a new nigga this year. 
That know's how to handle this here. 
Now I look forward to goin' home at night. 
Brother does mo right. 
Under the candlelight. 
Wax upon my back, can I handle all of that? 
I guess I can. 
Can I, why not? 
If I want to guess I can. Can I? 
More honey than a bumble-bee hive.
Pulling 69 ways in my archive. 
Sweet like licorice. 
Sugar for my booga. 
Juicy like Hi-C. Or an Icee. 
I got shit to make your ass write a bad check. 
Cause like I said I ain't afraid of the sweat. 
Beat on my drum if you feel the need to.
As I proceed to  Open up and feed you. 
I got a longing to put you where you want to be. 
Been I can, I get rid of all company.

CHORUS

Many have tried strict regulation. 
Lazy motherfuckers get put on probation. 
Those that didn't perform well. 
They gets no answer when they ring-a-ring-a my bell. 
You're playing with my time. 
Trying to jerk me hurt me then dessert me. 
You better work me. 
While you got the oppurtunity. 
To be in the midst of the L-why-T-E. 
Only the strong survive. 
Only the wise excel. 
Once said by my born-in-hell.
Only the lonely die slowly. 
Left all alone try to control me. 
Easy does it never ask how was it.
Never speak my info why my sheets in the streets. 
Cause that ain't cool. And that ain't cute. 
To talk about who knocked the boots on a video shoot. 
But it's all good, though you gotta get it when you want it. 
Like your prey, make your move and hop up on it. 
It's natural. Never be ashamed. 
Fuck the fame. Get the name, and kick the game.",Keep on Keepin' On [T.V. Track with Ad Libs]
