Band,Lyrics,Song
NWH,"NWH is in the house 
To tell you punk little suckers what it's all about 
When it comes to butts we are the masters 
Ain't a butt with a kitty in front gettin' past us 
But there's a part of the butt that we want to introduce 
It's nasty and wet and it's called booty juice 

[Chorus:]
That booty juice, juice, juice 
That booty juice, juice, juice 

Booty juice comes right from the source 
What's the source an ass of curse 
The kind that spreads out extra wide 
The kind that's nice when you come inside. 
It's fresh an meaty all pasturized 
But I always rise when I tap the thighs 
'Cause I like'm big , I like'm greasy 
I like'm round and I like'm easy 
I like'm when the girls steps on the floor 
Shake'n them booties just like a ho 
I like it when it shakes in the pants so loose 
But I love it when it's drippin -- that booty juice 

[Chorus]

When booty juice falls gotta go for yours 
When it's really wet you gotta mop the floor 
When I look fine fade to dance 
I make my decision by the shape of her pants 
Cause the bigger the butt, the bigger the shake 
The bigger the shake, the more it's gonna make that booty juice 
Ain't made by hand but yes it does come from a can 
Pop it open and take a sip careful not to catch you lip 
In a can is where the river runs and quench your thirst between those buns 

[Chorus]

See I like the fit with the nasty ass 
The kind that hums when the shit goes past 
Grab a cheek when the girl goes by 
Slap it hard make the booty juice fly 
Yo baby doll pull down those tight draws 
When your butt expands it'll slap the walls 
I'll grab it from front and from behind 
We'll do the nasty and do the grind 
Slip and slide all over the sheets 
Cause booty juice is just like grease 
Buck so hard that your butt gets wet 
Put that ass in full effect 
Take off those draws, take off that lace 
Have a seat on my face and let me taste 
That booty juice 

[Chorus]",Booty Juice
NWH,"People ask why I walk this way 
Protection first is all I say 
I got it they want it 
Believe it, they'll steal it 
Some of them punks just want to feel it 
When they see me grip with both hands 
It's a black thing they don't understand 
It's true they want to take it all 
So before they rip you ball for ball 
Cup your hand and cover up 
[NWH] say grab your stuff 
[Chorus ]
Grab it, you gotta grab it 
Grab it 
Grab it, you gotta grab it 
Grab it 
You gotta grab your stuff 
Four hundred years and it ain't enuff 
Suckers still tryin? to take our stuff 
Stealin it, swipin it, rippin it, bitin it 
They can't grow it so punks try to heist it 
[NWH ]ain't down with that 
Gotta look out for the black 
When they start going for the family jewels 
Protect that gear by whatever tools 
Cup your hand and cover up 
Nwh say, grab your stuff 
[Chorus] 
Ladies this involves you too 
Stand by the man that stands by you 
Help him, love him, need him, believe him 
Plenty of others will try to defeat him 
If your man is wit you 
Let no other make issue 
When they try to take him down 
You can keep him off the ground 
Lend a hand and lift him up 
[NWH] say, grab your stuff 
[Chorus]",Grab Yo Stuff
NWH,"Yeah suckers it's me 
The tiddly tiddly 'T?'
Servin' up dynamite and 
Strikin' like a cobra at the foot of your bed 

It's over when I leave you for dead 
Ice melts when the 'T' gets hot 
Ice cracks when the 'T' does rock 
Gonna hit you so hard you scream 

How could a little nigga be so mean 
I'm ready to blast like a megaton 
I'm strong I last for millenniums 
You're gonna feel stress when you mess 

With the best the one and only taste ?T? yes 
Power packed like t-n-t 
When I rock you get no relief 
From the barrage of rhymes I'm droppin' 

On your head and the ammo ain't stoppin 
Packed, stacked, tracks that ain't ever whack 
And I ain't jacked, sucka step to the back 
It's not a game when the T attacks you 

You so weak I could just bitch slap you 
I'm gonna kick your black ass 
Granny says kick your black ass 
I'm gonna kick your black ass 

Granny says kick your black ass 
My foot is ready to fly like a government stealth-G 
I'm hazardous to your health 
Got your butt in the bulls-eye 

And my leather boots ready to fly 
Direct to the center of the most soft tissue 
So far up in you that you're gonna wish 
You never ever heard my name 

Never ever tried my game 
It ain't murder it ain't homicide 
But when you fuck with me its sheer suicide 
When my foot goes in that posterior 

You'll taste it in your mouth?s interior 
Cause this is the way I play 
Sucker punks get outta my way 
I'm gonna kick your black ass 

Granny says kick your black ass 
I'm gonna kick your black ass 
Granny says kick your black ass 
Don't know what you get 

When you mess with this kid 
G- tell em, don't even make a bid 
'Cause I see red 
Leavin' other poot butt suckers cold left for dead 

An now I'm aimin' at you 
Callin' you out, so what you gonna do 
You weak want to be hard 
Booty wipe punk 

Gonna step to me and talk that junk 
And G you're dealin' with a man 
And you're gonna stand like a punk 
With your meat in your hand 

Time for you to get nervous 
Cause I'm impervious to the pain that battle serves us 
Tasty-taste will go to the top 
Tasty taste will always rock 

Tastey T will go to the battle 
Killin' more fools than mickey dees kills cattle 
I'm gonna kick your black ass 
Granny says kick your black ass 

I'm gonna kick your black ass 
Granny says kick your black ass",Granny Says Kick Yo Black Ass
NWH,"Guerrillas in the midst of a race riot 
Say it ain't black or white but I ain't dumb and don't buy it 
Talkin' about a time to heal 
But step to it, Time for you to get real 

We can't do it 
We were lookin' for healin' in the court see 
Out in the valley of the semi 
But a black man gets no justice 

'Cause the kangaroo court don't trust us 
Wasn't the first and won't be the last 
Brothers gotta move to get that ass 
Plead your case to the court but they don't see you and me 
Verdict by a punk assed jury opened up a black man?s fury 

Now see me jack you in the valley 
Now see me take you in the alley 
Now see me pull you out the truck 
Now see me I don't give a fuck 
Now see me burn this shit down 
Now see my hatred shape this town 

Guerrillas in the midst 
Guerrillas in the midst 
Guerrillas in the midst of a sequel 
Gonna rock make it real gonna go until we treated equal 

An I'm runnin' with a set that's a threat 
And you bet we lookin' for payment on the debt 
Ain't lookin for a handout looking for a way out 
Before a nigga gets played out 

In the hood where the cops do lie 
They'd rather see a nigga just die 
See the fear in their eyes when they realize 
How a brother gets wise and he starts to rise 

Up from the bottom of the heap we creep 
Squeak, peep breakin through the concrete 
Tired of livin in an occupied state 
Other motherfuckers decidin our fate 

Now see me jack you in the valley 
Now see me take you in the alley 
Now see me pull you out the truck 
Now see me I don't give a fuck 
Now see me burn this shit down 
Now see me terrorize this town 

Guerrillas in the midst 
Guerrillas in the midst 
Guerrillas in the midst 
Guerrillas in the midst 
Guerrillas in the midst of a concrete jungle 

Pretty soon we gonna tunnel 
Out of the city ain't lookin' for pity 
From another committee we about to get busy 
'Cause memories fade every damn decade 

More promises made and the past gets replayed 
Ya'll forget about all the shit you talked about 
Once again we get blocked out 
People say violence ain't justified 

Stay silent when a nigga gets crucified 
So let's go, you know, toe to toe on the floor 
See em rock and watch us roll 
Heads down the street as we defeat the elite 
Those that lead become obsolete
 
Now see me jack you in the valley 
Now see me take you in the alley 
Now see me pull you out the truck 
Now see me I don't give a fuck 
Now see me burn this shit down 
Now see me terrorize this town",Guerrillas in the Midst
NWH,"You are just like me 
I'm just a human 
I am just like you 
I'm just a human 
We all stand or sit when we pee 
I'm just a human just a human being 
When I doo-doo is my shit not brown 
It's a universal thing we all flush it down 
And when you wipe do you look at the tissue 
Most folks do, it ain't even an issue 
Hot stuff makes it burn comin out 
I bet everyone knows what I'm talkin about 
'Cause we are all one race on this planet 
We all burp and fart, and that's the way God planned it 
So don't act like your superior 
Eat something bad an just like me you'll get diarrhea 
'Cause black, white, yellow, red, brown or gold 
Our shit all comes from the same little hole 
You are just like me 
I'm just a human 
I am just like you 
I'm just a human 
We all stand or sit when we pee 
I'm just a human just a human being 
Like most humans in my car I pick my nose 
We've all mined a rock or two I'd suppose 
The nose might be white when you reach to clean 
But red, yellow, brown or black the booger's still green 
An sometimes it's anchored to some snot 
That hangs from your nose, and you're afraid it's gonna drop 
So you catch it in your hand and hope no one realizes 
You've got mucous on your hand while your driving 
So you look for a place to try and hide it 
You open up your mouth, and there you slide it 
But it ain't really much for you to worry about 
'Cause you won't be first or last to put a booger in your mouth 
You are just like me 
I'm just a human 
I am just like you 
I'm just a human 
We all stand or sit when we pee 
I'm just a human 
Just a human being 
Sometimes I smell the lint from my belly button 
How could somethin' so small make a stench so rotten 
At night there's always jam between my toes 
Sometimes I pull it out, and that's the way it goes 
When I'm alone I'll take a leak in the shower 
I bet you do it too, it's only water 
I pick sleep from my eyes and wax from my ears 
I rub the goo between my fingers and I watch it disappear 
It might sound gross to you 
But these are the things we all do 
So shake hands with your fellow man but first 
Make sure he's washed his hands 
You are just like me 
I'm just a human 
I am just like you 
I'm just a human 
We all stand or sit when we pee 
I'm just a human 
Just a human being",I'm Just a Human
NWH,"From the depths of the pond back to the top
Ice froggy frog jumpin and I got the drop
Git so low in the grass, tadpoles will sing
Long reach to the spot where my tongue will fling
Hippin and hoppin hoppin and hippin but don't your sleep,
Nine four-zay's the ye zear for me to buck up the sheets
And I ain't holdin nothin back and 
I'm bout to yank nine from my gunny sack
It's like that and as a matter of fact, (fling your tongue fast) 
Cause I never hesitate to give a dragonfly a smack.
Yeah, so jump through the sands a bit, 
You see that it's a must we hop logs n sit
What's my name fool
[Chorus]
Ice froggy frog. Ice froggy frog.
It's the frog to the log, hippin and hoppin. 
Ribbit in all an ice froggy frog in the middle of the pond. 
Like every day, amphibian slippin in all the way, like I said 
None of ya'll can hip to this and none of ya'll can hop to that
Flies that I drop and you know I don't 
Stop, mister 187 on a CB 4 plot.
Hip hop, not wit a glock just some rocks and a shock
Ever call me kermit and you'll feel that blood loss. 
And I spring through the bog and I bounce through the fog 
Cause I'm ice froggy froggy froggy frog!!!
[Chorus]
Croak croak croak ribbit croak ribbit croak Croak croak croak ribbit croak ribbit croak
Now just flick your tongue way up in the air and lap it
All around like it all around till you taste that tail 
Yeah, roll up the plank and walk the length, you in the drank
Why Cause froggy's on the bank
My croaker sacks all swoll 
My skins is mean green and now I'm on a roll, so flow
With the frog pond right behind me and up in your toad is 
Where you might find me slingin and swingin that swamp thing
She wants the frog with the croaker sack, so jump back
Polly gets what polly-wogs, the frog with the biggest log
What's my name fool
[Chorus]
Croak croak croak ribbit croak ribbit croak Croak croak croak ribbit croak ribbit croak",Ice Froggy Frog
NWH,"Well they're low cholesterol and high protein 
hotter than a Mexican jumping bean 
Have em dry roasted or vacuum packed 
my peanuts come alive when you open that sack 
Smoother than jiff, and fresher than planters 
my peanuts exceed all standards 
Def enough to knock you to your knees 
and even planters don't crack no nuts like these 
My peanuts! 
Well they rock they top they hit the spot 
open a can and gobble em up 
they're ready for action, the girls do snatch em 
sure to give you some satisfaction 
So let?s not squibble they sure ain't little 
Deffer than any ole peanut brittle 
An if you want to chill no need to get ill 
 my peanuts give you a thrill 
Like mickey dees my peanuts an me 
were tasty eating from sea to sea 
My peanuts! 
My nuts stand tall they never fall 
Ripe and yes always on the ball 
FDA fresh and they are the best 
A winner of every damn taste test 
Eat em for pleasure or at your leisure 
a taste that all the girls do treasure 
Never illin but chillin 
Never stealin but dealin 
my peanuts are what you're feelin 
I take em to the beach, I take em to the park 
I takem to your mothers house after dark 
They ain't like no nuts from Jimmy Carter 
I know my nuts rock you harder 
My peanuts! 
I met a home girl from around the way 
she saw my peanuts and wanted to play 
She said can I hold your peanuts inside my hand 
I said be careful cause they're in demand 
I took my peanuts outta the sack 
her hand started movin up, down and back 
She squeezed too hard, I said oh brother 
it looks like you made peanut butter 
Next time I jam her 
I think I am a gonna talk a little bout my banana 
Banana and nuts, banana and nuts 
I'm gonna give you some banana an nuts 
Banana an nuts banana an nuts 
I think you need my banana an nuts 
Always classy, never trashy, always flashy, never rashy, always tasty, never hasty, always racy, never pasty 
You know nothin will come between us, unless of course it is- 
(What is it?) 
My peanuts! 
This girl was yellin my head was swellin 
What she was sayin there ain't no tellin 
I needed something to quiet her down 
and my peanuts was all I found 
I baked em I shaked em and then she taked em 
Soon all was quiet in the house 
because my peanuts were in her mouth 
Like M&M?s you understand 
they melt in your mouth and not in your hand 
My peanuts have the fame my peanuts have the glory 
my peanuts will invade your territory 
My peanuts! 
I?ll tell ya a little story bout a man named mel 
Keep his peanuts inside the shell 
Then one day he got hungry for some food 
He ate his own peanuts now ain't that rude? 
(Dry roasted, vacuum packed, on a half shell, don't tell Granny) 
A girl who looked much better than bad 
took my peanuts from inside my bag 
Tasted them and then said I had salt peanuts, salt peanuts 
My peanuts always rise to any occasion 
My peanuts can handle any social situation 
I met a home girl from Albuquerque 
who ate my peanuts with her turkey 
I know this song is kinda long 
I guess I have ta go and I?ll be gone 
Bust this beat just one more time 
cause I think I have just one more rhyme 
Have my peanuts and a diet coke 
My peanuts and a little joke 
My peanuts and some hog jowls 
My peanuts and some candied yams",My Peanuts
NWH,"A hat is the last line of defense between the black man and the weather 
""Where's my hat?""
It's a fact that the white man wants to keep you bald 
We promise we will keep our heads covered...with any hat available.? 
Gotta keep your head covered and wear your hat 
To avoid all the noise that destroys the black 
Or they take you out, one by one. 
Basted, baded and done. 
A nigga dead from exposure to the sun. 
Victims of hostile elements. 
Not so swell events. 
Designed to keep the black irrelevant. 
Hats in the ghetto streets decrease the blood shed 
Hats in between the sheets and you won't be dead 
Hats that preach and teach decrease the knuckleheads 
Hats dealing with the police and ya won't get bled-son 
Hey we ain't done 
Ice meets the heat with a bigger gun 
Bustin' caps that free the truth 
Wearin' hats that save our youth 
An' while you busy drinkin' forty and eight ball 
We takin' a roll call to see who's down to fight the white why'all 
We ain't stoppin' 
Steady clockin' 
My lid's on tight so their knees keep knockin? 
We be the niggas that pull all the triggas 
Takin' no prisoners, raisin casualty figures 
Dressed for the battle but not fatigued 
My hats made of metal to avoid debris 
Yo gee they stole the kangol right off my head 
Better grab a fedora instead 
It's genocide the way they be snubbin' ya 
Grab a brim babushka or yarmulke 
Yo gee what about a bonnet 
It really don't matter just put a lid on it 
Cause they want more than to see you fall 
They want to keep a brother buried and bald 
Don't wear a toupee cause that's assimilation 
Don't say it's okay that's oral masturbation 
Hats offer enclosure from deadly exposure 
Of sucker imposers ready to close your Coffin 
And lower you down black 
Bald buried and beaten into a pre-dug track 
That's whack- the way they dis the black 
How can a brother complain when we don't fight back? 
It ain't hate cause we retaliate 
With the gat in my hands and the hat on my pate 
See back in the day out in the fields they kept us 
Exposed to the rays, without no shields they left us 
Without a hat we wuz exposed 
Without a hat we wuz sunstroked 
The African sun was pure and good 
Never needed a hat just brotherhood 
But the good old days are a brothers worst enemy 
Tell me stay bald I say it ain't me 
Look in my eyes and you'll realize 
These ain't lies I wouldn't lead you wrong 
Get wit the facts as I chart the stats 
Cold kick the hats make the black grow strong 
Time to make the change 
Gotta cover my brain 
Start dealin' the pain 
To those who'd keep me in chains 
Cause they want more than just to see you fall 
They want to keep a brother buried and bald",Wear Yo Hat (Buried and Bald)
NX Zero,"Apenas um olhar, mistério
Confuso de entender
Do que me vale ser sincero
Se o destino me afasta de você?
De você...
De você..

Porque você está 
Fugindo de mim com nossas fotos rasgadas?
Se for pra ser 
Assim será...

Apenas um olhar, mistério
Confuso de entender
Do que me vale ser sincero
Se o destino me afasta 
De você... 

Agora é pra valer
Esqueça o que eu disse para você
Já não tem sido fácil
Tirar você da minha mente

Apenas um olhar
Espero desvendar os seus mistérios
Tentar entender eu mesmo
Tentar entender
Você

Agora é pra valer
Esqueça o que eu disse para você
Já não tem sido fácil

Eu odeio saber que as coisas não são como deveriam ser
Esse é o protesto de um amante singelo
Porém sincero
Sincero...",Apenas Um Olhar
NX Zero,"Acordei com as mãos sujas de sangue
Olhei no espelho e não me refleti
Mas vem ver, o problema não é tão natural assim.

Na verdade não assumo a culpa
Por não estar mais aqui
Finja entender do mesmo modo que finjo viver

E você não vê
Nem assim a verdade
E você não vê
Nem assim a verdade

Não me orgulho
E nem aceito
O que ontem fiz de errado
Finjo ser o que não sou
Posso ver, mas não mudar.

De que adianta se arrepender
De que adianta se arrepender

E você não vê
Nem assim a verdade
E você não vê
Nem assim a verdade
",Finja Entender
NX Zero,"Eu não vou mais mentir
Eu não vou tentar ser
Algo que não sou
Não dá mais para finjir que não vou me importar
O jogo terminou 

E agora?
O que faço?
Os sonhos se perdem no tempo e ninguém vê

São tantas decepções
Mentiras e fracassos
É difícil acreditar
Que vai ser diferente
Dessa vez não vou cair
Sinto que recomeçou

E agora?
O que faço?
Só me resta a angústia da incerteza

No vão dos sentimentos que deixei para trás
Sobra a desconfiança de ser superficial

No vão dos sentimentos que deixei para trás
Sobra a desconfiança de ser superficial",Mentiras E Fracassos
NX Zero,"As vezes perco a noção do tempo
O mundo gira e eu não vejo tanta diferença
As horas passam pra mim pra você e nada muda
Me olho no espelho e não consigo me entender

Meu pulso cortado se esquece da dor
Que é bem mais fraca que dor
Da qual me faz a falta
Do seu amor

O que passou passou e não vai mas voltar
E já não há nada que você possa falar

Não
Parece que foi tudo em vão
Sei que dessa vez não fui eu que errei
Não
Parece que foi tudo em vão
Sei que dessa vez não fui eu que errei

Por mais que eu tente relevar e esquecer os erros
Os sonhos sempre acabam sendo os mesmos pesadelos
Do que adianta vocêr vir dizendo que se importa
Se tudo o que vivemos ficou apenas na memória

Tarde demais!

(Ahhh)Mais tempo pra recomeçar
Não adianta correr atrás
Você diz que quer uma nova chance
Agora é tarde demais

O que passou passou e não vai mas voltar
E já não há nada que você possa falar

Não
Parece que foi tudo em vão
Sei que dessa vez não fui eu que errei
Não
Parece que foi tudo em vão
Sei que dessa vez não fui eu que errei

",Tarde Demais
NX Zero,"Por quanto tempo eu tentei 
Ter palavras pra dizer sobre o que a vida é 

Hoje parei pra pensar, não preciso entender 
E desisti de procurar um motivo, uma razão 
Para tudo que acontece na minha vida agora 

Não há quem possa dizer
Que a vida nunca é tão certa 
Talvez possa buscar um outro caminho 

Por quanto tempo vou fugi, 
Controlar meus sentimentos não é a solução pra mim 

Hoje parei pra pensar, não preciso entender 
E desisti de procurar um motivo, uma razão 
Para tudo que acontece na minha vida agora 

Então abra seus olhos 
Não pense no que deve sentir para evitar sofrer 
A vida não vai esperar seu sonho se realizar 

Não há quem possa dizer que a vida nunca é tão certa 
Talvez possa buscar um outro caminho
Na minha vida agora
Na minha vida agora
",Um Outro Caminho
NX Zero,"I hope someday will come 
Fake feelings on my own 
Dead days on cold all alone
When it's over 
I'm sure she's not the one 

Se ajoelhe e faça suas preces 
Acredite no que ninguém vê 

Uma chance
Não desisto de tentar
Vem aqui 
Tenho algo pra falar
Sei que não é fácil encarar a traição 
Machuca eu sei
É verdade... 

Cego sim sou eu
Certa é você 
Ouça o que eu tenho a dizer 
Minhas palavras não te fazem nem pensar 
Cego sim sou eu
Certa é você 
Ouça o que eu tenho a dizer 
Minhas palavras... 

E de novo eu tentei
Mesmo assim não consegui 

Uma chance
Não desisto de tentar 
Vem aqui
Tenho algo pra falar
Sei que não é fácil encarar a traição 
Machuca eu sei
É verdade... 

Eu só queria uma chance
Eu só queria uma chance 
Eu só queria uma chance
Eu só queria...
Eu só queria...

Cego sim sou eu
Certa é você 
Ouça o que eu tenho a dizer 
Minhas palavras não te fazem nem pensar 
Cego sim sou eu
Certa é você 
Ouça o que eu tenho a dizer 
Minhas palavras...


",Uma Chance
NX Zero,"Aonde estiver, espero que esteja feliz
Encontre o seu caminho
Guarde o que foi bom e jogue fora o que restou

Tem horas que não dá pra esconder no olhar
Como as coisas mudam e ficam pra trás
O que era bom hoje não faz mais sentido, é
Uma hora isso ia acontecer
A vida cobra e a gente tem que crescer
Me pergunto se você pensa em mim
Como eu penso em você

Aonde estiver, espero que esteja feliz
Encontre o seu caminho
Guarde o que foi bom (foi bom) e jogue fora o que restou

Pois acredito nos meus sonhos
Eu acredito na minha vida
E no meio dessa guerra nenhum de nós pode ganhar

Sonhar e não desistir, cair e ficar de pé
Dar valor depois que passou é duvidar da sua fé
Eu vejo a vida, tem vários caminhos
E entre eles o destino improvisa
Nos pequenos detalhes da vida
A resposta está escondida

And I'll be rolling, rolling
Baby get me dope
And I did all wrong, although your heart was gold
Now I may be numb and lonely and heartbroke
Facing that before this heart starts smoke
If you wanted I should, could, would get it
Maybe I should a couple miles, just a little bit
But I was thinking about the present, I was way too selfish
Trying hard not to call you, I just can't help it
Girl you changed me, know this ain't a praise
But it's kind hard to speak without my faith
If you left, leave me I'll act I was all brave
I want you in my life, no one can please me
Rush in to the phone when I hear your ringtone
Hear you when I think, like you push your things on
I'll wrap, but you make me want get my sing on
Gotta sit back and wonder how you get the jeans on, shut

Memórias e lembranças, certezas e duvidas
Nada parece mudar
E apesar de tudo, enquanto o tempo passa
Ainda espero sua resposta

Aonde estiver, espero que esteja feliz
Encontre o seu caminho
Guarde o que foi bom (foi bom) e jogue fora o que restou
Aonde estiver, espero que esteja feliz
Encontre seu caminho
Guarde o que foi realmente bom (foi realmente bom)
E jogue fora o que restou

Pois acredito nos meus sonhos
Eu acredito na minha vida
E no meio dessa guerra
Nenhum de nós pode ganhar",Onde Estiver
