Band,Lyrics,Song
Raulin Rodriguez,"(ver1)
Seore se fue la mujer
la que me enseo a querer
la que me entrego su vida
ahora solo vivo yo
recordando aquel amor
que le dio vida a mi vida
porque sin ella muero yo
y si no vuelve otra vez
pues de pena morire

(coro)
Que vuelva
que vuelva
hoy me muero yo
que vuelva
que vuelva
hoy me muero yo
que vuelva
que vuelva
hoy me muero yo

(ver2)
Que conmigo fuiste infiel
nunca mas pienso volver
oye bien lo que te digo
si muere no me importa
porque me hiciste sufrir
engaandome con otra
adios adios es para siempre
porque me voy de tu lado
de tu vida para siempre

Oye mujer lo que te digo
que yo estoy arrepentido
de lo que te hice sufrir
vuelve mujer vuelve conmigo
porque si no esta conmigo 
pues de pena morire

(coro)
Que vuelva
que vuelva
hoy me muero yo
que vuelva 
que vuelva
hoy me muero yo
que vuelva 
que vuelva
hoy me muero yo

(ver3)
Que conmigo fuiste infiel
nunca mas pienso volver
oye bien lo que te digo
si muere no me importa
porque me hiciste sufrir
engaandome con otra
adios adios es para siempre
porque me voy de tu lado
de tu vida para siempre

Oye mujer lo que te digo
que yo estoy arrepentido
de lo que te hice sufrir
vuelve mujer vuelve conmigo
porque si no esta conmigo 
pues de pena morire

Que vuelva
que vuelva
hoy me muero yo
que vuelva 
que vuelva
hoy me muero yo
Nereyda que vuelva
hoy me muero yo
Areina que vuelva
hoy me muero yo
que vuelva 
que vuelva
hoy me muero yo",Que Vuelva [DVD]
Raulin Rosendo,"Que no se rompa la noche,
por favor, que no se rompa.

Que no se rompa la noche,
por favor, que no se rompa.

Que sea serena y larga
como el tallo de la rosa,
que sea de luna blanca
con su escarcha y con sus sombras.

Que tengo que amarte mucho,
que tengo que amarte tanto,
que si la noche no acaba
yo te voy a enloquecer.

Que tengo que amarte mucho,
que tengo que amarte tanto,
que si la noche no acaba
yo te voy a enloquecer.

Porque guardo un mundo
de inquietos deseos,
porque guardo sueos,
caricias y besos,
porque guardo tanto,
tanto que...

Maana por la maana
si no se rompe la noche,
haremos locura nuevas
con el amor que nos sobre.

Maana por la maana
si no se rompe la noche,
haremos locura nuevas
con el amor que nos sobre.

Que no se rompa la noche,
que no llegue la maana.

Que no se rompa la noche,
que no llegue la maana.

Que no se oculte la estrella
ni la luna en tu ventana;
que sea una noche eterna,
una noche larga, larga.

Que tengo que amarte mucho,
que tengo que amarte tanto,
que si la noche no acaba
yo te voy a enloquecer...
",Que No Se Rompa la Noche
Raulin Rosendo,"(ver1)
Seore se fue la mujer
la que me enseo a querer
la que me entrego su vida
ahora solo vivo yo
recordando aquel amor
que le dio vida a mi vida
porque sin ella muero yo
y si no vuelve otra vez
pues de pena morire

(coro)
Que vuelva
que vuelva
hoy me muero yo
que vuelva
que vuelva
hoy me muero yo
que vuelva
que vuelva
hoy me muero yo

(ver2)
Que conmigo fuiste infiel
nunca mas pienso volver
oye bien lo que te digo
si muere no me importa
porque me hiciste sufrir
engaandome con otra
adios adios es para siempre
porque me voy de tu lado
de tu vida para siempre

Oye mujer lo que te digo
que yo estoy arrepentido
de lo que te hice sufrir
vuelve mujer vuelve conmigo
porque si no esta conmigo 
pues de pena morire

(coro)
Que vuelva
que vuelva
hoy me muero yo
que vuelva 
que vuelva
hoy me muero yo
que vuelva 
que vuelva
hoy me muero yo

(ver3)
Que conmigo fuiste infiel
nunca mas pienso volver
oye bien lo que te digo
si muere no me importa
porque me hiciste sufrir
engaandome con otra
adios adios es para siempre
porque me voy de tu lado
de tu vida para siempre

Oye mujer lo que te digo
que yo estoy arrepentido
de lo que te hice sufrir
vuelve mujer vuelve conmigo
porque si no esta conmigo 
pues de pena morire

Que vuelva
que vuelva
hoy me muero yo
que vuelva 
que vuelva
hoy me muero yo
Nereyda que vuelva
hoy me muero yo
Areina que vuelva
hoy me muero yo
que vuelva 
que vuelva
hoy me muero yo",Que Vuelva
Raunchy,"They want you so very bad, it's glooming for miles
And the boys are talking about it all the while
And down like from totally far down they see you tweaking
And your lips are shivering, your secret story is leaking

You don't turn on the lights, don't talk on the phone
You hope that for at least a day, they'd leave you alone
And down like from totally far down they see you tweaking
And your lips are shivering, your secret story is leaking

Kicking and screaming, bleeding, becoming what you detest
Is what your proceeding",Bleeding
Raunchy,"Explosions in my thoughts keep going on and on
It's keeping me awake till the crack of dawn
I'm so paranoid
I hope nobody is ever gonna see me like this
I'm twisting and turning my eyes feel like they're burning
I don't know what I'll do please stop before I lose my mind

I am falling through the holes of my mind
I know that it will be that way till the crack of dawn

What is this shit that I jjust can't do nothing about
Talking is useless help is useless
I'm going out of my mind

I lay down to rest my soul
Until the words of glory has been told
My pillow is soft and warm
I'll leave spots in the crack of dawn

I am falling through the holes of my mind
I know that it will be that way till the crack of dawn

Though it's all so quiet
Nothing can keep my thoughts from being wild",Crack of Dawn
Raunchy,"I can't smell this
I can't feel this
I can't eat this even touch this
I can't smoke this so face this
I can't play this

I want you to take it away
Grrr move it I don't want it

Could I choose
What I'd choose
This is how I want it to be

You can't smell me
You can't feel me
You can't taste me even see me
You can't hear me so tell me how I fake it

I want you to take it away
Grrr move it I don't want it

Could I choose
What I'd choose
This is how I want it to be

I can't write this
I can't drive this even feel this
I don't need this",Drive
Raunchy,"I tried just to avoid you
I was never able to
Cause you were always around
Anywhere you could appear
You spoiled it all for me
Nobody else could see
The pain you put me in
I never needed a friend

I wanna meet you there
And I will take you out
Cause I wanna break your bones
And make you regret that you ever came here

You feed on my appearance
My response is your response
You lie behind my back
I want to place an end
Never again will you pretend
In he what you never were
As leech I'll bury you

I wanna meet you there
And I will take you out
Cause I wanna break your bones
And make you regret that you ever came here
Well you did not understand
No you did not understand

I wanna meet you there
And I will take you out
Cause I wanna break your bones
And make you regret that you ever came here",Leech
Raunchy,"The noise pumping through your insides
Makes you wanna scream in pain
Visions get incomprehensible
You loose the touch with your brain

As the blood runs thick and warm
You're melting down inside
The music's hammering never ends
Realization si denied

You can't run you can't hide
Not this time
You're trapped in my game
Filled with pain
I'm to blame

Now I've got you on your knees in front of me
You're so little you never were shit and you'll never be

You can't run you can't hide
Not this time
You're trapped in my game
Filled with pain
I'm to blame
You're mine until the music stops
Your temperature raises your body drops
And now you'll never forget me

Now I've got you on your knees in front of me
You're so little you never were shit and you'll never be",My Game
Raunchy,"What if I tried to forget all about you
Pretend that you and I never was and never would be

Why (when I tried it never made a difference)
Why (why can't I be the one you want?)

When ever I tried to regret all about you
What we had was no good and never could be

Why (when I tried it never made a difference)
Why (Why can't I be the one you want?)

Never be the same when you're not here

What if I tried to forget all about you?
Pretend that you and I never was and never would be

Why (when I tried it never made a difference)
Why (why can't I be the one you want?)
Never be the same when you're here",Never Be
Raunchy,"And after tourniquet fights on my veins
Then I'll begin again
Rhythms are burned from the glare
From the wing on a plane
So without thinking I respond

Look at me now I am out of sight
Carrying a torch but the light ain't that bright

The air dry breeds clear
Thoughts are levelheaded
I'll be no use to my self once when I'm dead
And though I trusted I was lied to by my own
I bare no grouch and I carry no milestone

Look at me now I am out of sight
Carrying a torch but the light ain't that bright

Say you will forget
This pain I won't regret

Look at me now I am out of sight

Carrying a torch but the light ain't that bright",Out of Sight
Raunchy,"Emptiness hold my hand and join me here tonight
Let me be your friend
Let's look at girls in fights
Let's get drunk
We've got nothing to lose tonight
Give it away
It's ours so give it away its alright

Could it be that my situation does that it suddenly seems like the world
Is
Coming down on me
I must try and find substance or sense and stability

Don't eject
It just can't be that hard
Don't eject
Change event
It just can't be that hard to change event

I tend to forget that thoughts reflect my words
I better contemplate
Cause words reflect my actions in which some relate
Those I need
In those I need to depend
No escape
I better contemplate it's alright

Could it be that my situation does that it suddenly seems like the world
Is
Coming down on me
I must try and find substance or sense and stability

Don't eject
It just can't be that hard
Don't eject
Change event
It just can't be that hard to change event",This Is Not an Exit
Raunchy,"Avoiding the bypass
Feeling at least
Silence, overrated
Our time, we made it

Missing hours alone
Lack of inspiration
No time left for consideration

Nothing is gonna bring me down tonight
Nothing is gonna pass me by
My perfect night my attention
I wanna be the one
The center of
Twelve feet tall women
Gasping for heat burning
Fire-water green silk-cut-shag
Crank it up till it bleeds
Whisky/coke skirts fights birds choke
Lever to wheels high speed fuel peaks me

Like roaches surviving
Take it higher, we're climbing
Loose the losers
Choose the choosers
Nothing is gonna bring me down tonight
Nothing is gonna pass me by
My perfect night my attention
I wanna be the one

The center of
Twelve feet tall women
Gasping for heat burning
Fire-water green silk-cut-shag
Crank it up till it bleeds
Whisky/coke skirts fights birds choke
Lever to wheels high speed fuel peaks me",Twelve Feet Tall
Raunchy,"There is somebody I meet when I'm drunk
Someone looking better than me
She don't sweat like little pink pigs
Don't smell like the sweat on my cheeks

And there is somebody around every time
Someone I don't care about
Smelling awfully good as well
But I am better company

There is something I don't want her to know
Something I don't want to tell
But I know that she sees right through me
And there is nothing that I can do

And there is somebody around every time
Someone I don't care about
Smelling awfully good as well

All that people want is a piece of flesh
They wanna bring it home

Somebody really starts to make me mad
Someone I couldn't care less about
I want him to get out of my view
He is really in my way
And there is somebody around every time
Someone I don't care about
Smelling awfully good as well
But I am better company

All that people want is a piece of flresh
They wanna bring it home
Tonight it's all about getting laid
A giant human flesh light




",Tonight
Raunchy,"Piercing through flesh
Cutting bones so don't test
You're so fed up because you think you know what's best
You didn't quite get there, something like this

But don't put yourself to rest
You winded up cold blood, gone cold but not quite dead
Don't think all is good as it gets
Reality check your biggest threat

Contemplate yourself

You're on when you're really off
In a beat down you're beating up a dead horse
Scream out loud, you're played out

They still want you very bad it's showing from far
But the boys still talk about you looking deep in that jar

Contemplate yourself

You're on when you're really off
In a beat down you're beating up a dead horse
Screamed out loud, you're played out

Enough is said
You're bleeding from stretched arms and legs
Contemplate yourself
When hate strikes your gate

You're on when you're really off
In a beat down you're beating up a dead horse
Scream out loud, you're played out",Bleeding #2
Raunchy,"Here we are we are big cigars today
What can I say?
We're goin' fast in our cars astray
Off to confusion bay

Light me up please
Take a big whiff
Can I smoke these??
Save some for me

We are liquor shots of grey
and we're here to stay
Girls seem prettier everyday

Pour me some please
One for my stead
Watch me get laid
Watch us succeed

Here we can all be lovers
And Take off our covers for each other
And if you get lucky one day
You can visit my place
and the others",Confusion Bay
Raunchy,"In the light of my darkness

I took the devil off my train
He laughed and got back in the game
He started messing with my head
And threw a pretty girl out of my bed

Though I smile to my man downstairs

I took a chance and started a fight
With a girl from the other side
He put me in a bad bad light
And she only stayed for one night

In the light of my darkness
You'll see me smile to my man downstairs
He's just a part of what life is
The part of you who just don't care

I took the devil off my train
He laughed and got back in the game
He started messing with my head
And threw a pretty girl out of my bed
I pushed the devil off the road
Did 180 and watched the car explde
The light wave blinded my eyes
The devil messed up my life",The Devil
Raunchy,"I'm bad, I'm a bad bad boy
Just think of what I've destroyed
You might say that I'm evil
I don't care about people
You might say that I'm evil
I don't care about ugly people

Who cares? Well it matters to me
And it would matter to you if you dared

So natural
It lies deep down in me
'Cause you have blinded eyes
I get what I see

When I'm down I'll feel it
And I'll probably lose my mind one time
Or who knows it might last forever
The needle spins in the same ol' line",I Get What I See
Raunchy,"Here we come and off we go
This is where it goes to show

Are you insane? Do you feel well?

Is it freaking you out?",Insane
Raunchy,"50 fags, Jim Beam, two wizards and me sitting in the street
A beat up bird with dragon blood sees me and joins the scene

So many pretty girls all over the world

Copenhagen, London town,
New York City and Amsterdam

I've got love for you all
The little ones the fat ones and the tall
All my life, every Saturday night

50 fags Jameson two wizards and I on the floor tonight
Twelve feet tall women gasping for heat, I better put up a fight

So many pretty girls all over the world

Copenhagen, London town,
New York City and Amsterdam

I've got love for you all
The little ones the fat ones and the tall
All my life, every Saturday night",Join the Scene
Raunchy,"Take it easy, you know what'll tease me
And keep it sunshine
Though your life is cheesy

You intimidate me and I'm on phantom ice
This ain't as it should be, nothing I recognize

Morning rise and a Friday night
Morning rise but just one night

You're so high and I'm so dry
Just one time in your town
I had your country in sight

I kept it gangster
You wouldn't take the chance cause
You had your package
I went home with my ass kicked

Morning rise and a Friday night
Morning rise but just one night

You're so high and I'm so dry
Just one time in your town
I had your country in sight
Morning rise and a Friday night
You felt it live and bright
You could have killed the beast inside",Morning Rise and a Friday Night
Raunchy,"12 years of thunder and storm
Turned me into what I was meant to become
I'm not a liar though I do you wrong
I just need fire to remain strong

Show me your real darkness
It's no use to me if you keep it to yourself
You're all sugar, call me pretty face
Well I'm nasty mind and your only hell

Oh show me your real darkness, you keep it to yourself

Your song, your sweet song I'm sick to my mind
I'll stick to my own life
Your song, your sweet empty song, so hollow

12 years of thunder and storm
Turned me into what I was meant to become
I'm not a liar though I do you wrong
I just need fire to remain strong

Oh show me your real darkness, you keep it to yourself

Your song, your sweet song I'm sick to my mind
I'll stick to my own life
Your song, your sweet empty song, so hollow

Don't say another word",Show Me Your Real Darkness
Raunchy,"We're approaching Showtime
You put down your closing punch line
There's no doubt about it
Push push push till the daddy takes the T-bird away
Well it's on my mind every day
No stopping, things are all like fucking
You want to taste the fruit and rub it
But there's this girl right down the road
And I know that she's gonna rock my boat
Well it's summer of overload

I'd rather die then not at least try

I saw you down the road and I want you to rock my boat
I saw you down the road and I want to stick it in there c'mon
Chicks on love drugs
Hoes in tank tops
Brunette rednecks
Redhead school chicks

I'd rather die then not at least try

I saw you down the road and I want you to rock my boat
I saw you down the road and I want to stick it in there c'mon",Summer of Overload
Raunchy,"Watch out, see us coming
Don't think about running

Speak up, stop playing
Who cares what you're saying?

How does it feel to be floating away?
The 7th generation today
Fight your own wars and let us play
Can you take yourself seriously?

Skip the same ol' routine and take it off your routine
You think we're joking?
Stop testing us cause we're breaking through
You're just barking! 
Who are you comparing? 
Our ways scaring you?

Watch out, see us coming
Don't think about running

Speak up, stop playing
Who cares what you're saying?

How does it feel to be floating away?
The 7th generation today
Fight your own wars and let us play
Can you take yourself seriously?

Watch out, see us coming
Don't think about running.",Watch Out
Raunchy,"Hollywood demonology
Sound the seventh parade of vanity
We built this city
For pleasure and sin
We love in self-pity
The light is getting dim
Accelerate the dead tonight
Embrace this
My stage fright

I saw a thought, an intent
Now everybody cries
We'll wait and stop for the dead
Now everybody talks

Hollywood demonology
Hey baby!
Say hello to tragedy
I bare my guilt in my worship
I indulge in your fame
Only myself to blame
Accelerate the dead tonight
Embrace this
My stage fright

I saw a thought, an intent
Now everybody cries
We'll wait and stop for the dead
Now everybody talks

Of revenge and conspiracy
Of love and lunacy
The dawn of the dead
Has arrived over Hollywood

I saw a thought, an intent
We'll wait and stop for the dead
I saw a thought, an intent
Now everybody cries
We'll wait and stop for the dead
Now everybody talks

Of revenge and conspiracy
Of love and lunacy
The dawn of the dead",Abandon Your Hope
Raunchy,"I will use the hate you have awakened
I will learn from every step taken
I can't believe you're willing to waste your hate on me
This is my dream and my dream will bury you

On a dark Thursday
I notice you're nasty
On a dark Thursday
I love you for it
This city of hurt will bring us all down
This city of hurt is the place of a broken sound

I am you at your darkest
And I will take you farthest
We ride this city with youth eternally
As the night brings pity, baby!
We avenge eventually

On a dark Thursday
I notice you're nasty
On a dark Thursday
I love you for it
This city of hurt will bring us all down
This city of hurt is the place of a broken sound

On a dark night I notice you're nasty
I will use the hate you have awakened
I will learn from every step taken
I can't believe you're willing to waste your hate on me
This is my dream and my dream will bury you

On a dark Thursday
I notice you're nasty
On a dark Thursday
I love you for it
This city of hurt will bring us all down
This city of hurt is the place of a broken sound",City of Hurt
Raunchy,"Closed hands yield open hearts
This is a song of rebellion and
I'm bleeding
For the heart that bleeds
For the lost and the dying
For the ones chasing their dreams
Cut it wide open for everyone to see
When they hold it up against me
Time has come to rise above the meaning
Accelerate the meaning in shadows
There is no master, no rules, no compromise
There is no master, no rules, no compromise
Cut it wide open for everyone to see
When they hold it up against me

All is Better than before
For everybody else

Do you really think I care?
Do you honestly believe?
This my everlasting oath
My burning fire
Cut it wide open and let them see
When they curse the truth inside me
This is a song of rebellion and my bleeding heart
If you don't care we don't care so fuck you all
Irreversible is the things we do in life  do or die!
Pick a fight, take a stand or fuckin die

All is Better than before
For everybody else

I'm burning for you
Better than before
Cut it wide open and let them see
This is my everlasting oath
Inside me",The Curse of Bravery
Raunchy,"I am seduced by your rush of devotion
The darkness is upon me
Bloodstain my name
My darkness is a farewell to devotion
My darkness, still you will hold me back

I burned all my bridges
Still I come tenfold
With a shadow heart insane
I can never be restrained
Still I come tenfold
Still I come tenfold

I am all I am your worship
Your tribute to freedom
Reinvent my exist to escape your kiss
Put a gun to my head
My god you would wish
My darkness is a farewll to devotion
My darkness, still you will hold me back

I burned all my bridges
Still I come tenfold
With a shadow heart insane
I can never be restrained
Still I come tenfold
Still I come tenfold

I am all
You are like the summer and a thousand pink roses
I say thank you for it all
This is where the panic sets in
As I sense the infinite syntax of your love
Only one question still remains
Will you say my name?
We burned down heavens
We are all the same

I burned all my bridges
Still I come tenfold
With a shadow heart insane
I can never be restrained
Still I come tenfold
Still I come tenfold

I AM ALL",Farewell to Devotion
Raunchy,"I've been avoiding the light
I join the myth
I need to realize what I've missed
I crawl through shadows, through space and time
And now I sense you at the end of the line
At the end of the night
Hold the line
As they transcend
The bringer of light

I caught a glimpse of you
Between the moment and the dead
Now I remember you still here
The stories in my head

This ride accelerates I live the myth
I celebrate the darkness of what I've kissed
I crawl through clouds, the shadows for us
Then you start pleading with my heart
Hold the line
As they transcend
The bringer of light

I caught a glimpse of you
Between the moment and the dead
Now I remember you still here
The stories in my head

These words of flames
In my white shade serenade
I still remain
The meaning in shadows
The place I choose to live
Is in a dream forever
As darkness falls, the shadows for us
Between the moment and the dead
As I wake up I can hear the echoes
Teh laughter from the living dead
As darkness falls, the shadows for us
Between the moment and the dead
I still remain

I caught a glimpse of you
Between the moment and the dead
Now I remember you still here
The stories in my head",Live the Myth
Raunchy,"This is just me
Nothing more and nothing less
It feels like the world is watching me
But my world is laid to waste
Persistence to the end
Persistence to the end
This is just me
Nothing more and nothong less
I see that you are crushing yourself
But I fall asleep next to your heartbeat
Take this heart
I give it to you
I pass the burden
Now it's up to you

From this day
We are here to stay
The apex of a choice
The weapon of your voice

I see the world alone
I watch you in a soul
Take this heart
I give it to you
I pass the burden
Now it's up to you

From this day
We are here to stay
The apex of a choice
The weapon of your voice

You can't take away my persistence
This is the apex of my choice
I don't need your acceptance
You will fall and I'll rejoice
Take this heart
I give it to you
I pass the burden
Now it's up to you

From this day
We are here to stay
The apex of a choice
The weapon of your voice",Persistence
