Band,Lyrics,Song
Sammy Johns,"Some have said, down through history 
If you last it's a mystery 
But I guess they don't know, what they're talking about 
From the mountains down to the sea 
You've become such a habit with me 
America, America 

Well I come from, down around Tennesee 
But the people in California 
Are nice to me, America 
It don't matter where I may roam 
Tell you people that it's home sweet home 
America, America 

And my brothers are all black and white, yellow too 
And the red man is right, to expect a little from you 
Promise and then follow through, America 

And the men, who fell on the plains 
And lived, through hardship and pain 
America, America 
And the men who could not fight 
In a war that didn't seem right 
You let them come home, America 

And my brothers are all black and white, yellow too 
And the red man is right, to expect a little from you 
Promise and then follow through, America 

Well I come from, down around Tennesee 
But the people in California 
Are nice to me, America 
It don't matter where I may roam 

And my brothers are all black and white, yellow too 
And the red man is right, to expect a little from you 
Promise and then follow through, America 

Tell you people that it's home sweet home 
America, America 
America, America 

And my brothers are all black and white, yellow too 
And the red man is right, to expect a little from you 
Promise and then follow through, America 

It's home sweet home, Amer-ica 
America, America",America
Sammy Kaye,"Say, it's only a paper moon
Sailing over a cardboard sea
But it wouldn't be make-believe
If you believed in me

Yes, it's only a canvas sky
Hanging over a muslin tree
But it wouldn't be make-believe
If you believed in me

Without your love
It's a honky tonk parade
Without your love
It's a melody played in a penny arcade

It's a Barnum and Bailey world
Just as phony as it can be
But it wouldn't be make-believe
If you believed in me

Say, it's only a paper moon
Sailing over a cardboard sea
But it wouldn't be make-believe
If you believed in me

Yes, it's only a canvas sky
Hanging over a muslin tree
But it wouldn't be make-believe
If you believed in me

Without your love
It's a honky-tonk parade
Without your love
It's a melody played in a penny arcade

It's a Barnum and Bailey world
Just as phony as it can be
But it wouldn't be make-believe
If you believed in me

It's phony it's plain to see
How happy I would be
If you believed in me",It's Only a Paper Moon
Sammy Kaye,"Gonna take a sentimental journey
Gonna set my heart at ease
Gonna make a sentimental journey
To renew old memories

Got my bag, got my reservation
Spent each dime I could afford
Like a child in wild anticipation
Long to hear that ""All aboard""

Seven, that's the time we leave, at seven
I'll be waitin' up for heaven
Countin' every mile of railroad track
That takes me back

Never thought my heart could be so yearny
Why did I decide to roam?
Gotta take that sentimental journey
Sentimental journey home

Sentimental journey!",Sentimental Journey
Sammy Kaye,"Years we've been together
Seems we can't get along,
No matter what I do
I don't appeal to you
Makes no difference whether
I am right or wrong
If we can't be sweethearts
This much you can do

Please don't talk about me when I'm gone
Oh, Honey, though our friendship ceases from now on
And listen, if you can't say anything real nice
It's better not to talk at all, that's my advice
We're parting, you go your way, I'll go mine
It's best that we do
Here's a kiss, I hope that this brings lots of luck to you
Makes no difference how I carry on
Just remember
Please don't talk about me when I'm gone.",Please Don't Talk About Me When I'm Gone
Sammy Kaye,"Sweet and lovely
Sweeter than the roses in may
Sweet and lovely
Heaven must have sent her my way

Skies above me
Never were as blue as her eyes
And if she loves me
Who could want a sweeter surprise?

When she nestles in my arms so tenderly
There's a thrill that words cannot express
In my heart a song of love is taunting me
Melody haunting me

Sweet and lovely
Sweeter than the roses in may
And if she loves me
There is nothing more I can say",Sweet and Lovely
Sammy Kaye,"I was dancin' with my darlin' to the Tennessee Waltz
When an old friend I happened to see
I introduced him/her to my loved one and while they were dancin'
My friend stole my sweetheart from me

I remember the night and the Tennessee Waltz
Now I know just how much I have lost
Yes, I lost my little darlin' the night they were playing
The beautiful Tennessee Waltz

I was dancin' with my darlin' to the Tennessee Waltz
When an old friend I happened to see
I introduced him/her to my loved one and while they were dancin'
My friend stole my sweetheart from me

I remember the night and the Tennessee Waltz
Now I know just how much I have lost
Yes, I lost my little darlin' the night they were playing
The beautiful Tennessee Waltz",Tennessee Waltz
Sammy Kaye,"We'll meet again 
We'll meet again, don't know where, don't know when,
But I know we'll meet again, some sunny day.
Keep smiling through, just like you always do,
'Til the blue skies drive the dark clouds far away. 

So will you please say hello to the folks that I know,
Tell them I won't be long.
They'll be happy to know that as you saw me go,
I was singing this song. 

We'll meet again, don't know where, don't know when,
But I know we'll meet again, some sunny day.

So will you please say hello to the folks that I know,
Tell them I won't be long.
They'll be happy to know that as you saw me go,
I was singing this song. 

Keep smiling through, just like you always do,
'Til the blue skies drive the dark clouds far away.",We'll Meet Again
Sammy Kaye,"Once there lived a chicken who would say ""chick-chick""
""Chick-chick"" all day
Soon that chick got sick and tired of just ""chick-chick""
So, one morning he started to say:

[Chorus]
""Chickery-chick, cha-la, cha-la
Check-a-la romey in a bananika
Bollika, wollika, can't you see
Chickery chick is me?""

Every time you're sick and tired of just the same old thing
Sayin' just the same old words all day
Be just like the chicken who found something new to sing
Open up your mouth and start to say
Oh!

[Chorus]",Chickery Chick
Sammy Kaye,"Me and my childhood sweetheart
Have come to the parting of the ways
He still treats me like he did In our baby days.
I'm a little bit older And a little bit bolder
Since both of us were three.
I'm a little more padded Something new has been added
He oughtta take one good look at me 
I'm a big girl now
I want to be daring like a big girl now
When daddy tells those certain jokes it isn't fair
He tells me I'm too young and makes me take the air
But I could tell a couple that would curl his hair
I'm a big girl now.
I'm a big girl now
I want to be handled like a big girl now
I'm tired of being babied like a kid of three
I'm tired of having chaperones to follow me
I want to have some secrets in my diary
I'm a big girl now
I'm a big girl now
I want to be cuddled like a big girl now
I'm through with going to movies with my Uncle Tim
Through with going to picnics with my old Aunt Min
I want to go to Mexico with ... you know him
I'm a big girl now
I'm a big girl now
I want to be wanted like a big girl now
I'm tired of staying home each evening after dark
Tired of being dynamite without a spark
I want to learn what fellows do in Central Park
I'm a big girl now",I'm a Big Girl Now
Sammy Kaye,"IT ISN'T FAIR    

It isn't fair for you to taunt me.
How can you make me care this way?
It isn't fair for you to want me
If it's just for a day.

It isn't fair for you to thrill me.
Why do you do the things you do?
It isn't fair for you to fill me
With those dreams that can't come true, dear.

Why is it that you came into my life
And made it complete?
You gave me just a touch of high life;
If this is love then I repeat

It isn't fair for you to taunt me.
How can you make me care this way?
It isn't fair for you to want me
If it's just for today.

Why is it that you came into my life
And made it complete?
You gave me just a touch of high life;
If this is love then I repeat

It isn't fair for you to taunt me.
How can you make me care this way?
It isn't fair for you to want me
If it's just for today.",It Isn't Fair
Sammy Kaye,"I'm as restless as a willow in a windstorm
I'm as jumpy as a puppet on a string
I'd say that I had Spring fever
But I know it isn't Spring

I am starry-eyed and vaguely discontented
Like a nightingale without a song to sing
Oh, why should I have Spring fever
When it isn't even Spring?

I keep wishing I were somewhere else
Walking down a strange new street
Hearing words that I have never heard
From a girl I've yet to meet

I'm as busy as a spider spinning daydreams
I'm as giddy as a baby on a swing
I haven't seen a crocus or a rosebud or a robin on the wing
But I feel so gay in a melancholy way
That it might as well be Spring

It might as well be Spring",It Might as Well Be Spring
Sammy Kaye,"Once I strayed 'neath the window
Of a lovely, lovely lady
And she smiled while I softly played
My penny serenade

Si si si, you can hear it for a penny
Si si si, just a penny serenade

In her eyes shone the tender dawn of love 
And sweet surrender
As for me, in my heart I played a lovers' serenade

Si si si, hear my love song for a penny
Si si si, just a penny serenade

In a dream so divine, she was mine
No word had been spoken
When I woke from my dreams, she was gone
No word had been spoken 

Still I pray that wherever she may be
She will remember 
In her heart, she will always hear 
My penny serenade

(Si si si)
Si si si
(You can hear it for a penny)
You can hear it for a penny
(Si si si}
Si si si
(Just a penny serenade)
Just a penny serenade
Just a penny serenade",Penny Serenade
Sammy Kaye,"If I sent a rose to you
For every time you made me blue
You'd have a room full of roses
If I sent a rose of white
For every time I cried all night
You'd have a room full of roses

And if you took the petals
And you took them all apart
You'd be tearing at the roses
Just the way you tore my heart

If someday you're feeling blue
And you could send some roses too
Well I don't want a room full of roses
I just want my arms full of you

And if you took the petals
And you took them all apart
You'd be tearing at the roses
Just the way you tore my heart

If someday you're feeling blue
And you could send some roses too
Well I don't want a room full of roses
I just want my arms full of you",Room Full of Roses
Sammy Kaye,"There's been a change in me!
I have a lovely disposition
That's very strange in me
And life's as sweet as it can be
I've lots of courage and ambition
From every care my mind is free
So I repeat, with your permission
There's been a change in me!
 
Have you heard I married an angel
I'm sure that the change'll be awf'lly good for me
Have you heard an angel I married
To heaven she's carried this fellow with a kiss
She is sweet and gentle, so it isn't strange
When I'm sentimental, she loves me like an angel
Now you've heard, I married an angel
This beautiful change'll be awf'lly good for me
 
Have you heard I married an angel
I'm sure that the change'll be awf'lly good for me
Have you heard an angel I married
To heaven she's carried this fellow with a kiss
She is sweet and gentle, so it isn't strange
When I'm sentimental, she loves me like an angel
Now you've heard, I married an angel
",I Married an Angel
Sammy Kaye,"There never was a gal I could love, like I love my Josephine
She's a flirt, she's a scamp, she's the vampiest vamp I've ever seen
It seems to me she's always flirting with the fellows passing by
But when I say she winks, then she tells me she thinks
There's a cinder in her eye
I believe it would be better if I'd leave her and forget
Everybody says it would be wise
But each time that I go out to dance with somebody else
I find myself dancing with tears in my eyes
For there's nobody quite so nice who can be quite so mean 
As my gal, what a gal, Josephine
 
There never was a gal I could love, like I love my Josephine
She's a flirt, she's a scamp, she's the vampiest vamp I've ever seen
It seems to me she's always flirting with the fellows passing by
But when I say she winks, then she tells me she thinks
There's a cinder in her eye
I believe it would be better if I'd leave her and forget
Everybody says it would be wise
But each time that I go out to dance with somebody else
I find myself dancing with tears in my eyes
For there's nobody quite so nice who can be quite so mean 
As my gal, what a gal, Josephine
",Josephine
Sammy Kaye,"Love walked right in and drove the shadows away
Love walked right in and brought my sunniest day
One magic moment and my heart seemed to know
That love said ""Hello""    though not a word was spoken

One look and I forgot the gloom of the past
One look and I had found my future at last
One look and I had found a world completely new
When love walked in with you",Love Walked In
Sammy Kaye,"Rosalie, my darling
Rosalie, my dream
Since one night when stars danced above
I'm oh, oh, so much in love

So, Rosalie, have mercy
Rosalie, don't decline
Won't you make my life thrilling
And tell me you're willing
To be mine
Rosalie, mine",Rosalie
Sammy Kaye,"Sometimes I'm happy, sometimes I'm blue,
My disposition, depends on you
I never mind the rain from the skies,
If I can find the sun in your eyes

Sometimes I love you, sometimes I hate you,
But when I hate you, it's cause I love you
That's how I am, so what can I do?
I'm happy when I'm with you

(Sometimes I love you, sometimes I hate you,)
But when I hate you, it's cause I love you
That's how I am, so what can I do?
I'm happy when I'm with you
(We're happy when we're with you)",Sometimes I'm Happy
Sammy Kaye,"And now the purple dusk of twilight time
Steals across the meadows of my heart
High up in the sky the little stars climb
Always reminding me that we're apart
You wander down the lane and far away
Leaving me a song that will not die
Love is now the stardust of yesterday
The music of the years gone by.
 
Sometimes I wonder, how I spend
The lonely nights
Dreaming of a song
The melody 
Haunts my reverie
And I am once again with you
When our love was new 
And each kiss an inspiration
But that was long ago
And now my consolation is in the stardust of a song

Besides the garden wall, when stars are bright
You are in my arms
The nightingale 
Tells his fairytale
Of paradise, where roses grew
Though I dream in vain
In my heart it will remain
My stardust melody
The memory of love's refrain.",Stardust
Sammy Kaye,"There is no greater love
Than what I feel for you
No greater love,
No heart so true

There is no greater thrill
Than what you bring to me
No sweeter song
Than what you sing to me

You're the sweetest thing
I have ever known
And to think that
You are mine alone.

There is no greater love
In all the world, it's true
No greater love
Than what I feel for you

You're the sweetest thing
I have ever known,
And to think that
You are mine alone.

There is no greater love
In all the world, it's true
No greater love
Than what I feel for you",There Is No Greater Love
Sammy Kaye,"I'll be loving you always
With a love that's true always.
When the things you've planned
Need a helping hand,
I will understand always.

Always.

Days may not be fair always,
That's when Ill be there always.
Not for just an hour,
Not for just a day,
Not for just a year,
But always.

Ill be loving you, oh always
With a love that's true always.
When the things you've planned
Need a helping hand,
I will understand always.

Always.

Days may not be fair always,
That's when Ill be there always.
Not for just an hour,
Not for just a day,
Not for just a year,
But always.

Not for just an hour,
Not for just a day,
Not for just a year,
But always.",Always
Sammy Kaye,"You stepped out of a dream
You are too wonderful to be what you seem!
Could there be eyes like yours, 
Could there be lips like yours
Could there be smiles like yours, 
Honest and truly?
You stepped out of a cloud
I want to take you away, away from the crowd
And have you all to myself, 
Alone and apart out of a dream, 
Safe in my heart
 
You stepped out of a dream
You are too wonderful to be what you seem!
Could there be eyes like yours, 
Could there be lips like yours
Could there be smiles like yours, 
Honest and truly?
You stepped out of a cloud
I want to take you away, away from the crowd
And have you all to myself, 
Alone and apart out of a dream, 
Safe in my heart",You Stepped Out of a Dream
Sammy Kaye,"I'm thru with love,
I'll never fall again.
Said I do to love,
Don't ever call again.
For I must have you
Or no one.
That's why I'm thru with love.

I've locked my heart.
I keep my feelings there.
I have stopped my heart
Like an icy frigidaire.
For I need to care for no one.
That's why I'm thru with love.

Why did you leave me
To think that you cared.
You didn't need me.
You have your share
of slaves around you
To hound you and swear
Their deep devotion.
Emotion.

Did you good by the spring 
And all it meant to me
a good neighbor 
The things that used to be.
For I must have you or no one.
That's why I'm thru with love.
That's why I'm thru with love.",I'm Through With Love
Sammy Kaye,"Many a tear has to fall
But it's all in the game

All in the wonderful game
That we know as love

You had words with him
And your future's looking dim
But these things your heart can rise above

Once in a while he won't call
But it's all in the game

Soon he'll be there by your side
With a small bouquet

And he'll kiss your lips
And caress your fingertips
And your heart will fly away

You had words with him
And your future's looking dim
But these things your heart can rise above

Once in a while he won't call
But it's all in the game

Soon he'll be there by your side
With a small bouquet

And he'll kiss your lips
And caress your fingertips
And your heart will fly away",It's All in the Game
Sammy Kaye,"Walkin' To Missouri
Sammy Kaye
Peaked at # 11 in 1952
Words and music by Bob Merrill, 1952
Poor little robin walkin', walkin', WALKIN' TO MISSOURI;
He can't afford to fly.
Got a penny for a Poor little robin, walkin' walkin' WALKIN' TO MISSOURI
Got a teardrop in his eye.
The above is the chorus for the three verses which follow:
1. I hope my story don't make you cry,
But this birdie flew too high;
He flew from his old Missouri home.
He fell right into the city ways, like dancin' in cabarets,
From party to party he would roam.
BR
BR(Chorus)
BR
BR2. He met a birdie who looked so nice,
BRA real bird of paradise,
BRGood lookin' but fickle in the heart.
BRShe gave him kisses and gave him sighs,
BRBut oh, how she told him lies,
BR'Cause she loved another from the start.
BR
BR(Chorus)
BR
BR3. His dreams are battered, his feathers bent,
BRNow he hasn't got a cent;
BRHe feels like his heart is gonna break.
BRSo if he ever walks up to you,
BRPlease throw him a crumb or two,
BR'Cause you could have made the same mistake.
BR
BR
P
/P
P
/P
script src=""/music/Lyrics4U/include/bottom.js""/script
/BODY
/HTML
",Walkin' to Missouri
Sammy Kaye,"The wheel of fortune
Goes spinning around
Will the arrow point my way?
Will this be my day?

Oh, wheel of fortune
Please don't pass me by
Let me know the magic of 
A kiss and a sigh

While the wheel is spinning, spinning, spinning
I'll not dream of winning fortune or fame
While the wheel is turning, turning, turning
I'll be yearning, yearning
For love's precious flame

Oh, wheel of fortune
I'm hoping somehow
If you ever smile on me
Please let it be now

While the wheel is spinning, spinning, spinning
I'll not dream of winning fortune or fame
While the wheel is turning, turning, turning
I'll be yearning, yearning
For love's precious flame

Oh, wheel of fortune
I'm hoping somehow
If you ever smile on me
Please let it be now",Wheel of Fortune
Sammy Kaye,"Saturday night is the loneliest night in the week
'Cause that's the night that my sweetie and I
Used to dance cheek to cheek
I don't mind Sunday night at all
'Cause that's the night friends come to call
And Monday to Friday go fast
And another week is past

But Saturday night is the loneliest night in the week
I sing the song that I sang for the memories I usually seek
Until I hear you at the door
Until you're in my arms once more
Saturday night is the loneliest night in the week

Saturday night is the loneliest night in the week
I sing the song that I sang for the memories I usually seek
Until I hear you at the door
Until you're in my arms once more
Saturday night is the loneliest night in the week

Until I hear you at the door
Until you're in my arms once more
Saturday night is the loneliest night in the week",Saturday Night (Is the Loneliest Night in the Week)
Sammy Kaye,"There is no greater love
Than what I feel for you
No greater love,
No heart so true

There is no greater thrill
Than what you bring to me
No sweeter song
Than what you sing to me

You're the sweetest thing
I have ever known
And to think that
You are mine alone.

There is no greater love
In all the world, it's true
No greater love
Than what I feel for you

You're the sweetest thing
I have ever known,
And to think that
You are mine alone.

There is no greater love
In all the world, it's true
No greater love
Than what I feel for you",(There Is) No Greater Love
Sammy Kaye,"There she is! There she is!
There's what keeps me up at night
Oh, gee whiz! Oh, gee whiz!
There's why I can't eat a bite
Those flaming eyes! That flaming youth!
Oh, mister oh, sister, tell me the truth

Ain't she sweet?
See her walking down the street
Now I ask you very confidentially
Ain't she sweet?

Ain't she nice
Look her over once or twice
Now I ask you very confidentially
Ain't she nice?

Just cast an eye in her direction
Oh me, oh my, ain't that perfection

I repeat
Don't you think she's kind of sweet
Now I ask you very confidentially
Ain't she sweet?

Tell me where, tell me where
Have you seen one just like that
I declare, I declare
That sure is worth looking at

Oh, boy, how sweet those lips must be
Gaze on it, doggonit! Now answer me

Ain't she sweet?
See her walking down the street
Now I ask you very confidentially
Ain't she sweet?

Ain't she nice?
Look her over once or twice
Now I ask you very confidentially
Ain't she nice?

Just cast an eye in her direction
Oh me, oh my, ain't that perfection

I repeat
Don't you think she's kind of sweet
Now I ask you very confidentially",Ain't She Sweet
Sammy Kaye,"Did you ever see a dream walking? 
Well, I did. 
Did you ever hear a dream talking? 
Well, I did.
 
Did you have a dream thrill you 
With ""Will you be mine?"" 
Oh, it's so grand, 
And it's too, too divine!
 
Did you ever see a dream dancing? 
Well, I did. 
Did a ever see a dream romancing? 
Well, I did!
 
Did you see heaven right in your arms, 
Saying, ""I love you, I do!"" 
Well, the dream that was walking, 
And the dream that was talking, 
The heaven in my arms was you.",Did You Ever See a Dream Walking?
Sammy Kaye,"Stars shining bright above you
Night breezes seem to whisper ""I love you""
Birds singing in the sycamore tree
Dream a little dream of me

Say ""Night-ie night"" and kiss me
Just hold me tight and tell me you'll miss me
While I'm alone and blue as can be
Dream a little dream of me

Stars fading, but I linger on, dear
Still craving your kiss
I'm longing to linger till dawn, dear
Just saying this

Sweet dreams till sunbeams find you
Sweet dreams that leave all worries behind you
But in your dreams whatever they be
Dream a little dream of me

Stars fading, but I linger on, dear
Still craving your kiss
I'm longing to linger till dawn, dear
Just saying this

Sweet dreams till sunbeams find you
Sweet dreams that leave all worries far behind you
But in your dreams whatever they be
Dream a little dream of me",Dream a Little Dream of Me
Sammy Kaye,"I'll get by
As long as I have you
Though there be rain
And darkness too
I'll not complain
I'll see it through

Poverty
May come to me, it's true
But what care I
Say, I'll get by
As long as I have you.

But what care I
Say, I'll get by
As long as I have you.",I'll Get By
Sammy Kaye,"I'll see you in my dreams
And I'll hold you in my dreams
Someone took you right out of my arms
Still I feel the thrill of your charms

Lips that once were mine
Tender eyes that shine
They will light my way tonight
I'll see you in my dreams

Oh, someone took you right out of my arms
Still I feel the thrill of your charms

Lips that once were mine
Tender eyes that shine
They will light my way tonight
I'll see you in my dreams",I'll See You in My Dreams
