Band,Lyrics,Song
Ray Anthony,"I could show the world how to smile
I could be glad all of the while
I could change the grey skies to blues 
If I had you
I could leave the old days behind
Leave all my pals, I'd never mind
I could start my life all a new 
If I had you
I could climb the snow capped mountains
Sail the mighty ocean wide
I could cross the burning desert
If I had you by my side
I could be a king, dear, uncrowned
Humble or poor, rich or renowned
There is nothing I couldn't do 
If I had you
 
I could show the world how to smile
I could be glad all of the while
I could change the grey skies to blues 
If I had you
I could leave the old days behind
Leave all my pals, I'd never mind
I could start my life all a new 
If I had you
I could climb the snow capped mountains
Sail the mighty ocean wide
I could cross the burning desert
If I had you by my side
I could be a king, dear, uncrowned
Humble or poor, rich or renowned
There is nothing I couldn't do",If I Had You
Ray Anthony,"Please teacher, teach me something,
Nice teacher, teach me something.
I'm as awkward as a camel, that's not the worst,
My two feet haven't met yet,
But I'll be teacher's pet yet,
'Cause I'm gonna learn to dance or burst.

Nothing's impossible I have found,
For when my chin is on the ground,
I pick myself up,
Dust myself off,
Start all over again.

Don't lose your confidence if you slip,
Be grateful for a pleasant trip,
And pick yourself up,
Dust yourself off,
Start all over again.

Work like a soul inspired,
Till the battle of the day is won.
You may be sick and tired,
But you'll be a man, my son!

Will you remember the famous men,
Who had to fall to rise again?
So take a deep breath,
Pick yourself up,
Dust yourself off,
Start all over again.

I'll get some self assurance
If your endurance is great.
I'll learn by easy stages
If you're courageous and wait.

To feel the strength I want to,
I must hang on to your hand,
Maybe by the time I'm fifty
I'll get up and do a nifty.

Nothing's impossible I have found,
For when my chin is on the ground,
I pick myself up,
Dust myself off,
Start all over again.

Don't lose your confidence if you slip,
Be grateful for a pleasant trip,
And pick yourself up,
Dust yourself off,
Start all over again.

Work like a soul inspired,
Till the battle of the day is won.
You may be sick and tired,
But you'll be a man, my son!

Will you remember the famous men,
Who had to fall to rise again?
So take a deep breath,
Pick yourself up,
Dust yourself off,
Start all over again.",Pick Yourself Up
Ray Anthony,"I don't know why, I made you cry
I'm sorry sweetheart and yet
Though you shouldn't be lenient with me
I hope you'll forgive and forget
 
What can I say, dear, after I say I'm sorry?
What can I do to prove it to you, I'm sorry?
I didn't mean to ever be mean to you
If I didn't care I wouldn't feel like I do
I was all wrong but right or wrong I don't blame you
Why should I take somebody like you and shame you
I know that I made you cry, and I'm so sorry dear
So what can I say, dear, after I say I'm sorry?
 
You made me glad, I made you sad
I made you lonesome and blue
And who ever knew 
Who'd ever think that I would be crying to you
 
What can I say, dear, after I say I'm sorry?
What can I do to prove it to you, I'm sorry?
I didn't mean to ever be mean to you
If I didn't care I wouldn't feel like I do
I was all wrong but right or wrong I don't blame you
Why should I take somebody like you and shame you
I know that I made you cry, and I'm so sorry dear
So what can I say, dear, after I say I'm sorry?
",What Can I Say After I Say I'm Sorry
Ray Anthony,"Somewhere over the rainbow, way up high
There's a land that I've heard of once in a lullaby.
Somewhere over the rainbow, skies are blue
And the dreams that you dare to dream,
Really do come true.

Someday I'll wish upon a star
And wake up where the clouds are far behind me.
Where troubles melt like lemon drops,
High above the chimney tops,
That's where you'll find me.

Somewhere over the rainbow, blue birds fly
Birds fly over the rainbow
Why then, oh why can't I?
If happy little bluebirds fly beyond the rainbow
Why, oh why can't I?

Somewhere over the rainbow, way up high
There's a land that I've heard of once in a lullaby.
Somewhere over the rainbow, skies are blue
And the dreams that you dare to dream,
Really do come true.

Someday I'll wish upon a star
And wake up where the clouds are far behind me.
Where troubles melt like lemon drops,
High above the chimney tops,
That's where you'll find me.

Somewhere over the rainbow, blue birds fly
Birds fly over the rainbow
Why then, oh why can't I?
If happy little bluebirds fly beyond the rainbow
Why, oh why can't I?",Over the Rainbow
Ray Anthony,"Let's build a stairway to the stars
And climb that stairway to the stars
With love beside us to fill the night with a song
We'll hear the sound of violins
Out yonder where the blue begins
The moon will guide us as we go drifting along
Can't we sail away on a lazy daisy petal
Over the rim of the hill?
Can't we sail away on a little dream 
And settle high on the crest of a thrill!
Let's build a stairway to the stars
A lovely stairway to the stars",Stairway to the Stars
Ray Anthony,"Sweet and lovely
Sweeter than the roses in May
Sweet and lovely
Heaven must have sent him my way

Skies above me
Never were as blue as his eyes
And he loves me
Who would want a sweeter surprise?

When he nestles in my arms so tenderly
There's a thrill that words cannot express
In my heart a song of love is taunting me
Melody haunting me

Sweet and lovely
Sweeter than the roses in May
And he loves me
There is nothing more I can say

When he nestles in my arms so tenderly
There's a thrill that words cannot express
In my heart a song of love is taunting me
Melody haunting me

Sweet and lovely
Sweeter than the roses in May
And he loves me
There is nothing more I can say

There is nothing more I can say
There is nothing more I can say
There is nothing more I can say
There is nothing more I can say",Sweet and Lovely
Ray Anthony,"I don't care what the weatherman says
When the weatherman says it's raining
You'll never hear me complaining
I'm certain the sun will shine

I don't care how the weather vane points
When the weather vane points to gloomy
It's gotta be sunny to me
When your eyes look into mine

Jeepers creepers, where'd ya get those peepers?
Jeepers creepers, where'd ya get those eyes?
Gosh all, git up, how'd they get so lit up?
Gosh all, git up, how'd they get that size?

Golly gee, when you turn those heaters on
Woe is me, got to put my cheaters on

Jeepers creepers, where'd ya get those peepers?
Oh, those weepers, how they hypnotize!
Where'd ya get those eyes?",Jeepers Creepers
Ray Anthony,"I was a stranger in the city
Out of town were the people I knew
I had that feeling of self-pity
What to do, what to do, what to do
The outlook was decidedly blue

But as I walked through the foggy streets alone
It turned out to be the luckiest day I've known

A foggy day, in London town
Had me low, had me down
I viewed the morning, with much alarm
British Museum, had lost its charm

How long I wondered,
Could this thing last
But the age of miracles, hadn't past
For suddenly, I saw you there
And through foggy London town,
The sun was shining everywhere

For suddenly, I saw you there
And through foggy London town,
The sun was shining everywhere

Everywhere
Everywhere
Everywhere",A Foggy Day
Ray Anthony,"Love walked right in and drove the shadows away
Love walked right in and brought my sunniest day
One magic moment and my heart seemed to know that love said hello
Though not a word was spoken

One look, and I forgot the gloom of the past
One look and I had found my future at last
One look and I had found a world completely new
When love walked in with you

One magic moment and my heart seemed to know that love said hello
Though not a word was spoken

One look and I had found a world completely new
When love walked in with you",Love Walked In
Ray Anthony,"Skylark
Have you anything to say to me?
Won't you tell me where my love can be?
Is there a meadow in the mist
Where someone's waiting to be kissed?

Skylark
Have you seen a valley green with spring?
Where my heart can go a journeying
Over the shadows and the rain
To a blossom covered lane

And in your lonely flight
Haven't you heard the music in the night?
Wonderful music, faint as a will o' the wisp
Crazy as a loon, sad as a gypsy serenading the moon

Oh skylark
I don't know if you can find these things
But my heart is riding on your wings
So if you see them anywhere
Won't you lead me there?

Oh skylark
I don't know if you can find these things
But my heart is riding on your wings
So if you see them anywhere
Won't you lead me there?",Skylark
Ray Anthony,"You stepped out of a dream
You are too wonderful to be what you seem!
Could there be eyes like yours, 
Could there be lips like yours
Could there be smiles like yours, 
Honest and truly?
You stepped out of a cloud
I want to take you away, away from the crowd
And have you all to myself, 
Alone and apart out of a dream, 
Safe in my heart
 
You stepped out of a dream
You are too wonderful to be what you seem!
Could there be eyes like yours, 
Could there be lips like yours
Could there be smiles like yours, 
Honest and truly?
You stepped out of a cloud
I want to take you away, away from the crowd
And have you all to myself, 
Alone and apart out of a dream, 
Safe in my heart",You Stepped out of a Dream
Ray Anthony,"Can anyone explain the thrill of a kiss
No! No! No!
But when two eager lips are pressed against yours
You'll know, yes, you'll know

Can anyone explain the glow of romance
No! No! No!
But when you hear the phrase ""It's you I adore""
You'll know, yes, you'll know

And you will find, to give love a start
Don't think with your mind, just feel with your heart

Can anyone explain the wonder of love 
No! No! No!
But now that you and I are sharing a sigh
We know, yes, we know

And you will find, to give love a start
Don't think with your mind, just feel with your heart

Can anyone explain the wonder of love 
No! No! No!
But now that you and I are sharing a sigh
We know, yes, we know","Can Anyone Explaine? (No, No, No)"
Ray Anthony,"It's very clear, our love is here to stay
Not for a year but ever and a day
The radio and the telephone and the movies that we know
May just be passing fancies and in time may go

But oh, my dear, our love is here to stay
Together we're going a long, long way
In time the Rockies may crumble, Gibraltar may tumble
They're only made of clay
But our love is here to stay

In time the Rockies may crumble, Gibraltar may tumble
They're only made of clay
But our love is here to stay",Love Is Here to Stay
Ray Anthony,"Listen, big boy
Now that you got me made
Goodness, but I'm afraid
Somethin's gonna happen to you

Listen, big boy
You gotta be hooked, and how
I would die if I should lose you now

Button up your overcoat
When the wind is free
Take good care of yourself
You belong to me

Eat an apple every day
Get to bed by three
Oh, take good care of yourself
You belong to me

Be careful crossing streets, ooh, ooh
Cut out sweets, ooh, ooh
Lay off meat, ooh, ooh
You'll get a pain and ruin your tum-tum

Wear your flannel underwear
When you climb a tree
Oh, take good care of yourself
You belong to me

Button up your overcoat
When the wind is free
Oh, take good care of yourself
You belong to me
Boop-boop-a-doop

When you sass a traffic cop
Use diplomacy
Just take good care of yourself
You belong to me

Beware of frozen funds, ooh, ooh
Stocks and bonds, ooh, ooh
Dockside thugs, ooh, ooh
You'll get a pain and ruin your bankroll

Keep the spoon out of your cup
When you're drinking tea
Oh, take good care of yourself
You belong to me

Don't sit on hornet's tails, ooh, ooh
Or on nails, ooh, ooh
Or third rails, ooh, ooh
You'll get a pain and ruin your tum-tum

Keep away from bootleg hooch
When you're on a spree
Oh, take good care of yourself
You belong to me",Button Up Your Overcoat
Ray Anthony,"The man who only lives for making money
Lives a life that isn't necessarily sunny
Likewise the man who works for fame

There's no guarantee that time won't erase his name
The fact is, the only work that really brings enjoyment
Is the kind that is for girl and boy meant
Fall in love and you won't regret it
That's the best work of all, if you can get it
Holding hands at midnight

'Neath a starry sky
Nice work if you can get it
And you can get it if you try
Strolling with the one girl
Sighing sigh after sigh
Nice work if you can get it
And you can get it if you try

Just imagine someone
Waiting at the cottage door
Where two hearts become one
Who could ask for anything more?
Loving one who loves you
And then taking that vow
It's nice work if you can get it
And if you get it, won't you tell me how?""

Just imagine someone
Waiting at the cottage door
Where two hearts become one
Who could ask for anything more?
Loving one who loves you
And then taking that vow
Nice work if you can get it
And if you get it, won't you tell me how?""",Nice Work If You Can Get It
Ray Anthony,"Love me or leave me and let me be lonely
You won't believe me that I love you only
I'd rather be lonely than happy with somebody else

You might find the night time the right time for kissing
But night time is my time for just reminiscing
Regretting instead of forgetting with somebody else
There'll be no else unless that someone is you, you, you

I intend to be independently blue
I want your love but I don't want to borrow
I have it today and give back tomorrow
For my love is your love but there's no love for nobody else",Love Me or Leave Me
Ray Bady,"Woo  ah mercy, mercy me
Ah, things ain't what they used to be.
No, no, where did all the blue skies go,
Poison is the wind that blows 
From the north and south and east 
Woo mercy, mercy me
 
Ah things ain't what they used to be, no, no
Oil wasted on the ocean and upon
Our seas fish full of mercury, ah.  oh
 
Ah things ain't what they used to be
What about this over crowded land
How much more abuse from man can she stand?
 
Oh mercy, mercy me.
Ah things ain't what they used to be.
No, no, no, radiation underground and in the sky;
Animals and birds who live near by are dying oh,
 
Oh mercy, mercy me.
Ah things ain't what they used to be.
No, no, no, radiation underground and in the sky;
Animals and land how much more abuse from man can she stand?",Mercy Mercy Me (The Ecology)
Ray Barretto,"East of the sun and west of the moon
We'll build a dream house of love dear
Close to the sun in the day
Near to the moon at night
We'll live in a lovely way dear
Sharing our love in the pale moonlight

Just you and I, 
Forever and a day
Love will not die, 
We'll keep it that way
Up among the stars 
We'll find a harmony of life to a lovely tune
East of the sun and west of the moon dear
East of the sun and west of the moon",East of the Sun
Ray Barretto,"I used to have a perfect sweetheart
Not a real one, just a dream
A wonderful vision of us as a team
Can you imagine how I feel now
Love is real now, it's ideal
You're just what I wanted
And now it's nice to live
Paradise to live

I know why I've waited
Know why I've been blue
Prayed each night for someone
Exactly like you

Why should we spend money
On a show or two
No one does those love scenes
Exactly like you

You make me feel so grand
I want to hand the world to you
I hope you'll understand
Each foolish little scheme I'm schemin'
And dream I'm dreamin'

Now I know why mother
Taught me to be true
She meant me for someone
Exactly like you",Exactly Like You
Ray Barretto,"Listen to my tale of woe, 
It's terribly sad but true, 
All dressed up, no place to go 
Each evening I'm awfully blue. 

I must win some handsome guy 
Can't go on like this, 
I could blossom out I know, 
With somebody just like you. So

Oh, sweet and lovely lady, be good 
Oh, lady, be good to me 
I am so awfully misunderstood 
So lady, be good to me 
Oh, please have some pity 
I'm all-alone in this big city 
I tell you I'm just a lonesome babe in the wood, 
So lady be good to me. 

Oh, please have some pity 
I'm all alone in this big city 
I tell you I'm just a lonesome babe in the wood, 
So lady be good to me. 
Oh lady be good to me.",Lady Be Good
Ray Barretto,"The shadow of your smile
When you have gone
Will color all my dreams
And light the dawn

Look into my eyes my love and see
All the lovely things you are to me

Our wistful little star
It was far, too high
A teardrop kissed your lips
And so did I

Now when I remember spring
All the joys that love can bring
I will be remembering
The shadow of your smile",The Shadow of Your Smile
Ray Barretto,"Star eyes,
That to me is what your eyes are,
Soft as stars in April skies are,
Tell me some day you'll fulfill
Their promise of a thrill.

Star eyes,
Flashing eyes in which my hopes rise,
Let me show you where my heart lies.
Let me prove that it adores
That loveliness of yours.

All my life I've felt
Content to stargaze at the skies.
Now I only want to to melt
The stardust in your eyes.

Star eyes,
When if ever, will my lips know
If it's me for whom those eyes glow?
Makes no diff'rence where you are,
Your eyes still hold my wishing star,
Oh, star eyes, how lovely you are.",Star Eyes
Ray Barretto,"I need mercy
I need mercy
I need mercy
I pray to God I'd hold you again
I need mercy
Mercy baby, mercy baby, mercy mercy mercy
I need mercy
Mery mercy baby, mercy baby, mercy mercy mercy
Lord have mercy
Mercy baby, mercy baby, mercy mercy mercy
I need mercy
Mery mercy baby, mercy baby, mercy mercy mercy
I need mercy
Mercy baby, mercy baby, mercy mercy mercy
I need mercy
Mery mercy baby, mercy baby, mercy mercy me, yeah
","Mercy, Mercy, Baby"
Ray Barretto,"Yeah baby
That's the soul drummers

Have you heard them cooking? (The soul drummers)
Well, they play so cool (The soul drummers)
It's so hard to resist (The soul drummers)
With the African twist (The soul drummers)

Oh, you know they can swing (The soul drummers)
That African thing (The soul drummers)
When they play that beat (The soul drummers)
That's to move my feet (The soul drummers)

Yeah, baby, oooh
Sack it to me

I wanna know what I mean (The soul drummers)
Well, at the best time to see (The soul drummers)
And from all of the town (The soul drummers)
People gather 'round (The soul drummers)

And when they get that feeling (The soul drummers)
No matter where they're from (The soul drummers)
That's what let people shout (The soul drummers)
Don't give the drummer's sound (The soul drummers)
Yeah

Yeah, baby, oooh
Give me some

Listen to him

Oh, don't you love them now? (The soul drummers)
When they play so cool (The soul drummers)
Yeah they move so good (The soul drummers)
Oh, they play so good (The soul drummers)

Sack it to me, baby
Oooh

Make me shout

Aha

Yeah, you love them now (The soul drummers)
When they play so good (The soul drummers)
Now they make you wanna move (The soul drummers)
Or they make you wanna dance (The soul drummers)
Yeah

Now come on

We

Don't stop it now

Sack it to me

Yeah ",The Soul Drummers
Ray Barretto,"El Hijo de Obatala 
Ray Barreto 
Eeeeeeee 
Eneeeeeee 
Tiene todos los sabores del africa primitiva 
Tiene todos los sabores del africa primitiva 
Pero dimelo en tambores por que el tambor fue mi vida 
Pero dimelo en tambores por que el tambor fue mi vida 
Si me llevas como hermano pon tu mano en el tabor que el hijo de obatala ya se contento 
Si me llevas como hermano pon tu mano en el tabor que el hijo de obatala ya se contento 

El hijo de obatala ya se contento 
Trompeta 
El hijo de obatala ya se contento 
Trompeta 
El hijo de obatala ya se contento 
Trompeta 
El hijo de obatala ya se contento 
Y el hijo el hijo de obatala e..se e..se soy yo 
El hijo de obatala ya se contento 
Obatala y obatal a el santo mayor cabeza de los dems 
El hijo de obatala ya se contento 

Mambo (Piano) y descarga conga 

Tambo tambo tambo tambo que la rumba llama* 
Ya se contento 
No pare, no pare que la rumba llama* 
Ya se contento 
Obatala obatala
Ya se contento 
Yo soy un niche del africa primitiva 
Ya se contento 
Barreto toca el tambo que a mi eso me inspira 
Ya se contento 
Eh tambo tambo tambo tambo 
Ya se contento 
Ehh tambores tabores 
Ya se contento 
El africa se viste de mil sabores 
Ya se contento 
Que siga que siga no pares los cueros 
Ya se contento 
Esto esto si esta bueno 
Ya se contento 
Hay no pare la rumba que esta sabrosa 
Fin",El Hijo de Obatal
Ray Barretto,"Rara como encendida
La vi bebiendo, linda why fatal
Beba why en el fragor del champan
Lo que rea x no llorar

Pena me dio encontrarte
Pues al mirarte yo vi brillar
Tus ojos con un elctrico ardor
Tus bellos ojos que tanto adore

Esta noche, amiga ma
El alcohol nos ha embriagado
Que me importa que se ran
Que nos llamen los mareados

Cada cual tiene sus penas why
Nosotros las tenemos
Esta noche viviremos porque ya
No volveremos a vernos mas

Hoy vas a entrar en mi pasado
En el pasado de mi vida
Tres cosas lleva el alma herida
Amor, pesar, dolor

Hoy vas a entrar en mi pasado
Why hoy nuevas sendas tomaremos
Que grande a sido nuestro amor
Why sin embargo ay, mira lo que quedo

Cada cual tiene sus penas
Why nosotros las tenemos
Esta noche beberemos porque ya
No volveremos a vernos mas

Hoy vas a entrar en mi pasado
En el pasado de mi vida
Tres cosas lleva mi alma herida
Amor, pesar, dolor

Hoy vas a entrar en mi pasado
Hoy nuevas sendas tomaremos
Que grande a sido nuestro amor
Why sin embargo ay, mira lo que quedo",Los Mareados
Ray Barretto,"When a star is born
They possess a gift or two
One of them is this
They have the power to make a wish come true

When you wish upon a star
Makes no difference who you are
Anything your heart desires will come to you

If your heart is in your dream
No request is too extreme
When you wish upon a star
As dreamers do
Fate is kind

She brings to those who love
The sweet fulfillment of their secret longing

Like a bolt out of the blue
Fate steps in and sees you through
When you wish upon a star
Your dreams come true

When you wish upon a star
Makes no difference who you are
Anything your heart desires will come to you

If your heart is in your dream
No request is too extreme
When you wish upon a star
As dreamers do
Fate is kind

She brings to those who love
The sweet fulfillment of their secret longing
Like a bolt out of the blue
Fate steps in and sees you through
When you wish upon a star
Your dreams come true",When You Wish upon a Star
Ray Barretto,"Through the dust bowl
Through the debt
Grandma was a suffragette
Blacklisted for her publication
Blacklisted for my generation
Go go go 

Raise your hands
Raise your hands high
Don't take a seat
Don't stand aside
This time
Don't assume anything
Just go go go 

Feed the fire
And fan the flame
I know you kids can stand the rain
I know the kids are still upsetters
'Cause rock is cool but the struggle is better
Go go go 

And raise your hands
Raise your hands high
Don't take a seat
Don't stand aside
This time
Don't assume anything
I said this time
Now don't assume anything
Just go 

The truth is I was afraid
I felt inferior
I felt I excelled in competing with others 
And I knew instantly 
That these people were not competing at all, 
That they were acting in a strange, 
Powerful trance of movement together
And I was filled with longing 
To act with them 
And with the fear that I could not 

Did they tell you it was set it stone
That you'd end up alone
Use your years to psyche you out
You're too old to care
You're too young to count 

Did they tell you, you would come undone
When you try to touch the sun
Undermine the underground
You're too old to care
You're too young to count 

I said go go go 

I said this time
Don't assume anything
Just go go go
Go go go
Go go go",Go
Ray Barretto,"Ollie told me I'm a fool. 
So I walked on down the road a mile, 
Went to the house that brings a smile
Sat upon my grandpa's knee, 
And what do you think he said to me?

[Chorus]
When you awake you will remember ev'rything, 
You will be hangin' on a string from your
When you believe, 
You will relieve the only soul
That you were born with to grow old and never know

Ollie showed me the fork in the road.
You can take to the left or go straight to the right,
Use your days and save your nights,
Be careful where you step, and watch wha-cha eat,
Sleep with the light on and you got it beat.

[Chorus]

Ollie warned me it's a mean old world,
The street don't greet ya, yes, it's true;
But what am I supposed to do:
Read the writing on the wall,
I heard it when I was very small.

[Chorus]

Wash my hand in lye water, 
I got a date with the captains daughter. 
You can go and tell your brother. 
We sure gonna love one another, oh! 
You may be right and ya might be wrong, 
I ain't gonna worry all day long.

Snow's gonna come and the frost gonna bite, 
My old car froze up last night. 
Ain't no reason to hang your head 
I could wake up in the mornin' dead. 
Oh! And if I thought it would do any good, 
I'd stand on the rock where Moses stood.",Lazy Afternoon
