Band,Lyrics,Song
Northlane,"Pay close attention
Or else you'll miss what's happening
We worship the sun
Yet we burn it's rays
So we seek out the dark
So we seek out the shade
It's such a mix of emotions
We call it regret
Chaotic patterns unfold
It's such an elegant mess
So I'll embrace the pain
It's time to face all my fears
I've had enough of this game
Oh how it brings me to tears
And I can only be sure
One day I won't be alive
Stepping into the future
With the brightest of eyes
Let time stand still
For one second please just stop
Oh my
It's frightening
It's right in front of my eyes
Oh my
It's right there
It's right in front of my eyes
Wake up from the nightmare
And become the dream
That you've always been
That you've always seen
Wake up from the nightmare
Because you are the dream
I stand tall grounded here on this earth
I'm loooking up at the sky
With the stars in my eyes, I'm alive
I'm looking up at the sky
I see life was my dream all along
I'm looking up at the sky
My self
My world
My people
My home
My everything",Dream Awake
Northlane,"Every single moment time will melt away my life
What choices do I have, how do I know is wrong or right?
How do I speak of what I see through my own eyes?
Without telling you that the truth you've known is all a lie
Stop living the lie, existing just because you can
I can be the dreamer
I can, I am",Genesis
Northlane,"The scent of lies is in the air tonight
We dance in a spell of lust, those eyes of yours I cannot trust
The scent of lies is in the air tonight
We dance in a spell of lust, those eyes of yours I cannot trust
You all act innocent but I have seen your true face
Stop lying to yourself, you're nothing but a fucking disgrace
You're a fucking disgrace
How can you trust anyone when you can't even trust your friends?
A masquerade of lies will kill us all in the end
The worst part of it all is I'm exactly the same
I'm looking around the room
I'll be the first one to blame
The scent of lies is in the air tonight
We dance in a spell of lust, those eyes of yours I cannot trust
The scent of lies is in the air tonight
We dance in a spell of lust, those eyes of yours I cannot trust
Take another look inside of yourself
Look at the mess you've made
Take another look inside yourself
You're living in a masquerade
You're just a two-faced piece of shit
I'll make sure all you cowards quit
So hide yourself behind a mask
In a room of double faces
You can never hide what's in your past
Nothing changes at all, I'm still exactly the same
I'm looking around the room
I'll be the first to blame
The scent of lies is in the air tonight
We dance in a spell of lust, those eyes of yours I cannot trust
The scent of lies is in the air tonight
Those eyes, those eyes
To everyone who's held me up and everyone who's brought me down
I will never forget your faces, your voices
Wink and smile for a while behind a mask
In a room of double faces you can never hide what's in your past",Masquerade
Northlane,"Set me free!

Feeling all the love I swear that its in the air
Leaving me, floating forever into infinity
I can see the colors dance when I close my eyes
Witnessing mysterious design
I can feel my body rush
From the love inside of me

Cant you see the joy of life is right before your eyes?
Infinite bliss, infinite love
Take a chance, close your eyes and just dream
It sets me free

Why cant you see the joy of life is right before your eyes?
Infinite bliss, infinite love
Take a chance, close your eyes and just dream
It sets me free

We walk around blinded like children in the dark
So cold and so empty, how did this even start
Its time to remember what its like to feel alive
Feel alive! Set me free!! Set me free!

Cant you see the joy of life is right before your eyes?
Infinite bliss, infinite love
Take a chance, close your eyes and just dream
It sets me free

Why cant you see the joy of life is right before your eyes?
Infinite bliss, infinite love
Take a chance, close your eyes and just dream

Feeling all the love I swear that its in the air
Leaving me, floating forever into infinity
Quantum fluctuations project into the air
Leaving me floating forever into infinity
Infinite potential! Infinite potential!",Quantum Flux
Northlane,"Crawling through the burning sand
Just a man whose lost in time
Distant memories of a life
That flow like waves within my mind
Look upon these calloused hands as they move without a thought
Lucid wisdom in every atom the golden mind of Thoth, 
We are the Gods, who have lost ourselves in forms, 
Like a scarab in the mind we fester in the soul
I have felt the burden of pain
For the last time
So you want the fucking truth?
So you want the fucking truth?
The truth is we all suffer
We all suffer in life
We all suffer in time
Beat me down, beat me down
Again and again, again and again
Let it Reign hell on me
In life we all suffer
But I will find my way
Through the darkness
This is the truth
In the back of my mind
It's been hiding away
For me to find
Dancing in the fire
We burn together
This pain will never end",Scarab
Northlane,"When the wind breaks before our very path
We are swept away; I hear the wind howling my name
Leaving behind me everything I thought that I should be
Everything they told me was right
Everything they said about life
We have made the sacrifices
We have been patient for long enough
It is our chance, our time
Our time to rise the fuck up
I will break the wind
This road, it leads so far away from home
I breathe the air, down a road to nowhere
Streams of oxygen, soothe our forms
We long to breathe in the air
Around us
I feel the kiss of the breeze against my face
We long to feel the air
Around us
I'm packing up
I'm leaving here
Don't know when I'm coming back
Close your eyes and I disappear
Floating free throughout this life
Reshaping my thoughts time does wither the mind
Time does wither the mind and in due time
The life I thought I wanted I never seem to find
It might be dark and it might be cold
But if I ever feel like turning back
I just breathe and remember where I am, inside the dream
I will break the wind
When the wind breaks before our very path
We are swept away; I hear the wind howling my name
Break",Windbreaker
Northlane,"You think you see the world I'll tell you nothing's how it seems
You think you see the world I'll tell you nothing's how it seems
Organ of intuition suppressed and maimed
Believed to be ""Nothing but a Dream""
Dymethylated spirits on fire in me
Burning from the inside
Divorce from nature exile from Eden
Confounding of tongues in a world full of lies
Why can't we open our eyes?
You think you see the world I'll tell you nothing's how it seems I've seen the world with the clearest of eyes
A world of fear it's loud and clear and no surprise
They watch us from above
Can you feel the chaos overtaking us like a never ending plague, they watch us from above, crying tears of blood for the souls of the world
They watch us from above
Now I hear the voices of an ancient race
Peering through the veil of time and space
Emerging from the void I am reborn I see the world for what it really is
Distorted visions of heaven
I have discovered there's hope in my heart
For I am One I am One
I am Love
I am Bliss I am Everything
I am Everything you fear
Everything you've ever known
But don't be scared for I am here You think you see the world I'll tell you nothing's how it seems
All your dreams
Nothings How it seems
All your dreams",Worldeater
Northlane,"The narrow road is all I know
No map to guide us
No compass beside us
The narrow road
The great unknown
The grater sacrifice grants the greatest gift in life

No more assembly lines of aspirations connecting carbon copy clones
Every artifact is marching like commodities of flesh and bone

The consistency of our censored thoughts
Tread a static course

Ordinary people: your outlook is lethal

Chiseling away imperfections
Until rough edges are same and smooth
The tools have now become too blunt
To break any of the rules

Post-modern minds bleached blank and clean
Drawing pixelated lines
In duller shades that my eyes have ever seen

The narrow road is all I know
No map to guide us
No compass beside us
The narrow road
The great unknown
The grater sacrifice grants the greatest gift in life

No more assembly lines of aspirations connecting carbon copy clones
Every artifact is marching like commodities of flesh and bone

Post-modern minds bleached blank and clean
Drawing pixelated lines
In duller shades that my eyes have ever seen

We're not defined by a blueprint if we re-write the plans
So will you paint paradise with the stroke of an artist's hand?",Animate
Northlane,"So alone in our digital world

The walls are closing in
Shrinking down to the box in the palm of my hand
The shock has settled in
Fibers and wires
Feed me the link that we desire

Every circuit getting smarter
Every signal getting stronger
But our ties are getting weaker
And I see us sinking deeper

I see it sinking deeper

Flawed relations of ones and zeroes connecting us to our digital heroes
An anti-social network where everyone's a fucking expert

I see it sinking deeper

Hollow as a hologram
Electricity without the spar
Hearts left to flicker and fade
Out in the dark

So alone in our digital world

Impulses flowing through my veins
Impulses flowing through copper
Flowing in waves
It feels so close
Yet so far away

Every circuit getting smarter
Every signal getting stronger
But our ties are getting weaker
And I see us sinking deeper

I see it sinking deeper

The walls are closing in",Impulse
Northlane,"Follow me underwater
Until the searchlights leave the shore
Follow me underwater
Until we find what we're looking for

Plastic oceans, plastic farms
Cover your footprints like a band-aid on a broken arm

They found the pipeline through the soul in the soil
I thought this place never changed
But now the reefs are bleeding smells of oil
And the forests are up in flames

You fell asleep, you fell asleep, you fell asleep
While your bed burned
You fell asleep, you fell asleep, you fell asleep
While your bed burned

Give me a reason, tell me why we lost our reason
Tell me the truth, not an excuse
Cause we have everything to lose

Plastic oceans, plastic farms
Cover your footprints like a band-aid on a broken arm

There's a cancer in our lifeblood, so silently it grew
The streams of least resistance poison me and poison you
There's a virus in the air, that drags the wind out from my chest
I don't see a way out
All I see is a sphere of unrest

Show me a way out
Show me a way out
Show me a way out

Follow me underwater
Until the searchlights leave the shore
Follow me underwater
Until we find what we're looking for

Plastic oceans, plastic farms
Cover your footprints like a band-aid on a broken arm

You fell asleep, you fell asleep, you fell asleep
While your bed burned
You fell asleep, you fell asleep, you fell asleep
While your bed burned",Leech
Northlane,"You can be the change

Pain is the elixir that keeps us entertained
Flowing through a looking glass
Numbing stinging eyes of shame
Absence rinses guilt away
But our conscience is still stained
You can be the catalyst
The ripple to the wave

You can be the change

One small step will shake the earth

We're sedated into submission
Apathetic addicts
Hooked on tunnel vision

Mindless progress is a dire setback
Humanity is slipping through the cracks

Let the pathways through our hearts guide us
To a universe where love survives us

You can be the change

One small step will shake the earth

Let the pathways through our hearts guide us
To a universe where love survives us",Node
Northlane,"Time in constant motion
Like the shifting desert sands
Slipping through my hands

Chasing down the minutes
That turn into days
Seconds get shorter
As years fall away
Chasing down my dreams
Under borrowed light
A mirage in the distance
Escaping my sight

Driven to live or driven apart
What's inside us when we depart
Driven to live outside of regret
Time is finite, the clocks are set
Driven to live or driven apart

I realize my flame is burning away
Starward searching I will find my way
The power of the mind ready to combust
I will show you fear in a handful of dust

Combust

My flame is fleeting
But I will live and learn
Rise and burn, Tick and Turn
Rise and burn

Time in constant motion
Like the shifting desert sands
Slipping through my hands

Driven to live or driven apart
What's inside us when we depart
Driven to live outside of regret
Time is finite, the clocks are set
Driven to live or driven apart

Combust",Obelisk
Northlane,"The earth gets smaller with everything I see
A technicolor picture on a black and white screen
There's a blackout on the ground
But an energy above the trees
Just past the edge of sound
So climb the ladder with me

Wanderer
Survey the shrinking globe
All your troubles seem smaller
The farther you go
Wanderer
Never coming home
All your troubles seem smaller
The farther you go

Shed the dead weight
Flight will follow
From the island that world will surely swallow

Falling our of orbit
My thoughts scrambled and distorted
Sailing through space in a panic
To escape the static

Escape the static

Wanderer
Survey the shrinking globe
All your troubles seem smaller
The farther you go
Wanderer
Never coming home
All your troubles seem smaller
The farther you go

How clear is the air up there
Breathe easy
Breathe easy as you leave the atmosphere
Breathe easy",Ohm
Northlane,"I am the tear in the gravity
The universal truth is my reality
In a drifting space
Where the dark draws near
I am stronger than fear
Collapse under the horizon
The ruins of a thousand stars
Illuminate who we are:

No drive
No direction
Purify
My perception
Sail on
Through the rift between the sky and ocean
Sail on
Find the peace that keeps your world in motion
Stare into the face of the sun
It melts away a shell of wax
To show the world how fucked I've become:
No drive
No direction
Purify my perception
There's a desert in my head
But an oasis in my dreams
Where veins glow in leaves
And illuminate the breeze
I will drag my being
To the edge of the beginning
Never still, never idle
Sever me from the endless spiral
Sail on
Through the rift between the sky and ocean
Sail on
Find the peace that keeps your world in motion
Lost inside a drifting space
Where drifting days interlac
And everything I saw so clear
Dances then disappears
I need to be grounded
But the plates keep shifting
So I look for my place
Where this space stops drifting",Ra
Northlane,"So cold my soul's numb
Like an icy breeze on solstice morning
The worst enemy’s one that’s homegrown
This is more than just a faceless warning

Don't let the world rot
Don't let the world rot
Hanging by a thread they just putrefy
Our blood our birth our sky
And we will not stand by
Don't let the world rot

So warm the sun burns my soul
Like the fossils in the earth they take my breath

Black blood bleeding heart filled stone
Take the power away from the hands of death 

A web of minds connected

Take purpose, Take action
Cause a reaction
Entangle the spiders
Make sense of this mess
A mind at large
Is a power they can’t repress

We are all connectedWe are one you and I
Yeah we will not stand by

Don’t let the world rot

Omnipotent mind at large
Sick of living underhanded
This is our life we command it
Go 
We can’t all hide in fear
A time of reckoning is near
We are all connected
Don’t let the world rot

We can’t all hide in fear
A time of reckoning is near
We are all connected
A web of minds connected
Take purpose, Take action,
Cause a reaction
Entangle the spiders
Make sense of this mess
A mind at large
Is a power they can’t repress

Sick of living underhanded
This is our life we command it",Rot
Northlane,"Daydreamer
Rise and shine
Daily deja vu
Yet still surprised
Watch the weary world with greyscale eyes

A millionaire in my mind
With a pocket full of lint
Confined to a puzzle where the pieces don't fit
Stare into a broken mirror
Reflecting shards of fear
Daydreamer
Now's your time
I refuse to die here

I refuse to die here

I see a prison of a city, destined for collapse
I see the worker bees buzzing in circles
Fighting over scraps
I see a concrete garden
Of lead and steel trees
I see the clouds swell with synthetic disease

A visionless man can't balance the scale
The court of conscience slips secrets on the gavel
Written in Braille
Lie just beyond my fingertips

Daydreamer
Rise and shine
Daily deja vu
Yet still surprised
Watch the weary world with greyscale eyes

A millionaire in my mind
With a pocket full of lint
Confined to a puzzle where the pieces don't fit
Stare into a broken mirror
Reflecting shards of fear
Daydreamer
Now's your time
I refuse to die here

I refuse to die here",Soma
Northlane,"Weightless my body
Floats in eternity
Weightless beyond the earth's gravity
A euphoric perpetual gaze
I taste the light of days

Beneath a luminescent haze
I cross the convoluted maze
Guided by familiar sight and sound
I let go of what weighs me to the ground

Weightless my body
Floats in eternity
Weightless beyond the earth's gravity
A euphoric perpetual gaze
I taste the light of days",Weightless
Northstar,"A censored write up on love in yesterday's paper
Left me feeling lonely
As rotten paper falls from my notebook
I had to bring myself to pick up my jaw

You can't stop daybreak, daybreak

Well In the back of my mind she sits
With her arms around his chest
If I had four hands
I could hold you like you wanted
And I'd give you my soul
To see that it's been sold
That it's been sold
That it's been sold
That it's been sold

You can't stop daybreak
With your voice inside
Scribbled on an empty sidewalk through his life
Flipping page by page
Looking up so far down

You can't stop daybreak, daybreak

Disappointed
From her looks of despair
From this",Daybreak
Northstar,"Like a star slipping out of place
Sliding from the sky
Tumbling through space
When you touch my hand
I swear I feel like I'm ballin'
(Ballin', Ballin', Ballin', Ballin')
Yeh ballin'
(Ballin', Ballin', Ballin', Ballin')
Like a wheel
Whirling round and round
Rolling down a hill (rollin' down a hill)
Spinning on the ground (rollin' down a hill)
Your kissing makes me dizzy yeh
In the head (ooh yeh)
And I'm ballin'
I'm ballin'

Hmm, I love this game coz this game love me back
I'm pushing a lac, smoking sacs like a mad mac
Bringing me back, banging the 8-track track
The Dramatics and Battle Cat and Snoop like that
Big stars in big cars we pull up at the big clubs and sit at the big bars
Sippin' champaign with a bowl of cavier
Hell yeh you are, yeh you are
Say it say it, coz they all deny it
Player play it, coz you can't deny it
As fly as it get, as fly as I spit you know its the shit
It's so gangsta, gangsta bitch
Switch back to the old school, old fools know
This here thang we do so original
I got to have it, lavish
Is how we establish
On the real love one it feels good to have

Like a rose, flippin down the street
Looking oh so sweet (lookin' oh so sweet)
Bumpin to the beat (bumpin to the beat)
These streets they keep me busy yeh
Makin' bread
And I'm ballin'
(Ballin', Ballin', Ballin', Ballin')
Yeh ballin'
(Ballin', Ballin', Ballin', Ballin')
Oh here I go!
Ballin making dough
Working for myself
Coz it thrills me so
I keep women on my line
Coz they know
That I'm ballin'
(Ballin', Ballin', Ballin', Ballin')
Yeh ballin'
(Ballin', Ballin', Ballin', Ballin')
Oh here I go!
Driving down the road
I can't help myself
Ballin' Thrills me so
Yeh you blew my mind
And I know , I'm ballin'
(Ballin', Ballin', Ballin', Ballin')
Yeh ballin'
(Ballin', Ballin', Ballin', Ballin')

Do that, who that, you that one they called on
Baller' get your ball on
It's all on now fall on to a new groove
Really ain't nothing to prove
We, set the mood
Or shoot some pool
Or blaze a Cool
What? Whatup fool
Now you can cruise if you choose but I prefer to do the cha-cha
And once my small kitchen ?throw?
You know I gotcha
Watch out, no need to pull your glock out
It's a players affair, now
Look at my hair and the girls wit me
They got the same thang on
Pimp pimp parade, my nigga get your bang on
Coz my uncles about to get their sang on
And all round the world, my nigga, it's the same song
And when its time for your callin', fallin', wit no stallin'
Keep it ballin'

He starts to mill
Just rollin' tru his town
Stacking dollar bills (stacking dollar bills)
Raising dogg pound (he be raising the dog pound)
Becasuse he's loved
Loved in every city
That's why he's ballin'
(Ballin', Ballin', Ballin', Ballin')
Yeh ballin'
(Ballin', Ballin', Ballin', Ballin')

There it is coz it is there
Now have a seat and come hit the game from a player
They say time brings change and change brings time
It's so genuine and so divine
It's been so long in fact its overdue
Now tell me baby girl what can D-O-DOUBLE-G do for you
I fell for you, I'll always look over you
There's really not much that a player would'nt do for you
So quit stallin' and fallin'
And come get a bar of some of this ballin'
Now quit stallin' and callin'
And come get yaself a bar of this ballin'

Yeah that's right, this is ahh, radio station 187.4 DG
Sock it to your ass
With something from The Dramatics
And Snoop Dog
Let them spot that ok
It's another one of those world premiers
Doin' it to ya doggystyle, in ya air hole
For the 2000 plus 1, yeh",Ballin'
Northstar,"[Intro: Midnight]
Yo! This for all my motherfucking niggaz
On the West Coast, on the East Coast
In the mid-West, the Dirty South
Nigga, I don't care what you doing
Who you wit, or where you at, nigga
Go Crazy, nigga
Go motherfucking Crazy, nigga
Get motherfucking sick wit it!

[Chorus 2X: Tonebone]
Sometimes I might get a little Crazy
Dipped and sticking doors with one-eighty
Ever since the G's raised me
The streets couldn't fade me, go Crazy

[Christ Bearer]
Yeah, all why'all niggaz go Crazy
Leave the bitch-ass niggaz braindead in the daily
Too many ho's yelling, ""Christ Bearer, save me!""
Bitches can't swim 'cause the water too wavy
My nigga, get a little nuts
The Wu don't give two fucks, Clan like Klu Klux
Lace the Digi with the 'dro
Tai Bo, bust ya fo'-fo', let ya hair down, ho
Ya gotta get a little sick
Let niggaz try to play you like a step-child and click
Fuck the dumb shit, nigga, trip
Lose ya grip, pull a semi-automatic out the whip
Get psychotic, neurotic, they want it, they got it
Bang it to the boogie, hypnotic
Dip a stick and do a quick one-eighty
Like G's that raised me, a Long Beach baby
Taught me the difference of a bitch and a lady
The streets can't fade me when I'm liable to go Crazy

[Shoshot]
Crazy, like hitting a bank with a three-eighty
And maybe, flip and pistol-whip an old lady
That's shady, ya think that's shady?
Hell, not as shady as the bitch that had my first baby
And maybe, that's why I blow big dope on the daily
And maybe, I'll fuck ten more bitches and have ten more babies
And lately, I've been wanting to take shit back to the eighties
And maybe, I'll drive-by shooting at niggaz that hate me
See baby, you know my story and that's the way it still goes
Real crazy, I'm still rapping baby and I still hate ho's
Shoshot is sick wit it, gots nothing for ho's
but conversation and some dick wit it, can you dig it?
I'm a zipped down fool, and niggaz pause when I spit it
I might strip to my drawers, when I trip off the liquid
See maybe, I need to get fucked up 'til I hurl
'cause I'm Crazy like 2Pac screaming ""Fuck the world!""

[Chorus 2X]
[Christ Bearer]
Yeah, fuck that, go looney
Screaming ""Bitch, sue me"", off the wall like a young Paul Moonie
Break a rule, act a motherfucking fool
Roll a cutty on D's, solo at the carpool
Play Clyde Bearer's like a young Warren Beaty
Let Bonnie be ya lady so the bitch go Crazy

[Meko the Pharaoh]
While niggaz go Crazy I stay amazing
Doing what I do, straight blazing
Re-arranging, the time structure in the streets
Rotating planets like my people far out, you can't see
Believe it or not, a drop
NorthStar make ya heart stop
Too hot.. yeah, my shit stay live.. wit a vibe
that makes niggaz go Crazy when they get high (pass that)
Bitches button down ya button-fly
Niggaz bust ya fo'-five, get real live
'cause ya only live this life once
So bounce to this motherfucker like you own one (bounce)
Dip a stick and straight trip on a nigga
Take a sip and straight spit on a nigga
'cause the streets straight raised me
But they couldn't fade me (nigga), go Crazy

[Chorus 4X]",Crazy
