Band,Lyrics,Song
Irving Berlin,"It's a lovely day today
So whatever you've got to do
You've got a lovely day to do it in, that's true

And I hope whatever you've got to do
Is something that can be done by two
For I'd really like to stay

It's a lovely day today
And whatever you've got to do
I'd be so happy to be doing it with you

But if you've got something that must be done
And it can only be done by one
There is nothing more to say
Except it's a lovely day for saying
It's a lovely day

It's a lovely day today
And whatever I've got to do
I've got a lovely day to do it in, that's true

But perhaps whatever I've got to do
Is something that can be done by two
If it is then you could stay

It's a lovely day today
But you're probably busy too
So I suppose there's nothing we can do

For if you've got something that must be done
And it can only be done by one
There is nothing more to say
Except it's a lovely day for saying
It's a lovely day

It's a lovely day today
If you've something that must get done
Now don't forget two heads are better than just one

And besides I'm certain if you knew me
You'd find I'm very good company
Won't you kindly let me stay?

It's a lovely day today
And whatever we've got to do
We've got a lovely day to do it in, that's true

And I know whatever we've got to do
Is something that can be done by two

I'll say it's a lovely day for saying
It's a lovely day",Act I: Plenty to Be Thankful For
Irving Berlin,"I could dance nightly
Just holding you tightly
My sweet
I could keep right on
Because you're so light on
Your feet
You're easy to dance with

There is no doubt in
The way we stand out in
The crowd
Though it's called dancing
To me it's romancing
Out loud
You're easy to dance with

Loving you
The way I do
Makes you easy to dance with
That is why I'm always right on the beat
All those charms
In one man's arms
Makes you easy to dance with
I can hardly keep my mind on my feet

Let's dance forever
Come on, say we'll never
Be through
It's so easy to dance with you","Act II: Be Careful, It's My Heart"
Irving Berlin,"I hear the drums echoing tonight
But she hears only whispers of some quiet conversation
She's coming in, 12:30 flight
The moonlit wings reflect the stars that guide me towards salvation
I stopped an old man along the way
Hoping to find some long forgotten words or ancient melodies
He turned to me as if to say, ""Hurry boy, it's waiting there for you""

It's gonna take a lot to take me away from you
There's nothing that a hundred men or more could ever do
I bless the rains down in Africa
Gonna take some time to do the things we never had

The wild dogs cry out in the night
As they grow restless, longing for some solitary company
I know that I must do what's right
As sure as Kilimanjaro rises like Olympus above the Serengeti
I seek to cure what's deep inside, frightened of this thing that I've become

It's gonna take a lot to drag me away from you
There's nothing that a hundred men or more could ever do
I bless the rains down in Africa
Gonna take some time to do the things we never had

Hurry boy, she's waiting there for you

It's gonna take a lot to drag me away from you
There's nothing that a hundred men or more could ever do
I bless the rains down in Africa
I bless the rains down in Africa
(I bless the rain)
I bless the rains down in Africa
(I bless the rain)
I bless the rains down in Africa
I bless the rains down in Africa
(Ah, gonna take the time)
Gonna take some time to do the things we never had",Act II: Finale Ultimo (Steppin' out with My Baby/I'll Capture Your Hear
Irving Berlin,"Sweetheart of mine, I've sent you a valentine
Sweetheart of mine, it's more than a valentine
Be careful, it's my heart
It's not my watch you're holding, it's my heart
It's not the note I sent you that you quickly burned
It's not the book I lent you that you never returned
Remember it's my heart
The heart with which so willingly I part
It's yours to take to keep or break
But please, before you start
Be careful, it's my heart",Act II: Song of Freedom
Irving Berlin,"Happy Holiday
Happy holiday, happy holiday
While the merry bells keep ringing
May your ev'ry wish come true

Happy holiday, happy holiday
May the calendar keep bringing
Happy holidays to you

Come To Holiday Inn
If you're burdened down with trouble
If your nerves are wearing thin
Park your load down the road
And come to Holiday Inn

If the traffic noise affects you
Like a squeaky violin
Kick your cares down the stairs
And come to Holiday Inn

If you can't find someone who
Would set your heart a-whirl
Take your car and motor to
The home of boy meets girl

If you're laid-up with a breakdown
Throw away your vitamin
Don't get worse, grab your nurse
And come to Holiday Inn 
",Act II: You're Easy to Dance With
Irving Fazola,"Islands of Hawaii
Where skies of blue are calling me
Where balmy air and golden moonlight
Caress the waving palms of Wai KiKi

Valleys with their rainbows
Your mountains green, and deep blue sea
Your fragrant flowers and dreamy music
Unite and sing a aloha-hi to me

Islands of Hawaii
Where skies of blue are calling me
Where balmy air and golden moonlight
Caress the waving palms of Wai KiKi

Valleys with their rainbows
Your mountains green, and deep blue sea
Your fragrant flowers and dreamy music
Unite and sing a aloha-hi to me",Song of the Islands
Irving Fazola,"In a Sentimental Mood I can see
The stars come through my room
While your loving attitude is
Like a flame that lights the gloom
On the wings of ev'ry kiss
Drift a melody so strange and sweet
In this sentimental bliss you make
My Paradise complete
Rose pearls seem to fall
It's all like a dream to call you mine
My heart's lighter thing since you
Made me this night a thing divine
In A Sentimental Mood
I'm within a world so heavenly
For I never dreamt that you'd be
Loving sentimental me
In A Sentimental Mood I can see
The stars come through my room
While your loving attitude is
Like a flame that lights the gloom
On the wings of ev'ry kiss
Drift a melody so strange and sweet
In this sentimental bliss you make
My Paradise complete
Rose pearls seem to fall
It's all like a dream to call you mine
My heart's lighter thing since you
Made me this night a thing divine
In A Sentimental Mood
I'm within a world so heavenly
For I never dreamt that you'd be
Loving sentimental me",In a Sentimental Mood
Irving Fazola,"It seems we stood and talked like this before
We looked at each other in the same way then
But I can't remember where or when

The clothes you're wearing are the clothes you wore
The smile you are smiling you were smiling then
But I can't remember where or when

Some things that happened for the first time
Seem to be happening again

And so it seems that we have met before
And laughed before, and loved before
But who knows where or when",Where or When
Irving Fazola,"Sadness just makes me sigh,
I've come to say goodbye,
Altho' I go, I've got those farewell blues.
Those farewell blues make me yearn,
That parting kiss seems to burn.
Farewell, dearie, Someday I will return.
Dreaming of you is sweet,
Someday again we'll meet.
 

",Farewell Blues
Irving Fazola,"Everything is set, skies are blue,
Can't believe it yet, but it's true, 
I'll give you just one guess, 
My sweet Lorraine said ""yes""
Waiting for the time, soon to be, 
When the bells will chime merrily,
 
(I'm so happy,) when it's raining I don't miss the sun, 
For it's in my sweeties smile,
Just think that I'm the lucky one 
Who will lend her down the aisle
Each night I pray 
That nobody steals her heart away, 
Just can't wait until that happy day,
When I marry sweet Lorraine
 
Everything is set, skies are blue,
Can't believe it yet, but it's true, 
I'll give you just one guess, 
My sweet Lorraine said ""yes""
Waiting for the time, soon to be, 
When the bells will chime merrily,
 
(I'm so happy,) when it's raining I don't miss the sun, 
For it's in my sweeties smile,
Just think that I'm the lucky one 
Who will lend her down the aisle
Each night I pray 
That nobody steals her heart away, 
Just can't wait until that happy day,
When I marry sweet Lorraine",Sweet Lorraine
Irving Fields,"I hate to see that evening sun go down
I hate to see that evening sun go down
Cause my baby, he's gone left this town

Feelin' tomorrow like I feel today
If I'm feelin' tomorrow like I feel today
I'll pack my truck and make my give-a-way

St. Louis woman with her diamond ring
Pulls that man around by her, if it wasn't for her and her
That man I love would have gone nowhere, nowhere

I got the St. Louis blues, blues as I can be
That man's got a heart like a rock cast in the sea
Or else he wouldn't have gone so far from me

I love my baby like a school boy loves his pie
Like a Kentucky colonel loves his mint 'n rye
I love my man till the day I die",St. Louis Blues
Irving Fields,"I love you much too much
I've known it from the start
But yet my love is such
I can't control my heart

I love you much too much
I ask myself what for
Then, darling, when we touch
Mm, I love you more

Perhaps I hold your heart too tightly
But who am I to say
If I should hold it lightly
It might slip away

I love you much too much
You've never really known
I love you oh so much
I'm yours alone.

I love you much too much, I love you much too much
I've known it from the start, right from the start
But yet my love is such,
I can't control my heart

I love you much too much
I love you too much oh my dear
I've known it from the start
But, but, but my love is such
I can't control my heart

Perhaps I hold your heart too tightly
But who am I to say
If I should hold it lightly
It might slip away

I love you much too much
You've never really known
Oh no, oh no you've never known
I love you oh so much, so much
I'm yours alone, alone.",I Love You Much Too Much
Irving Joseph,"When they begin the beguine
It brings back the sound of music so tender
It brings back a night of tropical splendor
It brings back a memory ever green

I'm with you once more under the stars
And down by the shore an orchestra's playing
And even the palms seem to be swaying
When they begin the beguine

To live it again is past all endeavor
Except when that tune clutches my heart
And there we are, swearing to love forever
And promising never, never to part

What moments divine, what rapture serene
Till clouds came along to disperse the joys we had tasted
And now when I hear people curse the chance that was wasted
I know but too well what they mean

So don't let them begin the beguine
Let the love that was once a fire remain an ember
Let it sleep like the dead desire I only remember
When they begin the beguine

Oh yes, let them begin the beguine, please make them play
Till the stars that were there before return above you
Till you whisper to me once more, ""Darling, I love you""
Then we suddenly know what heaven we're in
When they begin the, begin the, begin the beguine

When they begin the, begin the, begin the beguine
When they begin the beguine",Begin the Beguine [From Jubilee]
Irving Joseph,"I know too well that I'm just wasting precious time
In thinking such a thing could be
That you could ever care for me
I'm sure you hate to hear
That I adore you, dear
But grant me

Just the same
I'm not entirely to blame
For love
You'd be so easy to love
So easy to idolize
All others above
So worth the yearning for
So swell to keep every home fire burning for

We'd be so grand at the game
So carefree together
That it does seem a shame
That you can't see
Your future with me
Cause you'd be oh, so easy to love",Easy to Love
Irving Joseph,"I've got you under my skin.
I've got you deep in the heart of me.
So deep in my heart that you're really a part of me.
I've got you under my skin.
I'd tried so not to give in.
I said to myself, this affair never will go so well.
But why should I try to resist when, baby, I know down well
I've got you under my skin?

I'd sacrifice anything come what might
For the sake of havin' you near
In spite of a warnin' voice that comes in the night
And repeats, repeats in my ear,
Don't you know, you fool, you never can win?
Use your mentality, wake up to reality.
But each time that I do just the thought of you
Makes me stop before I begin
Cause I've got you under my skin.

I would sacrifice anything come what might
For the sake of havin' you near
In spite of the warning voice that comes in the night
And repeats, how it yells in my ear,
Don't you know, you fool, ain't no chance to win
Why not use your mentality, get up, wake up to reality?
And each time I do just the thought of you
Makes me stop just before I begin
Cause I've got you under my skin.
And I like you under my skin.",I've Got You Under My Skin [From Born To Dance]
Irving Joseph,"In the still of the night
As I gaze out of my window
At the moon in it's flight
My thoughts all stray, stray to you

In the still of the night
While the world lies in slumber
Oh the times without number
When I say to you

Do you love me
Just like I love you
Are you my life to be
That dream come true
Or will this dream of mine
Will it fade way out of sight

Just like that moon growing dim
Way out on the rim of the hill
In the still of the night",In the Still of the Night [From Rosalie]
Irving Joseph,"The night is young, the skies are clear 
So if you want to go walking, dear, 
It's delightful, it's delicious, it's de-lovely. 
I understand the reason why 
You're sentimental, 'cause so am I, 
It's delightful, it's delicious, it's de-lovely. 
You can tell at a glance 
What a swell night this is for romance, 
You can hear dear Mother Nature 
Murmuring low, 
""Let yourself go!"" 

So please be sweet, my chickadee, 
And when I kiss you, just say to me, 
""It's delightful, it's delicious, 
It's delectable, it's delirious, 
It's dilemma, it's delimit, it's deluxe, 
It's de-lovely"". 

I feel a sudden urge to sing 
The kind of ditty that invokes the spring. 

I'll control my desire to curse 
While you crucify the verse. 

This verse I started seems to me 
The Tin-Pantithesis of a melody

So spare us all the pain, 
Just skip the darn thing and sing the refrain

Mi, mi, mi, mi, 
Re, re, re, re, 
Do, sol, mi, do, la, si. 

The night is young, the skies are clear 
So if you want to go walking, dear, 
It's delightful, it's delicious, it's de-lovely. 
I understand the reason why 
You're sentimental, 'cause so am I, 
It's delightful, it's delicious, it's de-lovely. 
You can tell at a glance 
What a swell night this is for romance, 
You can hear dear Mother Nature 
Murmuring low, 
""Let yourself go!"" 

So please be sweet, my chickadee, 
And when I kiss you, just say to me, 
""It's delightful, it's delicious, 
It's, it's de-lovely"".","It's De-Lovely [Red, Hot and Blue]"
Irving Joseph,"You'd be so nice to come home to
You'd be so nice by the fire
While the breeze on high, sang a lullaby
You'd be all my heart could desire

Under stars chilled by the winter
Under an August moon shining above
You'd be so nice, you'd be paradise
To come home to and love

Under stars chilled by the winter
Under an August moon burning above
You'd be so nice, you'd be paradise
To come home to and love",You'd Be So Nice to Come Home To [From Something to Shout About]
Irving Joseph,"At words poetic, I'm so pathetic
That I always have found it best,
Instead of getting 'em off my chest,
To let 'em rest unexpressed.
I hate parading my serenading
As I'll probably miss a bar,
But if this ditty is not so pretty,
At least it'll tell you how great you are.

You're the top! You're the Colosseum,
You're the top! You're the Louvre Museum,
You're a melody from a symphony by Strauss,
You're a Bendel bonnet, a Shakespeart sonnet,
You're Mickey Mouse.
You're the Nile, You're the Tow'r of Pisa,
You're the smile on the Mona Lisa.
I'm a worthless check, a total wreck, a flop,
But if, Baby, I'm the bottom,
You're the top!

Your words poetic are not pathetic
On the other hand, boy, you shine
And I can feel after every line
A thrill divine down my spine.
Now gifted humans like Vincent Youmans
Might think that your song is bad,
But for a person who's just rehearsin'
Well I gotta say this my lad:

You're the top! You're Mahatma Ghandi.
You're the top! You're Napolean brandy.
You're the purple light of a summer night in Spain,
You're the National Gall'ry, You're Garbo's sal'ry,
You're cellophane.
You're sublime, You're a turkey dinner.
You're the time of the Derby winner.
I'm a toy balloon that is fated soon to pop.
But if, Baby, I'm the bottom,
You're the top!

You're the top! You're a Ritz hot toddy.
You're the top! You're a Brewster body.
You're the boats that glide on the sleepy Zuider Zee,
You're a Nathan Panning, You're Bishop Manning,
You're broccoli.
You're a prize, You're a night at Coney,
You're the eyes of Irene Bordoni,
I'm a broken doll, a fol-de-rol, a blop,
But if, Baby, I'm the bottom,
You're the top.

You're the top! You're an Arrow collar.
You're the top! You're a Coolidge dollar.
You're the nimble tread of the feet of Fred Astaire,
You're an O'Neill drama, You're Whistler's mama,
You're Camembert.
You're a rose, You're Inferno's Dante,
You're the nost of the great Durante.
I'm just in the way, as the French would say
""De trop,""
But if, Baby, I'm the bottom,
You're the top.

You're the top! You're a Waldorf salad.
You're the top! You're a Berlin ballad.
You're a baby grand of a lady and a gent.
You're an old dutch master, You're Mrs. Aster,
You're Pepsodent.
You're romance, You're the steppes of Russia,
You're the pants on a Roxy usher.
I'm a lazy lout that's just about to stop,
But if Baby, I'm the bottom,
You're the top!

You're the top! You're a dance in Bali.
You're the top! You're a hot tamale.
You're an angel, you simply too, too, too divine,
You're a Botticelli, You're Keats, You're Shelley,
You're Ovaltine.
You're a boon, You're the dam at Boulder,
You're the moon over Mae West's shoulder.
I'm a nominee of the G.O.P. or GOP,
But if, Baby, I'm the bottom,
You're the top!

You're the top! You're the Tower of Babel.
You're the top! You're the Whitney Stable.
By the River Rhine, You're a sturdy stein of beer,
You're a dress from Saks's, You're next year's taxes,'
You're stratosphere.
You're my thoist, You're a Drumstick Lipstick,
You're the foist in the Irish svipstick,
I'm a frightened frog that can find no log to hop,
But if, Baby, I'm the bottom,
You're the top!",You're the Top [From Anything Goes]
Irving Kaufman,"There's a time each year
That we always hold dear
Good old summertime
With the birds and the trees'es
And sweet scented breezes
Good old summertime
When your day's work is over
Then you are in clover
And life is one beautiful rhyme
No trouble annoying
Each one is enjoying
The good old summertime

In the good old summertime
In the good old summertime
Strolling through a shady lane
With your baby mine
You hold her hand and she holds yours
And that's a very good sign
That she's your tootsey-wootsey
In the good, old summertime

Oh, to swim in the pool
You'd play hooky from school
Good old summertime
You'd play ""ring-a-rosie""
With Jim, Kate and Josie
Good old summertime
Those days full of pleasure
We now fondly treasure
When we never thought it a crime
To go stealing cherries
With faces brown as berries
In good old summertime

In the good old summertime
In the good old summertime
Strolling through a shady lane
With your baby mine
You hold her hand and she holds yours
And that's a very good sign
That she's your tootsey-wootsey
In the good, old summertime",In the Good Old Summertime
Irving Kaufman,"When a girl has the heart of a mother
It must go to someone of course
It can't be sister or brother
And so I love my horse
But horses are frequently silly
Mine ran from the beach of Okhala
And left me alone for a filly
So I have picked you up

I'm a sentimental sap, that's all
What's the use of trying not to fall?
I have no will, you've made your kill
Cause you took advantage of me
I'm just like an apple on a bough
And you're gonna shake me down somehow
So, what's the use, you've cooked my goose
Cause you took advantage of me

I'm so hot and bothered that
I don't know my elbow from my ear
I suffer something awful each time
You go and much worse when you're near
Here I am with all my bridges burned
Just a babe in arms where you're concerned
So lock the doors and call me yours
Cause you took advantage of me.

I'm a sentimental sap, that's all
What's the use of trying not to fall?
I have no will, you've made your kill
Cause you took advantage of me
I'm just like an apple on a bough
And you're gonna shake me down somehow
So, what's the use, you've cooked my goose
Cause you took advantage of me

I'm so hot and bothered that
I don't know my elbow from my ear
I suffer something awful each time
You go and much worse when you're near
Here I am with all my bridges burned
Just a babe in arms where you're concerned
So lock the doors and call me yours
Cause you took advantage of me
You took advantage of me",You Took Advantage of Me [From Present Arms]
Irving Mills,"It isn't alcohol no yaller gal at all 
thrills me fills me with the pep I've got

I've got a pair of feet
That found a low down beat
Low down, down around a spot that's hot!

I've got no peace
I'm losin' my lease on livin'
Here's the how?
I'm tellin' you now to give in!

Oh, make 'em play that crazy thing again
I've gotta do that lazy swing again.
Heigh, ho, doin' the new low down.

I got my feet to misbehavin' now,
I got a soul that's not for savin' now.
Heigh, ho, doin' the new low down.

That dancin' demon has my feet in a trance,
'cause while I'm dreamin'
I go into that dance

And once you hear the haunting strain to it,
I'd like to bet you'll go insane to it.
Heigh, ho, doin' the new low down.
",Doin' the New Low Down [Vocal Version]
Irwin Goodman,"Maailma on kaunis ja hyvä elää sille
Jolla on aikaa ja tilaa unelmille
Ja mielen vapaus, ja mielen vapaus
On vapautta kuunnella metsän huminoita
Kun aamuinen aurinko kultaa kallioita 
Ja elää elämäänsä, ja elää elämäänsä
On vapautta valvoa kesäisiä öitä ja katsella hiljaisen haavan värinöitä 
Ja elää elämäänsä, ja elää elämäänsä
Maailma on kaunis ja hyvä elää sille 
Jolla on aikaa ja tilaa unelmille 
Ja mielen vapaus, ja mielen vapaus
On vapautta istua iltaa yksinänsä
Ja tuntea tutkia omaa sisintänsä 
Ja elää elämäänsä, ja elää elämäänsä
On vapautta vaistota viesti suuremmasta 
Ja olla kuin kaikua aina jatkuvasta
Ja elää elämäänsä, ja elää elämäänsä
Maailma on kaunis ja hyvä elää sille jolla on aikaa ja tilaa unelmille 
Ja mielen vapaus, ja mielen vapaus",Maailma on kaunis
Irwin Goodman,"Saat multa horsman
Se rentun ruusu on
(rentun ruusu on)
Sen poimin tuolta maantien ojasta
Saat multa horsman
Se rentun ruusu on
(rentun ruusu on)
Kuin juoppolalli tuli pojasta

Olen viikon ollut tiettömällä tiellä
Rapakosta krapulassa heräsin
Eivät ruusut kuki eikä tuoksu siellä
Yhden horsman mukaan keräsin

Sinne maantien ojaan viimein taju sammui
Niin kuin sika röhkin kuravedessä
Sittisontiainen pörräs lehmä ammui
Paluu arkeen oli edessä

Saat multa horsman
Se rentun ruusu on
(rentun ruusu on)
Sen poimin tuolta maantien ojasta

Tämä horsmankukka on kuin antajansa
Rikkaruoho elon yrttitarhassa
Voiko muuta tuoda renttu reissultansa
Hortoiltuaan kauan harhassa
Tämän lahjan annan silti sydämestä
Niin kuin anteekspyynnön katumuksenkin
Pian se kuihtuu ei se maljakossa kestä
Niin käy joka lupauksenkin

Saat multa horsman
Se rentun ruusu on
(rentun ruusu on)
Sen poimin tuolta maantien ojasta

Saat multa horsman
Se rentun ruusu on
(rentun ruusu on)
Sen poimin tuolta maantien ojasta",Rentun ruusu
Irwin Goodman,"Olet maamme armahin Suomenmaa!
Ryysyranta.

Siellä on kirppuja, luteita, täitä
Seassa lapsia pellavapäitä
Itkua, parkua jatkuvaa,
olet maamme armahin Suomenmaa.
Pirtti on ainoa viljelyssarka
Satoa kantaa saa emäntäparka.
Ihanuuksien ihmemaa!

Minkä Jooseppi kylvää
Sen vaimo taas niittää,
On pirtissä Joosepin elämäntyö.
Siinä yhdelle miehelle touhua riittää,
niin pitkä on Pohjolan valoisa yö. 

Olet maamme armahin Suomenmaa!
Ryysyranta.

Siellä ei kuljeta pihalle asti,
nurkkaan vain lasketaan kumpikin lasti,
Hajua, lemua jatkuvaa.
Olet maamme armahin Suomenmaa
""Syö mitä saat"" on elämisen ehto,
Tyhjänä milloinkaan seiso ei kehto.
Ihanuuksien ihmemaa! 

Minkä nuorena oppii,
sen vanhana taitaa.
Sen vilkaisu kamariin voi vahvistaa.
koska vaimokin pitää vain risaista paitaa,
Se vanhankin vielä niin nuoreksi saa. 

Olet maamme armahin Suomenmaa!
Ryysyranta. 

Limppuunkaan ei riitä puhdasta ruista,
jauho on sekoitettu Kainuun puista.
Havupuusetsuurin ravittaa,
olet maamme armahin Suomenmaa.
Siellä on tupajumiyhdyskunta,
kaikki kuin pahinta painajaisunta,
Ihanuuksien ihmemaa! 

Koska lehmä ei lypsä
niin tyhjä maitokannu
ois muuten ehkä ruostunut kokonaan,
mutta siitä on värkätty pontikkapannu,
Iloa murheisiin tiputtelemaan. 

Olet maamme armahin Suomenmaa!
Ryysyranta.",Ryysyranta
