Band,Lyrics,Song
George Nascimento,"Once in your life you find her
Someone that turns your heart around
And next thing you know you're closing down the town
Wake up and it's still with you
Even though you left her way across town
Wondering to yourself, ""Hey, what've I found?""

When you get caught between the Moon and New York City
I know it's crazy, but it's true
If you get caught between the Moon and New York City
The best that you can do
The best that you can do is fall in love

Arthur he does as he pleases
All of his life, he's mastered choice
Deep in his heart, he's just, he's just a boy
Living his life one day at a time
And showing himself a really good time
Laughing about the way they want him to be

When you get caught between the Moon and New York City
I know it's crazy, but it's true
If you get caught between the Moon and New York City
The best that you can do,
The best that you can do is fall in love

When you get caught between the Moon and New York City
I know it's crazy, but it's true
If you get caught between the Moon and New York City
The best that you can do,
The best that you can do is fall in love",Arthur's Theme (Best That You Can Do)
George Nascimento,"I feel so unsure
As I take your hand and lead you to the dance floor
As the music dies, something in your eyes
Calls to mind the silver screen
And all its sad good-byes

I'm never gonna dance again
Guilty feet have got no rhythm
Though it's easy to pretend
I know you're not a fool

Shoulda known better than to cheat a friend
And waste this chance that I've been given
So I'm never gonna dance again
The way I danced with you

Tonight the music seems so loud
I am wishing that we could lose this crowd
But maybe it's better this way
We hurt each other with the things we wanna say

We could have been so good together
We could have danced this dance forever
But no one's gonna dance with me
Please stay

I'm never gonna dance again
Guilty feet have got no rhythm
Though it's easy to pretend
I know you're, know you're not a fool

I shoulda known better than to cheat a friend
And waste this chance that I've been given
So I'm never gonna dance again
The way I danced with you",Careless Whisper
George Nascimento,"Tell him what you know thought you had me
But I let it go
And now I'm gonna take down the whole thing
Everything is going down with me
Thought you told him everything
Left out a little bit about yourself
And I found out from your best friend
I think its time that I filled him in
And now I'm gonna take down the whole thing
Everything is going down
With me


You know to much keep it to yourself
So much at stake but you don't give a damn
And now it's coming back on you
You keep on pushing baby can't you see
Always try but your never gonna get to me
I'll make sure this time


Tell him what you know I thought you had me
But you let me go
Can't take it anymore cause
I got so much I've been saving up


Everyone's gonna drown in it",Crazy for You
George Nascimento,"Remember when the days were long
And rolled beneath a deep blue sky
Didn't have a care in the world
With mommy and daddy standing by

When ""happily ever after"" fails
And we've been poisoned by these fairy tales
The lawyers dwell on small details
Since daddy had to fly

But I know a place where we can go
That's still untouched by man
We'll sit and watch the clouds roll by
And the tall grass wave in the wind

You can lay your head back on the ground
And let your hair fall all around me
Offer up your best defense
But this is the end

This is the end of the innocence
O' beautiful, for spacious skies
But now those skies are threatening
They're beating plowshares into swords

For this tired old man that we elected king
Armchair warriors often fail
And we've been poisoned by these fairy tales
The lawyers clean up all details

Since daddy had to lie
But I know a place where we can go
And was away this sin
We'll sit and watch the clouds roll by

And the tall grass wave in the wind
Just lay your head back on the ground
And let your hair spill all around me
Offer up your best defense

But this is the end
This is the end of the innocence
Who knows how long this will last
Now we've come so far, so fast

But, somewhere back there in the dust
That same small town in each of us
I need to remember this
So baby give me just one kiss

And let me take a long last look
Before we say good bye
Just lay your head back on the ground
And let your hair fall all around me

Offer up your best defense
But this is the end
This is the end of the innocence",The End of the Innocence
George Nascimento,"She packed my bags last night, preflight
Zero hour, nine a.m.
And I'm gonna be high
As a kite by then

I miss the earth so much
I miss my wife
It's lonely out in space
On such a timeless flight

And I think it's gonna be a long, long, time
'Til touchdown brings me 'round again to find
I'm not the man they think I am at home
Ah, no no no
I'm a rocket man
Rocket man
Burnin' out his fuse
Up here alone

Mars ain't the kind of place
To raise your kids
In fact, it's cold as hell
And there's no one there to raise them
If you did

And all this science
I don't understand
It's just my job
Five days a week
A rocket man
Rocket Man

And I think it's gonna be a long, long, time
'Til touchdown brings me 'round again to find
I'm not the man they think I am at home
Ah, no no no

And I think it's gonna be a long, long, time
'Til touchdown brings me 'round again to find
I'm not the man they think I am at home
Ah, no no no...
I'm a rocket man
Rocket man
Burnin' out his fuse
Up here alone

And I think it's gonna be a long, long, time
And I think it's gonna be a long, long, time
And I think it's gonna be a long, long, time

Long, long, time
Long, long, time

Ah, no, no, no...
Oh, no, no, no, no, no, no, no...",Rocket Man
George Nozuka,"Goodbye is what she said
When she said I'm sorry
And I, I'm dying on the inside
'cause I tried but I can't hide the tears
That fall from my eyes

Hold me close one more night
Hold me close one more time
Hold me close 'cause I'm dyin on the inside
A butterfly

hello with a little wink 
But what she think of me 
And oh she smiled
Give me her name
But who would have thought I would be crying here
With all this pain no no


Hold me close one more night baby
Hold me close one more time (just give me one more time my baby)
Hold me close 'cause I'm dyin on the inside
A butterfly

Now there's nothing I can do and
There's nothing I can say
About losing you
I wish that I could find a way, wish that I could see you again
If only I could turn back time

Hold me close one more night...
Hold me close one more time.. 
Hold me close 'cause I'm dyin on the inside (dying on the inside)
A butterfly....
",Butterfly
George Nozuka,"Can't Stop Loving You Lyrics
Artist: George Nozuka


Since you let me go
Every single day seems impossible
Just can't get you out of my mind
Everything I see brings back memories
Of you and me
Left me on my knees
Even though its been hell
I'm still begging please
And I really just wanna why

babe if you're home please pick up the phone
'cause I'm incomplete.. without you
I just can't stop loving you
I just can't stop loving you 
'cause I'm all torn up and I just can't give up
Loving you, 
I just can't stop loving you
I just can't stop loving you
'cause I'm all torn up and I just can't give up

I know you hate girl
And I know you're only doing this to
Hurt me, girl, and I'm dying inside
Tonight, I got no other choice, I need to hear your voice
To get goodbye,
If were meant to be just thought I should be happy
And I'm saying it straight from the phone
If loving you is wrong I don't wanna be right
Guess it is what it is I..

I just can't stop loving you
I just can't stop loving you (cant stop, can't can't stop)
'cause I'm all torn up and I just can't give up
Loving you, 
I just can't stop loving you
I just can't stop loving you
'cause I'm all torn up and I just can't give up loving you

there's are times I don't know what I'm suppose to do
'cause I don't like to be alone (don?t like to be alone)
Lookin at all the pictures that I have of you
I'm listening to sad love songs
Where will I go, what will I do
Who will I be if I can't be with you
Here I stand, half a man
And I'm givng my all in my hand

I just can't stop loving you
I just can't stop loving you 
(cant loving you, can't stop loving you)
'cause I'm all torn up baby and I just can't give up
Loving you, 
I just can't stop loving you can't stop loving you
I just can't stop loving you
'cause I'm all torn up and I just can't give up loving you

I just can't stop loving you
I just can't stop loving you 
'cause I'm all torn up and I just can't give up
Loving you, 
I just can't stop loving you
I just can't stop loving you
'cause I'm all torn up and I just can't give up 
(all torn up, can't give up)
(all torn up, can't give up)
",Can't Stop Loving You
George Nozuka,"I saw this girl and she was tight 
Hey, go and talk to her 
I said, Ha, alright 
So grabbed a hold of her 
Got up in those eyes 
I didn't know what to do 
Or what to say 
Caught up in those eyes 

Girl I can't take what you're doing 
You're who I'm choosing 

Oh, shake it, like you got something girl 
Oh, like you rock my world (shake it)
Rock out your body 
Rockin' your body 
Dance with me. 
Shake it (girl I want that somethin' somethin')
Oh (I want that somethin' somethin')
Shake it (give me that somethin' somethin')

Now here we are, don't turn around 
I'm not getting what I see, what's going down 
I wanna take you home where we can be alone 
What you say girl, you comin' home with me? 
So we can be alone 

Girl I can't take what you're doing 
You're who I'm choosing 
Oh, shake it, like you got something girl 
Oh, like you rock my world (shake it)
Rock out your body 
Rockin' your body 
Dance with me. 
Oh, shake it, like you got something girl 
Oh, like you rock my world (shake it)
Rock out your body 
Rockin' your body 
Dance with me. 

If you wanna ride with gee 
You better come dance with me girl 
If you wanna come back to the suite 
You better come dance with me 
Say what? 2-3-4 

Girl I can't take what you're doing 
You're who I'm choosing 
Oh, shake it, like you got something girl 
Oh, like you rock my world (shake it)
Rock out your body 
Rockin' your body 
Dance with me. 
Shake it (girl I want that somethin' somethin')
Oh (I want that somethin' somethin')
Shake it (give me that somethin' somethin')
Shake it (girl I want that somethin' somethin')
Oh (I want that somethin' somethin')
Shake it (give me that somethin' somethin')

No I can't take what you're doing 
You're who I'm choosing. 
Ugh",Dance with Me
George Nozuka,"In the middle of the night,
No one heard the boy
Who cried himself to sleep
Didn't care about himself 'cause he
Hurt too much, he was hurt too much
And the burden of the world was put
On a hurting child, hurting child
Who never smiled
The world was put on the hurting child,
Hurting child
I sing for the hurting child
I sing for the hurting child

In the middle of the fight
No one saw the girl who thought it
Was her fault, didn't know about her pain
Though it was right there
No one said they cared
And the burden of the world was put
On a hurting child, hurting child
Who never smiled
The world was put on the hurting child,
Hurting child
I sing for the hurting child

I sing for the children, dream for the children,
Cry for the children now
So I sing for the children, dream for the children,
Smile for the children now
Said the world was put
On a hurting child, hurting child
Who never smiled
The world was put on the hurting child,
Hurting child
I sing for the hurting child

I sing for the children, dream for the children,
Cry for the children now
So I sing for the children, dream for the children,
Smile for the children
...I was that hurting child
",Hurting Child
George Nozuka,"Can I play 
I said can I play 
Hey pretty with them sunshades on 

What you say tonight 
The sun is settin' and its almost dawn 
You know I am bout to say right 

You wanna hang with your crew 
Wanna dance me and you real close 
To my tempting 
You wanna hang with your crew 
Girl I'll show you what to do ya 
What do you say 
I wanna love you 
Think you can keep up with me 
I wanna love you 
Girl hold on tight 
I wanna love you 
Can't wait to tell your friends it was G 
I wanna love you all through the night 

Do other guys sing this song like me 
I can put up a fight 
Girl what you heard is true, and soon you'll see 
Were gonna be up all night 

You wanna hang with your crew 
Wanna dance me and you real close 
To my tempting 
You wanna hang with your crew 
Girl show I'll you what to do ya 
What do you say 
I wanna love you 
Think you can keep up with me 
I wanna love you 
Girl hold on tight 
I wanna love you 
Can't wait to tell your friends it was G 
I wanna love you all through the night 

So I guess this my introduction 
I wanna love you girl 
Oh oh, oh 
So can you keep up with me? 

So can I play? 

I wanna love you 
Think you can keep up with me 
I wanna love you 
Hold on, hold on, hold on baby 
I wanna love you 
Can't wait to tell your friends it was G 
I wanna love you all through the night 
All through the night 
I wanna love you 
Think you can keep up with me 
I wanna love you 
Hold on, hold on, hold on baby 
I wanna love you 
Can't wait to tell your friends it was G 
I wanna love you all through the night 
All through the night",I Wanna Love You
George Nozuka,"I'll tell you all something man
This girl man
I used to love we was together
She left, She with this other guy
Its really blowing my mind right now
George man I gotta tell you about it

I was up in the VIP section
I've seen her with her girlfriends dancin'
With her tight blue jeans and stilettos on
I thought about our last convo on the telephone
And I said girl I'm going on a tour
I'll be gone for 4 months
So why don't we just break it on off for 4 months
She said boy if you leave you so nuts
'Cause Imma just move on
And you gonna be so crushed

Never thought I'd bump into you
With another guy under your arm
Now I know that I was a fool
Fool of my girl, fool of my girl
The whole time that you were with me
My friends said I did you wrong
And now it's easy to see
It just took too long

That was the last time
'Cause the last time
I said goodbye to you
(said goodbye to you)

You may scroll down and join the discussion
Don't let him take all my love
I know it was all my fault
Give me just one more truth
It was the last time
Don't let him take all my love
I know it was all my fault
Give me just one more truth
It was the last time

You keep on blocking my calls
So now I know how it feels
And it hurts
What goes around comes around
The pain is so real
I see you two so happy
Don't know what to do (Oh)
I'm lost without you (Nooo)

It was the last time
'Cause the last time (Ohhh)
Don't wanna say goodbye (say goodbye)
Don't wanna say goodbye to you

Don't let him take all my love
I know it was all my fault
Give me just one more try
It was the last time
Don't let him take all my love
I know it was all my fault
Give me just one more try
It was the last time

Jeah, momma said
Boy she with a keeper
But now I understand
Why I'm sick with a fever
That's why I run around
With the models and divas
Drinkin' away the pain
With the henni and tequila
If I could take it all back I would
I'd take it back to the days
Where our love was all good
When I used to have you
On the bed, legs spread
Instead, I'm listening to the words you always said

On the real
Doesn't matter what's been said or done
How I feel
Don't you know that your the only one
Last time,
I took you for granted
When you were mine
Please forget about the last time
Let's talk

Don't let him take all my love
I know it was all my fault
Give me just one more try
It was the last time
Don't let him take all my love
I know it was all my fault
Give me just one more try
It was the last time

Don't let him take all my love
I know it was all my fault
Give me just one more truth
Last time
Don't let him take all my love
I know it was all my fault
Give me just one more truth
[fades..]
",Last Time
George Nozuka,"Why didn't I listen to my heart'
When she had me guessing from the start,
More and more I wonder,
Why do I still want her'
After all the love I gave to you,
All this pain and all because of you

[Chorus)
What am I supposed to do when it's all a lie'
Where am I supposed to go when it's dark outside'
What am I supposed to do when it's all a lie'
Lie to me lie to me,
Lie to me lie to me,
Lie to me lie to me one last time,

Still have those letters from last fall,
And every time the phone rings,
Wish it was your call,
More and more I wonder,
Why do I still want her'
After all the love I gave to you,
All this pain I'm in because of you,
(You, you, you, you, you)

[Chorus)
What am I supposed to do when it's all a lie'
Where am I supposed to go when it's dark outside'
What am I supposed to do when it's all a lie'
Lie to me lie to me,
Lie to me lie to me,
Lie to me lie to me one last time,

Why did you have to hide'
Loved you through all your lies
One thing I know is true
I'll never stop loving you
Lovin' you

To tell me,
What am I supposed to do when it's all a lie'
Where am I supposed to go when it's dark outside'
What am I supposed to do when it's all a lie'
Won't you Lie to me lie to me baby,
Lie to me lie to me baby,
Lie to me baby, one last time",Lie to Me
George Nozuka,"Yeahh here we go
There she is in the club on a Friday night, 
With her back against the wall,
Somethin' about this girl I can't describe
But I know that I want it
In a crowded room she stands alone 
With her back against the wall 
Biggest eyes I've ever known
Yeahh
She knows that I'm watching 
She's right were I'm walking
Every five minutes Its the second yeahh
She knows what I'm doing its no mystery to her 
I tried looking way but, 
There's that girl with the soft as sweet 
Just like sugar and she's higher then me 
Somethings going down that somethin' somethin' now 
There's that girl with the softest smile 
Ain't gonna stop till the somethin's mine
Stand up baby please
And drop the somethin' somethin' on me
Drop your pants if you feel right 
Because you know were going to rock through the whole night
Drop your pants if you feel right
Does it feel right
You...
Gotta see this girl with your one two eyes
With her back up against the wall
Its the way she moves from side to side 
She's got me hipnotized
Its hard to focice 
Not to notice
When her backs up against the wall
She's all up onto me
Yeahh you know that's cool with me 
She knows that I'm watching 
She's right were I'm walking
Every five minutes Its the second yeahh
She knows what I'm doing its no mystery to her 
I tried looking way but, 
There's that girl with the soft as sweet 
Just like sugar and she's higher then me 
Somethings going down that somethin' somethin' now 
There's that girl with the softest smile 
Ain't gonna stop till the somethin's mine
Stand up baby please
And drop the somethin' somethin' on me...
You wanna know what she's like?...
Okay...
She goes like this...
She's like boom boom boom boom
She's like nair nair nair nair
She's like Bair.. Bair..Bair Bair
She's like Ohhhh Yeahh Ahhhhhaaaa!
There's that girl with the soft as sweet
Just like sugar and she's higher then me 
Somethings going down that somethin' somethin' now 
There's that girl with the softest smile 
Ain't gonna stop till the somethin's mine
Stand up baby please
And drop the somethin' somethin' on me
There's that girl with the soft as sweet
Just like sugar and she's higher then me 
Somethings going down that somethin' somethin' now 
There's that girl with the softest smile 
Ain't gonna stop till the somethin's mine
Stand up baby please
And drop the somethin' somethin' on me
There's that girl with the soft as sweet
Just like sugar and she's higher then me 
Somethings going down that somethin' somethin' now 
There's that girl with the softest smile 
Ain't gonna stop till the somethin's mine
Stand up baby please
And drop.. And drop the somethin' somethin' on me
",Somethin' Somethin'
George Nozuka,"Let me start with a soft caress 
Wanna show you I'm not like the rest 
So put me to the test 
Anything that you feel let it go 
Wanna take things nice and slow 
So baby lose control 
I want this, want that 
I want anything, anything 

So let's stay up tonight 
Girl that's all 
Let me sing you a song 
So let's stay up tonight 
Girl that's all 
Let me sing you this song 
'cause it's all about love tonight 
It's all you see 
So stay up with me tonight 

So come make it right next to me 
Let me show you what love can be 
I'll kiss the lips softly 
I'm lookin' you right in the eyes 
Girl I slowly go deep inside 
Your heart is what I mean 
'Cause I want this, want that 
I want anything, anything 

So let's stay up tonight 
Girl that's all 
Let me sing you a song 
So let's stay up tonight 
Girl that's all 
Let me sing you this song 
'Cause it's all about lovin' tonight 
It's all you see 
So stay up with me tonight, oh 

It's all about you and me 
That's right (that's right) 
That's right (that's right) 
This it what it means to me 

So don't leave me (don't leave me) 
Don't leave me 
I need this just as bad as you do
So don't leave me 
Don't leave me 
Tonight 

(Oh) 
So let's stay up tonight 
Girl that's all 
Let me sing you a song 
So let's stay up tonight 
Girl that's all 
Let me sing you this song 
'Cause it's all about lovin' tonight 
It's all you see 
So stay up with me 

So let's stay up tonight 
Girl that's all 
Let me sing you a song 
So let's stay up tonight 
Girl that's all 
Let me sing you this song 
'Cause it's all about lovin' tonight 
It's all you see 
So stay up with me tonight 

Baby baby 
It's all you see 
So stay up with me all night",Stay Up
George Nozuka,"4 o'clock in the morning, I'm chilling with some friends
Before the club we're hanging out until this girl walked in
Caught me by surprise when she didn't say hello
Had an attitude, why be so rude I know just what to do
Pulled the girl aside and politely gave my name
Told the girl don't act this way
I see right through your game
What he did was such a shame
Don't be living with his pain

So let it go tonight
I see the beauty within your eyes
So let it go tonight

I never thought that it would be me
How could I be such a fool, oh?
And here I am saying girl I'm sorry
For something I didn't do, this is my point of view
Baby I never meant to fall for her
Lately it's been driving me crazy
Baby, baby, you still and always will be my baby
Oh yeah

It's 4 o'clock in the morning and it didn't take too long
For the girl to change her tune and now she's singing a different song
She's all up on me, kissing on me, grinding on me
What's a guy to when his brain is all muted
Baby I'm not that guy
I already got that someone in my life
Baby I'm not that guy

I never thought that it would be me
How could I be such a fool, oh?
And here I am saying girl I'm sorry
For something I didn't do, this is my point of view
Baby I never meant to fall for her
Lately it's been driving me crazy
Baby, baby, you still and always will be my baby
Oh yeah

I let her in but only for a minute girl
She was up in my mind
But it was you I found a start
You'll always have my heart
Say my heart

I never thought that it would be me
How could I be such a fool, oh?
And here I am saying girl I'm sorry
For something I didn't do, this is my point of view
Baby I never meant to fall for her
Lately it's been driving me crazy
Baby, baby, you still and always will be my baby
Oh yeah

I never thought that it would be me
How could I be such a fool, oh?
And here I am saying girl I'm sorry
For something I didn't do, this is my point of view
Baby I never meant to fall for her
Lately it's been driving me crazy
Baby, baby, you still and always will be my baby
Oh yeah",Such a Fool
George Nozuka,"I wanna take you home, to my place
Share my dreams and my fantasies, I can't wait
I wanna show you things, that you ain't never seen before
Girl I keep crying, crying out for more.

Talk to me, talk to me, am I doing this right.
Talk to me, talk to me, I am feelin' all right
I've been waiting for this my whole life, and here you are tonight
I've been waiting for this my whole life, and I can see it in your eyes
Are you ready to stay the whole night? To see the morning lights

I been waiting, and waiting, and waiting, my whole life.




So now, here we are, turn the lights down low

Oh we can go fast, or should I go slow?

I wanna kiss your lips, is that ok?

I'm that guy, I'm that guy baby, you'll be callin' out my name, sing it to me now.

Talk to me, talk to me, am I doing this right.
Talk to me, talk to me, I am feelin' all right, (sing it)
I've been waiting for this my whole life, and here you are tonight (here you are tonight)
I've been waiting for this my whole life, and I can see it in your eyes
Are you ready to stay the whole night? To see the morning lights

I been waiting, and waiting, and waiting, my whole life.

I wanna cater to you
No, nothing I wouldn't do
I tried to find words to say, I've never felt love in this way, this way

I've been waiting for this my whole life, and here you are tonight (here you are tonight)
I've been waiting for this my whole life and I can see it in your eyes
Are you ready to stay the whole night? To see the morning lights 
I been waiting, and waiting, and waiting

My whole life.",Talk to Me
