Band,Lyrics,Song
McAlmont & Butler,"Blue come today 
Put color on the trees and on the ground 
Blue come today 
Shine on the town and turn the blues around 
Save London from the grey and all the brown 

I wanna walk you through a summer's day 
I want the clouds to leave the town 
I need the sun to make a stand today 
Now that everybody looks so down 

I'm begging you  
Blue come today 
The wind so cold don't wanna be outside 
Blue be winter's grave 
Shine on the town and turn the blues around 
Shine on the town and turn my life around 

I wanna walk you through a summer day 
I want the clouds to leave the town 
I need the sun to make a stand today 
Now that everybody looks so down 

I'm begging you 
Blue, blue, blue, blue 
Shine on the town 

I wanna walk you through a summer day 
I want the clouds to leave the town 
I need the sun to make a stand today 
Now that everybody looks so down 

I'm begging you 
Blue, blue, blue, blue. 

Shine on the town, Shine on the town 
Shine on the town, Shine on the town 

Blue",Blue
McAlmont & Butler,"I never wanted to hear you say goodbye 
And I wondered why 
I had to let you go and dry my eyes 
My weeping eyes 
Try to figure what was wrong with me 
What was wrong with me? 
But I'm glad you're back now baby 
Now that we can complete what we started 

Bring it back bring it all back, bring it back do it like that 
Bring it we got nothing to lose, I wanna see ya 
Bring it back bring it all back, bring it back do it like that 
Bring it we got nothing to lose, I wanna see ya soon 

It's been oh such a long time 
But a change's gonna come 

It's been a long time but I'm glad it's over now 
We said so many foolish things and how 
It's over now 
And the sun came out the moment you called Â­ I'm glad you called 
I'm gonna be whatever you want me 
So if you wanna we can try to 

[Chorus]

And I don't care what anyone says 
People gonna say what they're gonna say 
So if you wanna try we can start it over 
And I don't care what anyone says 
People gonna say what they're gonna say 
So if you wanna try we can start it over, over 

Bring it back bring it all back, bring it back do it like that 
Bring it we got nothing to lose, I wanna see ya soon 
Yeah 
Bring it all back Bring it all back yeah, bring it all back Bring it all back yeah 
'Cause I don't care I don't care, I don't care I don't care",Bring It Back
McAlmont & Butler,"Keep trying, keep keep on trying 
Keep trying, keep keep on trying 

Everybody's saying 
What can we do to make it better? 
Day out and day in 
We're standing on the edge of forever 

Can we make it? Can we try? 
Can we make it? Can we make it right? 

And the news just keeps on breaking Â­ 
It's breaking now more than ever 
Everybody aiming 
To be a name and not a number 

Can we make it? Can we try? 
Can we make it? Can we make it right? 
Can we make it? Can we make it right? 

Who really cares what clothes we wear 
Who styles our hair 
Or what goes on in our heads, tell me 
Who really cares what books we've read 
What boots we wear 
All that matters is we are there 
We are there, you can count me in 

Keep on trying, Keep on trying 

Can we make it? Can we make it right? 
One more time 

Don't you spend your time now wandering about forever 
Day in and day outÂ  now Don't you waste Don't you waste Don't you wasteâ?¦ 

Can we make it? Can we make it right? 
Can we make it? Can we make it right? 
You've gotta rock 'n roll you gotta save your soul 
You gotta make it right, you gotta work through the night 
You gotta move on up, you gotta get on down 
Spinning round and round and round",Can We Make It?
McAlmont & Butler,"Well I do the best I can 
Try to improve the way I am 
I work hard but when things get slow 
I please my love the only way I know 

Now mama said it'll never pay 
Get a proper job Â­ it's the only way 
But I keep reaching for the stars 
But with my feet on the ground they just seem so far 

We paint with different strokes 
From time to time we're broke 
But I'm a simple man 
Take me for what I am 

I didn't mean to keep the money I made 
I really meant to pay you back some day 
But how could I make you feel like a star 
Without my credit card and my big flash car 

Now mama said it'll never pay 
Be like everyone else Â­ it's the only way 
But I believe in what you are 
There ain't a man on the planet who don't wanna be a star 

We paint with different strokes 
From time to time we're broke 
But I'm a simple man 
Take me for what I am 

We paint with different strokes 
From time to time we're broke 
But I'm a simple man 
Take me for what I am - what I am",Different Strokes
McAlmont & Butler,"Feeling lost and I don't wanna be here 
Burning up inside the atmosphere 
If I should spread my wings I could fly away 
But I don't wanna stay up here all night 

And if you take my hand, you could take command 
Can't you hear me calling I'm falling 
Won't you take my hand, won't you understand? 
Can't you hear me calling I'm falling 

See the world below and I'm floating by 
All alone here in the fearless sky 
Feeling weightless please don't let me go 
Cause I need you so, tonight, tonight 
Â  
If you take my hand, you could take command 
Can't you hear me calling I'm falling 
Won't you take my hand, won't you understand? 
Can't you hear me calling I'm falling 

The sky at night is cool when your feet are on the ground 
But I need your sense of gravity 
Something to pull me down 

Aha 
Aah 
Ooh 
Falling 

If you take my hand, you could take command 
Can't you hear me calling I'm falling 
Won't you take my hand, won't you understand? 
Can't you hear me calling I'm falling 
For you ahh yeah 
Falling 
For you 
Â ",Falling
McAlmont & Butler,"This conversation isn't working for me 
Eye to eye is something we'll never see 
There's nothing else that I really wanna do 
Maybe I'm crazy but I ain't getting through 

Tell me why can't we try 
And make the right decision 
Just one decision 
Tell me why can't we try 
And make the right decision 
Make the right one 

My own indifference is getting to me 
I'm not aching for your sympathy 
Baby my worst easily matched your best 
I tried it on but you're not easily impressed 

Tell me why can't we try 
And make the right decision 
Just one decision 
Tell me why can't we try 
And make the right decision 
Make the right one 

Tell me why can't we try 
And make the right decision 
Just one decision 
Tell me why can't we try 
And make the right decision 
Make the right one 
Tell me why can't we try 
And make the right decision 
Just one decision 
Tell me why can't we try 
And make the right decision 
Make the right one",Make It Right
McAlmont & Butler,"One day I met a guy 
He had sunshine in his eyes 
Pretty soon I was hypnotized 
Completely open 

Then he smiled and he said Hi 
And I thought ooh He's such a child 
But I was hooked 
Was in a bind 
And I was taken 

Whithersoever you go I will follow 
Whithersoever you go I will follow 
I will follow yes I will yes I will 
I will follow yes I will yes I will 

We drove when we were wired 
After talking through the night 
It was good to find somebody else as crazy 
And when the thunder made him high 
He was a tripped out spirit child 
Awake for four days at a time 
How he amazed me 

Whithersoever you go I will follow 
Whithersoever you go I will follow 
I will follow yes I will yes I will 
I will follow yes I will yes I will",Sunny Boy
McBee,"Everywhere I go
When everyone who knows me
Knows that I would stand alone
It's all part of the game
The game, the game, the game

When you said I could move on and go
You said I'm weak and it shows
I couldn't go on without you
Now you're sitting in your house alone
Wondering why I left home
And I'm hoping that you know

Had to fake it till I made it
And you try to break it
Now you try to take it back
But you know that
I've been doing my thing
I've been running my game
And you know I won't look back

Everywhere I go
When everyone who knows me
Knows that I would stand alone
It's all part of the game
The game, the game, the game

I'm standing on my toes
To the sky I go
And you know you're the one to think
It's all part of the game
The game, the game, the game
We all play it the same

As you looked, you saw me walking out
You tried to knock me down
I would go on without you
Now you're sitting in the mess you made
Now you're feeling my pain
And I'm hoping that you know that

I'm stronger cause you made me
You will never faze me
You can never take me down
'Cause you know that
I've been doing my thing
I've been running my game
And you know I won't look back
You know that

Everywhere I go
When everyone who knows me
Knows that I would stand alone
It's all part of the game
The game, the game, the game

I'm standing on my toes
To the sky I go
And you know you're the one to think
It's all part of the game
The game, the game, the game
We all play it the same

Everywhere I go
When everyone who knows me
Knows that I would stand alone
It's all part of the game
The game, the game, the game

I'm standing on my toes
To the sky I go
And you know you're the one to think
It's all part of the game
The game, the game, the game
We all play it the same",In the Game
McBusted,"I never was a cool kid
No one ever really gave a damn what I did
Liked to party, but I never got invited
Alone again so, me, myself and I

Tried karaoke
But they told me I was only ok
I guess I never should have sang Beyonce
So I dropped the mic

Oh yeah
All the people in the bar turned round and stared
I was on my knees and whipping round my hair
And I knew that I was winning

Close my eyes and see the crowd
But my fingers don't make any sound
My air guitar

I keep it with me night and day
You won't believe the way that I can play
My air guitar
Air guitar
Like this

Bom chicka wah wah

In my head I am a rock star
And I probably date a popstar
A popstar and a model on the side

I know I'll never make it
But tonight I'm good enough to fake it
Bend an imaginary string and break it, replace it
In the backstage of my mind

But I, know all my friends think I'm living such a lie
But the lie they think I'm living gets me high
It's the gift that keeps on giving

Close my eyes and see the crowd
But my fingers don't make any sound
My air guitar

Jimmy Page and Brian May
Won't believe the way that I can play
My air guitar
Air guitar
Like this

You think there's nothing there
It's simply made of air
You laugh but you're just scared
Try it if you dare

Air guitar
Air guitar
I take it with me everywhere
You don't even know its there
My air guitar
Air guitar

Close my eyes and see the crowd
But my fingers don't make any sound
My air guitar

I keep it with me night and day
You won't believe the way that I can play
My air guitar
Air guitar
Like this
Like this",Air Guitar
McBusted,"Why does my head hurt?
How did I get here? 
Was it the thirteenth shot or the twelfth beer? 
Why did I wake up, with all my clothes off?
On someone's kitchen floor, this is so wrong
I guess I must've passed out
I never got her name
I've got to have her number
Somewhere inside of my brain 

If I could go back in time
Then I would replay last night
She got me losing my mind
Wish I could go back in time 
Back in time 
If I could go back in 
If I could go back in
If I could go back in time 
Back in time 

Maybe I'll spend my whole day on tinder
Trying to find that face I remember
And then I'll text her
And she'll come over 
And we'll undo last night on the sofa 
Did anybody see her
Before she slipped away? 
Someone could've stopped me 
Making a big mistake 

If I could go back in time
Then I would replay last night
She got me losing my mind
Wish I could go back in time 
Back in time 
If I could go back in 
If I could go back in
If I could go back in time 
Back in time 

If I could show up from the future 
I'd try to make things right
And I would tell me to leave the party and take her back to mine
And if I argued, I'd punch myself out and I would take my place 
She'd be here right now instead of somewhere else today 

If I could go back in time
Then I would replay last night
She got me losing my mind,
Wish I could go back in time 
If I could go back in time 
I know that I'd get it right 
If I could just press rewind 
I know that you would be mine
Would be mine 

If I could go back in (time) 
If I could go back in (time)
If I could go back in (time) 
If I could go back in (time)  
Back in time",Back in Time
McBusted,"Everybody says that I'm a mess 'cause you left
I should be moving on, on, on
Can't get out of bed and get dressed
Crazy obsessed, still can't believe you're gone, gone, gone
You left me high and dry
Wasted time

Gotta pick myself up and stay out all night singing
Get up, get up, get up, get over it
Get up, get up, get up, get over it
Get up and get over it, get up and get over it
Get up, get up, get up, get over it
Get up, get up, get up, get over it
Get up and get over it, get up and get over it

Put me down, down, down, down, down
Get up and get over it

Everybody says that you're doing just fine
And that's so hard to take, take, take
So I guess that it's my fault that you left
'Cause you're telling my friends that I was just a big mistake
A-just a big mistake
You left me high and dry
Wasted time

Gotta pick myself up and stay out all night singing
Get up, get up, get up, get over it
Get up, get up, get up, get over it
Get up and get over it, get up and get over it
I'm singing get up, get up, get up, get over it
Get up, get up, get up, get over it
Get up and get over it, get up and get over it

Put me down, down, down, down, down
Get up and get over it

I know that we can't never go back
You told me that you never want that
I get that, it's clear that
You're better on your own
It's been so long since we broke up
Now it's about time I woke up
We broke up, we broke up
I guess I gotta let you go

Get up, get up, get up, get over it
Get up, get up, get up, get over it
Get up and get over it, get up and get over it (I'm so over it)
Get up, get up, get up, get over it
Get up, get up, get up, get over it (I'm so over it)
Get up and get over it, get up and get over it (I'm so over it)
Get up, get up, get up, get over it
Get up, get up, get up, get over it (I'm so over it)
Get up and get over it, get up and get over it

(And I'm over it) get up, get up, get up, get over it
Get up, get up, get up, get over it (so over it)
Get up and get over it, get up and get over it

Put me down, down, down, down, down
But I'm up and I'm over it",Get Over It
McBusted,"Always the same
Too much, the pain
You are to blame
And I know I got to get myself
Back in the game
Forget your name
I need a change
'Cause you're such a hazard to my health

The moment that you think there's nothing wrong
With moving on, you know you must be long gone

I'm done thinking about you forever 
And ever
Now I'm through
Being used
So I'm not going back there 
Not ever 
I'll never
Not for you
Not for you
I'm long gone
Long gone

Now I can breathe
Watching you leave
You can't believe
That this is what I wanted
It came so easily 
Setting you free
It's alright with me
If you go out there and flaunt it

The moment that you think there's nothing wrong
With moving on, you know you must be long gone

I'm done thinking about you forever
And ever
Now I'm through
Being used
So I'm not going back there
Not ever
I'll never 
Nor for you
Not for you
I'm long gone
Long gone

I'm doing us both a favour
Let's say goodbye but not ""see you later on""
'Cause now you're long gone, gone, gone

I'm done thinking about you forever
And ever
Now I'm through
Being used
So I'm not going back there
Not ever
I'll never 
Nor for you
Not for you
I'm long gone
Long gone

(Gone, gone, gone)
Long gone
Long gone
(Gone, gone, gone)",Gone
McBusted,"Tonight, I feel like I just wanna let it go
And hang with a crowd that I don't even know
So I don't lose my mind
Back home, the words that I hear are so predictable
They fuck with my mind, make me miserable
They gotta know first hand
They wanna understand
What happened to your band?
What are your future plans?
I'm like your biggest fan
Where'd you go, I've been lost without you, baby
Time moves slow, I ain't seen you on the TV lately
I walk through the neighbourhood where I used to live
And the only thing that people ask me is
What happened to your band?
What happened to your band?
What happened to your band?
What are your future plans?
I'm like your biggest fan
Where'd you go, I've been lost without you, baby
Time moves slow, I ain't seen you on the TV lately
Where'd you go (go go go)?
Time moves slow (slow slow slow)
Where'd you go, I've been lost without you, baby
Time moves slow, I ain't seen you on the TV lately
Where'd you go, I've been lost without you, baby
Time moves slow, I ain't seen you on the TV lately
What happened to your band?",What Happened to Your Band
McCarthy,"My mother, the Red Arrow fly
Nosedives towards me

London is falling down
London is falling down

Shining new pylons descend to the earth
As I walk towards them skyscrapers crash down to the ground

London is falling down, down down
London is falling down

Inside and outside what goes up comes down
London is falling down, down down down down
London is falling down

I'll take a plane or a kite I'm flying Northwards
I'm going uptown

London is falling down, down down down down
London is falling down

Inside and outside what goes up comes down
London is falling down
London is falling down
London is falling down
London is falling down",The Fall
McCoy Tyner,"Speak low when you speak, love,
Our summer day withers away
Too soon, too soon.

Speak low when you speak, love,
Our moment is swift, like ships adrift,
We're swept apart too soon.

Speak low, darling speak low,
Love is a spark lost in the dark,
Too soon, too soon,
I feel wherever I go
That tomorrow is near, tomorrow is here
And always too soon.

Time is so old and love so brief,
Love is pure gold and time a thief.
We're late darling, we're late,
The curtain descends, ev'rything ends
Too soon, too soon,
I wait darling, I wait
Will you speak low to me,
Speak love to me and soon.",Speak Low
McCoy Tyner,"It begins to tell
'Round midnight, midnight
I do pretty well, till after sundown
Suppertime I'm feelin' sad
But it really gets bad
'Round midnight

Memories always start 'round midnight
Haven't got the heart to stand those memories
When my heart is still with you
And ol' midnight knows it, too
When a quarrel we had needs mending
Does it mean that our love is ending
Darlin' I need you, lately I find
You're out of my heart
And I'm out of my mind

Let our hearts take wings'
'Round midnight, midnight
Let the angels sing
For your returning
Till our love is safe and sound
And old midnight comes around
Feelin' sad
Really gets bad
Round, Round, Round Midnight",'Round Midnight
McCoy Tyner,"Star eyes,
That to me is what your eyes are,
Soft as stars in April skies are,
Tell me some day you'll fulfill
Their promise of a thrill.

Star eyes,
Flashing eyes in which my hopes rise,
Let me show you where my heart lies.
Let me prove that it adores
That loveliness of yours.

All my life I've felt
Content to stargaze at the skies.
Now I only want to to melt
The stardust in your eyes.

Star eyes,
When if ever, will my lips know
If it's me for whom those eyes glow?
Makes no diff'rence where you are,
Your eyes still hold my wishing star,
Oh, star eyes, how lovely you are.",Star Eyes
McCoy Tyner,"I look at you and suddenly
Something in your eyes I see
Soon begins bewitching me
It's that old devil moon
That you stole from the skies
It's that old devil moon in your eyes

You and you glance make this romance
Too hot to handle
Stars in the night
Blazing their light
Can't hold a candle
To your razzle-dazzle

You've got me flyin' high and wide
On a magic carpet ride
Full of butterflies inside
Wanna cry, wanna croon
Wanna laugh like a loon
It's that old devil moon in your eyes

Just when I think
I'm free as a dove
Old devil moon
Deep in your eyes
Blinds me with love",Old Devil Moon
McCoy Tyner,"Though folks with good intentions
Tell me to save my tears
Well I'm so mad about him
I can't live without him

Never treats me sweet and gentle
The way he should
I've got it bad
And that ain't good

My poor heart is so sentimental
Not made of wood
I've got it so bad
And that ain't good

But when the fish are jumpin'
And Friday rolls around
My man an' I, we gin some
We pray some, and sin some

He don't love me like I love him
The way he should
I've got it bad
And that ain't good
Yes I've got it bad
And that ain't good",I Got It Bad (And That Ain't Good) [*]
McCoy Tyner,"How did I know that the warmth of the glow would last.
How did I guess that the long loneliness was past.
I merely looked at you and I knew that I knew.

It's you or no one for me
I'm sure of this each time we kiss
Now and forever and when forever's done
You'll find that you are still the one

Please don't say no to my plea
'Cause if you do then I'm all through
There's this about you
My world's an empty world without you
It's you or no one for me

Please don't say no to my plea
'Cause if you do then I'm all through
There's this about you
My world's an empty world without you
It's you or no one for me
For me",It's You or No One
McCoy Tyner,"The song a robin sings,
Through years of endless springs,
The murmur of a brook at evening tides.
That ripples through a nook where two lovers hide.

That great symphonic theme,
That's Stella by starlight,
And not a dream,
My heart and I agree,
Shes everything on this earth to me.

That great symphonic theme,
That's Stella by starlight,
And not a dream,
My heart and I agree,
Shes everything on this earth to me.",Stay as Sweet as You Are
McCoy Tyner,"You stepped out of a dream
You are too wonderful to be what you seem!
Could there be eyes like yours, 
Could there be lips like yours
Could there be smiles like yours, 
Honest and truly?
You stepped out of a cloud
I want to take you away, away from the crowd
And have you all to myself, 
Alone and apart out of a dream, 
Safe in my heart
 
You stepped out of a dream
You are too wonderful to be what you seem!
Could there be eyes like yours, 
Could there be lips like yours
Could there be smiles like yours, 
Honest and truly?
You stepped out of a cloud
I want to take you away, away from the crowd
And have you all to myself, 
Alone and apart out of a dream, 
Safe in my heart",You Stepped out of a Dream
McCoy Tyner,"Ah ya e ya
Ah e yea ya
Oba ibo si areo
Ergua mala gura
Obakoso cabiosile ache",Hannibal
McCoy Tyner,"If you hear
A song in blue
Like a flower crying
For the dew
That was my heart serenading you
My prelude to a kiss

If you hear a song that grows
From my tender sentimental woes
That was my heart trying to compose
A prelude to a kiss

Though it's just a simple melody
With nothing fancy
Nothing much
You could turn it to a symphony
A Shubert tune with a Gershwin touch

Oh how my love song gently cries
For the tenderness within your eyes
My love is a prelude that never dies
A prelude to a kiss

Though it's just a simple melody
With nothing fancy
Nothing much
You could turn it to a symphony
A Shubert tune with a Gershwin touch

Oh how my love song so gently cries
For the tenderness within your eyes
My love is a prelude that never dies
A prelude to a kiss",Prelude to a Kiss
McCoy Tyner,"How much do I love you?
I'll tell you no lie
How deep is the ocean?
How high is the sky?

How many times a day do I think of you?
How many roses are sprinkled with dew?

How far would I travel
To be where you are?
How far is the journey
From here to a star?

And if I ever lost you, how much would I cry?
How deep is the ocean?
How high is the sky?

How far would I travel
To be where you are?
How far is the journey
From here to a star?

And if I ever lost you, how much would I cry?
How deep is the ocean?
How high is the sky?
How high is the sky?",How Deep Is the Ocean
McCoy Tyner,"The falling leaves drift by the window
The autumn leaves of red and gold
I see your lips, the summer kisses
The sun-burned hands I used to hold

Since you went away the days grow long
And soon I'll hear old winter's song
But I miss you most of all my darling
When autumn leaves start to fall

C'est une chanson, qui nous ressemble
Toi tu m'aimais et je t'aimais
Nous vivions tous deux ensemble
Toi qui m'aimais moi qui t'aimais
Mais la vie separe ceux qui s'aiment
Tout doucement sans faire de bruit
Et la mer efface sur le sable les pas des amants desunis",Autumn Leaves
