Band,Lyrics,Song
Samantha Fox,"Ah, touch me
(This is the night) Ah, touch me

I want to feel your body
Ah
Ah

Full moon in the city and the night was young
I was hungry for love, I was hungry for fun
I was hunting you down, and I was the bait
When I saw you there, I didn't need to hesitate

This is the night
This is the night
This is the time, we've got to get it right
(This is the night)
Touch me, touch me
I want to feel your body
Your heartbeat next to mine
(This is the night)
Touch me, touch me now

Quick as a flash you disappeared into the night
Did I hurt you boy
Didn't I treat you right
You made me feel so good, made me feel myself
Now I'm alone and you're with somebody else

This is the night
This is the night
This is the time, we've got to get it right
(This is the night)
Touch me, touch me
I want to feel your body
Your heartbeat next to mine
(This is the night)
Touch me, touch me now

Touch me, touch me now
Touch me, touch me now

Hot and cold emotion, confusing my brain
I could not decide, between pleasure and pain
Like a tramp in the night, I was begging for you
To treat my body like you wanted to

Oh, Oh
Oh, Oh
Oh, I was begging for you

(This is the night)
Touch me, touch me
I want to feel your body
Your heartbeat next to mine
(This is the night)
'Cause I want your body
All the time

Ah, touch me, touch me, touch me
(This is the night)
Touch me, touch me

I want to feel your body
(This is the night)
I want to feel your body
(This is the night)",Touch Me (I Want Your Body)
Samantha Fox,"You say you love me
But only when you need me

You say you love me
But when you need
But only you see your loneliness
So put my arms around you
Feel that love surrounds you
Discovering the boundaries of love

Boundaries of love
Can you shake it of
The boundaries of love
Can you shake it of
The boundaries of love
Boundaries of love
Can you feel it
Boundaries of love
Can you feel it
Boundaries of love
Can you bare it

When I say that I love you
I don't know can you feel the pain
This way, that way
My head's in a circle
My body's weak
But my heart is full of you

Boundaries of love
Can you shake it of
The boundaries of love
Can you shake it of
The boundaries of love

You say you love me
Boundaries of love
You say you love me
But only when you need me
Boundaries of love

Can you feel
The boundaries of love

You say you love me
But when you need me
But only you see your loneliness
So put my arms around you
Feel that love surrounds you
Discovering the boundaries of love

Boundaries of love
Can you shake it of
The boundaries of love
Can you shake it of
The boundaries of love Boundaries of love

Can you feel it
Boundaries of love
Can you feel it
Boundaries of love...",Boundaries of Love
Samantha Fox,"(s. fox, a. bruhn)

I take a trip to the oceandrive
Straight up and right into the blue
Whatever it takes to get out alive
My love is coming up for you

Now I'm walking right up at the waterfront
And I'm still looking for a cure
Don't you know it gets hard to relax
When this problem gets pure

Won't you feel my love again
Can't you see my heart's in pain

It goes deeper and deeper
And deeper and deeper
Deeper and deeper
And deeper again

It goes deeper and deeper
And deeper and deeper

Till my love wins
Back your love again

I'm walking the edge of a borderline
Am I walking on real thin ice
Am I getting too close to heaven now
Dreaming gets real

But otherwise
It never rains in wonderland
It never rains at all
So won't you give me the answer now
I'm breaking these walls...
",Deeper
Samantha Fox,"(J. Astrop, S. Fox)

Do you want me baby
Do you want my love?
Do you want me baby
Do you want my love?

So many questions demanding answers
Is the writing on the wall
Do you want me
The way I want you
Do you hold this love up
Or do we let it fall
Forever knowing
You're the one now
Ever growing in my heart
Feel the pressure
That we are under
For this love to fall apart
We should make a start

Do you want me baby
Do you want my love?
Are we taking it for granted
Do we call the whole thing off

If you want me baby
Got to let me know
Do you want me baby
Or do I let you go

It's so peculiar
How emotion takes you higher
Than the furthest star above
When two lovers kiss
Do they wonder
Whether this is infatuation
Or is it really love?

Do you want me baby
Do you want my love?
Are we taking it for granted
Do we call the whole thing off

If you want me baby
Got to let me know
Do you want me baby
Or do I let you go...



",Do You Want Me?
Samantha Fox,"(s. fox, i. horne, p. mcmahon)

When I dream, I dream in colours, in bright colours, yeah
When I start to dream
When I dream, I dream in colours, in bright colours, yeah
When I start to dream

I will bring you flowers, I will put them in your hair
I will build a mountain for you safe somewhere
I will bring you images of things you've never seen
Walk into the future with me, oh only

When I dream, I dream in colours, in bright colours, yeah
When I start to dream
When I dream, I dream in colours, in bright colours, yeah
When I start to dream

I will take you far beyond the distance of the sun
It will be as if you were the chosen one
I will bring you images of things you've never seen
Walk into the future with me, oh only

When I dream, I dream in colours, in bright colours, yeah
When I start to dream
When I dream, I dream in colours, in bright colours, yeah
When I start to dream
",I Dream in Colours
Samantha Fox,"(c. bonnacci, s. fox, m. shreeve)

I wake up, I wake up
What does it mean to dream
Is it staying alive or to fall or rise
So take it to the limit and lets dream on, dream on

I wake up, to find you
To find you next to me
I reach out, yeah
You're there like a vision of ecstasy

But when I wake up
I realise, I'm holding on to a dream
(don't you know it's just a)
You're just a dream to me
(you're just a dream to me)
A part inside of me
(a part inside of me)

You're just a part of a dream in me
You're a dream in me
I feel cold
As your, as your shadow moves away
I feel heat
Heat now

I need you
I really need you here to stay

You're just a dream to me
(you're just a dream to me)
A part inside of me
(a part inside of me)

You're just a dream
You're just a part of a dream in me
You're a dream in me
You're a dream in me
You're a dream in me
You're a dream in me
You're a dream in me

It's so nice to dream
But then again
Your dreams are not always reality
It seems we're always searching
Searching for that real dream
Dream, dream...
",Just a Dream
Samantha Fox,"(r. swan, s. fisher, s. fox)

What you are inside you
Carry with you always
And everything you do
Is reflection of you
No matter where you are
No matter what you do
I will be there to show you
I care in the shadow of the night

Only love makes you
What you are
And what you are
Is everything to me
Baby find a star and any star
Will lead you back to me
Love makes you
What you are
You're everything to me

Whatever you have done
And whatever you may do
Love has made you what you are
And it's love I feel for you

No matter where you go
I will always come to you
I'll be your friend
Right to the end
In the shadow of the night

Baby find a star and any star
Will lead you back to me
Love makes you
What you are
You're everything to me

People wish for many things
Things they'll never be
But I won't wish for anything
As long as you stay by me

Love makes you
What you are
You're everything to me
Baby find a star and any star
Will lead you back to me
Love makes you
What you are
You're everything to me
Love makes you
What you are
You're everything to me...
",Love Makes You
Samantha Fox,"Run, run baby run, run
I don't want to loose you
Run, run baby run, run
I don't want to loose you
Run, run baby run, run
The reason is you

You said that everything is all right
Stop coming on strong
In the middle of the night
I need you right beside me
You were meant for me

In my dreams i see it clearly
Just you and me
Show me the way to heaven
This love will always be

One on one
Lets get it on get it on baby
This could be
Ya giving me ecstasy baby

Run, run baby run, run
I don't want to loose you
Run, run baby run, run
I don't want to loose you
Run, run baby run, run
The reason is you

You said that everything is all right
Stop coming on strong
In the middle of the night
I need you right beside me
You were meant for me

Each time i think of you
My head's in a spin
Take me now and show me
The real thing
Forever love will always win...",The Reason Is You (One on One)
Samantha Fox,"Say what you want
Say what you need now
Name your desire
Say what you need now

In the times of trouble
When you think you can't last think
Ahead now and not of the past
Put your arms around me
Squeeze me strong, oh yeah, oh yeah

But can we last that long
It's all I ever needed
All along and now
I know
I'm not to worry

I've gotta be strong
Lift my head up high
'Til I touch the sky
I feel high, I feel high
And I say what I want

Say what you want
Say what you need now
Name your desire
Say what you mean now

What you want
Say what you need now
Name your desire
Say what you mean now

So hold me closer
Can't you feel
I'm burning up
Inside forever
I'll lick the last drop

Feel the passion
In my body
Tonight, tonight
I'm your wild kind of love

Say what you need now, need now
Name your desire
Say your desire

Say what you mean now
Say what you need now, need now
Name your desire

Say what you mean now
Say what you want
Say what you need now
Name your desire
Say what you mean now...",Say What You Want
Samantha Fox,"(c. bonacci, s. fox, m. wallace)

Nice and easy
Take it nice and slowly
Let's relax and just enjoy
Each other my baby

We've so little time to be
Alone together
Watching you
Watching me
Let's break free

I can lie in your arms
Meditate away tension
You can carry away
Until all my senses melt

So, take it nice and easy
Climb the walls of my defences
So, take it nice and slowly
Oh, you know how to please me

I'll get used to missing you
Make the most of the moment
I'm afraid to let you go
Hold me with the motion
You'll be leaving me too soon

Watching you
Watching me
Let's break free...

So, take it nice and easy
Climb the walls of my defences
So, take it nice and slowly
Oh, you know how to please me

You'll be leaving me too soon

Watching you
Watching me
Let's break free my love

Watching you
Watching me
Let's break free

So, take it nice and easy
Climb the walls of my defences
So, take it nice and slowly
Oh, you know how to please me

Take it easy
Take it nice and slowly...

So, take it nice and easy
Climb the walls of my defences
So, take it nice and slowly
Oh, you know how to please me...
",Watching You
Samantha Fox,"Are you ready to do things tonight
That you never dreamed were possible?
Let, let let's go

Love house, house, house
Want to visit a house, hmmm?
I am ready, anything
Follow me

There's love in my house for fun, wee
There's love in my house for you
There's love in my house, you won't be sorry
'Cause I know just what to do

I'll be good to you
It's Friday night, I'll burn heat
I'm dynamite, just catch me
Nice blow, yeah

This is Sam Fox, I have some fun
Whose you are? This is Samantha

Love house
I'll open the door, come closer
Something good in stone, woo what you got me for, yeah
This is Samantha

Just knock
I'll be good to you

I hope you enjoyed your visit to the house",Love House [the Black Pyramid Mix]
Samantha Fox,"
Sometimes you've gotta leave what you love
To make that love grow strong
There comes a time when a voice inside will tell you where you truly belong.
You search your heart and you will find
The answer has been there all the time

CHORUS
Tonight all my dreams unfold
The hand of love has touched my soul
The longest journey's reached the end of the road
I will never walk alone as my dreams unfold


Goodbye's the hardest word to say
Each and every time
And if I had to leave this sacred place
I would leave my soul behind
You search your heart and you will find
The answer has been there all the time

CHORUS
Tonight - all my dreams unfold
The hand of love has touched my soul
The longest journey's reached the end of the road
I will never walk alone as my dreams unfold


Close your eyes and you'll hear my call
Through every high and through every low
Let's prove - we can weather the storm

CHORUS
Tonight all my dreams unfold
The hand of love has touched my soul
And I've been waiting for this moment
For all my life and I'll never let it go
The longest journey's reached the end of the road
I will never walk alone as my dreams unfold



",Dreams Unfold
Samantha Jade,"In the night, I hear 'em talk
The coldest story ever told
Somewhere far along this road, he lost his soul to a woman so heartless
How could you be so heartless?
Oh How could you be so heartless?

How could you be so, cold as the winter wind when it breeze, yo
Just remember that you talkin' to me though
You need to watch the way you talkin' to me, yo
I mean after all the things that we've been through
I mean after all the things we got into
Hey yo, I know of some things that you ain't told me
Hey yo, I did some things but that's the old me
And now you wanna get me back and you gon' show me
So you walk around like you don't know me
You got a new friend, while I got homies
But in the end it's still so lonely

In the night, I hear 'em talk
The coldest story ever told
Somewhere far along this road, he lost his soul to a woman so heartless 
How could you be so heartless?
Oh How could you be so heartless?

How could you be so Dr. Evil, you bringin' out a side of me that I don't know 
I decided we weren't gon' speak so
Why we up 3 A.M. on the phone
Why does she be so mad at me fo'
Homie I don't know, she's hot and cold
I won't stop, won't mess my groove up
'Cause I already know how this thing go
You run and tell your friends that you're leaving me
They say that they don't see what you see in me
You wait a couple months then you gon' see
You'll never find nobody better than me

In the night, I hear 'em talk
The coldest story ever told
Somewhere far along this road, he lost his soul to a woman so heartless
How could you be so heartless?
Oh How could you be so heartless?

Talkin', talkin', talkin', talk
Baby let's just knock it off
They don't know what we been through
They don't know 'bout me and you
So I got something new to see
And you just gon' keep hatin' me
And we just gon' be enemies
I know you can't believe
I could just leave it wrong
And you can't make it right
I'm gon' take off tonight
Into the night 

In the night, I hear 'em talk
The coldest story ever told
Somewhere far along this road, he lost his soul to a woman so heartless 
How could you be so heartless?
Oh How could you be so heartless?",Heartless
Samantha Jade,"Scream, 
I see you over there so hypnotic
Thinking bout what I'd do to that body
I'll get you like uh baby, baby, uh baby, baby
Uh baby, baby, uh baby, baby
And I've tried, to fight it, to fight it
But you're so, magnetic, magnetic
Got one life, just live it, just live it
Now relax and get on your back

[Chorus]
If you wanna scream, yeah
Let me know and I'll takeyou there
Get you going like uh baby, baby, 
Uh baby, baby, uh baby, baby
If you wanna turn right
Hope you're ready to go all night
Get you going like uh baby, baby
Uh baby, baby, uh baby, baby
Scream

Kill the lights, shut em off, you're electric
Devil eyes tellin me come and get it
I'll have you like uh baby, baby
Uh baby, baby, uh baby, baby
And I've tried, to fight it, to fight it
But you're so, magnetic, magnetic
Got one life, just live it, just live it
Now relax and get on your back

[Chorus]
If you wanna scream, yeah
Let me know and I'll take you there
Get you going like uh baby, baby, 
Uh baby, baby, uh baby, baby
If you wanna turn right
Hope you're ready to go all night
Get you going like uh baby, baby
Uh baby, baby, uh baby, baby

And I've tried, to fight it, to fight it
But you're so, magnetic, magnetic
Got one life, just live it, just live it
Now relax and get on your back

[Chorus:x2]
If you wanna scream, yeah
Let me know and I'll take you there
Get you going like uh baby, baby, 
Uh baby, baby, uh baby, baby
If you wanna turn right
Hope you're ready to go all night
Get you going like uh baby, baby
Uh baby, baby, uh baby, baby
Yeah!",Scream
Samantha Jade,"You know the bed feels warmer
Sleeping here alone
You know I dream in color
And do the things I want

You think you got the best of me
Think you've had the last laugh
Bet you think that everything good is gone
Think you left me broken down
Think that I'd come running back
Baby you don't know me, cause you're dead wrong

What doesn't kill you makes you stronger
Stand a little taller
Doesn't mean I'm lonely when I'm alone
What doesn't kill you makes a fighter
Footsteps even lighter
Doesn't mean I'm over cause you're gone

What doesn't kill you makes you stronger, stronger
Just me, myself and I
What doesn't kill you makes you stronger
Stand a little taller
Doesn't mean I'm lonely when I'm alone

You heard that I was starting over with someone new
They told you I was moving on, over you

You didn't think that I'd come back
I'd come back swinging
You try to break me, but you see

What doesn't kill you makes you stronger
Stand a little taller
Doesn't mean I'm lonely when I'm alone
What doesn't kill you makes a fighter
Footsteps even lighter
Doesn't mean I'm over cause you're gone

What doesn't kill you makes you stronger, stronger
Just me, myself and I
What doesn't kill you makes you stronger
Stand a little taller
Doesn't mean I'm lonely when I'm alone

Thanks to you I got a new thing started
Thanks to you I'm not the broken-hearted
Thanks to you I'm finally thinking about me
You know in the end the day you left was just my beginning
In the end...

What doesn't kill you makes you stronger
Stand a little taller
Doesn't mean I'm lonely when I'm alone
What doesn't kill you makes a fighter
Footsteps even lighter
Doesn't mean I'm over cause you're gone

[2x]
What doesn't kill you makes you stronger, stronger
Just me, myself and I
What doesn't kill you makes you stronger
Stand a little taller
Doesn't mean I'm lonely when I'm alone

(When I'm alone)",Stronger (What Doesn't Kill You)
Samantha Jade,"Sometimes you get what you want
Sometimes you get what you don't
Sometimes ya, get nothing at all

And when it finally comes round
You tear it up, break it down down
'Til there's nothing at all

I used to be so in control
No one could ever touch me
I'd tell myself I'd never fall
And nobody would catch me

You shot your love through my defences
And left me wide open
Feels like my feet can't touch the ground (the ground)
That's what you've done to me

I'm a rocket to the sun
I'm a heartbeat on the run
That's what you've, what you've done to me
I'm a bullet I can fly
When you kiss me I could die
That's what you've, what you've done to me (Done to me, to me)

Sometimes you love but they don't
Sometimes they love but you won't
Sometimes ya, just can't figure it out

My planets aligned
And there's no doubt in my mind
Mmm

Baby, you shot your love through my defences
And left me wide open
Feels like my feet can't touch the ground
That's what you've done to me

I'm a rocket to the sun
I'm a heartbeat on the run
That's what you've, what you've done to me
I'm a bullet I can fly
When you kiss me I could die
That's what you've, what you've done to me (Done to me)
(Ooh hoo ooh hoo) Done to me
(Ooh hoo ooh hoo) Done to me
I'm a rocket to the sun
I'm a heartbeat on the run
That's what you've, what you've done to me (Done to me)

I used to be so in control
No one could ever touch me
I'd tell myself I'd never fall
And nobody would catch me

I'm a rocket to the sun
I'm a heartbeat on the run
That's what you've, what you've done to me (You've done to me)
I'm a bullet I can fly
When you kiss me I could die
That's what you've, what you've done to me (You've done to me)

I'm a rocket to the sun
I'm a heartbeat on the run
That's what you've, what you've done to me (Done to me)
I'm a bullet I can fly
When you kiss me I could die
That's what you've, what you've done to me (Done to me)

And nobody would catch me
(Ooh hoo ooh hoo ooh hoo)
(Ooh hoo ooh hoo ooh hoo)
And nobody would catch me
(Ooh hoo ooh hoo ooh hoo)
(Ooh hoo ooh hoo ooh hoo)

I'm a rocket to the sun
I'm a heartbeat on the run
That's what you've, what you've done to me (Done to me)
I'm a bullet I can fly (Done to me)
When you kiss me I could die
That's what you've, what you've (done to me)",What You've Done To Me
Samantha James,"Welcome to the beat baby
Step into my room
Tell me how you feel
When sinking to the mood

If you want to be the reason
I can be the answer
We can stand together, baby
Walk the world together

Let the rhythm take you
Where you want to go
Listen to the melody
Let it take control

If you wanna be the reason
I can be the answer
We can stand together, baby
Walk the world forever

I want to feel you
I want to taste the world we've found
I want to feel you
I want to breathe you in right now

Give yourself to me, baby
Listen to a song
Let the music take us
As we move along

If you wanna be the reason
I can be the answer
We can stand together, baby
Walk the world together

It's driving
('Round)
('Round)
Don't stop

I want to feel you
I want to taste the world we've found
I want to feel you
I want to breathe you in right now

I want to feel you
I want to taste the world we've found
I want to feel you
I want to breathe you in right now

With you
In my life
We can find
The world together

With you
In my life
We can find
The world together

The world together
The world together
The world together
Find the world together

I want to feel you
I want to taste the world we've found
I want to feel you
I want to breathe you in right now

I want to feel you
I want to taste the world we've found
I want to feel you
I want to breathe you in right now

Feel you
Breathe you in
Feel you
Breathe you in

Feel you
(It's driving)
('Round)
('Round)
Don't stop

Breathe you in
(It's driving)
('Round)
('Round)

Feel you
(It's driving)
('Round)
('Round)
(Don't stop)

Breathe you in
(It's driving)
('Round)
('Round)
(Don't stop)

",Breathe You In
Samantha James,"Caught like a rose between two thorns
As you left that day, I felt so torn
Falling down into a hiding place I've found

I was trying to reach a higher sound
Across the black and blue, shined a silver star
Leading me to you and where you are

I won't walk away from your love
I've been searching for so long to feel your touch
And I won't walk away from your truth
So when the time arrives, you can come through

Your silence tells me all I need to know
And in the dark of night I see your glow
Your magic moves me when I need to grow

Walking me into a peaceful flow
Now the golden light I see surrounding me
Nourish the barrows when you came to me

I won't walk away from your love
I've been searching for so long to feel your touch
And I won't walk away from your truth
So when the time arrives, you can come through
(You can come through)
(You can come through)

",Come Through
Samantha James,"Take me on a ride inside your heart tonight
Just you and me,
Take me to live inside the truth.

Sugar, I wanna taste the way you feel inside,
All through the night
Forget about the time 
Just close your eyes

Sugar, always
Though my heart, it breaks, baby

Oh, let me be the one to come alone 
Let me just be such a deep surprise

As the world you know begins to cry tonight
Just let it be, if you wanna grow it all must die

Sugar, we can come alive inside your dreams tonight,
Live to believe you are the only one for me",Deep Surprise
Samantha James,"Now that I found you
Let the truth remind you
Now that I found you
Only love surrounds you

Now that I found you
Let the truth remind you
Now that I found you
Only love surrounds you

I can't seem to remember this feeling we get
But I'm hearing it call my name
I've been waiting for so long to understand
That it takes time to come again
That it takes time to come again

Tara, layada, layada, layada
Layada, layada, laya
Parara, layada, layada, layada
Layada, layada, laya

Tara, layada, layada, layada
Layada, layada, laya
Parara, layada, layada, layada
Layada, layada, laya

Now that I found you
Let the truth remind you
Now that I found you
Only love surrounds you

Now that I found you
Let the truth remind you
Now that I found you
Only love surrounds you

I've been waiting for so long to feel this way
And it's easy to understand
I see something in your eyes I can't forget
And I know that you see the same
I know that you see the same

Tara, layada, layada, layada
Layada, layada, laya
Parara, layada, layada, layada
Layada, layada, laya

Tara, layada, layada, layada
Layada, layada, laya
Parara, layada, layada, layada
Layada, layada, laya

Now I fin'lly see the truth in my life
Now that I found you I can feel the sun come alive
Now I fin'lly see the truth in my life
Now that I found you I could feel the sun come alive

",I Found You
