Band,Lyrics,Song
Jodeci,"Oh girl I see you
The time is so right
Let's plan a day
Let's go out at night
Let's make this special
Remember our fun
Go through the storms
And look back on

The times we shared together
Make it last forever
The times we shared together
Make it last forever

Can't forget the night
We watched for the sun
We laughed and played
Then morning comes
Just like the day we started our heart
It was sunrise when we made our first love
The times

The times we shared together
Make it last forever
The times we shared together
Make it last forever

The times we shared together
Let's make it last forever
Just like the morning sun
We laughed and played now til morning come

I like the way you kiss me
Holding me girl when we do this
It keeps me rising high
All our love will never die
Nothing could compare to the love we share
Say nothing not a thing girl
Could compare to the love we share together
Oh girl I see you
I want to do you tonight",Xs We Share
Jodeci,"It's been so long
since I touched a lady
and I'm still waiting
for you to come back to me
now will you forgive me
for the wrong I've done
and let's try again
to make it last so long
chorus:

I'm still waiting
for you to come back to love
to fulfill this life
we're dreaming of
so don't wait
another day might be too long
don't rush
go slow so nothing goes wrong

listen baby
I can't wait
to feel your love again
cause you can stop this pain
that I've been feeling
so let's start all over
and put the past behind
and make a love to stand
to the test of time

I'm still waiting
for you to come back to love
to fulfill this life, yeah
we're dreaming of
and these feelings are so very strong
another day might be too long
go slow so nothing goes wrong
I just can't take it no more, baby
the feel of your warm embrace, baby
I'm still waiting on you
I'm still waiting
for you to come back to love (ohhh, yes I am)
to fulfill this life (that we're dreaming of)
we're dreaming of
so baby, please don't wait, baby baby
another day might be too long (my arms are open wide)
go slow so nothing goes wrong

sometimes I get so lonely want to call you, baby
just a little love is all I need
yeahhhhh
another day might be too long
go slow so nothing goes wrong
just a little love is all I need (my arms are open wide)
just a little love is all I need
yeah
woh ohhhhh
the feel of your warm embrace
I'm still waiting
for you to come back to love
to fulfill this life
we're dreaming of
(repeat chorus until fade)",I'm Still Waiting [Album Version]
Jodeci,"It's been so long
Since I touched a lady
And I'm still waiting
For you to come back to me
Now will you forgive me
For the wrong I've done
And let's try again
To make it last so long

[Chorus:]
I'm still waiting
For you to come back to love
To fulfill this life
We're dreaming of
So don't wait
Another day might be too long
Don't rush
Go slow so nothing goes wrong

Listen baby
I can't wait
To feel your love again
Cause you can stop this pain
That I've been feeling
So let's start all over
And put the past behind
And make a love to stand
To the test of time

[Chorus]

I just can't take it no more, baby
The feel of your warm embrace, baby
I'm still waiting on you
I'm still waiting
For you to come back to love (ohhh, yes I am)
To fulfill this life (that we're dreaming of)
We're dreaming of
So baby, please don't wait, baby baby
Another day might be too long (my arms are open wide)
Go slow so nothing goes wrong

Sometimes I get so lonely want to call you, baby
Just a little love is all I need
Yeahhhhh
Another day might be too long
Go slow so nothing goes wrong
Just a little love is all I need (my arms are open wide)
Just a little love is all I need
Yeah
Woh ohhhhh
The feel of your warm embrace

[Chorus]",I'm Still Waiting [Jazz Version]
Jodeci,"girl where is our child
sent him to your mother's 
for a while
all your friends are gone
you know i sent them home
girl i live for you 
so i don't give a fuck about the news
so please turn off the t.v.
and if you give a damn about me

i wanna hear you moan
let's be alone
i wanna hear you moan
let's be alone
so we can get it on
let's be alone
I wanna hear you moan
let's be alone

check me out

it's better than you and me
it's better than a damn movie
our love is so much fun
let's do some freaky shit
and then i'll make you cum
nothing compares to us
i love we have so much trust 
tell me can you see
i was made for you and you for me

i wanna hear you moan
let's be alone
i wanna hear you moan
let's be alone
so we can get it on
let's be alone
I wanna hear you moan
let's be alone

Hey special lady
Unplug the phone
Cause no one's home
Girl we're alone
Hey special lady
Let's get it on
You know what's going on
If you wanna bone
If you wanna bone
I wanna hear you moan
Let's be alone
I wanna hear you moan
Let's be alone
So we could get it on
Let's be alone
I wanna hear you moan
Let's be alone
",Alone
Jodeci,"Without you baby
I feel worthless
I'm livin on the edge
It's been an hour
since you've been gone
and that's too long
so come back home
I can't live without you
so I'll cry for you
do anything that I can
to feel that touch from your hand
sorry that I want you
lady what do I do

you know you're everything I do
ooh yeah
do what you want me to
I would do anything
get on my knees for you
ooooh, baby
what else is there to do
I don't know, I don't know
but I'll cry

lady I, will cry for you tonight
tonight
yeah
lady I, will cry for you tonight
tonight

help me out
help me out, yeah
you spoil me girl
like a child
when you're not here I can't even smile
I can't think without you
my mind is always with you
it's amazing what you do
to keep me falling in love with you
girl you all that I know
where else can I go

you know you're everything I do
ooh wee
do what you want me to
anything you need from me baby
get on my knees for you
ohhh, ooooh, ohh
what else is there to do
I don't know, I don't know
but I'll cry

lady I, will cry for you tonight
tonight
lady I, will cry for you tonight
tonight

help me out baby
help me out baby, yes
I don't know what else to say
I don't know what else to say
K-Ci help me sing it
JoJo I'm right here yes I am
I will cry for you lady
sometimes my pillow gets so wet with tears
I don't have no one to call my own
I want you back baby
ooh yeah
baby I'm beggin, baby I'm beggin, beggin baby
baby I'm beggin, baby I'm beggin, beggin baby
baby I'm beggin, baby I'm beggin, beggin baby
baby I'm beggin, baby I'm beggin, beggin baby
yeahhhhhhhhh",Cry for You
Jodeci,"Hit me.
All the chronic in the world couldn't even mess with you.
You're the ultimate high.
You hear what I'm saying, baby?
Now check this out:

Take my money, my house and my cars.
For one hit of you, you can have it all.
Cause makin' love, ev'rytime we do, girl,
It's worse than drugs, 'cause I'm an addict of you.
And you know that I

I can't leave you  alone.
You got me feenin'.
I can't leave you alone.
You got me feenin'.
Girl, I'm feenin' for you.

Said I'm feenin' for you.
I don't mind.
It's all on you, baby.
Girl, I'm so strung out.
All I do is wish for you.
So, tomorrow if you're not here,
then girl, I'm down, so I need you near.
I just want to make it through the night,
so hold me tight, then girl I'm all right.

I can't leave you  alone.
You got me feenin'.
I can't leave you alone.
You got me feenin'.
Girl, I'm feenin' for you.

Lady, I'm hooked on you,
There's nothing else I'd rather do,
spend my last dime for a drop of your time.
Surely, girl, without a doubt you know you got me strung out.
And I need you more and more,
'cause you are my joy.

You got me feenin'.
I can't leave you alone.
You got me feen in'.
Girl, I'm feenin' for you.

I can't leave you  alone.
You got me feenin'.
I can't leave you alone.
You got me feen in'.
Girl, I'm feenin' for you.

I can't leave you  alone.
You got me feenin'.
I can't leave you alone.
You got me feen in'.
Girl, I'm feenin' for you.",Feenin'
Jodeci,"Sticky, sticky,
Let's get sticky, word
Yeah, I like it

In the mirror

Can you pose in the mirror baby, get sticky

I don't have to be the only one
But we can still have fun
Till the rising sun
As long as you with me
Baby don't diss me
And we can get busy
I know you have a lot to do
But can I get a second or two
So when you get with me
I can spin you around and we can get busy

You know I'm down to make you smile
So I'll be around in the meanwhile
You know I'm down to make you smile
So I'll be around in the meanwhile
You know I'm down to make you smile
So I'll be around in the meanwhile
You know I'm down to make you smile
So I'll be around in the meanwhile

How you want it (Sticky)
How you like it (Sticky)
How you love it (Sticky)
How you need it (Sticky)
How you want it (Sticky)
How you like it (Sticky)
How you love it (Sticky)
How you need it (Sticky)

You say you wanna do a lot of things
So check the joy I bring
Baby you can hang
If you wanna feel sexy
Baby just call me
And we can get nasty
Come out cha' clothes and play for awhile
Come to my crib and check my style
So baby let me pour you found,
In the meanwhile, in the meanwhile

You know I'm down to make you smile
So I'll be around in the meanwhile
You know I'm down to make you smile
So I'll be around in the meanwhile
You know I'm down to make you smile
So I'll be around in the meanwhile
You know I'm down to make you smile
So I'll be around in the meanwhile

Yo DeVante, (Yo what)
This girl tried to get sticky with me, wear it out
And guess what I told her, (What's that) Timbaland

I can rock a party, like Liberace
I can catch a groupie, and all the hotties
Take her out and get sticky right in the lobby
Then get my crew and run a Swing Mobbie
We like Norman, our skills are the beats
People can't wait to get a dub of our tapes
On a hundred and twenty-fifth, catch a whiff
K-Ci my man won't cha' hit a riff (Ooooh)
And show the sticky girls with the ather
Rub her down, lick her thighs now we passed her

All night long, keep you smilin'
All night long, get buck wildin'
All night long, make it sticky
All night long, we're not naked

F-feels, f-f-feels
F-feels, f-f-feels so damn
F-feels, f-f-feels
F-feels, f-f-feels so damn
F-feels, f-f-feels, h-how you want it, h-how you want it
F-feels, f-f-feels so damn, h-how you want it, h-how you want it sticky
F-feels, f-f-feels, h-how you want it, h-how you want it
F-feels, f-f-feels so damn, h-how you want it, h-how you want it sticky

You know I'm down to make you smile
So I'll be around in the meanwhile
You know I'm down to make you smile
So I'll be around in the meanwhile
You know I'm down to make you smile
So I'll be around in the meanwhile
You know I'm down to make you smile
So I'll be around in the meanwhile

How you want it (Sticky)
How you like it (Sticky)
How you love it (Sticky)
How you need it (Sticky)
How you want it (Sticky)
How you like it (Sticky)
How you love it (Sticky)
How you need it (Sticky)

You know I'm down, in the meanwhile

You know I'm down to make you smile
You know I'm down to make you smile
You know I'm down to make you smile

You know I'm down to make you smile
So I'll be around in the meanwhile
",In the Meanwhile
Jodeci,"let us take our time
to give you something real
a feeling that is right
a groove that you can feel
we know what you need
a little bit of jodeci
lady groove and feel this beat
with jodeci
we know what you need 
a little bit of jodeci
lady groove and feel this beat
with jodeci
we show you how to love
we show you how to love somebody
we show you how to love
we show you how to love somebody
we show you how to love
we show you how to love somebody
",Jodecidal Hotline
Jodeci,"Anything you want from me
You got it

You can have my love
You're the girl of my life
Am I all you're dreaming of
Yes you're my desire

I wanna give you so much
for the things that you give to me
Just take my love baby
because you are so dear to me

Whatever you want
Whatever you need
My heart belongs to you
Whatever you need
there's nothing I won't do

I say whatever you want
my heart belongs to you
I say whatever you need
I'll be right here for you

Once in a lifetime
You will find someone like you
and now that I have you
Here's what I'm gonna do
I'm gonna give you so much
I will give you my all and all
over and over again lady,lady,lady
lovin' you too much baby
is not, is not, is not a sin

Whatever you want
Whatever you need
My heart belongs to you
Whatever you need
there's nothing I won't do

I say whatever you want
my heart belongs to you
I say whatever you need
I'll be right here for you

Anything you want I'll do it for you
in the morning
whenever you want it (makes no difference)
in the evening
whenever you need (late in the midnight hour)
when the night fogs (you know that I got it)
you know that I got it
so baby just call me
you know that I'll do it

Whatever you want
Whatever you need
My heart belongs to you
Whatever you need
there's nothing I won't do

I say whatever you want
my heart belongs to you
I say whatever you need
I'll be right here for you

I say whatever you want
my heart belongs to you
",My Heart Belongs to U
Jodeci,"Come in and shut the door
I could leave my back down on
The floor
Girl you are so bold
Come and take control

Riding up and down
Give you all my lovin' round and round
Suck on your toes
And we can start to blow 

Do you know
You can get a ride
I wanna slide tonight
Baby, I'm gotta taste your love tonight
Sugar, one more time, come on 

Do you know
You can get a ride
I wanna slide tonight
Baby, I'm gonna hear you moan so right
Sugar

Feel my tongue move up and down
I can taste the waters streaming down
Girl you taste so fine
You're one of a kind
You're one of a kind

Lady move with me
So I can keep you humping to my beat
Don't you worry about the time
Temperatures are to climb

Do you know
You can get a ride
I wanna slide tonight
Baby, I'm gotta taste your love tonight
Sugar 

Do you know
You can get a ride
I wanna slide tonight
Baby, I'm gonna hear you moan so right
Sugar

All day
And baby all night
We can rock it
Just hold me tight
And I won't ever let you go o-no-no

Girl I know it's gonna feel so right
We can rock it
Just hold me tight
And don't ever let me go o-no-no

We can start to flow
We can start to flow
Oh, DeVante solo 

Do you know
You can get a ride
I wanna slide tonight
Baby, I gotta taste your love tonight
Sugar 

Do you know
You can get a ride
I wanna slide tonight
Baby, I'm gonna hear you moan so right
Sugar

Slide
Help Me sing my song
do do do do do do
do do do do do do do do 
do do do do do do
do do do do do do do do 

Do do do do you wanna ride with me
Do do do do you wanna ride with me
Do do do do you wanna ride with me
Do do do do you wanna ride with me

Come on ride
Come on ride 
Come on ride with me",Ride & Slide
Jodeci,"Miggity, mix check one, two get ready uh huh
I'ma get with Red, while I sex ya get sweaty huh
Mix check one, two get ready uh huh
I'ma get with Red, while I sex ya get sweaty huh
Mix check one, two get ready uh huh
I'ma get with Red, while I sex ya get sweaty huh

So what chu' sayin' baby

Miggity, mix check one, two get ready uh huh
I'ma get with Red, while I sex ya get sweaty huh
Mix check one, two get ready uh huh
I'ma get with Red, while I sex ya get sweaty huh
Mix check one, two get ready uh huh
I'ma get with Red, while I sex ya get sweaty huh

Your body's lookin' so fine girl, so baby walk this way
Come to check out all my lines girl, sure that I can make you pay
Come and talk for a minute and I can surely make you smile
Then you can jump right in it, I know I've heard it for awhile

Girl I'm ready (Girl I'm ready)
To get nasty (Wanna get nasty)
Said you wanna get freaky
But are you ready to get sweaty (HUH! SO KEEP IT GOIN')

Girl I'm ready (Girl I'm ready)
To get nasty (Wanna get nasty)
Said you wanna get freaky
But are you ready to get sweaty (HUH! SO KEEP IT GOIN')

I'll make ya, sweaty
Girl I'll make ya, sweaty
Girl I'll make ya, sweaty

Ooh, I know you like to have fun girl, I know you like to catch vet
You know that I'll be the one girl to make you love the sex
I'll give you all that you can take girl, if you go all the way
We don't ever have to break girl, cause I ain't hit you all day

Girl I'm ready (Girl I'm ready)
To get nasty (Wanna get nasty)
Said you wanna get freaky
But are you ready to get sweaty (HUH! SO KEEP IT GOIN')

Girl I'm ready (Girl I'm ready)
To get nasty (Wanna get nasty)
Said you wanna get freaky
But are you ready to get sweaty (HUH! SO KEEP IT GOIN')

You can come play for awhile, for awhile, for awhile
Girl I know you will sweat my style, sweat my style
You can come play for awhile, for awhile
Girl I know you'll leave with a smile

Girl I'm ready (Girl I'm ready)
To get nasty (Wanna get nasty)
Said you wanna get freaky
But are you ready to get sweaty (HUH! SO KEEP IT GOIN')

Girl I'm ready (Girl I'm ready)
To get nasty (Wanna get nasty)
Said you wanna get freaky
But are you ready to get sweaty (HUH! SO KEEP IT GOIN')

Mr. Dalvin, pick up

Ah, whoa, whoa, whoa girl I got ya sweat
I got the Trojan keep me strap
And let me freak the funky body all the way down to Manhattan, uh
In ya thang, we jet, we out the way I'm doin' my thing
I hurt ya feelings so good ya might think I'm kind of strange, what yes
But anyway it's Mr. Dalvin on the case
I got ya drippin from ya ankles, from ya thighs, to ya freakin' face
We're good and ready when all ya want is sweaty
Let me run around the party, just like I be witcha dirty, uh

Girl I'm ready (Girl I'm ready)
To get nasty (Wanna get nasty)
Said you wanna get freaky
But are you ready to get sweaty (HUH! SO KEEP IT GOIN')

Girl I'm ready (Girl I'm ready)
To get nasty (Wanna get nasty)
Said you wanna get freaky
But are you ready to get sweaty (HUH! SO KEEP IT GOIN')
",Sweaty
Jodeci,"Come and talk to me
can I talk to you
come and talk to me
K-Ci
yeah, we can do this

I wanna love you 
I wanna love you 
I wanna love you 
I wanna love you 
I wanna love you 
I wanna love you 
I wanna love you 
I wanna love you 

girl I'm reaching out my hand
trying to make you understand
that you don't have to be alone
cause I wanna be your man
girl I need you in my life
just wanna live right by your side
so girl I won't be satisfied
until you give this love a try

I'm in need of love
and baby you're in need of love
so what about us
on and on and on til the break of dawn, and it's on
I'm in need of love
and baby you're in need of love
so what about us
on and on and on til the break of dawn, and it's on

can you feel, can you feel, can you feel me
I can feel you lady

satisfaction guarenteed
if you come and get with me
girl I can get down on my knees
so let me please let me do you lady
cause I know just what you need
I need your love
I need your love
girl listen to me

I'm in need of love
and baby you're in need of love
so what about us
on and on and on til the break of dawn, and it's on

shoobie doo-wop shoobie doo-wop I wanna love you 
shoobie doo-wop shoobie doo-wop I wanna love you
shoobie doo-wop shoobie doo-wop I wanna love you
shoobie doo-wop shoobie doo-wop I wanna love you
shoobie doo-wop shoobie doo-wop I wanna love you

I'm in need of love
and baby you're in need of love
so what about us
on and on and on til the break of dawn, and it's on 

I'm in need of love
and baby you're in need of love
so what about us
on and on and on til the break of dawn, and it's on

I'm in need of love
and baby you're in need of love
so what about us
on and on and on til the break of dawn, and it's on

I wanna love you
I wanna love you

I'm in need of love
and baby you're in need of love
so what about us
on and on and on til the break of dawn, and it's on 

I'm in need of love
and baby you're in need of love
so what about us
on and on and on til the break of dawn, and it's on
",What About Us
Jodeci,"Yo what's up K, what's up dog (Hey)
It's cool man, yo what's been goin' on with you man
Look K, you know everything that's been goin' on, what's up baby
What's up, so what's up man,
Nothin' just the same girl that gave me a tatoo last weekend
Well, yeah I heard that, she got it goin' on

Won't waste your time, I won't waste your time
Don't play with my mind, don't play with my mind
Won't waste your time, I won't waste your time
Don't play with my mind, don't play with my mind

Ooh, last night I called you on the phone
Sounded like you had an attitude with me
Do you want me to leave you alone
If so, like a bird I will set you free
I won't NO!

I won't waste your time
So girl don't play with my mind (Do what you wanna do)
Do what you wanna do (Don't cha' play me like a fool)
Just don't play me like a fool

Was it something I said or something I done
Ya know I would do anything for you
Just last week we were having fun
Now all of a sudden you wants to be so cruel, oh oh oh

I won't waste your time (I won't waste your time, no no)
So girl don't play with my mind (Don't cha', don't cha' play with me)
Do what you wanna do (Do what you wanna do baby)
Just don't play me like a fool (Don't waste no time)

You know time is too precious girl (Yes it is, yes it is)
So we gotta do, what we gotta do (Yeah)
You know games are not for me no, no (No, no)
If you want, I can play them too (I won't waste your time, no)

I won't waste your time (Oh)
So girl don't play with my mind (Hey)
Do what you wanna do (Do what you wanna do with me baby)
Just don't play me like a fool (Don't cha' play me like ya fool)

Black sugar, the man gets enough of this stuff, it's good nigga
Give me, give me hey, yeah, they got the fingers
Up, up me ass but bigger black sugar
Big up, big up BUMP! BUMP! black sugar
Cats get enough of this stuff, it's good nigga
Give me, give me hey, yeah, they got the fingers
Up, up me ass but bigger black sugar
Big up, big up BUMP! BUMP!
Give me the day, give me the day, I'm freestyler
Breakin' through the place, black sugar on she prowla
Just because I'm far, plenty gent-men gets angry
Bucks and bucks, in my butt and then ya take me, ooh baby
Help me, help me, help me 9-1-1 honey
Check for respect and a nine for me gun, son
I don't really wanna hurt no one
Me just wanna break a few bones when I'm done

I won't waste your time (Oh)
So girl don't play with my mind (Hey)
Do what you wanna do (Do what you wanna do with me baby)
Just don't play me like a fool (Don't cha' play me like ya fool)
",Won't Waste You
