Band,Lyrics,Song
Steven Curtis Chapman,"It's knowin' that your door is always open
And your path is free to walk
That makes me tend to leave my sleepin' bag rolled up
And stashed behind your couch

And it's knowin' I'm not shackled by forgotten words and bonds
And the ink stains that have dried upon some lines
That keeps you in the back roads
By the rivers of my memory and keeps you ever gentle on my mind

It's not clingin' to the rocks and ivy
Planted on their columns now that bind me
Or somethin' that somebody said because
They thought we fit together walkin'

It's just knowin' that the world will not be cursin' or forgivin'
When I walk along some railroad track and find
That you're movin' on the back roads
By the rivers of my memory and for hours you're just gentle on my mind

Though the wheat fields and the coal mines and the junkyards
And the highways come between us
And some other woman's cryin' to her mother
'Cause she turned and I was gone

I still might run in silence tears of joy might stain my face
And the summer sun might burn me till I'm blind
But not to where I cannot see
You walkin' on the back roads by the rivers flowin' gentle on my mind

I dip my cup of soup
Back from some gurglin', cracklin' cauldron in some train yard
My beard a roughenin' coal pile
And a dirty hat pulled low across my face

Through cupped hands 'round a tin can
I pretend to hold you to my breast and find
That you're wavin' from the back roads
By the rivers of my memory ever smilin', ever gentle on my mind",Hark! The Herald Angels Sing/The Music of Christmas
Steven Curtis Chapman,"One of us is cryin' as our hopes and dreams are led away in chains, 
And we're left all alone, 
One of us is dyin' as our love is slowly lowered in the grave, 
Oh and we're left all alone. 

But for all of us who journey through the dark abyss of loneliness 
There comes a great announcement - we are never alone - 
For the maker of each heart that breaks, the giver of each breath we take 
Has come to earth and given hope it's birth. 

[Chorus]
And our God is with us, Emmanuel. 
he's come to save us, Emmanuel. 
And we will never face life alone 
Now that God has made Himself known, 
As Father and Friend, with us through the end, Emmanuel. 

He spoke with prophets voices and showed Himself in a cloud of fire, 
But no one had seen His face, 
Until the One Most Holy revealed to us His perfect heart's desire, 
And left His rightful place, 

And in one glorious moment, all eternity was shaken, 
As God broke through the darkness that had kept us apart. 
And with love that conquers loneliness, and hope that fills all emptiness 
He came to earth to show our worth. 

[Chorus]

So rejoice, rejoice, Emmanuel has come! 
And our God is with us, Emmanuel. 
he's come to save us, Emmanuel. 
And we will never face life alone 
Now that God has made Himself known, 
As Father and Friend, with us through the end, Emmanuel. 
Our God is with us, Emmanuel!",Our God Is With Us
Steven Curtis Chapman,"Oh what a precious promise,
Oh what a gift of love;
An angel tells a virgin that
She's gonna have a son.
And though it's a precious promise,
She wonders how can this be;
What will the people say
And what if Joseph can't believe.
And her questions and her fears
Are met with an overwhelming joy
That God has chosen her.
Oh what a precious promise;
Mary waits as heaven comes to earth.

Oh what a precious promise,
Oh what a gift of love;
Joseph makes his choice to do
What few men would have done:
To take Mary as his bride,
When she's already carrying a child
That isn't his own.
Oh what a precious promise;
Mary and the child will have a home.

And shepherds stand on a hillside,
Their hearts racing with the news the angel told them;
A star's light fills up the dark sky,
As the night of precious promise is unfolding.

Oh what a precious promise,
Oh what a gift of love;
The waiting now is over and
The time has finally come.
For the God who made this world
To roll back the curtain
And unveil His passion for the heart of man.
Oh what a precious promise,
Lying in a manger in Bethlehem.
Oh what a precious promise,
Lying in a manger in Bethlehem



",Precious Promise
Steven Curtis Chapman,"Well, He cried when He was hungry,
Did all the things that babies do;
He rocked and He napped on His mother's lap,
And He wiggled and giggled and cooed.
There were the cheers when He took His first step,
And the tears when He got His first teeth;
Almost everything about this little baby
Seemed as natural as it could be.

CHORUS
But this baby made the angels sing,
And this baby made a new star shine in the sky.
This baby had come to change the world.
This baby was God's own son, this baby was like no other one.
This baby was God with us, this baby was Jesus.

And this baby grew into a young boy,
Who learned to read and write and wrestle with dad;
There was the climbin' of trees and the scrapin' of knees,
And all the fun that a boy's born to have.
He grew taller and some things started changing,
Like His complexion and the sound of His voice;
There was work to be done as a carpenter's son
And all the neighbors said He's such a fine boy.

But this boy made the angels sing,
And this boy made a new star shine in the sky.
This boy had come to change the world.
This boy was God's own son, this boy was like no other one.
This boy was God with us. This boy became a man,

And love made Him laugh and death made Him cry.
With the life that He lived and the death that He died,
He showed us heaven with His hands and His heart,
'Cause this man was God's own son.
This man was like no other one,
Holy and human right from the start.

(chorus)

This baby was God with us, this baby, this baby was Jesus; this baby was Jesus, this baby was Jesus.



",This Baby
Steven Curtis Chapman,"I'm no stranger to your gentle reminders
That the world does not revolve around me
But no sooner have you spoken the words
Then your love comes once again to surround me
And every time I look in your eyes
I see the reflections of myself
But this time I want to look deeper
And see you and nobody else

So, tell me what you think, and tell me what you feel
I want to hear the thunder I'm so quick to steal
Listen to the dreams you're dreaming and celebrate you
Let me show you what a treasure you are
A priceless gift from heaven to this thankful heart
I want to take this lifetime to celebrate you
I want to celebrate you

I have heard you say so many times
How you're sorry you're not everything you should be
So let me tell you this one more time
There's no way you could be any more precious to me
But I know that lovely flowers and phrases
Are not what you need the most from me
You're longing for someone to listen
And that's what I want to learn how to be

I want to share your laughter
And I want to share your tears
We're gonna share this life together
And I'm gonna celebrate you
Celebrate you



",Celebrate You
Steven Curtis Chapman,"Isaiah 42:5-7; Jn. 8:31-36; Rom. 8:38-39

The sun was beating down inside 
The walls of stone and razor wire
As we made our way across the prison yard
I felt my heart begin to race 
As we drew nearer to the place
Where they say that death 
Is waiting in the dark
The slamming doors of iron 
Echoed through the halls
Where despair holds life 
Within its cruel claws 

But then I met a man 
Whose face seemed so 
Strangely out of place
A blinding light of hope 
Was shining in his eyes
And with repentance in his voice 
He told me of his tragic choice
That led him to this place 
where he must pay the price

But then his voice grew strong 
As he began to tell
About the one he said 
Had rescued him from Hell, he said

I'm free, yeah, oh, 
I have been forgiven
God's love has taken off my chains, 
And given me these wings
And I am free, yeah, yeah 
And the freedom I've been given 
Is something that not even 
Death can take away from me
Because I'm free
Jesus set me free

We said a prayer and said good-bye, 
And tears began to fill my eyes
As I stepped back out into the blinding sun
And even as I drove away I found 
That I could not escape 
The way he spoke of what 
The grace of God had done
I thought about how sin 
Had sentenced us to die
And how God gave His only Son 
So you and I could say

I'm free, yeah, oh, 
I have been forgiven
God's love has taken off my chains, 
And given me these wings
And I am free, yeah, yeah 
And the freedom I've been given 
Is something that not even 
Death can take away from me
Because I'm free
Jesus set me free

And if the Son has set you free
Oh if the Son has set you free
Than you are free indeed, 
Oh, you are really free

If the Son has set you free
Oh if the Son has set you free
Than you are free, really, really free, oh

We're free, yeah, 
Oh we have been forgiven
God's grace has broken every chain, 
And given us these wings

And we're free, yeah, 
and the freedom we've been given 
Is something that not even 
death can take from you and me

Because we're free, yeah 
and the freedom I've been given 
Is something that not even 
death can take away from me

Because we're free
We are free, we are free
The Son has set us free
If the Son has set you 
You are free indeed",Free
Steven Curtis Chapman,"I have come to this ocean
And the waves of fear are starting to grow
The doubts and questions are rising with the tide
So I'm clinging to the one sure thing I know

I will hold on to the hand of my Savior
And I will hold on with all my might
I will hold loosely to things that are fleeting
And hold on to Jesus, I will hold on to Jesus for life

I've tried to hold many treasures
They just keep slipping through my fingers like sand
But there's one treasure that means more than breath itself
So I'm clinging to it with everything I am

I will hold on to the hand of my Savior
And I will hold on with all my might
I will hold loosely to things that are fleeting
And hold on to Jesus, I will hold on to Jesus for life

Like a child holding on to a promise
I will cling to His word and believe
As I press on to take hold of that
For which Christ Jesus took hold of me

So I will hold on to the hand of my Savior
And I will hold on with all my might
I will hold loosely to things that are fleeting
And hold on to Jesus for life
I will hold on to Jesus for life
I'll hold on to Jesus, I will hold on to Jesus for life
Hold on for life
",Hold on to Jesus
Steven Curtis Chapman,"Let Us Pray
1 Thess 5:17, Col 4:2, Eph 6:18, Heb 4:16, Rom 12:12

I hear you say your heart is aching
You've got trouble in the making
And you ask if I'll be praying for you please
And in keeping with convention
I'll say yes with good intentions
To pray later making mention of your needs
But since we have this moment here at heaven's door
We should start knocking now, what are we waiting for?

Let us pray, let us pray, everywhere in every way
Every moment of the day, it is the right time
For the Father above, He is listening with love
And He wants to answer us, so let us pray

So when we feel the Spirit moving
Prompting, prodding and behooving
There is no time to be losing, let us pray
Let the Father hear us saying
What we need to be conveying
Even while this song is playing, let us pray
And just because we say the word, ""Amen""
It doesn't mean this conversation needs to end

Let us pray, let us pray, everywhere in every way
Every moment of the day, it is the right time
Let us pray without end and when we finish start again
Like breathing out and breathing in, let us pray

Let us approach the throne of grace with confidence
As our prayers draw us near
To the One who knows our needs
Before we even call His name

Let us pray, let us pray, everywhere in every way
Every moment of the day, it is the right time
For the Father above, He is listening with love
And He wants to answer us, so let us pray

Let us pray everywhere in every way
Every moment of the day, it is the right time
Let us pray without end and when we finish start again
Like breathing out and breathing in, let us pray",Let Us Pray
Steven Curtis Chapman,"On the bank of a Tennessee River
In a small Kentucky town
I drew my first breath one cold November morning
And before my feet even touched the ground
With the doctors and the nurses gathered 'round
I started to dance
I started to dance

A little boy full of wide-eyed wonder
Footloose and fancy free
But it would happen, as it does for every dancer
That I'd stumble on a truth I couldn't see
And find a longing deep inside of me, it said

I am the heart, I need the heartbeat
I am the eyes, I need the sight
I realize that I am just a body
I need the life
I move my feet, I go through the motions
But who'll give purpose to chance
I am the dancer
I need the Lord of the dance

The world beneath us spins in circles
And this life makes us twist and turn and sway
But we were made for more than rhythm with no reason
By the one who moves with passion and with grace
As He dances over all that He has made

I am the heart, He is the heartbeat
I am the eyes, He is the sight
And I see clearly, I am just a body
He is the life
I move my feet, I go through the motions
But He gives purpose to chance
I am the dancer
He is the Lord of the dance

Lord of the dance
Lord of the dance

And while the music of his love and mercy plays
I will fall down on my knees and I will pray

I am the heart, You are the heartbeat
I am the eyes, You are the sight
And I see clearly, I am just a body
You are the life
I move my feet, I go through the motions
But You give purpose to chance
I am the dancer
You are the Lord of the dance

I am the heart, You are the heartbeat
I am the eyes, You are the sight
And I see clearly, I am just a body
You are the life
I move my feet, I go through the motions
But You give purpose to chance
I am the dancer
You are the Lord of the dance

I am the dancer
You are the Lord of the dance",Lord of the Dance
Steven Curtis Chapman,"I've got a Grandpa Rudd
He gave thirty years to the lumber yard
Loving his family and working hard
Got a faith like a solid rock
He's just doing the walk, yeah

I've got a friend named Larry
He sends me letters from a foreign land
He moved there with his kids and his pretty wife Mary
To answer the holy call
He's just doing the walk

Oh, you can run with the big dog
You can fly with the eagle
You can jump through all the hoops
And climb the ladder to the top
But when it all comes down
You know it all comes down to the walk
It all come down to the walk

Now there's a man I know
He said He'd come to show us the way
He died on a cross and He rose from the grave
And proved He was more than talk
He taught us the walk, yes He did

And now I'm singing my songs
Standing up on a big and bright stage, yeah
And I do my dance while the music plays
But when the music stops
Am I doing the walk?

'Cause you can run with the big dog
You can fly with the eagle
You can jump through all the hoops
And climb the ladder to the top
But when it all comes down
You know it all comes down to this

Do justly, love mercy
Walk humbly with your God
Do justly, love mercy
Walk humbly with your God
Do justly, love mercy
Walk humbly with your God
Do justly, love mercy
Walk humbly with your God
Walk humbly with your God

'Cause you can run with the big dog
You can fly with the eagles
You can jump through all the hoops
And climb your ladder to the top
But when it all comes down
You know it all comes down, down, down, down, down
To the walk

To the walk
To the walk
To the walk
Do justly, love mercy
Walk humbly with your God
Do justly, love mercy
Walk humbly with your God
Do justly, love mercy
Walk humbly with your God
You all keep doing the walk
",The Walk
Steven Curtis Chapman,"Another case of I wish I wouldn't have;
Another promise not to let Him down again.
Fighting battles in a war I thought was over;
The old man of sin died a long time ago,
But left behind a sinful nature deep within,
So if I want to win this fight,
There's a part of me that must die,
But I'm not gonna cry.

[Chorus:]
'Cause I'm dying to live,
Live for Jesus.
Dying to give myself to Him,
And the life that He gives will be mine
If I am dying to live.
Dying to live,
Live for Jesus.
I want to give myself to Him;
Gonna give up - from now on I'm dying to live.
Giving up what I can't keep anyway,
To gain something that I know I'll never lose,
Trading in the temporary for the eternal,
And though it's settled, I'm reminded everyday;
To live or die to self - it's up to me to choose,
So if I want to win the fight there's a part of me
That must die.
Well I've said my goodbyes.

[Chorus]",Dying to Live
Steven Curtis Chapman,"In the distance I can see the storm clouds coming my way,
And I need to find a shelter
Before it starts to rain,
So I turn and run to you Lord;
You're the only place to go,
Where unfailing love surrounds me
When I need it most.

[Chorus:]
You're my hiding place;
Safe in your embrace,
I'm protected from the storm that rages
When the waters rise,
And I run to hide;
Lord, in You I find my hiding place.
I'm not asking You to take away
My troubles, Lord,
'Cause it's through the stormy weather
I learn to trust You more.
So I thank You for Your promise;
I have come to know
Your unfailing love surrounds me
When I need it most.

[Chorus]

So let Your people seek You
While You may be found,
'Cause You're our only refuge
When the rain comes pouring down.

[Chorus]",Hiding Place
Steven Curtis Chapman,"As I look back on the road I've travelled, 
I see so many times He carried me through; 
And if there's one thing that I've learned in my life, 
My Redeemer is faithful and true. 
My Redeemer is faithful and true. 

[Chorus] 
My Redeemer is faithful and true. 
Everything He has said He will do, 
And every morning His mercies are new. 
My Redeemer is faithful and true. 

My heart rejoices when I read the promise 
'There is a place I am preparing for you.' 
I know someday I'll see my Lord face to face, 
'Cause my Redeemer is faithful and true. 
My Redeemer is faithful and true. 

[Chorus]
 
And in every situation He has proved His love to me; 
When I lack the understanding, He gives more grace to me. 

[Chorus]",My Redeemer Is Faithful and True
Steven Curtis Chapman,"Strolling past temptation avenue, 
You hear so many voices calling you; 
Maybe you'll step in and take a quick look around. 
Try to walk through it, 
And you're gonna fall down. 

[CHORUS ]
You've gotta run away, 
Turn around and run the other way; 
Don't even look in the direction 
of a thought you should not entertain. 
You've gotta run away, 
It's a prison that is calling your name; 
You just can't win if you play, 
So run away. 
There comes a time when you must stand and fight, 
When the darkness tries to overcome the light; 
But sin that is dressed up in the color of gray, 
Is only defeated 
When we run away. 

(chorus) 

Don't put yourself in that position 
Where sin can make it's proposition; 
And if you find that you have fallen, 
You gotta get up, get ready to run 
Next time sin comes calling, calling. 
(
chorus)",Run Away
Steven Curtis Chapman,"Another rainy Monday, 
Looks like I'm gonna be late again; 
Why does the race I'm runnin' never seem to have an end. 
A day away from Sunday, 
Feels like I'm already losing ground - 
Funny sometimes how quickly my emotions get turned around; 
They're letting me down. 

[CHORUS] 
I gotta keep my eyes on Jesus 
Through the weak days; 
In a world where we really don't belong, 
I've discovered if I keep my eyes on Jesus 
Through the weak days, 
Then even on the weak days He'll make me strong. 
The spirit is so willing 
When the fellowship is so sweet; 
How soon all the good intentions 
Find the flesh is weak. 
But there's a power waiting, 
With no limits to times or space; 
All of our doubts and fears disappear without a trace 
When we look on His face. 

(chorus) 

And when we keep our eyes on Jesus, 
We'll gladly follow where He leads us. 

(chorus)",Weak Days
Steven Curtis Chapman,"Jimmy and Mary were quite a pair back in their younger days
They met a married in six weeks time and
That was sixty years ago this May
Four kids made a house a home and a love for Jesus kept them strong
Now every morning at eight A.M. Jimmy takes a drive through town
He spends his days at Mary's side In a home for the old and broken down
With a cane in his lap and a Bible in his hand He reads her stories about the promised land
And with tears in their eyes they dream of a place Where everything changes in the light of Jesus' face and

CHORUS
That's paradise... Hey, that's paradise...
When the life breaks through and the old's made new And the joy will never die, that's paradise

In another corner of this world, met another man named Jim
Told me how twenty years of running from God Had finally gotten the best of him
He said all hope was gone and he wanted to die 'Cause what could God do with such a messed up guy
So we talked about Jesus, God's love and His plan And when Jim walked away he was a brand new man

(Chorus)

Now listen, Well I know the best remains to be seen In a place that's far beyond our wildest dreams
But until we see heaven we've got Jesus' world That He'll never leave us and each prayer will be heard



",That's Paradise
Steven Curtis Chapman,"I didn't come lookin' for trouble
And I don't want to fight needlessly
But I'm not gonna hide in a bubble
If trouble comes for me
I can feel my heart beating faster
I can tell something's coming down
But if it's gonna make me grow stronger thenâ?¦

Bring it on
Let the lightning flash, let the thunder roll, let the storm winds blow
Bring it on
Let the trouble come, let the hard rain fall, let it make me strong
Bring it on

Now, maybe you're thinkin' I'm crazy
And maybe I need to explain some things
'Cause I know I've got an enemy waiting
Who wants to bring me pain
But what he never seems to remember
What he means for evil God works for good
So I will not retreat or surrender

Now, I don't want to sound like some hero
'Cause it's God alone that my hope is in
But I'm not gonna run from the very things
That would drive me closer to Him
So bring it on

Bring it on
Let the lightning flash, let the thunder roll, let the storm winds blow
Bring it on
Let the trouble come, let it make me fall on the One who's strong
Bring it on
Let the lightning flash, let the thunder roll, let the storm winds blow
Bring it on
Let me be made weak so I'll know the strength of the One who's strong
Bring it on
Bring it on



",Bring It On
Steven Curtis Chapman,"I will not pretend to feel the pain you're going through
I know I cannot comprehend the hurt you've known
And I used to think it mattered if I understood
But now I just don't know

Well, I'll admit sometimes I still wish I knew what to say
And I keep looking for a way to fix it all
But we know we're at the mercy of God's higher ways
And our ways are so small

But I will carry you to Jesus
He is everything you need
I will carry you to Jesus on my knees

It's such a privilege for me to give this gift to you
All I'd ever hope you'd give me in return
Is to know that you'll be there to do the same for me
When the tables turn

And if you need to cry go on and I, I will cry along with you, yeah
I've given you what I have but still I know the best thing I can do
Is just pray for you

I'll carry you
I'll take you to Jesus on my knees




",Carry You to Jesus
Steven Curtis Chapman,"My heart is restless as I wander through this jungle
The trees above refuse to let the sunlight through
And somewhere deep inside I hear the whispered longings
That tell me I was made for more than this

A blinding flash of light falls down into the darkness
Slowly I notice strange new markings on the trail
The crimson drops are calling out to me come and follow
I am the God who made you
Let Me show you how to live and I cry

I want to be a God follower
I want to go wherever He leads
I want to be a God follower
I want to walk the trail he's marked for me
And be a God follower more than anything

And now I journey on with purpose and with passion
Just like a dead man who's been given breath again
And though this path can still grow 
Dark with tears and sorrow
I know he will never leave me
So with everything I am I will say

And when I reach God's place
I will look into his face
And then I'll look for you
Will I find you there?
Can you say with me
I want to be a God follower
I want to be a God follower
I want to be a God follower
I want to be a God follower",God Follower
Steven Curtis Chapman,"And the pain falls like a curtain
On the things I once called certain
And I have to say the words I fear the most
I just don't know

And the questions without answers
Come and paralyze the dancer
So I stand here on the stage afraid to move
Afraid to fall, oh, but fall I must
On this truth that my life has been formed from the dust

God is God and I am not
I can only see a part of the picture He's painting
God is God and I am man
So I'll never understand it all
For only God is God

And the sky begins to thunder
And I'm filled with awe and wonder
'Til the only burning question that remains
Is who am I

Can I form a single mountain
Take the stars in hand and count them
Can I even take a breath without God giving it to me
He is first and last before all that has been
Beyond all that will pass

Oh, how great are the riches of His wisdom and knowledge
How unsearchable for to Him and through Him and from Him are all things

So let us worship before the throne
Of the One who is worthy of worship alone



",God Is God
