Band,Lyrics,Song
Jocelyn Enriquez,"[VERSE 1] 
 Looking from a window above 
 It's like a story of love 
 Can you hear me 
 Came back only yesterday 
 I'm moving further away 
 Want you near me 
 
[-HOOK-] 
 All I needed was the love you gave 
 All I needed for another day 
 And all I ever knew 
 Only you 
 
[-VERSE 2-] 
 Sometimes when I think of your name 
 When it's only a game 
 And I need you 
 Listen to the words that you say 
 It's getting harder to stay 
 When I see you 

[-HOOK-] 

 All I needed was the love you gave 
 All I needed for another day 
 And all I ever knew 
 Only you 
 All I ever knew 
 All I ever knew 

[-HOOK-] 

 All I needed was the love you gave 
 All I needed for another day 
 And all I ever knew 
 Only you 
 
[-VERSE 3-] 
 This is gona take a long time 
 And I wonder what's mine 
 Can't take no more 
 Wonder if you'll understand 
 It's just the touch of your hand 
 Behind a closed door 

[-HOOK-] 
 All I needed was the love you gave 
 All I needed for another day 
 And all I ever knew 
 Only you",Only You
Jocelyn Enriquez,"To live in a house not a home
I've counted my tears falling down each night for all these years
I can't believe it ends like this
We've gone on our own separate ways to find ourselves again
Where should I go from here can I live here without your love
Somehow someday I'll make it through
Please help me ease the pain
I'm lost I can't find my way
Hope and pray it will end in time the pain inside
Can somebody hear I'm crying for shelter
Please help me see this through
A world that can no longer feel
Seems that they have abandoned me forgotten me
Do I blame myself
Save me from being alone
How can you mend a lonely soul
Trying to leave the past the sorrow and the lies
How can I forgive someone who just doesn't understand
That true love is gone away
Maybe it's for the best to live these lives on our own
To say goodbye still I wonder why
Please help me ease the pain
I'm lost I can't find my way
Hope and pray it will end in time the pain inside
Can somebody hear I'm crying for shelter
Please help me see this through
A world that can no longer feel
Seems that they have abandoned me forgotten me
Do I blame myself
Save me from being alone
(To live in a house
(Without your love)
(Still wonder why)
(Can somebody hear)
(Can somebody hear)
(I'm crying for shelter)
Save me from being alone",Save Me From Being Alone
Jocelyn Enriquez,"Never, never have I felt like this before
Forever, I just want to be forever yours
So take me in your arms and say you love me
Hold me close and never let go

[CHORUS]
Baby please stay with me
Your love is heavenly
Won´t you please say it´s me
That you love forever
Baby please stay with me
Hold me so tenderly
Won´t you please stay with me
Be in love together

Lately, seems like you are always on my mind
And maybe I want you to be forever mine
So pull me close and wrap your arms around me
Love me with all your heard and soul

[CHORUS]
Every night I see you in my dreams
Only when I´m with you do I feel complete
Your the only one who can fulfill my needs
Baby please stay
Don´t go away
Won´t you say you´ll stay

[CHORUS out]",Stay With Me
Jocelyn Menard,"Somewhere waiting for me
There is someone I'm longing to see
Someone I simply can't help but adore
Someone who'll thrill me forever
Some day my prince will come
Some day I'll find my love
And how thrilling that moment will be
When the prince of my dreams comes to me
He'll whisper, I love you,
And steal a kiss or two
Though he's far away,
I'll find my love some day
Some day when my dreams come true
Some day I'll find my love
Someone to call my own
And I'll know her the moment we meet
For my heart will start skipping a beat
Some day we'll say and do
Things we've been longing to
Though she's far away
I'll find my love some day
Some day when my dreams come true",Someday My Prince Will Come
Jocelyne Béroard,"jacob-
Iyé
(iyé)
Iyé
(iyé)

Tou sa ki vé sòti dan a yo a lablani
Vini pou zòt kouté, makrélaj ké tonbé
Sòti dan fon, vini pou kouté an son
Milan dèyé lisin avé manzé Hoslin

Iyé
(iyé)
Iyé
(iyé)

Mwen di si paraza fanm-la ka bay lavwa
Anlé démélé aw, fè kon si sé pa ta'w
Pa jen faché, pa chouboulé
Pas lé tout présyon-la ka monté
Sé wou sèl ki ka tonbé

Iyé
(iyé)
Iyé
(iyé)

Kouté, perlenpenpew
(Wa)
Perlenpenpew
(Wa)
Perlenpenpew
(Wa)
Perlenpenpew
(Wa)

Jocelyne-
Mè non,
(wi)
An an
Man pa lé ri di sa, (a)
Ki rivé Alberta, (a
Mé i ka two pwan kòy pou an fanm desekede
Lot jou-a nou alé adan ""garden party"" yo a
Té ni an lo bèl moun, i mété pli bèl wob, ay ay ayayay
Mé tou moun lan savé ki adan joli piti péyi nou an
soley-la ka kléré mé lapli-ya ka fè zafey
Rob li té long kon an jou san pen
E lé kouri vini i volplané dan jaden-an
Yépa, krakrakra

Man pa lé rakonté sa ki té rivé Kolino
Mé i ka bay lavwa lè sé an lòt ki ka pwan fè
Lòtjou i ba fanm li an ti sisi pou mijoté
Lè i rivé a tab mandé si fanm-la ka fè grèv
Madanm li déklaré : ""Kolino, sisi sa piti
E lé mwen dépwélé'y i vini ankò pli piti
Lè i té ka woti, dé zyé mwen wè'y rétrési
Epi lè mwen gouté'y i pa té rété pou nou manjé""
Yépa, Yépa

kè-
Ba nou milan, tou sa ou sav an lé yo
Ba nou anko, nou pé ké jen las amizé

Iyé
(iyé)
Iyé
(iyé)

Man di si paraza fanm-la ka bay lavwa
Anlé démélé aw, fè kon si sé pa ta'w
Pa jan faché, pa chouboulé
Pas lé tout présyon-la ka monté
Sé wou sèl ki ka tonbé

Iyé
(iyé)
Iyé
(iyé)

Mé wi
(non)
Ou ja wè'y
Fifin sé an ti fi (wi)
Ki ni an ti fidji (wi)
Mé Bondyé bay an kò, menm fanm ka gadé
I toujou ka sapé, ou pé ké jen apwann li karé
Lé non manzél anlé, latè pa ka pòté'y han han rayayay
An jou i té mété an djin pou tout moun konstaté
Sa i kriyé kapital sé pa ti zafè, sé pa jwé
Mi an papyé tonbé i té oblijé ramasé'y
Djin-la pa rézisté é kapital vin libéré, yépa !

(iyé)
Iyé
(iyé)
Iyé

Kouté, perlenpenpew
(Wa)
Kouté, ...
(Wa)
Kouté, ...
(Wa)
Kouté, ...
(Wa)

Kra kra kra

(...) = kè-",Milans
Jocelyne Jocya,"It's cost me a lot
But there's one thing that I've got 
It's my man
Cold and wet, tired you bet
But all that I soon forget 
With my man
He's not much for looks 
And no hero out of books 
Is my man
Two or three girls has he 
That he likes as well as me
But I love him! 
I don't know why I should
He isn't good, he isn't true
He beats me too
What can I do?
 
Oh, my man I love him so
He'll never know
All my life is just despair
But I don't care 
When he takes me in his arms 
The world is bright, all right
What's the difference if I say
I'll go away, When I know
I'll come back on my knees some day?
For whatever my man is 
I am his forever more
Oh, my man I love him
 
Sometimes I say 
If I could just get away 
With my man
He'd go straight sure as fate
For it never is too late
For a man
I just like to dream 
Of a cottage by a stream 
With my man
Where a few flowers grew
And perhaps a kid or two
Like my man
And then my eyes get wet
I most forget till he gets hot
And tells me not to talk such rot
 
Oh, my man I love him so
He'll never know
All my life is just despair
But I don't care 
When he takes me in his arms 
The world is bright, all right
What's the difference if I say 
I'll go away, When I know
I'll come back on my knees some day?
For what ever my man is 
I am his forever more",Mon Homme
Jocelyne Jocya,"Looking out on the morning rain I used to feel uninspired
And when I knew I'd have face another day.
Lord, it made me feel so tired.
Before the day I met you
Life was so unkind.
Your love was the key to my peace of mind
'Cause you make me feel, you make me feel,
You make me feel like a natural woman.
When my soul was in the lost and found
You came along to claim it.
I didn't know just what was wrong with me
Till your kiss helped me name it.
Now I'm no longer doubtful of what I'm livin' for,
'Cause if I make you happy I don't need to do more.
You make me feel, you make me feel,
You make me feel like a natural woman.
 
Oh, baby, what you've done to me
(What you've done to me')
You make me feel so good inside
(Good inside.)
And I just want to be 
(Want to be)
Close to you. 
You make me feel so alive!
You make me feel, you make me feel,
You make me feel like a natural, natural woman.
You make me feel, you make me feel,
You make me feel like a natural natural woman
You make me feel, you make me feel,
You make me feel like a natural natural woman",Natural Women
Jochen Kowalski,"O come, all ye faithful,
Joyful and triumphant,
O come ye, O come ye to Bethlehem!
Come and behold Him,
Born the King of Angels!
O come let us adore Him,
O come let us adore Him,
O come let us adore Him,
Christ the Lord!

God of God,
Light of Light,
Lo! He abhors not the Virgin's womb,
Very God,
Begotten, not created.

O come, all ye faithful,
Joyful and triumphant,
O come ye, O come ye to Bethlehem!
Come and behold Him,
Born the King of Angels!
O come let us adore Him,
O come let us adore Him,
O come let us adore Him,
Christ the Lord!

See how the shepherds
Summoned to His cradle,
Leaving their flocks, draw nigh to gaze!
We, too, will thither
Bend our hearts' oblations.

O come, all ye faithful,
Joyful and triumphant,
O come ye, O come ye to Bethlehem!
Come and behold Him,
Born the King of Angels!
O come let us adore Him,
O come let us adore Him,
O come let us adore Him,
Christ the Lord!

Lo, star-led chieftains,
Magi, Christ adoring,
Offer Him incense, gold and myrrh,
We to the Christ-child
Bring our hearts' oblations

O come, all ye faithful,
Joyful and triumphant,
O come ye, O come ye to Bethlehem!
Come and behold Him,
Born the King of Angels!
O come let us adore Him,
O come let us adore Him,
O come let us adore Him,
Christ the Lord!

Child, for us sinners,
Poor and in the manger,
Fain we embrace
Thee with love and awe,
Who would not love Thee,
Loving us so dearly?

O come, all ye faithful,
Joyful and triumphant,
O come ye, O come ye to Bethlehem!
Come and behold Him,
Born the King of Angels!
O come let us adore Him,
O come let us adore Him,
O come let us adore Him,
Christ the Lord!

Sing, choirs of angels,
Sing in exultation,
O sing, all ye citizens of heaven above!
""Glory to God,
In the highest!""

O come, all ye faithful,
Joyful and triumphant,
O come ye, O come ye to Bethlehem!
Come and behold Him,
Born the King of Angels!
O come let us adore Him,
O come let us adore Him,
O come let us adore Him,
Christ the Lord!

Yea, Lord, we greet Thee,
Born this happy morning,
Jesus, to Thee be all glory given,
Word of the Father,
Now in flesh appearing!

O come, all ye faithful,
Joyful and triumphant,
O come ye, O come ye to Bethlehem!
Come and behold Him,
Born the King of Angels!
O come let us adore Him,
O come let us adore Him,
O come let us adore Him,
Christ the Lord!",Adeste Fideles
Jochen Kowalski,"Of all the boys I've known, and I've known some
Until I first met you, I was lonesome
And when you came in sight, dear, my heart grew light
And this old world seemed new to me

You're really swell, I have to admit you
Deserve expressions that really fit you
And so I've racked my brain, hoping to explain
All the things that you do to me

Bei mir bist do schon, please let me explain
Bei mir bist do schon means you're grand
Bei mir bist do schon, again I'll explain
It means you're the fairest in the land

I could say ""Bella, bella"", even ""sehr wunderbar""
Each language only helps me tell you how grand you are

I've tried to explain, bei mir bist do schon
So kiss me and say you understand

Bei mir bist do schon, you've heard it all before
 but let me try to explain
Bei mir bist do schon means that you're grand
Bei mir bist do schon, it's such an old refrain
 and yet I should explain
It means I am begging for your hand

I could say ""Bella, bella"", even ""sehr wunderbar""
Each language only helps me tell you how grand you are

I could say ""Bella, bella"", even ""sehr wunderbar""
Each language only helps me tell you how grand you are

I've tried to explain, bei mir bist do schon
So kiss me and say that you will understand",Bei mir bist du schรถn
Jochen Rueckert,"Just friends, lovers no more
Just friends, but not like before
To think of what we've been and not to kiss again
Seems like pretending it isn't the ending
Two friends drifting apart
Two friends, but one broken heart
We loved, we laughed, we cried, and suddenly love died",Just Friends
Jodeci,"(Been watching you baby
For a long time
You look so good
Got my eyes on you)

I've been watching you
For so very long
Trying to get my nerve built up to be so strong
I really want to meet you
But I'm kind of scared
'Cause you're the kind of lady
With so much class
Get my thoughts together
For the very next day
But when I see you lady
I forget what to say
Your eyes and hair
Such a beautiful tone
The way you dress and walk
It really turns me on
Ooh, you really turn me on
Come on, come on, come on

Come and talk to me
I really wanna meet you
Can I talk to you?
I really wanna know you
Come and talk to me
I really wanna meet you
Can I talk to you?
I really wanna know you
Oh, oh, oh, oh, oh

There you are again
With the same smile each day
I wanna know what it is that makes me feel this way
I wish I could grab you
Tell you what it means to me
To see you walking by my way
It really makes my day
Before I go to sleep and dream about you
I'm a single man
I hope that you are single too
Why do I seek
Something to set my mind free
'Cause curiousity is buggin' the hell outta me, baby
Talk to me, talk to me, talk to me, baby

Come and talk to me
I really wanna meet you
Can I talk to you?
I really wanna know you
Come and talk to me
I really wanna meet you
Can I talk to you?
I really wanna know you, baby

(You wanna tell me your name) wanna tell me your name
Let me play your game, ooh
You wanna tell me your name, ooh
(Let me play your game)

(I wanna) come and talk to me (come on, come on)
I really want, I really want, I really want, I really want to know you
Can I talk to you?
I really want, I really want, I really want, I really want to know you
Come and talk to me
I really want, I really want, I really want, I really want to know you
Come and talk to me
I really want, I really want, I really want, I really want to know you
I want you know you
I wanna know
You wanna tell me your name (tell me your name)
I wanna know
I wanna know
You wanna tell me your name (I wanna know ya)
Let me play your game (let me in your game, ooh)
I wanna know
Let me play your game",Come & Talk to Me
Jodeci,"Forever, forever, forever
So you're having my baby
And it means so much to me
There's nothing more precious
Than to raise a family
If there's any doubt in your mind
You can count on me
I'll never let you down
Lady believe in me

You and I
Will never fall apart
You and I
We knew right from the start, baby, baby
The day
We fell so far in love
Now our baby is born, healthy and strong
Now our dreams are reality

Forever my lady
It's like a dream
I'm holding you close
You're keeping me warm
If this is ecstacy
Forever my lady
I say just what I mean
Forever and ever
I pray is what I see

Can you picture my lady
This empty scene
There's no me or no you
What will we do
An awful sight to me
If I ever lose you
Tell me where would I go
Life would have no meaning
And I pray that you will always stay with me

You and I
Would never fall apart, baby
You and I
Said we knew right from the start
The day
We fell so far in love
Now our baby is born
Healthy and strong
Now our dreams are reality

Forever my lady
It's like a dream
I'm holding you close
You're keeping me warm
If this is ecstacy
Forever my lady
I say just what I mean
Forever and ever
I pray is what I see

Lady, you and I
Will never fall apart,no no
You and I
I say we made it
And I say we made it from the start
The day
We fell so far in love
Now our baby is born
So healthy and strong
Now my dreams are reality
Yeahhhhhh
Forever my lady
Ah yeah, baby
Forever my lady
Woo oooh
Said I pray every night, baby
Forever my lady
And every day of the week",Forever My Lady
Jodeci,"I gotta love
I want to give you 
Much
Tell me

Bass
Love I want to give
Drop it
Bass

Drop it
Come get it gal
Whatever you want
Do do do do do do do do...

Your place or mine
Tell me what will it be
I've got something I would like for you to see
Trust me now

It won't take much time
I got something I want to leave on your mind
I gotta love
When you walk through that door

Kick off your shoes
Take off that dress I got a treat for you
Don't be afraid
Baby don't be scared
Can I touch your body or can I touch you there

[Chorus]
I gotta love
I want to give
If it's too much
Baby just tell me
I gotta love
I want to give
If it's too much
Baby just tell me

Check it out girlfriend
Yeah yeah yeah
Your sexy voice
Really turns me on

You've given me no choice
It's got to be done
How do you want it
Simple or complex

Gimme all you got
I just want to be sexed

I gotta love
I want to give you
Much
Tell me

Love I want to give you
Much
Tell me
Yeah yeah yeah

Drop it on em
I gotta love
I want to give
If it's too much

Baby just tell me
I gotta love
I want to give
If it's too much
Baby just tell me

DeVante, break it down
(DeVante's rap)

I take that it was fun
'Cause I didn't hear any complaints
I hope it was so good
Til it made you insane

I gotta love
If you should ever get bored
And you need some more
Come see me anytime
You're always welcome through my door

I gotta love
I want to give you
Much
Tell me

Love I want to give you
Much
Tell me

Bass
Yeah yeah yeah
Drop it on em
Aaah I gotta love

I gotta love
I want to give
If it's too much
Baby just tell me

[Chorus: x 2]

Break it down one more time for me baby
I gotta love
Bass, bass, bass
Do do do do do you want it baby

Bass
Do you want it baby

[Chorus]",Gotta Love
Jodeci,"I see ya movin' baby yeah
And you're lookin' good, said you're lookin' fine
Everything's gonna be alright, yeah
Let the music take control of your body tonight
Whoa, everything's gonna be alright, it's gonna be alright
Let the music take control of your body tonight
Father break it down

Well I begin the weekend with a groove
Roll about eight deep now what's my next move
Waitin' to nightfall so I can enjoy
System pumped by four Jeeps, runnin' like a convoy
Roll to the park, kinda crowded, what a scene
Pullin' up with Jodeci blastin' out the fifteen
So I park my ride, girls see my ???
Notice my grill that cause the pointin' and starin'

[Chorus]
Everything's gonna be alright
Let the music take control of your body tonight
Ooh, everything's gonna be alright
Let the music take control of your body tonight

Now I sign a couple autographs, take a few flicks
Order Don Perionne and lay back with my chicks
Michael's on the left of me, Smooth is flippin'
Took ??? away, I'm on the dance floor rippin'
?? is for the cutie, the ??? I'm tryna' find 'em
Tim is in the front and Mobat is right behind him
And me, I'm just layin' on the prowl
Got say what's up as the girls cry out
She grabbed her man, I think she tried to play him
My only thought, was to step to the A-M
Cause I came to have a good time
And at the end of the night, no doubt, I'm gonna get mine
Cause I don't have to raise my voice to be seen
I maintain, if you know what I mean
Understand I'm not conceded, Father's just mellow
I'm a smooth, dark Romeo, freak kinda fellow

[Chorus]

Do that dance, do that dance, baby
Do that dance, let's work it out
(Both) Do that dance, do that dance, baby
(Both) Do that dance, let's work it out
Do that dance, do that dance, baby
Do that dance, let's work it out
(Both) I said do that dance, do that dance, baby
(Both) Do that dance, let's work it out

Loungin' on the DL, this type of night is rare
I glanced to the right, oh who do we have here
Puffin Sweet, gettin' ripped, what the hell
I see Mr. Uptown, it's Andre Farwell
Conversatin' with his boys
I say stop and barge straight through the crowd,
It's time to get charged
It's kinda mellow so I leap,
To the center where the soul's rollin' five deep
Mark Currey, a ??, kin and nephew
Doin' the wild thing 'cause the soul is true
And every time I see bodies gettin' biz'
Girls are gettin' wild 'cause Father's known for his
And every time ya hear the music thumpity-thump
And all the girls gettin' bumped right in ya rump
So everybody who feel the mood is right
Get on the dance floor tonight

[Chorus:Repeat x2]

Everybody dance with me, oh yeah
Everybody move with me, everybody
Everybody dance with me
Everybody move with me
Everything's gonna be alright
Let the music take control of your body tonight",It's Alright
Jodeci,"Yesterday was pouring
For straight two months now
How did we do it I just don't know how
Life's a real big pain
Without you
You left you did the same

Cause my love was so true
Your friends told me that
You kept up with me I don't understand
Why we both can't see
Why is it this way
When we knew it could be
Could we both just stop
And listen to me

All alone I sit at home baby
Waiting for the phone to ring
All I know is that I miss you baby
This loneliness is driving me crazy
My phone doesn't ring anymore
No face, knocking at my door
Lonely days are here again
I know you feel the same girlfriend

Who was that guy I caught you walking with
In your smile I knew you wasn't with it
Let's stop awhile
And start our love again
It won't take no time
For our hearts to mend

All alone I sit at home baby
Waiting for the phone to ring
All I know is that I miss you baby
This loneliness is driving me crazy
My phone doesn't ring anymore
No face, knocking at my door
Lonely days are here again
I know you feel the same girlfriend

My phone doesn't ring anymore
No face, knocking at my door
Lonely days are here again
I know you feel the same girlfriend

I want to tell you why I'm lonely
I'm so lonely without you
Don't know what
I'm about do, oh girl I guess I've got to
Take you, back now
Driving me crazy, baby
Crazy, loneliness is driving me crazy
Loneliness is driving me crazy
I don't know what to tell you

My phone doesn't ring anymore
No face, knocking at my door
Lonely days are here again
I know you feel the same girlfriend
You don't come around
You don't call me no more, baby
This loneliness is driving me crazy

My phone doesn't ring anymore
No face, knocking at my door
Lonely days are here again
I know you feel the same girlfriend
My phone doesn't ring anymore
Ring anymore, baby",My Phone
Jodeci,"Don't talk
Just listen
First of all
I have to be honest with you baby
I lied
When I told you I never wanted to see you again
Can you please stay
Just for tonight
And maybe we can do something
Like make love
Watch the sunrise
Or listen to jojo, k-ci, sing us a verse
Slide closer baby
Ha, that devante baby
Oh you feel so sexy, so good
Sorry I left you
Left you cryin
But since you've been gone
I've been all alone
Cause all of my tears
You know they left me drownin
Please baby I'm beggin
For you to stay at home

Tonight
Let's start our love again
Tonight
We can be more than just friends
Don't you know
The sun
Is going down
So baby won't you just stay
Baby won't you just stay
For a little while


Baby won't you just stay
For a little while
Baby won't you just stay
Baby won't you just stay

So here we are
Just me and you
We're thinkin of the things
That we used to do babe
Tonight is yours, lady
Yours and mine
Let's try again to put our trust on the line, yeah

Tonight
Let's start our love again
Tonight
We can more than just friends
Don't you know
The sun
Is going down
So baby won't you just stay
For a little while

Baby won't you just stay
Baby won't you just stay
For a little while
Baby won't you just stay
For a little while
Baby won't you just stay

Forget about yesterday
Cause I want you so bad
Make love to me like you never had
My love
Is coming down
So baby won't you just stay
For a little while

Baby won't you just stay
For a little while",Stay
Jodeci,"If i could tell you 
In words how i feel
And if i could stop
I could make you hear
I would tell you about
You and I
A story that could live 
And never die,oh

You and I
Could be one after all
Our love
Could be so strong
(i said it would be so strong)
You and I
Would never stop (oh no)
You and I
Could reach the top

Do you understand
Its gotta be me and you
you know how i feel
I guess you feel the same too
I could go on and on
To tell you how i feel
The story is too long
I guess i've said the real deal

You and I (You and I)
Could be one after all
Our love
Could be so strong
(do you know what im talking bout baby)
You and I
Would never stop (we would never stop)
You and I
Could reach the top
 
You know i love you baby
Before you take it in
This story never ends,baby
Before you take it in
You and I,You and I

You and I
Could be one after all
(before you take it in)
Our love (you see)
Could be so strong
We could make love all night (before you take it in)
You and I
Would never stop (we would never stop)
You and I
Could reach the top
You and Me,Me and You
You and Me
We could make love all night long
It would be so strong baby
It would be so strong
Now let me tell you how i feel

I LOVE YOU
I LOVE YOU
",U&I
