Band,Lyrics,Song
Job for a Cowboy,"I sleep on a cross for my madness
I exist within a foundation of stone
Encircled and smothered within bars of rust

It all helps me rest within a confine of serenity
Sealed windows and doorways feel
Like decrepit paintings on the walls

Pieces of immovable art
Grow an everlasting flavour of neglect and dust
An existence within a casket to bear the living

My humble and delusional confine
My humble and delusional confine

Pieces of immovable art
Grow an everlasting flavour of neglect and dust
An existence within a casket to bear the living

I sleep on a cross for my madness
I exist within a foundation of stone

It all helps me rest within a confine of serenity
Sealed windows and doorways feel
Like decrepit paintings on the walls

Pieces of immovable art
Grow an everlasting flavour of neglect and dust

I sleep on a cross for my madness
I exist within a foundation of stone
Encircled and smothered within bars of rust",The Stone Cross
Job for a Cowboy,"Sun of Nihility, I shamefully disturb you
My relentless knocking is constantly ignored
I can narrowly overhear your serene breathing anymore
Have you grown weary of spinning measureless circles across the sky?

Are you drained of feeding and decalcifying my awakening third eye
A resting place to connect with the Earth's depths
I lay designating my dreams as masters under composed breath
Enraptured by the sphere of damnation",Sun of Nihility
Job for a Cowboy,"Finding comfort in knowledge of an enthralling higher power
My transformation catalyzed from our continual encounters
As I draw breath from clouds littering a synthetic sea
I overlook how trustful we are. So simple, so damned naive
I beg for one's own remission, simultaneously teething the flesh that breeds religion
Transmitted whispers crawl into each of us and birth dictating monsters
All creations encircling me are charades and impostors
So trustful we are. So simple, so damned naive
All comprehension I've discovered was all concocted to deceive",The Synthetic Sea
Job for a Cowboy,"A landscape of mountains and filth floods my perspective
Nightfall worms its way, mutating the air into a black mass of secrets
It's alluring as I stand on the summit of self-destruction in all of its brilliance
I have a panoramic view of my prodigal fate with a nose dive out of existence
My untouched eyelids unlock in a pineal gland trance of blasphemy
My cerebral matter synthesizes a sharpened warmth forming a kaleidoscopic ecstasy
A fond farewell decent morphs to a stairwell of a hallucinogenic world
Lost in a sea of illusions and alternate reality",Worming Nightfall
Jobim-Morelenbaum,"Ela é carioca, ela é carioca
Basta o jeitinho dela andar
Nem ninguém tem carinho assim para dar

Eu vejo na cor dos seus olhos
As noites do Rio ao luar
Vejo a mesma luz, vejo o mesmo céu
Vejo o mesmo mar

Ela é meu amor, só me vê a mim
A mim que vivi para encontrar
Na luz do seu olhar
A paz que sonhei

Só sei que sou louco por ela
E pra mim ela é linda demais
E além do mais
Ela é carioca, ela é carioca

Só sei que sou louco por ela
E pra mim ela é linda demais
E além do mais
Ela é carioca, ela é carioca",Ela ĂŠ Carioca
JoBoxers,"You're the thing that makes me weak
My heart knows of the beat I seek
And I found it (just got lucky)
Oh yes I found it (just got lucky)

I never worry that your love is fake
I'm feeling easy and I'm feeling ???
Cause I found it (just got lucky)
Before I found it (just got lucky)

And I never felt this way before
Like a dog always begging for more

I've been fooled by love so many times
I gave up on love and silly rhymes
Got my feelings always on my heart
Locked doors, the key was cut, it was a fake
Now I'm such a very lucky girl
Gang way, ???? 

(gotta hear me say) Got the answer and it's plain to see
(gotta hear me say) I'm for you and you're for me

I feel a quiver that I never miss
The sky's the limit with a friend like this
And I found it (just got lucky)
Together we found it (just got lucky)

And I never felt this way before
Like a dog always begging for more

I've been fooled by love so many times
I gave up on love and silly rhymes
Got my feelings always on my heart
Locked doors, the key was cut, it was a fake
Now I'm such a very lucky girl
Gang way, ???? 

Gotta hear me say
Gotta hear me say
Gotta hear me say
Just got lucky
Just got lucky
Just got lucky",Just Got Lucky
Jobriath,"Do you have to show up on every corner
Won't the dancin' begin without you
Do you have to put on your eyes for me
Be still I love you
Now be still

We walked through space in the twilight hours
But did you really see the starset
In your restless eyes I found the city lights
Be still I love you
Now be still

Be still I love you
Be still I love you
Be still I love you
I still love you now be still

I know the child that I am has hurt you
And I was a woman when I made you cry
But a little boy wants to dry your tears
Be still I love you
Come on now

Be still I love you
Be still I love you
Be still I love you
I still love you now be still
I still love you 
Come on now be still",Be Still
Jobriath,"I maman
So I'm an elegant man
I'm a man
Clara bowes and open toes
Are what I am

Yes I maman
Yea I'm a fragile man
I'm a man
Light of step and soft of touch
A gentle man

You know I could love you
But if I should love you
Then I would love you
The way a man loves a woman
And live my life like been livin' it
My body claims my mind and soul so let me be
What I am
An elegant man

Yes I maman
So I'm a graceful man
I'm a man
Pierrots and spaceous clothes
Are what I am

You know I could love you
But if I should love you
Then I would love you
The way a man loves a woman
And live my life like been livin' it
My body claims my mind and soul so let me be
What I am
An elegant man

Yes I maman and I could love you",I'maman
Jobriath,"Outside of my window
The rain's fallin' down
It's fallin' so close its chill is near yet far
Away

And the splash of the busy wheels
The thunder of the mourning
Fade to silence in a distant dream that carried me
Away

Outside
The little yellow raincoats running in the rain
Beckon, how they beckon with their sweet refrain
Their gentle laughter

Outside
Those fools that don't know 'nough to come in out of the rain
Would you know they would if they could just remain
Inside
Inside with someone like you

Outside
Poor fools that don't know 'nough to come in out of the rain
Would they know they would if they could just remain
Inside
Inside with someone like you",Inside
Jobriath,"So what if a-wop-bop-a loo-bam boom didn't rhyme
Billy Haley and the Comets drove me to the prom in time
A Little Richard goes a long long way
More than twenty long years to this day
Rock of ages roll away, rock away, roll away

We were dancin' in the streets and shapin' our lives in school
When we were simply thirteen, God saved the Queen in Liverpool
A mop top Mersey goes a long, long way
More than ten long years to this day
Rock of ages roll away, rock away, roll away

Three plays for a quarter is ancient history now
But the Stones roll away and rock that jukebox till
Satisfaction goes a long, long way
Much more than five long years to this day
Rock of ages roll away, rock away, roll away
A Little Richard goes a long, long way
More than twenty long years to this day
Rock of ages roll away, rock away, roll away",Rock of Ages
Jocelyn Brown,"I can't get off my high horse and I can't let you go
You are the one who
You are the one who makes me feel so real, yeah

Oh, what am I supposed to do
Oh, what am I supposed to do, baby

When I'm so hooked up on you
Then I realized, oh, I realized
That you are somebody else's guy, oh, yeah
Why you want to do this to me, boy

(Somebody else's guy)

Can you remember the times we've spent together
Sharin' the days in the sun
But then I found out that you were somebody else's love
After all our plans we've made, now they're shattered

But still I can't get off my high horse, I can't let go
You are the one who makes me feel so real
Ooh, what am I supposed to do when I'm so hooked on you
And then I realized that you're somebody else's guy

That day in September, I'm sure you can remember
That's when all the stuff hit you fast
You told me a lie and you didn't have an alibi
But baby, yet I still cared

You know, I loved you so, baby, that I can't let you go, no, no
You are the one who makes me feel so real
Ooh, what am I supposed to do when I'm so hooked on you
And I realize that you're somebody else's guy

You know, I loved you so, baby, that I can't let you go, no
You are the one who make me feel so real
Ooh, what am I supposed to do when I'm so hooked on you
And then I realized that you're somebody else's guy

Oh, I can't get off my high horse and I can't let go
You are the one who makes me feel so real
Ooh, what am I supposed to do when I'm so hooked on you
And I realized that you're somebody else's guy, oh

I can't let you go, no
You are the one who makes me feel so real",Somebody Else's Guy [M&M Dub MLX]
Jocelyn Brown,"I'm caught up in a one night love affair
  Hoping true love will find me there
  Caught up in a one night love affair
  In need of love again, that's just the way I am

Before I let you in
There's just one thing I wanna say
There's no need to pretend
That this will end another way
Tomorrow you'll wake up and be on your way
Forget all the things you say tonight
That's why...

* Repeat

So make yourself at home
I want you only for a while
I haven't got much time
To find the man behind the smile
I'm a fairy-tale princess in search of a knight
And I never believe dreams come true
I'm just like you
You see...

* Repeat (x4)

Stay for a while, baby
Got to hold you for a while
Lay with you in style
Close the door and I'm next to you
The music sweet, just
watch what I'm gonna do

* Repeat and fade",I'm Caught Up (In a One Night Love Affair)
Jocelyn Brown,"You got me down
Running all around this town
'Cause you think you're ahead of the game

But I'll let you know
Baby you don't run the show
When it comes to my happiness or pain
Of course it's true
There's all I can do
Just to keep up with all your crazy tricks
At my expense you build up your confidence
But baby you just don't know when you're late

'Cause
I'm gonna get you baby
I'm gonna get you yes I am
Love's gonna get you baby
Oh oh ooh yeah
I'm gonna get you baby
I'm gonna get you yes indeed
Love's gonna get you baby
So don't you try to run from me
No, no

You must admit that it doesn't quite fit
The way you keep me runnin' so hard
If you don't care
Then why act so scared?
When I send to you my calling card
You should be flattered
To me it really matters
In this chase whether I lose or I win
You ain't fast enough to keep me from catching up
So why don't you just turn yourself in?

'Cause
I'm gonna get you baby
I'm gonna get you yes I am
Love's gonna get you baby
I'm gonna get you yes I am
I'm gonna get you baby
I'm gonna make you my man
Love's gonna get you baby
Don't you try to run from me

Your lead can dance
'Cause you know I'm way too fast
And 'cause this is only a test
I've got the power to chase you back the hour
So I'm taking your heart under arrest
I'm a deputy of love
And if you are thinking of
When it comes to committing a crime
Baby you have seen
It's just grand larceny
When I feel your love and make it mine

Why waste your time?
You know you gonna be mine
There is no escape from my master plan
Soon you will be
Locked up in my heart's custody
Then you wonder why you ever ran

Don't you know that love's gonna get you
Don't you know that love's gonna get you baby
You know that
You know that love's gonna get you
It's gonna get you
Love's gonna get you baby
It's waiting out there for you
Love's gonna get you
One day boy
Don't you know that?
Love's gonna get you baby
Gonna turn around and stand
You know
Love's gonna get you
Love love love love
Love's gonna get you baby

Do you know that baby
Love's gonna get you
It's looking over you
Love's gonna get you baby
Locked up in my heart's custody
Love's gonna get you
Oh yeah oh yeah oh yeah
Love's gonna get you baby
One day you'll see that
Love's gonna get you
Reach out your arms and grab you, boy
Love's gonna get you baby
 
Love's gonna get you
 
I've been loving
I've been had to have you
Love's gonna get you baby
Now I'm gonna get you
I'm gonna satisfy all them great needs
Love's gonna get you
Oh oh",Love's Gonna Get You
Jocelyn Brown,"I can't get off my high horse and I can't let you go
You are the one who
You are the one who makes me feel so real, yeah

Oh, what am I supposed to do
Oh, what am I supposed to do, baby

When I'm so hooked up on you
Then I realized, oh, I realized
That you are somebody else's guy, oh, yeah
Why you want to do this to me, boy

(Somebody else's guy)

Can you remember the times we've spent together
Sharin' the days in the sun
But then I found out that you were somebody else's love
After all our plans we've made, now they're shattered

But still I can't get off my high horse, I can't let go
You are the one who makes me feel so real
Ooh, what am I supposed to do when I'm so hooked on you
And then I realized that you're somebody else's guy

That day in September, I'm sure you can remember
That's when all the stuff hit you fast
You told me a lie and you didn't have an alibi
But baby, yet I still cared

You know, I loved you so, baby, that I can't let you go, no, no
You are the one who makes me feel so real
Ooh, what am I supposed to do when I'm so hooked on you
And I realize that you're somebody else's guy

You know, I loved you so, baby, that I can't let you go, no
You are the one who make me feel so real
Ooh, what am I supposed to do when I'm so hooked on you
And then I realized that you're somebody else's guy

Oh, I can't get off my high horse and I can't let go
You are the one who makes me feel so real
Ooh, what am I supposed to do when I'm so hooked on you
And I realized that you're somebody else's guy, oh

I can't let you go, no
You are the one who makes me feel so real",Somebody Else's Guy [M&M Acapella]
Jocelyn Brown,"Get down, it's saturday night. 
Saturday night, saturday night
Get down, it's saturday night
Saturday night, saturday night

Saturday morning, 
Friday's at an end
Housework is calling, 
But where to begin
Kids are out of school, 
Trying to find a friend
Everybody's busy, 
Can't wait for the night to begin

You work all week long, 
You work your fingers to the bone
Friday's at an end, 
I can't wait for saturday to begin!

Gonna have myself some fun fun fun fun
(Get down it's saturday night, gonna be alright)
Make love until the morning come (x2)

I love to party, everybody does
You can't wait for the weekend no no
See what you get into
But you've got to get down down down down
Even if you stay at home
Make love and listen to the music
You've got to let yourself go go go go go, girl

You work all week long, 
You work your fingers to the bone
Friday's at an end, yeah
I can't wait for saturday to begin!

Gonna have myself some fun fun fun fun
(Get down it's saturday night, gonna be alright)
Make love until the morning come (x2)

In New York, in Detroit 
Yeah Yeah.
In New York, in Detroit
Even in L.A.

I can't wait for saturday to begin (x4)

You work all week long, 
You work your fingers to the bone
Friday's at an end, 
I can't wait for Saturday to begin!

Gonna have myself some fun fun fun fun
(Get down it's saturday night, gonna be alright)
Make love until the morning come (x2)

Some like the party, some like the dance
Some like to make romance
Some like to smoke, some like to joke
Some like to drink, some like to think
Some is on the blink
Me, my baby and me, yeah

You work all week long, 
You work the fingers to the bone
Friday's at an end, 
I can't wait for Saturday to begin!

Get down, get down, get down and spend the night",Get Down Saturday Night
Jocelyn Enriquez,"You would be in love with me
If I could change your mind
I would put away these letters
And stop wasting all this time

If you only felt the same
Whenever you were near
I could show you how I miss you
If I had you here

Just to see your smile
Just to have that moment of happiness
Would make it all worthwhile
All my life

I've been waiting for you
All my life
I'd give you so much more
Now you're gone

And now that we are apart
I didn't know love would break my heart
Are you still in love with me
The way I am with you

Do you feel your heart is breaking
After all that we've been through
Heaven knows where you are now
The more I wonder why

And the only thing that I regret
We didn't say goodbye
Just to see your smile
Just to have that moment of happiness

Would make it all worthwhile
All my life
I've been waiting for you
All my life

I'd give you so much more
Now you're gone
And now that we are apart

I didn't know love would break my heart
I didn't know love would break my heart",I Didn't Know Love Would Break My Heart
Jocelyn Enriquez,"Alone again 
I'm waiting for your love 
To come into my life 
I'll take you in and give you all I have 
Together we'll make it last 
I've been thinking about you again 
I'll be your lover and your best friend 
Every night I hope and pray 
That maybe you'll come my way 
We could be falling together in love 
Your are the only one I'm dreaming of 

[Chorus]
I've been thinking about you 
And I don't want to live without you 
You and I we can be just fine 
But I want your love to be all mine 
I've been thinking about you 
And I don't want to live without you 
You and I we can be just right 
But I need your love tonight 

Here I am still waiting for your love 
So come into my life 
Take me in and never let me go 
Baby just hold me close 
I've been thinking about you again 
I know you know so I won't pretend 
Everynight I hope and pray 
That this time you'll come my way 
We could be fallin together in love 
Your the only one I'm dreaming of 

We could be falling together in love 
Your are the only one I'm dreaming of 

[Chorus: x2]",I've Been Thinking About You
Jocelyn Enriquez,"Do you remember how it all began 
We didn't know how far 
Or where we were going 
But somehow we never stopped knowing 
That love would keep us together this time 
It's you and me my love 
You know what I feel for you, can't you see 
Hold me now don't you stop loving me 

Make this last forever 
Knowing that we'll keep it together 
Forever more 
Make this last forever 
Don't look back, let's keep it together 
Don't ever go 

Tell me if you know how this dream came true 
It's all because of you 
Now I see true love showing 
Come with me 'cause I know where we're going 
My love, let's keep it together this time 
It's only you and I 
You know what I feel for you, can't you see 
Hold me tight don't you stop loving me",Make This Last Forever
Jocelyn Enriquez,"[Chorus]
The radio plays our favorite song
And it's what keeps me holding on
Baby, do you miss me
Now that I'm gone, yeah

I remember the love we had
How could I forget
I remember the tears I cried
Over one regret

Now we're alone, so alone
I can't help thinking about you
All the love in the world
And I'm lonely without you

[Chorus]

Get the DJ to play our favorite song
'Cause it's what keeps me holding on
Baby, do you miss me
Now that I'm gone

Do you miss me, do you miss, [Repeat: x 2]
Do you miss,
I remember the love we had
Not a day goes by

Heaven knows where you are right now
But my heart won't lie
We were in love so in love
My mind's been thinking about you

All the love in the world
And I'm lonely without you

[Chorus]

Do you miss me, do you miss, [Repeat: x 2]
Do you miss,
Do you miss me, do you miss, [Repeat: x 2]
Do you miss,

[Chorus]",Do You Miss Me? [Energybox Mix]
Jocelyn Enriquez,"The radio plays our favorite song
And it's what keeps me holding on 
Baby, do you miss me 
Now that I'm gone, yeah 

I remember the love we had 
How could I forget 
I remember the tears I cried 
Over one regret 
Now we're alone, so alone 
I can't help thinking about you 
All the love in the world 
And I'm lonely without you 

(chorus)
The radio plays our favorite song
And it's what keeps me holding on 
Baby, do you miss me 
Now that I'm gone, yeah 
Get the DJ to play our favorite song 
'Cause it's what keeps me holding on 
Baby, do you miss me 
Now that I'm gone 

Do you miss me, do you miss, (2X) 
Do you miss, 

I remember the love we had 
Not a day goes by 
Heaven knows where you are right now 
But my heart won't lie 
We were in love so in love 
My mind's been thinking about you
All the love in the world 
And I'm lonely without you 

(chorus) 
Do you miss me, do you miss, (2X) 
Do you miss, 
Do you miss me, do you miss, (2X) 
Do you miss
~wc~
",Do You Miss Me? [Radio Mix]
Jocelyn Enriquez,"Time, they say eases the pain
But how must I keep myself apart
From how things used to be
I know I should go on with my life
And leave the world behind
But I have learned to live
I know, I know I've got to be strong

Even if my heart
Should call out your name out in the rain
And even if 
This heart would want to embrace you once again
And even if I'm all cried out 
And no longer in pain 
I'll never fall, in love that way 
Ever again

In Time, there's only you and me
But how do I convince my heart again
That things will be okay
I know I hav to make it on my own
Since you left me all alone
All alone again
I know I know I've got to move on

Even if my heart
Should call out your name out in the rain
And even if 
This heart would want to embrace you once again
And even if I'm all cried out 
And no longer in pain 
I'll never fall, in love that way 
Ever again

Promise that you'll stay and never leave
Then tell me why should I believe
Obviously you have gone astray
And now you're miles away
I'll go on without you.

Even if my heart
Should call out your name out in the rain
And even if 
This heart would want to embrace you once again
And even if I'm all cried out 
And no longer in pain 
I'll never fall, in love that way 
Ever again",Even If
Jocelyn Enriquez,"(Get into the rhythm)
Get into the rhythm
Let the music control
Get into the rhythm
For your body and your soul
(Repeat)

Get into the rhythm
Get into the rhythm
Get into the rhythm

Let the rhythm take you high
Let the rhythm take you high

Get into the rhythm
Let the music control
Get into the rhythm
For your body and your soul
(Repeat)

Get into the rhythm
Get into the rhythm
Get into the rhythm
Get into the rhythm",Get Into the Rhythm
Jocelyn Enriquez,"A little
A little bit
A little
A little bit
A little
A little bit
A little
A little bit of ecstasy
A little bit of you and me
A little bit of set you free
A little bit of ecstasy
A little bit of ecstasy
A little bit of you and me
A little bit of set you free
A little bit of ecstasy

Give me what I want 'cause what I want is what you need
Give me what I want a little bit of ecstasy

Give me what I want 'cause what I want is what you need
Give me what I want a little bit of ecstasy

A little
Do do do do do yeah
Do do do do do yeah
Do do do do do yeah
Do do do do do yeah
Do do do do do yeah
Do do do do do yeah
Do do do do do yeah

A little bit of ecstasy
A little bit of you and me
A little bit of set you free
A little bit of ecstasy

Tell me that you want me
Tell me that you need me
Tell me that want me
Tell me that you love me

I'll be your dream you can be my fantasy
I'll be your dream you can be my fantasy
I'll be your dream

I'll be your dream

I'll be your dream you can be my fantasy
I'll be your dream you can be my fantasy
I'll be your dream you can be my fantasy
Oh oh yeah

A little bit of ecstasy
A little bit of you and me
A little bit of set you free
A little bit of ecstasy
A little bit of ecstasy",A Little Bit of Ecstasy
Jocelyn Enriquez,"Do you believe in miracles?
You've got to believe
Cause the second you do
They all will come true
And love you
And love for you
We will all have a good time
It's just a party
Let's have some fun
Huggin and laughin and dancin away
Cause that's how a party
Should be done
Our love goes
Our love grows
Our love goes
Round and round and round the world
Now look at all these lovely people
It's got to be my family
No worries
Smiling faces everywhere
No problems to think of
Don't want to be anywhere else because",Lovely People
