Band,Lyrics,Song
Isaac Hayes,"Woo-wooo-woo,
Ah-ah-ah,
Woo-woo-woo-wooo.

(One.) Thou shalt never love another.
{Thou shalt never love another.}
(Two.) And stand by me all the while.
{And stand by me all the while.}
(Three.) Take happiness with the heartaches.
{Take happiness with the heartaches.}
(Four.) And go through love wearing a smile.
{And go through love wearing a smile.}

And, oh, how happy we will be,
If we keep the ten commandments of love, of love.

(Five.) Thou should always have faith in me,
{Thou should always have faith in me,}
In everything I say and do.
{In everything I say and do.}
(Six.) Love with all your heart and soul,
{Love with all your heart and soul,}
Until our life on earth is through.
{Until our life on earth is through.}

Oh, how happy we will be,
If we keep the ten commandments of love.

Love, oh, sweet love, it's oh, oh, so grand.
You will find since the beginning of time,
It has rooted in all the land.

(Seven.) Come to me when I am lonely.
{Come to me when I am lonely.}
(Eight.) Kiss me when you hold me tight.
{Kiss me when you hold me tight.}
(Nine.) Treat me sweet and gentle.
{Treat me sweet and gentle.}
(Ten.) And always do what's right.

An', oh, how happy we will be,
If we keep the ten commandments of love.
Oh, how happy we will be,
If we keep the ten commandments of,
Woo-woo-woo, ah-ah-ah, woo-hoo-hoo
{The ten commandments of love.}",The Ten Commandments of Love
Isaac Hayes,"Now see here, why'all calling me.
We both agreed it was gonna be a one-night thing, no strings attached.
I go my way and you go yours, and look what happened.
Yeah, but...

I lay there every night while you loved me,
And I'm used to nights that go by slow.
And I wake up every morning where you left me
Wondering which way the day is gonna go.
But you never cross my mind,
Though I cry from time to time.
No, you never cross my mind.
You just stay there all the time.

I got a letter from you. You promised you wasn't gonna do that.
But from time to time my eyes found a picture,
The very one I forgot to put away.
Hmmm.
Just another memory trying to make me miss you,
And I found one more without you in my mind.
But you never cross my mind,
Though I cry from time to time.
No, you never cross my mind,
But you just stay there all the time.

You want to know why I'm calling you.
I want to know why you wrote to me.
Well, I-I--I just wanted to say hi.
I can understand that, 'cause...

Now and then, a friend will say they saw you, 
And I said what could all that matter to me.
You know what, late at night, when I'm content with being lonely,
I get this unwanted visit from old misery.
And that's why, that's why you never cross my mind.
And you never cross my mind.
No, you never cross my mind.
You just stay there (Stay there.),
Stay there (Stay there) all the time.
I said you never, never cross my mind,
Even though, I find myself crying from time to time.
I don't care what you say, 
I know you never cross my mind.
Oh, no. Stay there. (Stay there)
Stay there all the time.
Hey. Hey, hey, hey, hey, hey, hey, hey, hey, eh.-ac",You Never Cross My Mind
Isaac Hayes,"Thanks for the times that you've given me,
The memories are all in mind.
And now that we've come
To the end of our rainbow
There's something I must say out loud!

Your once, twice
Three times a lady
And I love you.
Yes, your once, twice
Three times a lady
And I love you!

When we are together
The moments I cherish
With every beat of my heart.
To touch you, to hold you
To feel you, to need you.
There's nothing to keep us apart
You're once, twice
Three times a lady
And I love you!
I love you !",Three Times a Lady
Isaac Hayes,"You think I love you
For just one thing
To you my love this may be
The way that it seems

But I love the way, that you carry yourself
I really love you, I love you, love you, love you, love you
I love you, baby, love you
The way you wear your hair

Ain't that loving you, ain't that loving you
For more reasons than one
You're the one, only one
You're the one, listen girl

Somehow, my love
You've been misled
By the things that others
Other guys have said, don't you believe 'em

Well, I love you, yes, I do, for what you are
Yeah, I even love you, I love you, love you, I love you
Love you, I love you, baby, love you
For what you may become

Ain't that loving you everyday, every way
Ain't that loving you, ohh, yeah, for more reasons than one
You're the one, you're the one, only one, only one
You're the one, I betcha never thought about it

Did it ever occur to you, why I do all that I can do?
To keep that smile upon your face that's why I love you
In so many ways, that's why I love you
In so many ways, ooh, la, baby

Somehow, my love
You've been misled
By the things that others
Other guys have said, slammed the door in your face

But I love you, everyday for what you are
Girl I even love you, I love you, love you, ooh
For what you may become

Ain't that loving you, whole lot of love, everyday
Ain't that loving you, in every way, ohh, yeah
For more reasons than one, you're the one
You're the one, only one, you're the one, listen girl

I love the way you wear your hair
I love the way that you carry yourself
I love the way that you squeeze me tight, yeah
I just love the way you make everything all right

I love the way you kiss my lips, girl
Baby, baby, love it when you're swinging your hips
Ain't that loving you for more reasons than one

Girl, I love the way you hold my hand
And there's no doubt I'm the only man, yeah
That could satisfy you, that could satisfy
I love to satisfy you, I love you, baby

Ohh, baby, ohh, baby, I love you baby
For more reasons than one
You're the one, you're the one",Ain't That Loving You (For More Reasons Than One)
Isaac Hayes,"Every morning when I rise, baby
I look into your sexy eyes, baby
Your love refreshing is good to me, baby
There's no other place I'd rather be, baby

What a way to start each day
Everything I think of
Just comes my way
Oh, yeah, yeah, yeah

[Chorus]
Cause you're my joy
You're everything to me
And you've shown me
How groovy life can be
Lips to lips, heart to heart
In a way that will never part

Sweetness is the name for you, sugar
And loveliness becomes you too
Dedication is your thing, mama
You're forever true to your man, baby

You're the only one
Who thrills me through and through
And I'll never find another
If I search this whole world through
Oh, no, no, no

[Chorus]

Now you know why
I smile all the time, baby
You give me such peace of mind, honey
Heartaches and pain is
A thing of the past, baby
I found happiness at last, mama

Anything you want
I'll glady give to you
Cause you never did nothing once
That's why I love you too
Oh, yeah, yeah, yeah

[Chorus]

Keep on loving me
Keep on teasing me",Joy
Isaac Hayes,"I, I'm so in love with you
Whatever you want to do
Is all right with me
'Cause you make me feel so brand new
And I want to spend my life with you

Since, since we've been together
Loving you forever
Is what I need
Let me be the one you come running to
I'll never be untrue

Let's, let's stay together
Lovin' you whether, whether
Times are good or bad, happy or sad

Whether times are good or bad, happy or sad

Why, why some people break up
Then turn around and make up
I just can't see
You'd never do that to me (would you, baby)
Staying around you is all I see
(Here's what I want us to do)

[Repeat to fade:]
Let's, we oughta stay together
Loving you whether, whether
Times are good or bad, happy or sad",Let's Stay Together
Isaac Hayes,"The look of love
Is in your eyes
A look your smile can't 
disguise

The look of love
Is saying so much more than
Just words could every say
And what my heart has heard
Well it takes my breath away

[Chorus]
I can hardly wait to hold you
Feel my arms around you
How long I have waited
Waited just to love you
Now that I have found you

You've got the look of love
It's on your face
A look that time can't erase
Baby be mine, tonight

Let this be just the start of 
So many nights like this
Let's take a lovers vow
And seal it with a kiss

[Chorus]

Don't ever go
Don't ever go
I love you so
The look of love

Let this be just the start of
So many nights like this
Let's take a lover's vow
And baby we'll seal it with a kiss

[Chorus]",The Look of Love
Isaac Hayes,"Baby, understand everything
There's no one else in my life
Maybe I can make you happy, baby
If I spend some time with you
Tell me baby, baby not to change
I'm still in love with you
Don't be afraid, let me hold your heart
Control everything you do
 
Baby, you know that I wouldn't do
Couldn't do anything to hurt you
But if you feel weak, don't you worry
Cause I never can say goodbye
Baby, you know that I couldn't do
Wouldn't live my life without you
But if you feel weak, don't you worry
Cause I never can say goodbye
 
Ohh baby, if it's okay with you
I'll do all that I can do
To make this thing unbreakable
And if you need me to
I'll swim through the stars till I touch the moon
Do anything baby just to get to you
Won't be afraid to let you hold my heart
Control everything I do

Baby, you know that I wouldn't do
Couldn't do anything to hurt you
But if you feel weak, don't you worry
Cause I never can say goodbye
Baby, you know that I couldn't do
Wouldn't live my life without you
But if you feel weak, don't you worry
Cause I never can say goodbye
 
Baby, if it's okay with you (if it's okay)
I'll do anything that I can do (ooh)
No one else can do it like you (oh yeah)
I'll give my love and vow to you
I'll will never leave you, that is true
I'm a good woman, let me prove to you (let me prove it to you)
If you feel weak, boy don't you worry
Cause I can never say goodbye

Baby, you know that I wouldn't do
Couldn't do anything to hurt you
But if you feel weak, don't you worry
Cause I never can say goodbye
Baby, you know that I couldn't do
Wouldn't live my life without you
But if you feel weak, don't you worry
Cause I never can say goodbye

Baby, you know that I wouldn't do
Couldn't do anything to hurt you
But if you feel weak, don't you worry
Cause I never can say goodbye
Baby, you know that I couldn't do
Wouldn't live my life without you
But if you feel weak, don't you worry
Cause I never can say goodbye
",Never Can Say Goodbye
Isaac Hayes,"You're just too good to be true
I can't take my eyes off you
You'd be like heaven to touch
I wanna hold you so much
At long last love has arrived
And I thank God I'm alive
You're just too good to be true
Can't take my eyes off you

Pardon the way that I stare
There's nothing else to compare
The sight of you leaves me weak
There are no words left to speak
But if you feel like I feel
Please let me know that is real
You're just too good to be true
I can't take my eyes off you

I need you baby
And if it's quite all right
I need you baby
And if its quite alright
I need you baby
To warm the lonely nights
I love you baby
Trust in me when I say its okay

Oh pretty baby
Don't bring me down I pray
Oh pretty baby
Now that I've found you stay
And let me love you, baby
Let me love you

You're just too good to be true
I can't take my eyes off you
You'd be like heaven to touch
I wanna hold you so much
At long last love has arrived
And I thank God I'm alive
You're just too good to be true
Can't take my eyes off You

I need you baby
And if it's quite all right
I need you baby
To warm the lonely nights
I love you baby
Now trust in me when I say its okay

Oh pretty baby
Don't bring me down I pray
Oh pretty baby
Now that I've found you stay
And let me love you, baby
Let me love you",Can't Take My Eyes off You
Isaac Hayes,"Hey, Girl! I want you to know,
I'm gonna miss you so much if you go.
And, Hey, Girl! I tell you  no lie,
Something deep inside of me's going to die,
if you say so long, if this is goodbye. Oh!

Hey, Girl! This can't be true,
How am I supposed to exist without you?
And, Hey, Girl! Now don't put me on,
What's gonna happen to me when you're gone.
How will I live. How can I go on.
How can I go on? Hey, Girl!

Hey, Girl! Now sit yourself down,
I'm not ashamed to get down on the ground,
Don't go away. Hey, Girl!
Don't go away. Hey, Girl!",Hey Girl
Isaac Hayes,"If loving you is wrong, I don't wanna be right
If being right means livin' without you, I'd rather live wrong than right
My mama and daddy say, ""it's a shame, it's a downright disgrace""

My friends tell me there's no future in lovin' a married man
If I can't see you when I want, I'll see you when I can
If loving you is wrong, I don't want to be right
(I don't want to be right)
If loving you is wrong, I don't want to be right
(I don't want to be right)

Am I wrong to fall so deeply in love with you
Knowin' you've got a wife and two little children dependin' on you too?
Am I wrong to hunger for the gentleness of your touch
Knowin' you've got someone else at home who need you just as much?

[Repeat: x2]
Am I wrong to give my love to married man?
Am I wrong for tryin' to hold on to the best thing I ever had?
If loving you is wrong, I don't want to be right
(I don't want to be right)
If loving you is wrong, I don't want to be right
(I don't want to be right)

I don't want to be right, if it means livin' without you
(I don't want to be right, I don't want to be right)
I don't want to be right, if it means sleeping alone at night
(I don't want to be right, I don't want to be right)
I don't want to be right
(I don't want to be right)

If loving you is wrong, I don't want to be right
(I don't want to be right)
If loving you is wrong, no, I don't want to be right
(I don't want to be right",(If Loving You Is Wrong) I Don't Want to Be Right
Isaac Hayes,"This is my same old coat
These are my same old shoes 
It was the same old me
With the same old blues

Oh, then you touched my life
Just by holding my hand
And when I look in the mirror
I see a brand new girl, oh me

[Chorus]
Just because of you, boy
Just because of you whoa, oh, oh
Just because of you, boy
Just because of you

I got the same old friends
And they've got the same old sins
I tell them the same old jokes
And I get the same old grins

But now the joke is on you
It happened somehow with you
Everyday of my life
I'm as fresh as morning dew

[Chorus]

I go to the same old places
I see the same old faces
I look at the same old sky
See it all with brand new eye

I got a brand new boy
And I got me a brand new smile
Since I found you, baby
I got me a brand new style

Just because of you, boy
Just because of you oh, I feel good
Just because of you, boy
Just because of you, oh, I feel good

Just because of you, boy
Hey, just because of you, yes, I do
Just because of you, boy
Just because of you, oh, it feels good

Just because of you, boy
Yeah, just because of you
Just because of you, boy
Just because, because, because of you

Just because of you, boy
Oh, boy
Just because of you, boy
Oh, boy
Just because of you, boy
Oh, boy",Brand New Me
Isaac Hayes,"I stand accused
Of lovin' you
Too much

And I hope
I hope it's not a crime
'Cause if it is, I'm guilty
Of lovin' you, you, you

Oh yeah

I, I hope to God 
That I never have to testify
'Cause if I do
Everyone is gonna, they're gonna cry
They're gonna say
(Guilty)

Old Ike is guilty
Of lovin' a sweet girl like you

I know, I know
You belong to another
I, I may not stand a ghost of a chance
I'll stand on top of Mount Everest
And proudly tell the world that I love ya
Oh yes I will

Because I, I just can't
I can't help it girl
I'm a victim of circumstance

And just one
Oh one touch of your hand
I don't know how it happened
But just look at me
I find myself chillin'
On the witness stand

And I'm shouting out
All over, all over the land
Yes, if I'm guilty then (guilty)
I'm guilty, guilty of loving you

I'm guilty of loving you, yeah
I said I'm guilty
But what can I do

I want to hold ya
I want to squeeze ya tight
But what my mind said, she
Belong to another
And that ain't right",I Stand Accused
Isaac Hayes,"Every morning when I rise, baby
I look into your sexy eyes, baby
Your love refreshing is good to me, baby
There's no other place I'd rather be, baby

What a way to start each day
Everything I think of
Just comes my way
Oh, yeah, yeah, yeah

[Chorus]
Cause you're my joy
You're everything to me
And you've shown me
How groovy life can be
Lips to lips, heart to heart
In a way that will never part

Sweetness is the name for you, sugar
And lovlieness becomes you too
Dedication is your thing, mama
You're forever true to your man, baby

You're the only one
Who thrills me through and through
And I'll never find another
If I search this whole world through
Oh, no, no, no

[Chorus]

Now you know why
I smile all the time, baby
You give me such peace of mind, honey
Heartaches and pain is
A thing of the past, baby
I found happiness at last, mama

Anything you want
I'll gladly give to you
Cause you never did nothing once
That's why I love you too
Oh, yeah, yeah, yeah

[Chorus]

Keep on loving me
Keep on teasing me","Joy, Pt. 1"
Isaac Hayes,"Black man, born free,
At least that's the way it's supposed to be;
The chains that bind him are hard to see,
Unless you take this walk with me;

The place where he lives, God, he gives them names 
The 'Hood, 'The Projects, 'The Ghetto; they are one and the same;
And I call it 'Soulsville' ah, yeah.

Any kind of job is hard to find,
That means an increase in the welfare line;
The crime rate is rising too, but
If you are hungry, what would you do?

The rent is two months past due, in a building that's falling apart,
Little boy needs a new pair of shoes, and this is only a part of Soulsville

Some of the brothers' got plenty of cash, tricks on the corner is going to see to that,
Some like to smoke and some like to blow, some are even strung out on a $50 Jones
Trying to ditch reality, by getting so, high,
Only to find out, that you can never reach the sky, 
Because your roots are in Soulsville, oh, yes they are.

Every Sunday morning, I can hear the church sisters sing 'Hallelujah, Hallelujah,
Trusting the Lord to make a way, oh yeah;
I hope that He hears their prayers, because deep in their souls they believe,
Someday He'll put an end to all this misery that we have in, Soulsville
All yeah, yeah, yeah, yeah 
Hm",Soulsville
Isaac Hayes,"If you see me walking down the street
And I start to cry each time we meet
Walk on by, walk on by

Make believe
That you don't see the tears
Sure just let me grieve in private
'Cause each time I see you,
I just can't help myself I think about how tight we used to be
I break down and cry, oh baby
Walk on by

I just can't get over losing you
So if I seem broken in two
Please walk on by, walk on by
Foolish pride
That's all that I have left
So let me hide
The tears and the sadness you gave me
You put the hurt on me, you socked it to me mama
When you said goodbye
So please walk on by
Make believe you never see the tears I cry
So do me a favor and walk by
So I'm beggin' ya to walk on by, oh yeah
Make believe you never see the tears I cry
So I'm beggin' ya, I'm beggin' ya to walk on by
Make believe you never see the tears I cry
Oh there's no dust in my eye, oh no
Smoke ain't makin' me cry, no no no
It's the hurt you put on me, yeah
I don't wantcha to see this man cry
So please walk on by, ah no no walk on by, walk on by",Walk on By
Isaac Hayes,"The time is right, you hold me tight
And love's got me high
Please tell me, 'Yes' and don't say, 'No'
Honey, not tonight

Move a little close to me, you owe it to yourself
And I will selfishly take a little for myself
And it's because of you
That love won't let me wait

Yeah, yeah

The time is right, turn down the lights
And take my hand, ooh, ooh, yeah
We'll take a flight and spend the night
In Wonderland

And I need to have you next to me in more ways than one
And I refuse to leave till I see the mornin' sun
Creep through your window pane
Because love won't let me wait
Not another minute

Ooh,ooh,ooh,yeah,yeah

And I need your love so desperately and only you can set me free
When I make to you, we'll explode in ecstasy
And I won't take the blame
That love won't let me wait

Love won't, no, no, no
Love won't, no, no, no
No, no, no, no
(Love won't let me wait)

Yeah,yeah
Love won't
I said
(Love won't let me wait)

My baby
My temperature's risin', ooh
(Love won't let me wait) Won't let me

Not another minute
(Love won't let me wait) Won't let me

Baby, baby
(I can't wait) I can't wait (I can't wait) I can't wait, I can't wait (I can't wait)
I can't wait, no, no, no, can't wait
(Wait) No way, no way, no, no, no, no
No way, no way, no, no
(Doo,ooh,) Ooh,ooh,ooh,ooh,ooh,yeah
(Wait) I cant wait not another minute
Not another minute (I can't wait, I can't wait) I'll be there (I can't wait) yes, I will
I'll be there
(Wait) Comin', I'm comin', I'm comin'
Hold on, I'm comin', I'm comin', I'm comin'
(Ooh,ooh,) I can't wait, can't wait
I can't wait, can't wait
No way, no way, no way, no, no
No, no, no, no
(Wait) Ooh,yeah,ooh,ooh,
(I can't wait, I can't wait, I can't wait)
(Wait)
The time is right, you hold me tight
And love's got me high
Please tell me, 'Yes' and don't say, 'No'
Honey, not tonight

Move a little close to me, you owe it to yourself
And I will selfishly take a little for myself
And it's because of you
That love won't let me wait

Yeah, yeah

The time is right, turn down the lights
And take my hand, ooh, ooh, yeah
We'll take a flight and spend the night
In Wonderland

And I need to have you next to me in more ways than one
And I refuse to leave till I see the mornin' sun
Creep through your window pane
Because love won't let me wait
Not another minute

Ooh,ooh,ooh,yeah,yeah

And I need your love so desperately and only you can set me free
When I make to you, we'll explode in ecstasy
And I won't take the blame
That love won't let me wait

Love won't, no, no, no
Love won't, no, no, no
No, no, no, no
(Love won't let me wait)

Yeah,yeah,
Love won't
I said
(Love won't let me wait)

My baby
My temperature's risin', ooh
(Love won't let me wait) Won't let me

Not another minute
(Love won't let me wait) Won't let me

Baby, baby
(I can't wait) I can't wait (I can't wait) I can't wait, I can't wait (I can't wait)
I can't wait, no, no, no, can't wait
(Wait) No way, no way, no, no, no, no
No way, no way, no, no
(Doo,ooh,) Ooh,ooh,ooh,ooh,ooh,yeah
(Wait) I cant wait not another minute
Not another minute (I can't wait, I can't wait) I'll be there (I can't wait) yes, I will
I'll be there
(Wait) Comin', I'm comin', I'm comin'
Hold on, I'm comin', I'm comin', I'm comin'
(Ooh,ooh,) I can't wait, can't wait
I can't wait, can't wait
No way, no way, no way, no, no
No, no, no, no
(Wait) Ooh,yeah,ooh,ooh,
(I can't wait, I can't wait, I can't wait)
(Wait)",Love Won't Let Me Wait
Isaac Hayes,"I've been diggin' on you little girl
Every time you stroll by
And I can't help but notice
The sad look in your eyes

Ever didn't be your man and hurt you
The pain is on your face
It's a shame to see
All that good lovin', just go to waste

So don't waste it, don't waste it
Don't waste it, baby
Just give all that good lovin' to me
Give it to me, you see, I can use it

Also know how it feels
To be the victim of a bad relation
So don't you feel all by yourself
Because we're in the same situation

You need love and I need love
We both got love to give
So let's stop drowning in our sorrows
Let's get together and live

So don't waste it, don't waste it
Don't waste it, baby
Just give all that good lovin' to me
Let me use it, I can use it

Don't waste it, don't waste it
Don't waste it, baby
Just give all that good lovin' to me
I can use it, I'm gonna use it",Give It to Me
Isaac Hayes,"Alone again, at last again
Please let love have its way
Don't let the waiting, anticipating
Be all in vain
Be good to me 'cause I'm gonna be
As good as I can be to you

Baby, oh baby, I need you
I swear I do
No other women can love me
Oh, like you do

You're the best thing
That ever happened to this man
And I'm gonna keep on loving you
Just as long as I can
I love you, I love you

One night alone is too long alone
When one's been loved by you
It's so good to touch
When I've missed so much
This thrills been long overdue

The love you give is the reason I live
You're food to this hungry, so are mine
If satisfaction was money
I'd be the worlds richest man
'Cause you give me such good lovin'
Just as much as I can stand

When we're together
If it's a hundred years from today
Through sunshine and stormy weather
You'll still hear me say
I love you, I love you

You're in my arms again
Where you should have been
You're in my arms again
Where you should have been",You're in My Arms Again
