Band,Lyrics,Song
Steven Last,"When I look in your eyes 
There I see 
Just what you mean to me
Here in my heart I believe
Your love is all I'll ever need
Holdin' you close through the night
I need you, yeah

One look in your eyes and there I see
What happiness really means
The love that we share makes life so sweet
Together we'll always be
This pledge of love feels so right
And, ooh, I need you

Here and now
I promise to love faithfully [faithfully]
You're all I need
Here and now
I vow to be one with thee [you and me], hey
Your love is all [I need] I need

Say, yeah, yeah

When I look in your eyes, there I'll see
All that a love should really be
And I need you more and more each day
Nothin' can take your love away
More than I dare to dream
I need you

Here and now
I promise to love faithfully [faithfully]
You're all I need
Here and now
I vow to be one with thee [you and me], yeah
Your love is all I need

[Starting here] Ooh, and I'm starting now
I believe [I believe in love], I believe
[Starting here] I'm starting right here
[Starting now] Right now because I believe in your love
So I'm glad to take the vow

Here and now, oh
I promise to love faithfully [faithfully]
You're all I need
Here and now, yeah
I vow to be one with thee [you and me], yeah
Your love is all I need

I, hey, yeah, yeah, hey
Uh, hey
I-I, love is all I need
Ooh, ooh, yeah
Yeah, yeah, hey, yeah, yeah
Love is all I need
Ooh, ooh
Yeah, yeah, yeah, yeah, yeah, yeah, yeah, yeah
Oh
Hey, yeah
Hey, yeah",Here and Now
Steven Lawson,"It's like singin' to empty tables
Or a gallery full of ghosts
Or like givin' a great big party
Where nobody shows but the host
That's what it's been like, baby
That's what it's been like all night
Without you around to applaud me
Every night's just like closing night
And I'm singin', singin' the same old numbers
An' I'm tellin' the same sad jokes
And there's nothin' out front but mem'ries
And lot of transparent folks
So, please call, call and make a reservation
In our favorite spot for two
`Cause I'm singin' to empty tables without you
Without you
Without you",Empty Tables
Steven Lawson,"The very thought of you makes my heart sing
Like an April breeze on the wings of spring,
And you appear in all your splendor,
My one and only love.

The shadows fall and spread their mystic charms
In the hush of night while you're in my arms.
I feel your lips, so warm and tender,
My one and only love.

The touch of your hand is like heaven,
A heaven that I've never known.
The blush on your cheek whenever I speak
Tells me that you are my own.

You fill my eager heart with such desire.
Ev'ry kiss you give sets my soul on fire.
I give myself in sweet surrender,
My one and only love.",My One and Only Love
Steven Maglio,"It's quarter to three
There's no one in the place 'cept you and me
So set 'em' up joe
I got a little story I think you oughtta know

We're drinking my friend
To the end of a brief episode
So make it one for my baby
And one more for the road

I know the routine
Put another nickel in that there machine
I'm feeling so bad
Won't you make the music easy and sad

I could tell you a lot
But you gotta to be true to your code
So make it one for my baby
And one more for the road

You'd never know it
But buddy I'm a kind of poet
And I've got a lot of things I want to say
And if I'm gloomy, please listen to me
Till it's all, all talked away

Well, that's how it goes
And joe I know you're gettin' anxious to close
So thanks for the cheer
I hope you didn't mind
My bending your ear

But this torch that I found
It's gotta be drowned
Or it soon might explode
So make it one for my baby
And one more for the road",Drinking Again
Steven Maglio,"Put your dreams away for another day
And I will take their place in your heart.
Wishing on a star
Never got you far,
And so it's time to make a new start.

When your dreams at night fade before you,
Then I'll have the right to adore you.
Let your kiss confess
This is happiness, darling,
And put all your dreams away.

When your dreams at night fade before you,
Then I'll have the right to adore you.
Let your kiss confess
This is happiness, darling,
And put all your dreams away.",Put Your Dreams Away
Steven Maglio,"You make me feel so young
You make me feel as though spring has sprung
And every time I see you grin
I'm such a happy in-div-dual

The moment that you speak 
I wanna go play hide and seek
I wanna go and bounce the moon
Just like a toy balloon

You and I are just like a couple of tots 
Runnin' across the meadow 
Pickin' up lots of forget me nots

You make me feel so young 
You make me feel there are songs to be sung Bells to be rung 
And a wonderful spring to be sprung
And even when I'm old and gray 
I'm gonna feel the way I do today
'Cos you make me feel so young",You Make Me Feel So Young
Steven Malcolm,"Yeah, every weekend we throw a party in the Hills for fun
It's drama free yeah, only got room for my day ones
Singin' like oh, oh-oh-oh-oh
Party in the Hills for fun
Oh, oh-oh-oh-oh
Party in the Hills for fun

Party in the Hills, it's a celebration
I'm talkin' lit with no limitations
Gotta keep it rockin' with the crew, yeah
Work hard, play harder 'til we through, yeah
Vacay all the way to the Bay, yeah
Up to Hollywood just to get away, yeah
I'm talkin' West Coast, maybe on an island
In the Hills, way, way up how we wylin', woo!
On one hundred with the squad
Poppin' wheelies on the block
Tell 'em keep up with the boy
Lookin' at the world and everything we achieved
But blessin' to be successful
Livin to see the dream, yeah
Like every weekend we drama free
And we ain't leavin' until the sun come up
Like every weekend we drama free
And we ain't leavin' until the sun come up

Yeah, every weekend we throw a party in the Hills for fun
It's drama free yeah, only got room for my day ones
Singin' like oh, oh-oh-oh-oh
Party in the Hills for fun
Oh, oh-oh-oh-oh
Only got room for my day ones

Day one, day ones
Shout out to my day ones
Day one, day one
It's time, it's time, it's time

Look, I've been workin' OT
Feelin' like I need a trip to the OC
Cause NY been cold OD, got a little numb
People actin' like they know me, nope
What up Prop and Beleaf?
They gonna roll up, I ain't talkin' no leaf
But I say, aye, what up blood
What up cuz, what up gangstas!
Speakin' 'bout 50, I remember chillin' in the office with him
He told me, ""Andy don't you ever let 'em box you in
You only rap for the Christians, that be a sin""
I grew up on that juice and the gin
I don't drive slow but the cruise on ten
Got a few with me, I don't need new friends
Take a trip, see things like hallucinogens

Yeah, every weekend we throw a party in the Hills for fun
It's drama free yeah, only got room for my day ones
Singin' like oh, oh-oh-oh-oh
Party in the Hills for fun
Oh, oh-oh-oh-oh
Only got room for my day ones

Party, party, party
Party all day, party all night
Party, party, party
Party all day, party all night
Party all day, party all night
Party like a rockstar
Party like a rockstar
Put them hands in the air, it's about that time

Yeah, every weekend we throw a party in the Hills for fun
It's drama free yeah, only got room for my day ones
Singin' like oh, oh-oh-oh-oh
Party in the Hills for fun
Oh, oh-oh-oh-oh
Only got room for my day ones

Party, party, party
Party all day, party all night
Party, party, party
Party all day, party all night
Shout out all my day ones
Party all day, party all night
Yeah, shout out all my day ones
Party all day, party all night
Shout out all my day ones",Party in the Hills
Steven Mayer,"Pack up your troubles and just get happy 
Ya better chase all your cares away 
Sing Hallelujah, come on get happy 
Get ready for the judgment day 

The sun is shining, come on get happy 
The Lord is waiting to take your hand 
Shout Hallelujah, come on get happy 
We're going to the Promised Land 

We're heading 'cross the river 
Gonna wash our sins in the tide 
It's all so peaceful 
On the other side 

Forget your troubles and just get happy 
Ya better chase all your cares away 
Sing Hallelujah, c'mon get happy 
Get ready for the judgment day 

The sun is shining, come on get happy 
The Lord is waiting to take your hand 
Shout Hallelujah, come on get happy 
We're going to the Promised Land 

We're heading 'cross the river 
Wash our sins away in the tide 
It's all so peaceful 
On the other side 

We're heading 'cross the river 
Wash our sins away in the tide 
It's all so peaceful 
On the other side 

Forget your troubles and just get happy 
Ya better chase your cares away!
Sing Hallelujah, come on get happy 
Get ready for the judgment day",Get Happy
Steven Mayer,"You went away
I let you
We broke the ties that bind
I wanted to forget you
And leave the past behind
Still, the magic of the night I met you
Seems to stay forever in my mind

The sky was blue
And high above
The moon was new
And so was love
This eager heart of mine was singing
Lover where can you be

You came at last
Love had its day
That day is past
You've gone away
This aching heart of mine is singing
Lover come back to me
When I remember every little thing

You used to do
I'm so lonely
Every road I walk along
I walk along with you
No wonder I am lonely

The sky is blue
The night is cold
The moon is new
But love is old
And while I'm waiting here
This heart of mine is singing
Lover come back to me
When I remember every little thing

You used to do
I grow lonely
Every road I walk along
I walk along with you
No wonder I am lonely

The sky is blue
The  night is cold
The moon is new
But love is old
And while I'm waiting here
This heart of mine is singing
Lover come back to me","Lover, Come Back to Me"
Steven Mayer,"I hate to see that evening sun go down
I hate to see that evening sun go down
Cause my baby, he's gone left this town

Feelin' tomorrow like I feel today
If I'm feelin' tomorrow like I feel today
I'll pack my truck and make my give-a-way

St. Louis woman with her diamond ring
Pulls that man around by her, if it wasn't for her and her
That man I love would have gone nowhere, nowhere

I got the St. Louis blues, blues as I can be
That man's got a heart like a rock cast in the sea
Or else he wouldn't have gone so far from me

I love my baby like a school boy loves his pie
Like a Kentucky colonel loves his mint 'n rye
I love my man till the day I die",St. Louis Blues
Steven Mayer,"Everything is set, skies are blue,
Can't believe it yet, but it's true, 
I'll give you just one guess, 
My sweet Lorraine said ""yes""
Waiting for the time, soon to be, 
When the bells will chime merrily,
 
(I'm so happy,) when it's raining I don't miss the sun, 
For it's in my sweeties smile,
Just think that I'm the lucky one 
Who will lend her down the aisle
Each night I pray 
That nobody steals her heart away, 
Just can't wait until that happy day,
When I marry sweet Lorraine
 
Everything is set, skies are blue,
Can't believe it yet, but it's true, 
I'll give you just one guess, 
My sweet Lorraine said ""yes""
Waiting for the time, soon to be, 
When the bells will chime merrily,
 
(I'm so happy,) when it's raining I don't miss the sun, 
For it's in my sweeties smile,
Just think that I'm the lucky one 
Who will lend her down the aisle
Each night I pray 
That nobody steals her heart away, 
Just can't wait until that happy day,
When I marry sweet Lorraine",Sweet Lorraine
Steven Mayer,"Where's that tiger! Where's that tiger!
Where's that tiger! Where's that tiger!
Hold that tiger! Hold that tiger ! Hold that tiger! 
Choke him, poke him, kick him and soak him!
Where's that tiger? Where's that tiger?
Where oh where can he be?
Low or highbrow, they all cry now
""Please play that Tiger Rag for me""
 
Where's that tiger! Where's that tiger!
Where's that tiger! Where's that tiger!
Hold that tiger! Hold that tiger ! Hold that tiger! 
Choke him, poke him, kick him and soak him!
Where's that tiger? Where's that tiger?
Where oh where can he be?
Low or highbrow, they all cry now
""Please play that Tiger Rag for me""",Tiger Rag
Stever,"Do I know you from somewhere?
Why do you leave me wanting more?
Why do all the things I say
Sound like the stupid things I've said before?

(Put your hand on my skin)
(Put your hand on my skin)
(Put your hand on my skin)

Kiss me, I'm dying
Put your hand on my skin
I close my eyes
I need to make a connection
I'm walking on a thin line
I close my eyes
I close my eyes

Do I know you from somewhere?
Why do you leave me wanting more?
Why do all the things I say
Sound like the stupid things I've said before?

Touch me, I'm trying
To see inside of your soul
I've got this thing
I want to make a correction
I'm not like this all the time
You've got this thing
You've got this thing

Do I know you from somewhere?
Why do you leave me wanting more?
Why do all the things I say
Sound like the stupid things I've said before?

Kiss me, I'm dying
Put your hand on my skin
I close my eyes
I need to have your protection
I close my eyes
I close your eyes

(Kiss, kiss, kiss me)

Do I know you from somewhere?
Why do you leave me wanting more?
Why do all the things I say
Sound like the stupid things I've said before?

Do I know you from somewhere?
Why do you leave me wanting more?
Why do all the things I say
Sound like the stupid things I've said before?

Kiss me, I'm dying
Touch me, I'm trying, oh
I'm not like this all the time
I'm not like this all the time

Put your hand on my skin
Put your hand on my skin
Put your hand on my skin

Touch me, I'm trying, oh
Put your hand on my skin
Put your hand on my skin

I'm not like this all the time
I'm not like this all the time
I'm not like this all the time",Skin
Stevie B,"You think that just because I'm serious
I'm not the one
I'd like to tell you, girl
There's a time and place for having fun
I love you more than words could ever say
The love I have you, girl will never go away

I want to give you more
Take a chance
What are you waiting for?
Take my hand
And you'll feel my love
Just try with me and you will see love

Come with me
I'll love you better
Come with me
No other love can do you right

Come with me
I'll love you better
Come with me
No other love can do you right

There comes a time in your life to say goodbye
A time to leave all the good things you did behind
No it's not easy
They'll say you're crazy
Love is blind
Come on and take a chance with your heart",Come With Me
Stevie B,"Woo
You told me that you loved me so
And then you said you've got to go
Baby, what's it gonna be
You told me that you're gonna stay
And then you up, then you went away
Why you want to be so mean

All I need is some love and emotion
It's the only thing that turns me on
All I need is some love and emotion
It's the only thing that turns me on

You told me that you would be mine
Baby, till the end of time
Tell me was that just a lie
Girl, you've got me on my knees
Begging for your sympathy
I just want to be your guy

All I need is some love and emotion
It's the only thing that turns me on
All I need is some love and emotion
It's the only thing that turns me on

Woo
All I need is some love and emotion
You know it girl that I've got the notion
Somehow I feel that you got the potion
To make my life complete, woo

Oh, yeah
Oh, yeah
All I need is love
Oh, yeah
I need a little love in the morning time

Get nasty
Woo

All I need is some love and emotion (All I need)
It's the only thing that turns me on (All I really need)
All I need is some love and emotion (Woo)
It's the only thing that turns me on (I need a little love in the morning time)

All I need is some love and emotion
It's the only thing that turns me on (All I really need)
All I need is some love and emotion (Woo)
It's the only thing that turns me on (I need a little love in the morning time)

All I need is some love and emotion
It's the only thing that turns me on (All I really need)
All I need is some love and emotion
It's the only thing that turns me on (I need a little love in the morning time)

Yeah",Love and Emotion
Stevie B,"The way I feel
whenever I think about you
maybe it's just a fantasy

but when you're near
the look in your eyes can tell me
maybe it's just my destiny

and I can't hide it anymore
the way you make me feel inside
the reason why I'm here tonight
is just to tell you girl

if you need me to touch and I hold you
baby, call my name
if you want me to say that I love you
baby, call my name

if you need me to touch and I hold you
baby, call my name
if you want me to say that I love you
baby, call my name

and tell me now
that you call that I ever listen
^^^^^
[??? Dieser Satz ist imho schwer zu verstehen]
maybe it's just a mystery
girl I'm say'in
that the distance can bring us closer
and maybe it's just reality

and I can't hide it anymore
the way you make me feel inside
the reason why I'm here tonight
is just to tell you girl

if you need me to touch and I hold you
baby, call my name
if you want me to say that I love you
baby, call my name

if you need me to touch and I hold you
baby, call my name
if you want me to say that I love you
baby, call my name

the reason why I'm here tonight
(baby, call my name)
is just to tell you girl

if you need me to touch and I hold you
baby, call my name
if you want me to say that I love you
baby, call my name
if you need me to touch and I hold you
baby, call my name
if you want me to say that I love you
baby, call my name",Call My Name
Stevie B,"I heard the news the other day, it said you've gone away
And left me hear behind, what happened to the time
We used to share? I thought you'd always be there
I can't get you off my mind

My heart's in pain but no one seems to care
I called you on the telephone, hoping you'd be there

Broken hearted, I'm left with a broken heart
You tore my whole life apart, I can't live without you
Broken hearted, I'm left with a broken heart
You tore my whole life apart, I can't live without you

Tell me what am I supposed to do?
My whole life has been just you
Now, it seems it's over
Tell me was I the one to blame

This is driving me insane
Now, that you got another lover
I can't believe this is happening to me
I can't let go my love for you, now, can't you see?

Broken hearted, I'm left with a broken heart
You tore my whole life apart, I can't live without you
Broken hearted, I'm left with a broken heart
You tore my whole life apart, I can't live without you

Oh, my heart's in pain but no one seems to care
I called you on the telephone, hoping you'd be there

Broken hearted, I'm left with a broken heart
You tore my whole life apart, I can't live without you
Broken hearted, I'm left with a broken heart
You tore my whole life apart, I can't live without you

Broken hearted, I'm left with a broken heart
You tore my whole life apart, I can't live without you
Broken hearted, I'm left with a broken heart
You tore my whole life apart, I can't live without you

",Broken Hearted
Stevie B,"There was a time in my life
When I opened my eyes
And there you were
You were more than a dream

I could reach out and touch you girl
That was long ago
There are some things
That I guess I'll never know

When you love someone
You gotta learn to let them go

When I dream about you
That's when everything's alright
You're in my arms, here next to me, forever
When I dream about you, girl you never go away
Just close my eyes, wait for my dreams
'Cause I still love loving you.

How can I get you to see
That I'm falling apart
Since you've been gone
I can never be sure
I could ever let go

Your love is much too strong
There are some things
That I guess I'll never know
When you love someone
You gotta learn to let them go

When I dream about you
That's when everything's alright
You're in my arms, here next to me, forever
When I dream about you, girl you never go away
Just close my eyes, wait for my dreams
'Cause I still love loving you.

There are some things
That I guess I'll never know
When you love someone
You gotta learn to let them go

When I dream about you
That's when everything's alright
You're in my arms, here next to me, forever
When I dream about you, girl you never go away
Just close my eyes, wait for my dreams
'Cause I still love loving you.",Dream About You [*]
Stevie B,"My love
When I think I think of all the
Good times that we shared
Many places, many promises we had
And now it seems it's over and I know
Feeling that you're never coming home
And I'll be going on without you in my world

I know we never planned for love
To turn out quite this way
The way we started out that
One September day

The first time that I ever saw your face
My lonely heart was
Searching empty places
I miss your warm embrace
I need you here today

And this is my prayer for you

No matter how much you think it's over
And this I will swear to you
That I will be loving you forever
And I know you have to go on your own
To find your way back home

If my love had the power
To turn back the hands of tie
I would cherish
Every moment you were mine
And now it seems it's over and I know
I didn't know how much I loved you so
Now I'm so all alone without
You in my world

Today I though of you and me and
I began to pray
I prayed Allah would bring you back
To me someday
And you will stay forever in my heart
No matter where you are,
Now matter how far
I'll come running back to you
I'm so in love with you",Prayer
Stevie Brock,"Yeah
Love found me then
I found you

I woke up from my bed about 7 AM
It was Saturday but I couldn't sleep in
I was up all night
So many things on my mind
Learned a lesson about love 
Learned a lot about life
Didn't think I was ready
But you came my way
My first instinct was to run away
Never believed about love at first sight
When I took a second look I was frozen in time

No one told me love could sneak right up on you
Take over you like an arrow going through
I wasn't ready cupid hit me way too soon
Love found me then I found you
All I know is that you took me by surprise
Couldn't get away cause you caught my eye
I got you so I know I didn't lose
Love found me then I found you

See I was think bout what I like
Cause when it clicks right before my eyes
We could be together for the rest of our lives
Turn a magic time to an endless night
Love won't ever let us be alone again
Cause love came down heaven sent
To let you slip on by just wouldn't be right
Couldn't let you go even if I tried

No one told me love could sneak right up on you
Take over you like an arrow going through (through going through)
I wasn't ready cupid hit me way too soon
Love found me then I found you
All I know is that you took me by surprise
Couldn't get away cause you caught my eye
I got you so I know I didn't lose
Love found me then I found you

No one told me love could sneak right up on you (yeah yeah)
Take over you like an arrow going through
I wasn't ready cupid hit me way too soon
Love found me then I found you (then I found you)
All I know is that you took me by surprise
Couldn't get away cause you caught my eye
I got you so I know I didn't lose
Love found me then I found you

Girl you came along and rescued me
I was thinking love could only happen in a dream
Now I know it's real I feel it deep in me
When I look into your eyes
I'm hypnotized
The search is over and forever has begun
I know in my heart that you're the one I want
Destiny led me right into your arms
And from that day to this day
I love you even more

No one told me love could sneak right up on you
Take over you like an arrow going through
I wasn't ready cupid hit me way too soon
Love found me then I found you
All I know is that you took me by surprise
Couldn't get away cause you caught my eye
I got you so I know I didn't lose
Love found me then I found you

Love found me
Love can sneak right up on you
Like an arrow going through
I found you (I found you)
Love found me then
I found you

Love found me
It's like living in a dream baby
Cause you caught my eye
I found you (you)
Love found me then
I found you",I Found You
