Band,Lyrics,Song
George Jones,"If you think it's lonesome where you are tonight. 
You oughta be here with me. 
If loneliness is calling where you are tonight. 
Then you oughta be here with me.

[Chorus]
Because with you I'm whole. 
Without you I'm cold. 
So if you think about me where you are tonight then 
You oughta be here with me.

If teardrops are fallin' where you are tonight. 
You oughta be here with me. 
If loneliness calls you where you are tonight. 
Then you oughta be here with me.

[Chorus]

Recitation,
You know if nobody loves you darlin' 
And it's lonely where you are tonight. 
Don't you know you oughta be here with me? 
Here's thinking of you where ever you are tonight
But you oughta be here with me.

[Chorus]",You Oughta Be Here With Me
George Jones,"Lyin' here thinkin' and I happen to think
Blamin' myself for the things that I said
Hoping that you soon forget and forgive
My life without you ain't no way to live.

Come home to me, come home to me
It just won't be right till you do
Come home to me, come home to me
I can't take one more night all alone
Come on home.

Baby, you left a hurtin' only your love can heal
And I understand that's how I made you feel
Well, my life without you would just fall apart
Right from the body come my lonely heart.

Come home to me, come home to me
It just won't be right till you do
Come home to me, come home to me
I can't take one more night all alone
Baby, come on home.

The moon through the window
Is my shade of blue
As I'm holding your pillow
Longin' for you, baby.

Come home to me, come home to me
It just won't be right till you do
Come home to me, come home to me
I can't take one more night all alone
Come on home.

Come on home",Come Home to Me
George Jones,"Well, you and me baby know what love's all about
It sure wasn't easy oh, but we figured it out
No matter what happens we'll see it through
Baby, don't you see there ain't no me without you

We're like Heckle and Jeckle, Jeckle and Hyde
Frankie and Jonny oh, Bonnie and Clyde
Just like Laurel and Hardy, Bartles and James
One without the other baby, just ain't the same

We've held it together and together we'll stand
You and me against the world hand in hand
A team of wild horses couldn't pull us apart
Forever joined together heart to heart

Just like Heckle and Jeckle, Jeckle and Hyde
Frankie and Jonny oh, Bonnie and Clyde
Just like Laurel and Hardy, Bartles and James
One without the other baby, just ain't the same

Just like birds of a feather we fit like a glove
When we snuggle together like two bugs in a rug

We're like Heckle and Jeckle, Jeckle and Hyde
Frankie and Jonny, Willie and Waylon, Bonnie and Clyde
Just like Laurel and Hardy, Bartles and James
One without the other baby, just ain't the same

We're like Heckle and Jeckle, Jeckle and Hyde
Frankie and Jonny, Willie and Dolly, Bonnie and Clyde
Just like Laurel and Hardy, Bartles and James
One without the other baby, just ain't the same",Heckel and Jeckel
George Jones,"Well I don't know why you left me but I do know that your gone 
Over night you turned my life into a sad ol' song And one way or another, 
I gotta get over you Well there's only one thing left for me to do Lord, 
I don't wanna die of a broken heart That would be too sad Or drive my car off a cliff 

Well, that would just hurt too bad And if I tied a rope around my neck, 
I couldn't get my breath Well I think I'll just honky-tonk myself to death 
Well, I may get a little bit crazy but I don't wanna go insane Young women and ole whisky, 
Well it just may kill the pain I'm gonna find the highest barstool and climb up to the top. 

I think I'll just drink and two-step until I drop Lord, 
I don't wanna die of a broken heart That would be too sad Or drive my car off a cliff 
Well, that would just hurt too bad And if I tied a rope around my neck, 
I couldn't get my breath Well I think I'll just honky-tonk myself to death 

And if I tied a rope around my neck, 
I couldn't get my breath Well I think I'll just honky-tonk myself to death Yeah, 
I think I'll honky-tonk myself to death",Honky Tonk Myself to Death
George Jones,"A friend of mine told me that you were down here last night
I almost called him a liar but I seen he was right, 
Yeah, he was right.

I'm over my anger but that's about all
It's hard to recover from that kind of fall
A fool never knows when to give up
For years I remember those long nights of love

But, I don't go back, anymore
My heart's locked it's windows and bolted it's door
It's like trying to hold back the sea from the shore
No I, don't go back anymore

You're still just as pretty as you were back then
If I didn't know you, I'd fall again
So don't smile and tell me that you still care
Don't stir up my feelings, it just isn't fair

I don't go back, anymore
My heart's locked it's windows and bolted it's door
It's like trying to hold back the sea from the shore
No I, don't go back, anymore

No, I don't go back, anymore

A friend of mine told me you might be down here tonight...",I Don't Go Back Anymore
George Jones,"I gave her that diamond she dreamed of,
And I bought her a home with a view;
I took her to the ends of the rainbow,
But all I left her was blue.

Seems I never had time to love her,
Now it seems time just stands still;
I thought I was king of the mountain,
But I was only a fool on the hill.

[Chorus]
Now I'm here alone, after leavin' her lonely,
Lord, I'm livin' with the memory I know I can't kill;
I thought I was king of the mountain,
But I was only a fool on the hill.

[Chorus]
 
Now I'm here alone, after leavin' her lonely,
Lord, I'm livin' with the memory I know I can't kill;
I thought I was king of the mountain,
But I was only a fool on the hill.
I thought I was king of the mountain,
But I was only a fool on the hill...",King of the Mountain
George Jones,"I started drinking and actin' crazy
Way back in sixty five
Mama would pray and say, he's my baby
Lord, please keep him alive

Sister came home with two little children
Her man had left her alone
Mama knew too well the hurt she was feelin'
'Cause daddy had been gone so long

We all did our part to add to her pain
We all broke her heart but she never complained

She loved a lot in her time
She watched love grow and die on the vine
She stood in the shadows
So others could shine
She loved a lot in her time

Mama's prayers were answered a long time ago
I ain't touched a drink in ten years
Sister remarried to a good ol' boy
They don't live far from here

Mama's work is done
Now, she's gone on home
The words in our hearts
Are engraved on her stone

She loved a lot in her time
She watched love grow and die on the vine
She stood in the shadows
So others could shine
She loved a lot in her time

She stood in the shadows
So others could shine
She loved a lot in her time

Mama, you loved a lot in your time",She Loved a Lot in Her Time
George Jones,"There's three bedrooms, hardwood flooring and the kitchen's new
It's got everything a family needs with a backyard view
Ask anyone where it is, everybody knows
Who used to live here, where the tall grass grows.

The couple who lived there before they kept it up
But since they left that big old yard looks a little rough
And God I miss that little boy who always kept it mowed
We say still lives where the tall grass grows.

So come by and get the key go make yourself at home.
Take all the time you  need, wish I could come along
But I'd sooner build a fire then walk across it slow
And to thank those burning memories where the tall grass grows.

Yes, I'd sooner build a fire then walk across it slow
Than face those burning memories where the tall grass grows
Can't go back and face those memories where the tall grass grows",Where the Tall Grass Grows
George Jones,"I hear people talkin' bad, 
About the way we have to live here in this country,
Harpin' on the wars we fight, 
And gripin' 'bout the way things oughta be.
And I don't mind 'em switchin' sides, 
And standin' up for things they believe in.
When they're runnin' down my country, man, 
They're walkin' on the fightin' side of me. 

[Chorus]
Yeah, walkin' on the fightin' side of me.
Runnin' down the way of life,
Our fightin' men have fought and died to keep.
If you don't love it, leave it,
Let this song I'm singin' be a warnin'.
If you're runnin' down my country, man,
You're walkin' on the fightin' side of me.

I read about some squirrelly guy,
Who claims, he just don't believe in fightin'.
And I wonder just how long,
The rest of us can count on bein' free.
They love our milk an' honey,
But they preach about some other way of livin'.
When they're runnin' down my country, hoss,
They're walkin' on the fightin' side of me.

[Chorus: x2]",Fighting Side of Me
George Jones,"Hey, I've got a guitar, I've got a fiddle
I'll sing the low part, I'll sing the middle
Rosin up the bow and let's pick a little
Got a fiddle and guitar band.

I like old songs, I like the new
I like the glad songs, I like the blues
Well, we'll play them and another note too
With the fiddle and guitar band.

Standing on the sidewalk singin' up a storm
You ain't seen ? till the day you were born ?
Pickin' and a-grinnin' and a-carryin' on
We're goin' to put you on a show.

He plays a music with a cajun beat
We play it hot and you played it sweet
First thing you know you'll be tappin' your feet
To a little bit of do se do oh oh.

If you really want to make it shine
Throw up a dollar or a quarter or a dime
Everybody's gonna have a real good time
With the fiddle and guitar band.

Standing on the sidewalk singin' up a storm
You ain't seen ? till the day you were born ?
Pickin' and a-grinnin' and a-carryin' on
We're goin' to put you on a show.

He plays a music with a cajun beat
We play it hot and you play it sweet
The first thing you know you'll be tappin' your feet
To a little bit of do se do oh oh.

If you really want to make it shine
Just throw up a dollar or quarter or a dime
Everybody's gonna have a real good time
With the fiddle and guitar band.

Everybody's gonna have a real good time
With the fiddle and guitar band
Fiddle and guitar band
Everybody's gonna have a real good time
With the fiddle and guitar band.

A fiddle and guitar band, yeah",Fiddle and Guitar Band
George Jones,"By the time I noticed her she was smilin' at me
From where I stood the mutual attraction was easy to see
Ten beers and twenty passes later the bar tender said it was time to go
I was outta money, she stood and said honey I'm a-going home on my own.

Oh, I've been there, listen buddy, I've been there
I been there when I thought I was livin' a dream and woke up in a real night mare
Yessum, I've been there, let me tell you I've been there
Anywhere a woman can leave you, man, I've been there.

My baby said honey you need a break
Why don't you take a little fishin' trip
I loaded my my old truck and as I drove away
She waved and kinda blew me a little kiss
A couple days later when I got home
Was nothing left but a note on the door
It said I had to leave you
I need a man who'll stay home a little more.

Let me tell you, I've been there, hey buddy, I've been there
I've been there when I thought I was livin' a dream and woke up in a real night mare
Oh, I've been there, I'm here to tell you, I've been there
'Bout anywhere a woman can leave you, man, I've been there.

'Bout anywhere a woman can leave you, son, I've been there

Oh, I've been there.
I've been there too, son, let me tell ya, I know what it's all about.",I've Been There
George Jones,"Hey, we broke up in Nashville on a cold and rainy night
My tears mixed with the cold rain drops as she walked out of sight
So I put Nashville in my rear view mirror and headed south
'Cause I thought the girls in San Antone would knock her memory out

But it hurts as much in Texas as it did in Tennessee
Lone star lonely, down and blue is what they're callin' me
I thought these Texas dance halls nights would kill my misery
But it hurts as much in Texas as it did in Tennessee

My heart still lives in Nashville with the girl I long to see
I'm tryin' to forget the way that she broke up with me
I thought that I could two step her sweet memory from my mind
But she still waltzes through my dreams and wakes me up at night

But it hurts as much in Texas as it did in Tennessee
Lone star lonely, down and blue is what they're callin' me
I thought these Texas dance halls nights would kill my misery?
But it hurts as much in Texas as it did in Tennessee
Yeah, it hurts as much in Texas as it did in Tennessee

",It Hurts as Much in Texas (As It Did in Tennessee)
George Jones,"I remember my grandfather's counsel
As he laid the leather to my hide
He said there's just one rule to life that always will apply
You can't do wrong and get by.

Now, lessons tend to fade as we grow older
And I found myself in jail at twenty-five
Had to sit there by my lawyer, the old judge looked me in the eye
Said, you can't do wrong and get by.

You can't do wrong and get by for very long
Do wrong and all your troubles multiply

You may not face them here but you'll face the man on high

You can't do wrong and get by.

Now once I had a wife and lovin' children
But I gave into the pleasures of the night
Used my grand dads very words to say her last goodbye
You can't do wrong and get by.

You can't do wrong and get by for very long
Do wrong and all your troubles multiply
Oh, you may not face them here but you'll sure face the man on high
You can't do wrong and get by.

No, no, you can't do wrong and get by
You can't do wrong and get by.

Oh no, you can't do wrong and get b",You Can't Do Wrong and Get By
George Jones,"(Hey) well, I've been a-working hard the whole week long
And I'm a-gonna have some wine, women and song
I gotta work next week but that's alright
I got five dollars and it's Saturday night

A-music and dancin', flirtin' and fun
It's gonna go on till way past one
I'm a-gonna go where the lights are bright
I got five dollars and it's Saturday night

I'm gonna have fun tonight
Gonna get right tonight
Everything will be alright
'Cause tonight is Saturday night (hey)

Well, other folks a-wonderin' what the future may bring
I'm a-gonna have fun and feel no pain
My pants are ragged but that's alright
I got five dollars and it's Saturday night

A-music and dancin', flirtin' and fun
It's gonna go on a-way past one
I'm a-gonna go where the lights are bright
I got five dollars and it's Saturday night

Gonna have fun tonight
Gonna get right tonight
Everything will be just right
Tonight is Saturday night (hey)

Let other folks a-wonder what the future may bring
I'm a-gonna have fun and feel no pain
My pants are ragged but that's alright
I got five dollars and it's Saturday night",I've Got Five Dollars and It's Saturday Night [*]
George Jones,"I know momma loved me
I reckoned that dad thought I was a pretty good kid
I've been blamed
But I'm not ashed of a couple of things I did

I learned the golden rule before I started to school
Like every little young'n should do
But what am I worth on God's great earth
If I'm not worth nothing to you?

What am I worth here on earth
Darling, If I can't have you?
I just can't find no peace of mind
With anything that I do

I don't know why you made me cry
Honey, won't you give me a clue 
What am I worth on God's great earth
If I'm not worth nothing to you?

I might get sent to be president
I'm sure I could do it for you
They would feature my face all over the place 
For all the good things I do

I might get my name in the hall of fame
Or even in the book of ""Who's-Who""
But what am I worth on God's great earth
If I'm mot worth nothin' to you?

What am I worth here on earth
Darling, If I can't have you?
I just can't find no peace of mind
With anything that I do

I don't know why you make me cry
Honey, won't you give me a clue?
What am I worth on God's great earth
If I'm not worth nothing to you?",What Am I Worth [*]
George Jones,"Written by George Jones and Darrell Edwards 
In the papers I saw you this morning
You were lovely, dressed in your wedding gown
And it said you would marry a stranger to me

That had drifted into our old home town
Accident'ly, you met him one ev'ning
And you say it was love at first sight
Accident'ly on purpose you're marryin'

Accident'ly on purpose, for spite
For you say that you saw me out painting the town
That I was just a fool with the heart of a clown
Accident'ly, you were mistaken that night

Accident'ly on purpose, for spite
Yes, you say that you saw me out painting the town
That I was just a fool with the heart of a clown

Accident'ly, you were mistaken that night
Accident'ly on purpose, for spite",Accidentally on Purpose
George Jones,"Well, I have lived a lot and done my part of running 'round
And never did I think I'd let a sweet love get me down
But now I see how wrong I was, you're part of every plan
Perhaps I'll pay but come what may, my heart's at your command

Oh, this aching, breaking heart of mine is crazy over you
And I'm afraid to let you know I love you like I do
For if you knew how much I care, I know what you would do
You'd drop me like the others and go find somebody new

Last night I saw you, darling, in the arms of someone new
And I know that you don't love him, you just want to make me blue
I guess you think that hurting me will make me love you more
But someday from you, darling, this old heart will lock its door

Oh, this aching, breaking heart of mine is crazy over you
And I'm afraid to let you know I love you like I do
For if you knew how much I care, I know what you would do
You'd drop me like the others and go find somebody new",Achin' Breakin' Heart
George Jones,"Up above me are the skies like the twinkle in your eyes
These things are the color of the blues
In the mail your letter came, the ink and paper looked the same
Blue must be the color of the blues

Bluebird sitting in the tree seems to sympathize with me
For he's not singing like he used to do
The pretty waters in the sea feel as cold as you left me
Yes, blue must be the color of the blues

There's a rainbow overhead with more blue than gold and red
Blue must be the color angels choose
A blue dress you proudly wore when you left to return no more
Blue must be the color of the blues

Blue days come and blue days go, how I feel nobody knows
Life is mighty empty without you
There's a blue note in each song that I sing since you are gone
Yes, blue must be the color of the blues",Color of the Blues
George Jones,"You took her from my side
The day you took her from me
And you though that it would hurt my pride
But there were things you failed to see.

You thought you stole away her love
But I want the world to know
It's the truth she turned her back on me
But I was glad to let her go.

Yes, you thought that you were foolin' me
And even though it wasn't right
Let me thank you for you set me free
From a lot of sleepless nights.

My love for her had died
Yes, it was over long ago
And it's true she walked away with you
But I was glad to let her go.

Yes, you knew that you were cheating me
And even though it wasn't right
Let me thank you for you set me free
From a lot of sleepless nights.

My love for her had died
Yes, it was over long ago
And it's true she walked away with you
But I was glad to let her go...",Glad to Let Her Go
George Jones,"Well, you got my heart a-feelin' used and jumpy
The road of love is gettin' mighty, mighty bumpy
Tell me pretty mama have I filled your heart today?

Well, if someone knew your affiliated
Then it's makin' me feel like I'm outdated
If I don't love you grits ain't groceries
And that's another poor mans place.

Well, let me know honey, tell me what's a-matter
Lat me know what's on your mind
If I don't love you ain't a cow in texas
They raise 'em there all the time.

Well, I don't want to soumd like I'm demandin'
I just wanta get a little understanding
If I don't love you grits ain't groceries
And that's another poor mans place.

Well, won't you tell me something, baby
Tell me what's a-matter
Let me know what's on your mind
If I don't love you ain't a cow in texas
They raise 'em there all the time.

Well, I don't want to sound like I'm demandin'
I just wanta get a little understanding
If I don't love you grits ain't groceries
And that's another poor mans place",If I Don't Love You (Grits Ain't Groceries)
George Jones,"The music from the honky tonk
The lonely songs they play
Comin' through my window
Cause I live not far away
There tempting me to come back
To the things we used to do
But the honky tonks and lonely songs
I left behind when I left you

The nightlife with it's party's
That's you're style of being gay
Although it meant I lost your love
I couldn't live that way

I hope some day you'll think
Enough of me and try to change
And come away from the honky tonk
Back into my arms again

The nightlife with it's party's
That's you're style of being gay
Although it meant I lost your love
I couldn't live that way

I hope some day you'll think
Enough of me and try to change
And come away from the honky tonk
Back into my arms again

Oh, won't you come away from the honky tonk
Back into my arms again?",Into My Arms Again
George Jones,"Put the bottle on the table
Let it stay there till I'm not able
To see your face in ev'ry place that I go
I've been sitting here so long
Just remembering that you are gone
Well, one more drink of wine
Then if you're still on my mind
One drink, just one more, and then another

I'll keep drinking, it won't matter
I'll just remember that I once had her
I don't know why I sit and cry every day
I've been trying to forget, but I haven't stopped as yet
Well, one more drink of wine
Then if you're still on my mind
One drink, just one more, and then another

Put the bottle on the table
Let it stay there till I'm not able
To see your face in ev'ry place that I go
I've been sitting here so long
Just remembering that you are gone
Well, one more drink of wine
Then if you're still on my mind
One drink, just one more, and then another",Just One More
George Jones,"THE LAST TOWN I PAINTED
(Writer Buddy Word)
Â« Â© '63 Glad Music Â»

I came home the other night I've been out on a town
I searched talk through the house she was not around
I finally found her note it red this is goodbye to you
And that's the last town I painted and I painted it blue
Now that I have lost her I don't want to live
I done all the takin' I didn't want to give
Time has come it's plain to see the devil must pay his dues
And that's the last town I painted and I painted it blue
I still go to the tavern that I went to before
I search for the fun I had it's not there anymore
If I could have her back again I know I would be true
Cause the last town I painted I painted it blue
Now blue is not my favorite color cause it makes me sad
Why I asked for all these blues when I'm usin' too much red
I've got a lotta troubles no one to tell it to
Cause the last town I painted I painted it blue



",The Last Town I Painted
George Jones,"I've got a feeling you'll soon be leavin'
But I won't beg you not to go
Because I've always been
A fool to cry for you.

I know this time it's really over
For there's no happiness in store
And I will never be the fool I was before
No one can ever call me Mr. Fool no more.

My tears were scattered with all was shattered
Dreams that faded in the past
Vows were spoken and vows were broken
But the last one was the last.

So I'll keep smilin' although you're leavin'
For time will heal a heart that's sore
And I will never be the fool I was before
No one can ever call me Mr. Fool no more.

So I'll keep smilin' although you're leavin'
For time will heal a heart that's sore
And I will never be the fool I was before
No one can ever call me Mr. Fool no more",Mr. Fool
George Jones,"What goes wrong with the mind of a man in a bar
Who sits and keep drinking with his thoughts strayed so far
It's the same old sad story that has often been told
One drink then another till he's out of control

As he sits at a table with his hands on the glass
For him there's no future there's only the past
He reaches for the bottle but his hands don't take hold
His eyes just can't focus he's out of control

Does he search for contentment that he might hope to find
From a honky tonk woman or the bottles of wine
He shakes and he trembles even though he's not old
Like a leaf in a whirlwind he's out of control

Yes I'm just like that fellow who sits there all alone
With no one to love me no family at home
I'm a picture of others with a future so cold
A life ain't worth livin' when it's out of control",Out of Control
