Band,Lyrics,Song
Steve Tyrell,"Rain drops keep fallin' on my head
And just like the guys whose feet are too big for his bed
Nothing seems to fit, those rain drops are fallin' on my head
They keep fallin

So I just did me some talkin' to the sun
And I said I didn't like the way he got things done
Sleeping on the job
Those rain drops are fallin' on my head
They keep fallin'

But there is one thing I know
The blues they sent to meet me, want to feed me
It wont be long till the happiness steps up to greet me

Rain drops keep fallin' on my head
But that doesn't my eyes will soon be turning red
Cryings not for me
Cause I'm never gonna stop the rain by complaining
Cause I'm free, nothings worrying in me

It wont be long till the happiness steps up to greet me
Rain drops keep fallin' on my head
But that doesn't my eyes will soon be turning red
Cryings not for me
Cause I'm never gonna stop the rain by complaining
Cause I'm free, nothings worrying in me",Raindrops Keep Fallin' on My Head
Steve Tyrell,"When you go through a day
And the things that people say
They make you feel so small

They make you feel that your heart will just never stop aching
And when you just cant accept the abuse you are taking

[Chorus]
Darling, reach out for me
Don't you worry ill see you through
You just have to reach out for me
I'll be there to, I'll comfort you

When good friends prove untrue
And the things they do to you
They make you feel so bad

They make you feel that
You haven't a reason for living
So when you feel you
Could throw in the towel and just give in

[Chorus]

Comfort you and love you
How I'm gonna love you baby

When you feel that your heart 
Will just never stop aching
And when you just cant 
Accept the abuse you been taking

[Chorus: x2]",Reach Out for Me
Steve Tyrell,"If you see me walkin' down the street and I start to cry
Each time we meet, walk on by
Walk on by, make believe that you don't see the tears
Just let me breathe in private
Cause each time I see you ill break down and cry

Oh walk on by, oh walk on by

I just cant get over losing you
So if I sing broken and blue
Walk on by, walk on by

Foolish pride is all that I have left
So let me hide the tears and the sadness you gave me when 
You said goodbye
Walk on by, oh walk on by
Walk on by, oh walk on by

Walk on, 

Walk on by, walk on by

Foolish pride thats all that I have so let me hide
The tears and the sadness you gave me when you said goodbye
Oh walk on by, walk on by
Walk on by babe, now you really gotta go and walk on by
Make me believe you never saw the tears I cried
Walk on by
Walk on by sweet love and don't stop",Walk on By
Steve Tyrell,"[Chorus]
What the world needs now 
Is love, sweet love 
It's the only thing that there's just too little of 
What the world needs now 
Is love, sweet love 
No, not just for some, but for everyone 

Look, we don't need another mountain 
There are oceans and rivers 
Enough to cross, enough to last 
Until the end of time 

[Chorus]

Lord we dont need another meadow
There are corn fields and wheat fields enough to grow
There are sun beams and moon beams enough to shine
This I know, if you want to know

[Chorus]

What the world needs now 
Is love, sweet love 
What the world needs now 
Is love, sweet love 
What the world needs right about now 
What the world needs now 
Is love, sweet love 
What the world needs now 
Is love, sweet love 

What the world needs now 
Is love, sweet love 
It's the only thing that there's just too little of 
What the world needs now 
Is love, sweet love 
No, not just for some, just for everyone

It's the only thing that there's just too little of 
What the world needs now 
Is love, sweet love 
No, not just for some, but for everyone",What the World Needs Now
Steve Tyrell,"You smile, the song begins you speak and 
Hear violins it's magic 
The stars deserve the sky and in 
Your eyes it's magic 
With out a golden one, a mystic chance 
Fantastic things begin 
When I am in your arms 
When we walk hand in hand the world 

Becomes a wander land 
How we can explain those rainbows 
When that it's no rain, it's magic 
What do I tell my self, this things 
That happened are already truth 
When in my heart I know the magic 
It's my love for you",It's Magic
Steve Tyrell,"Strolling along country roads with my baby. 
It starts to rain, it begins to pour. 
Without an umbrella we're soaked to the skin. 
I feel a shiver run up my spine.
I feel the warmth of her hand in mine.

Oo, I hear laughter in the rain,
Walking hand in hand with the one I love.
Oo, how I love the rainy days and the happy way I feel inside. 

After a while we run under a tree. 
I turn to her and she kisses me. 
There with the beat of the rain on the leaves 
Softly she breathes and I close my eyes.
Sharing our love under stormy skies.

Oo, I hear laughter in the rain, 
Walking hand in hand with the one I love.
Oo, how I love the rainy days and the happy way I feel inside.
I feel the warmth of her hand in mine.

Oo, I hear laughter in the rain, 
Walking hand in hand with the one I love.
Oo, how I love the rainy days and the happy way I feel inside.
Oo, I hear laughter in the rain,
Walking hand in hand with the one I love.
Oo, how I love the rainy days and the happy way I feel inside. 
Oo, I hear laughter in the rain, 
Walking hand in hand with the one I love.
Oo, how I love the rainy days and the happy way I feel inside.
Oo, I hear laughter in the rain,
Walking hand in hand with the one I love.
Oo, how I love the rainy days and the happy way I feelinside",Laughter in the Rain
Steve Tyrell,"They say the neon lights are bright
On Broadway 
They say there's always magic in the air 
But when you're walkin' down that street
And you ain't have enough to eat
The glitter rubs right off and you're nowhere

They say the women treat you fine
On Broadway 
But lookin' at them just gives me the blues 
How ya gonna make some time
When all you got is one thin dime
And one thin dime won't even shine your shoes
 
They say that I won't last too long 
On Broadway 
I'll catch a Greyhound bus for home they all say 
But they get wrong, I know they are
'Cause I can play this here guitar

I won't quit till I'm a star
On Broadway 
On Broadway 
On Broadway",On Broadway
Steve Vai,"I need some junk
To shoot in my vein
Would you give me some
To relieve the pain?

These city streets
Are drivin' me insane
I tried laundry detergent
But it's not the same

I need some food
To stuff in my face
But the garbage man
He took the trash away

These city streets
Are makin' me crazy
I tried to eat rocks
But they have no taste

My face is a wreck
My brain's decayed
I need a fix ‘n I'll be OK
These city streets
Are makin' me crazy
I'm chewing on glass but I
Don't even bleed
I don't even bleed
I don't even bleed
I don't even bleed

I'll pray tonight
To the king of kings
Won't you pull me out
I'd rehabilitate those city streets
You know I can't keep straight
Will I murder somebody?
Well ya can't fool fate
Ya can't fool fate
Ya can't fool fate
No, you can't fool fate

I need some help, I need some help,
I'm falling apart
Will I die in my sleep
Or will I live in the streets
In agony?",Junkie
Steve Vai,"Here we stand
As time keeps turning
Near and far
The fires are burning

Victory
The endless passion
For a cause
We will take an action

I'm not a savior
I'm not a king
There's only one voice in your head
But I feel your anger
I speak your peace
Freedom time is here
So are you ready for the
Here & Now

Sacrifice
The soul needs baring
Bring new life
To a world worth sparing

I'm not a prophet
I'm not a prince
The ego dies with the flesh
You are the garden
I am the seed
Harvest time is here
But tell me are you ready for the
Here & Now

Courage
Sacrifice
Victory
Freedom

One for all
Time is fleeting
Hear the call
Our world is bleeding

There are no saviors
There are no kings
The power lies in your hands
So you be the fire
The light without heat
Precious time is here
So tell me are you ready for the
Here & Now",Here & Now
Steve Vai,"I'm watchin' you, I'm wantin' you, but you turn away
I'd crawl through broken glass to you, but it wouldn't pay
You take me for a fool, but if you only knew
What I do in my dreams with you

You're so cold and critical, and baby that's too bad
So my reality will have to come to me in my dreams

I know that you belong to me every night, you suddenly appear in my eyes
It happens when I sleep, it isn't right, what I do in my dreams with you
It isn't right what I do in my dreams with you

I love the way you come to me every night
My fantasies are real, and they never lie
If you only knew, what I do in my dreams with you, yeah
It isn't right, Lord knows that it isn't right

The world can make you cynical, with all its love and pain
But I don't have to carry the weight of the world

I know that you belong to me every night, you suddenly appear in my eyes
It happens when I sleep, it isn't right, what I do in my dreams with you
It isn't right what I do in my dreams with you

Baby don't wake me, let me take you on an endless journey
We touch, and the softest kiss explodes with lust, yeah
It's real, you can't deny the heat you feel
And if I die before I wake, baby, that's all right

I know that you belong to me every night, you suddenly appear in my eyes
It happens when I sleep, it isn't right, what I do in my dreams with you
It isn't right what I do in my dreams with you

I know that you belong to me every night, you suddenly appear in my eyes
",In My Dreams With You
Steve Vai,"And though the sun goes down
The fever you adore is burning in your breast
Helpless in the fall from paradise into your bed
For here it is sown, in time we forget what is man

Don't let your body cry
This game of love is war
And I'm already dead

You say- Hold me down and wash away
This hunger from my flesh
And make me reborn in sweet innocence
Come on and make me live

It's voodoo that you possess
(Your heaven is danger)
Deny your dark side, I know
All about your secret life 
Oh Eve

And so the moon is high 
I see that love is blind
To the fire in your eyes

As our garden fiercely burns
We have no place to hide
Naked and cold running from the wind
Now wrapped in skin

It's voodoo that you possess
(Your heaven is danger)
Deny your dark side, I know
All about your secret life

It's voodoo that you possess
(Your heaven is danger)
Behind those lucid eyes
The shadow of the serpent lies
Oh Eve 
All about Eve

And though the sun goes down 
The mortals never know",All About Eve
Steve Vai,"[ANATOLY]
No man, no madness
Though their sad power may prevail
Can possess, conquer, my country's heart
They rise to fail
She is eternal
Long before nations' lines were drawn
When no flags flew, when no armies stood
My land was born.

And you ask me why I love her
Through wars, death and despair.
She is the constant, we who don't care
And you wonder will I leave her -- but how?
I cross over borders but I'm still there now.

How can I leave her?
Where would I start?
Let man's petty nations tear themselves apart
My land's only borders lie around my heart.",Bangkok
Steve Vai,"De antwoorden zijn altijd al aanwezig

I cannot be ungrateful for what I
Have received from America,
But I am not the judge.
The judge of justice say, ""Led-em-go.""",Answers
Steve Vai,"Words fall silent when no one will hear
Emotions are deadly when there's too much to fear
Touch a feeling and we feel again
To know the pleasure, we must know the pain

I'm going down for the last time
Open your eyes

Who's gonna hear you when you're callin'
And who's gonna catch you when you're fallin'
Who's gonna trust you
Well I'll be around for a while

And who's gonna heal you when you're bleeding
And who's gonna give to you when you're needing
And who's gonna love you
Well I'll be around for a while

When love lies bleeding only fools are bold
They search for pennies in a pot of gold
Faith is dying when no one's to trust
But your soul is crying
And it's glorious

It's coming down to the last time
Open your heart

Who's gonna hear you when you're callin'
And who's gonna catch you when you're fallin'
And who's gonna laugh with you
Well I'll be around for a while

And who's gonna warm you when you're freezing
And who's gonna hold you when you're screaming
And who's gonna promise you
To be around for a while

There you stand, drowning in the rain
Kidding yourself the wind don't sting
And all this time the thing you want is calling to you

I dig the way you take that storm
While spitting in the face of right and wrong
Well you could let down your defenses
When you're in my arms

You could my face
In my arms
You could dream on and on
In my arms
You would never be alone
In my arms
You could cry like a child
In my arms

Who's gonna hear you when you're callin'
And who's gonna catch you when you're fallin'
And who's gonna trust you
Well I'll be around for a while

And who's gonna mend you when you're broken
And who's gonna find you when you're stolen
And who will always love you
I'll be around for a while

And who's gonna shield you when it's rainin'
And who's gonna kneel with you when you're prayin'
Who's gonna feel for you
Well I will, I'll be around for a while

Who's gonna help you when you're tryin'
And who's gonna hold you when you're dyin'
Who's gonna beg you
To be around for a while",I'll Be Around
Steve Vai,"Everybody's a dreamer
And everybody's a star
And everybody's in movies
It doesn't matter who you are

There are stars in every city
In every house and on every street
And if you walk down Hollywood Boulevard
Their names are written in concrete

Don't step on Greta Garbo
As you walk down the Boulevard
She looks so weak and fragile
That's why she tried to be so hard

But they turned her into a princess
And they sat her on a throne
But she turned her back on stardom
Because she wanted to be alone

You can see all the stars as you
Walk down Hollywood Boulevard
Some that you recognize
Some that you hardly even heard of

People who worked and suffered
And struggled for fame
Some who succeeded and some
Who suffered in vain

Rudolph Valentino looks
Very much alive
And he's lookin' up ladies' dresses
As they sadly pass him by

Avoid stepping on Bela Lugosi
'Cause he's liable to turn and bite
But stand close by Bette Davis
Because hers was such a lonely life

And if you covered him with garbage
George Ganders would still have style
And if you stamped on Micky Roonie
He would still turn around and smile

But please don't tread on our dearest Marilyn
'Cause she's not very tough
She should have been made of finer steel
But she was only made of flesh and blood

And you can see all the stars
As you walk down Hollywood Boulevard
Some that you recognize
Some that you hardly ever heard of

People who worked and suffered
And struggled for fame
Some who succeeded and some
Who suffered in vain

Everybody's a dreamer
And everybody's a star
And everybody's in movies
It doesn't matter who you are

And those who are successful
Be always on your guard
Success walks hand in hand
With failure along Hollywood Boulevard

I wish my life was a non-stop Hollywood movie show
A fantasy world of celluloid villains and heroes
Because celluloid heroes never feel any pain
And celluloid heroes never really die

And you can see all the stars
As you walk down Hollywood Boulevard
Some that you recognize
Some that you hardly ever heard of

People who worked and suffered
And struggled for fame
Some who succeeded and some
Who suffered in vain

La la la la [unverified]
Celluloid heroes never feel any pain
And celluloid heroes never really die

I wish my life was a non-stop Hollywood movie show
A fantasy world of celluloid villains and heroes
'Cause celluloid heroes never feel any pain
And celluloid heroes never really die

",Celluloid Heroes
Steve Vai,"Walking down the street
You're the center of my universe
You got the world in your pocket,
My manhood in your purse
You ain't a bad girl, honey,
No matter what the neighbors say,
It's just that you were those skin-tight dresses
With your G-string tuned to ""A"" 

Sweet, sweet, child of the street 

Heaven sent, you're an angel dressed in black,
Cool, stiletto strut, you're a drop jaw cardiac
You're the genuine, feline, prettiest girl I've ever seen,
With your thief of hearts smile
You're a certified pleasure machine 

Sweet, sweet, child of the street 

Dressed to kill in diamonds and fur,
You get what you want
With your pussy cat purr 

But, the kittens got claws,
She'll tear your heart out
The kittens got claws,
She'll scratch your back
The kittens got claws
She'll tease an' please you
The kittens got claws,
She's a heart attack 

You treat me good,
Sometimes you treat me bad,
But, keep it up, honey,
You're the best time I've ever had
No matter what you put me through I must confess,
Oh, you got more style than a brand new XJS 

Sweet, sweet, child of the street 

Dressed to kill in diamonds and fur,
You get what you want
With your pussy cat purr 

But, the kittens got claws,
She'll tear your heart out
The kittens got claws,
She'll scratch your back
The kittens got claws,
She'll tease an' please you
The kittens got claws,
She's a heart attack

Walking down the street
You're the center of my universe
You got the world in your pocket,
My manhood in your purse
I know you ain't a bad girl, honey,
No matter what the neighbors say,
It's just that you were those skin-tight dresses
With your G-string tuned to ""A"" 

Sweet, sweet, child of the street 

Dressed to kill in diamonds and fur,
You get what you want
With your pussy cat purr 

But, the kittens got claws,
She'll tear your heart out
The kittens got claws,
She'll scratch your back
The kittens got claws,
She'll tease an' please you
The kittens got claws,
She'll blow your stack 

The kittens got claws,
She'll tear your heart out
The kittens got claws,
She'll scratch your back
The kittens got claws,
She'll tease an' please you
The kittens got claws,
She's a heart attack

You scratch my back, baby,
An' I'll scratch yours",Kittens Got Claws
Steve Vai,"Well who's that writin'?
John the revelator
Who's that writin'?
John the revelator
Who's that writin'?
John the revelator
A book of the seven seals

Well who's that writin'?
John the revelator
Who's that writin'?
John the revelator
Who's that writin'?
John the revelator
A book of the seven seals
Oh what's john writin'?
Ask the revelator
Oh what's john writin'?
Ask the revelator
What's john writin'?
Ask the revelator
A book of the seven seals

Well ooh ooh tell me, thousands cried holy
Battles of fortune, sons of our god
Daughter of zion, judah the lion
He redeemeth, and he brought us with his blood
John the revelator, great advocator
Gets 'em on the battle of zion
Lord, tellin' the story, raisin' the glory
Cried, ""lord, don't you love some I""

Well who's that writin'?
John the revelator
Who's that writin'?
John the revelator
You tell me who's that writin'?
John the revelator
A book of the seven seals

Oh what's that writing
Ask the revelator
What's that writing
Ask the revelator
Tell me who's that writing
Ask the revelator
Who's got the seven seals?

Well moses to moses, watchin' the flock
Saw the bush where they had to stop
God told moses, ""oh pull off your shoes""
Out of the flock, well you I choose
It's you I chose the tears of the angels
Burning down from heaven, 
Waiting for the love of god
Down for the glory, I'm telling the story
This is the story of us

Well who's that writin'?
John the revelator
Tell me who's that writin'?
John the revelator
Tell me who's that writin'?
John the revelator
A book of the seven seals
John the revelator",John the Revelator
Steve Vai,"De antwoorden zijn altijd al aanwezig

I cannot be ungrateful for what I
Have received from America,
But I am not the judge.
The judge of justice say, ""Led-em-go.""",Answers [Version]
Steve Veale,"I just came back from a lovely trip along the Milky Way
Stopped off at the North Pole to spend a holiday
I called on dear old Santa Claus
To see what I could see
He took me to his workshop 
And told his plans to me, so
 
[Chorus]
You better watch out, you better not cry
Better not pout, I'm telling you why
Santa Claus is comin' to town
He's making a list and checking it twice
Gonna find out who's naughty and nice
Santa Claus is comin' to town
He sees you when you're sleepin'
He knows when you're a wake
He knows if you've been bad or good
So be good for goodness sake
Oh! You better watch out, you better not cry
Better not pout, I'm telling you why
Santa Claus is comin' to town
 
With little tin horns and little toy drums
Rooty toot toots and rummy tum tums
Santa Claus is comin' to town
And curly head dolls that toddle and coo
Elephants, boats, and kiddie cars too
Santa Claus is comin' to town
Then kids in Girl and Boy land will have a jubilee
They're gonna build a Toyland all around the Christmas tree
So! You better watch out, you better not cry
Better not pout, I'm telling you why
Santa Claus is comin' to town
 
Now Santa is a busy man, He has no time to play
He's got millions of stockings to fill on Christmas day
You'd better write your letter now
And mail it right away
Because he's getting ready
His reindeer's and his sleigh. So
 
[Chorus]
 
With little tin horns and little toy drums
Rooty toot toots and rummy tum tums
Santa Claus is comin' to town
And curly head dolls that toddle and coo
Elephants, boats, and kiddie cars too
Santa Claus is comin' to town
Then kids in Girl and Boy land will have a jubilee
They're gonna build a Toyland all around the Christmas tree
So! You better watch out, you better not cry
Better not pout, I'm telling you why
Santa Claus is comin' to town",Santa Claus Is Coming to Town
Steve Veilleux,"Travailler comme un chien toute ta vie durant
La fonderie, la coulée, les poussières d’années
Envolées à coup d’usure, d’eau de vie dure…
Vieille école, huile de bras, le pain noir avant le blanc
Fin de semaine, plutôt terne, pas un jour plus haut que l’autre
Tu n’as même jamais pris le temps de faire semblant
Jamais de merci facile, tout se mérite dans la vie
Tu disais aussi que la pluie nettoie les menteries
De ceux qui n’ont jamais eu le courage
De gagner leur vie…

Routinier de métier travaillant jusqu’au sang
Capitaine à ton bord au diable les routards
Les nouvelles sont moins bonnes aujourd’hui qu’avant
Qu’avant…
Que tu te réveilles dépassé par le temps
Que les enfants s’ambitionnent et prennent la clé des champs
Demain tout recommence ground zero commandant
Il n’est jamais trop tard pour s’offrir une tournée de bon temps…

Je sais je n’ai pas appelé assez souvent
Ni avant de débarquer un soir de semaine, ridé
J’avais seulement envie de t’entendre me raconter
Que dans ton temps le ciel était plus bleu qu’aujourd’hui
Que le bonhomme 7 heures faisait sa ronde à minuit
Que tout le monde se tenait pour le meilleur, pour le pire

Routinier de métier travaillant jusqu’au sang
Capitaine à ton bord au diable les routards
Les nouvelles sont moins bonnes aujourd’hui qu’avant
Qu’avant…
Que tu te réveilles dépassé par le temps
Que les enfants s’ambitionnent et prennent la clé des champs
Demain tout recommence ground zero commandant
Yé jamais trop tard pour s’offrir une tournée de bon temps…

Pense à toi pas au passé le ciel clément 
Le bonheur donnant donnant…
Ta vie ce n’est pas juste une boîte à souvenirs
Fais-toi plaisir offre-toi ce que tu mérites de vivre
",La  clĂŠ des champs
Steve W. Mauldin,"Put your sweet lips a little closer to the phone.
Let's pretend that we're together, all alone.
I'll tell the man to turn the jukebox way down low,
And you can tell your friend there with you he'll have to go.

Whisper to me, tell me do you love me true,
Or is he holding you the way I do?
Tho' love is blind, make up your mind, I've got to know,
Should I hang up, or will you tell him he'll have to go?

You can't say the words I want to hear
While you're with another man,
If you want me, answer ""yes"" or ""no,""
Darling, I will understand.

Put your sweet lips a little closer to the phone.
Let's pretend that we're together, all alone.
I'll tell the man to turn the jukebox way down low,
And you can tell your friend there with you he'll have to go.",He'll Have to Go
