Band,Lyrics,Song
Novembre,"Upon the rivers of the day
It blows a cool breeze in the air
Of thoughts and shimmering hours of May
And all its feelings

I dared to walk down by the lane
Calm and fearless in the rain
I felt that you were by my side
Calm and tender

You are the reason for this May
Has washed the purple clouds away

You are the reason for this May
Has washed the purple clouds away

You are the reason for this May
Is warm and fills me with its rays

Listen, all the time we witness miracles,
All the time!

We thought that anyone that has a life
Bear the cross of the passion and of the time
Oh, the way I was blind!

The time I stumbled over your blue eyes
I felt like falling into a pool of joy
And a sort of miracle happened
The ancient fortress vanished at your smile

You are the reason for this May
Has blown all darkness far away
You are the reason for this May
Is warm and fills me with its rays",Reason
Novembre,"Sarah, we once feltered
As you froze that
Morning omen
And you told them
And you warned them
That the sky turned red
Above them

Sarah it's said, same rain
Doesn't fall down twice.
Days, gone by,
Come back as the morning light

A colourless demise rises
And the only shelter I used to know
Is gone lost out of sight

Sarah of the wonders
Of the wonders
Made of wonders

Venivi dall'atrio del cuore
Portando le chiavi del sole
Domani faremo l'amore
E niente potrà mai cambiare

Di questo rimase il rumore
D'un sogno che come nel mare
Si infrange su nere scogliere
D'un nero che può cancellare

Si dice che il sogno dell'uomo
È far si che il proprio domani
Sia senza calar del Sole
Ma dimmi com'è senz'amare?

Ma I sogni son figli del cuore
Creati in quanto dolore
Spogliati dalla lor ragione
Per questo mandati a morire",Verne
Novi Singers,"I was a stranger in the city
Out of town were the people I knew
I had that feeling of self-pity
What to do, what to do, what to do
The outlook was decidedly blue

But as I walked through the foggy streets alone
It turned out to be the luckiest day I've known

A foggy day, in London town
Had me low, had me down
I viewed the morning, with much alarm
British Museum, had lost its charm

How long I wondered,
Could this thing last
But the age of miracles, hadn't past
For suddenly, I saw you there
And through foggy London town,
The sun was shining everywhere

For suddenly, I saw you there
And through foggy London town,
The sun was shining everywhere

Everywhere
Everywhere
Everywhere",A Foggy Day
Now It's Overhead,"Five ten, one thirty-five
Brown hair with blue eyes
Light skin, twenty-six
Status: negative

In search of conversation
Name withheld
Just drop me a line, I will get back to you all right in my sweet time
In a dry spell

Ideal: hot lips
Versatile, club kid
Eighteen to twenty-nine only need reply",Profile
Now It's Overhead,"In the distance I hear a cryin' out
A choir of voices singing
Oh, you've done it now to satisfy the crowd

In a sleight of hand and a burst of light
I walk you through your motions
And you will rise tonight over the fires high

If you fall into their arms you lose
Everything is coming unglued
And the hardest part's in front of you
Out of your hands giving up to

[Chorus]
Reverse
They're closing in on every other side
Reverse
They're closing in on every other side

Draw the curtains tight, lock up in a room
In a lonely fit of certainty they're onto you
Not any sudden moves

Don't remember when they were all right
In your tunnel vision, one solution crept up
You're holding out for love

But the cards close up before you move
You're adamant it's your time
Make a fuss with nothing to lose

And your eyes lock in to see it through
Your head in the mouth of a lion
Your knees giving in under you",Reverse
Now It's Overhead,"I'm sick of living in this movie
Everybody looking through me
No one here to hold
I just wake up and leave.
A chill is in my bones
More than this sunless early winter morning
Waiting for a ride
Out in the freezing rain

And it goes by
Without stopping

Her stuff is on the counter
What if I had never met her?
All I know is just a feeling
From inside my veins
I am broken-hearted
It is awful worse than I had ever guessed
I wouldn't wish it on an enemy

And I can't hear
What my friends say

It won't let up
Just enough
To come down
Just one day.
I have given up
All but one
Thing I
Can do or say

Blood is rushing, pumping through
My heart to push the oxygen and
Opiates through arteries up to my brain
The beat is systematic
Not the reason for my habit
I just need a bigger picture
To fill in the space
My head is getting lighter
I can almost hear my sister calling
Begging for my reason to go on this way

I'm sick of living in this movie
Everybody looking through me
No one here to hold me
As I fade away
But I won't die
In no pain
I won't die, won't die
Won't die, won't die
I won't die, won't die
Won't die, won't die",Let Up
"Now, Now","I can't feel you bones but I can see them,
And I can't call you up without a reason.
I can take a thousand miles, and I can drive for hours to your house in summer, but I can stay for longer if you wanted me to.
 Oh, oh, oh, oh, oh, I've been up, and oh, oh, I don't sleep enough, and oh, oh, I know we don't talk as much but I can hear you still (x2)
Oh, oh, oh, oh, oh, I've been up, and oh, oh, I don't sleep enough, and oh, oh, I know we don't talk as much, but I can hear you voice on the phone when you're up all alone in your room. 'Cause I am up to you.",Dead Oaks
"Now, Now","I have gone from four to one in the past seven months
And I can't afford to lose anymore
But I will keep you company until you go to sleep
Because you've been everything good to me

Father, tell us all where you found her
Since the day the pattern formed in December

The math doesn't add up or match with the language
Of books that I've read or things that you said
I'll leave this with the darker night I carried you inside
And I know that it will find me in time

You were too small I should have known not to leave you alone
The morning it told me 
You take what you can get and you die with it

Father, tell us all where you found her
Since the day the pattern formed in December
Father, tell us all where you found her
Since the day the pattern formed in December","Lucie, Too"
"Now, Now","I know this will mess things up tonight
But god it feels so good to close my eyes 
I'll say that I've been trying to move on 
We both know I'm not

It may be different now but the pattern won't wash out
Covers up our eyes, leaves us knots and severed ties
We follow new lines

I would trade this sleep for you in a heartbeat 
But this weather will not lift
It leaves us shouting into cliffs without an echo 
Each day you come closer
So close I can almost feel your breath on my shoulders
But I know if I turn around you might run away again
Stuck like those prehistoric mammoths in the ice 
Thaw me out and I won't close my eyes
Stuck like those prehistoric mammals in the ice
Thaw me out and I won't go to sleep tonight",Prehistoric
"Now, Now","Find a thread to pull and we can watch it unravel
The lines we both have sewn 
To form the fabric of a fragile home
We'll spend a month apart
At least I know when you'll be coming home
But this is just the start
We'll find out who we are

A hint of light in the dark
But only enough to keep from giving up
If I could go back to the start
To break the pattern forming between us",The Pull
"Now, Now","You have a girlfriend but she's not your girlfriend
She's just your friend for the night
You'll have a new one in the morning
She'll have really pretty eyes

She'll be invisible like you want her
She'll try to do everything just right for you

You have a girlfriend but she's not your girlfriend
You just like her where she's at
And you'll thank her for the things she bought you
Then you'll go on your way

She'll be invisible like you want her
She won't go to class, but she'll sleep in your bed
And the next day when you chase the other girl
She'll remember all the things you said to her",School Friends
"Now, Now","Find a thread to pull
and we can watch it unravel
'Cause we've been waiting with
A ghost of somewhere from 2 years ago

A hint of light in the dark
Only enough to keep from giving up
If I could go back to the start
To break the pattern forming between us

A needle dragging thread
To form the chapters only we could know
But they would override and cast a shadow on what little is left

A hint of light in the dark
Only enough to keep from giving up
If I could go back to the start
To break the pattern forming between us

Find a thread to pull
and we can watch it unravel
But this is just the start
Well find out who we are

A hint of light in the dark
Only enough to keep from giving up
If I could go back to the start
To break the pattern forming between us",Thread
"Now, Now Every Children","For once I want to be the car crash
Not always just the traffic jam
Hit me hard enough to wake me
And lead me wild to your dark roads

Headlights, before me
So beautiful, so clear
Reach out and take it
'Cause I'm so tired of all this fear

My tongue is lost; oh, I can't tell you
Please just see it in my eyes
I pull up thorns from our ripped bodies
And let the blood fall in my mouth

Headlights, before me
So beautiful, so clear
Reach out and take it
'Cause I'm so tired of all this fear",Headlights
"Now, Now Every Children","We're moving slow passing accidents 
And we're singing to the ambulance:
""Oh my God, I don't care about the car!""
And ""Oh my God I don't care at all!""

And my words can't compare to your integers and numbers
And I can't be a bag to board a plane
I know, know I'm not inside, I'm not in sight

I've found where you have been
And I know it won't be long 
Until we're found again

And I haven't got plastic on my teeth
But I can make you feel like it's open season
I'll take what I want and take what you have 
But I'd put it back if I had the chance 

I've found where you have been
And I know it won't be long 
Until we're found again",Cars
Nox Aurea,"Since I once heard the enticing call
From the depth of the most secret core, 
The very rebellious lust of triumph
Burns wild in my black longing heart

And now as it enchants me again, 
Stronger and clearer than ever before
I run in ecstasy towards the utmost edge
Disregarding any border, striving beyond

I saddle the maelstrom of a burning Charybdis
Without an ounce of fear, nor stumbling or doubt
For no chains of profane can ever prevent me
Even though my world's foundation tremble

Nor even Death... 

As I once left the pity fellowship of man
And my liberation shook their conception, 
They scorned and feared the essence of my quest
Since it made them question their deceitful reasons

Yet their taunts and attempts to enslave me again
Were all in vain, for Lucifer himself shines within me
""The higher we soar, the smaller we appear
To those who cannot fly"" 

Driven by an urge to experience the concealed
And now I shalt conquer God's throne itself
Through aeons I have travelled, floating through tunnels
For nothing I seek but the gold of divine
No chains of profane can ever prevent me
Even though my world's foundation tremble

So I followed the call and threw myself
Out from earthly cliffs, into the unknown
Where those who dare to enter will burn, 
Yet ascending in triumph...",Ascending in Triumph
Nox Aurea,"The beautiful odour of October winds
Gently caress me with it's benevolent hands, 
Yet so dark and gloomy in it's soul
It permeates my intense heart with silent delight
How I do love the passion of fading away

The passion of dying... 

For it is Death herself who sweeps the landscape, 
Embracing a lost world in shades and vapour

I will never forget the dread of November, 
Her grievance and stillness of lonely nights
The desire of heart, in minor adorned, 
Dancing so gently as dim northern lights

How I do love this pleasant seclusion, 
This old bitter-sweet feeling, 
The passion of solitude

O' my frozen Queen of December nights
Let me transcend into a sleep without dreams, 
Let me wither in your cold white arms...",The Delight of Autumn Passion
Nox Aurea,"Brethrens and sisters of the greatest Cause, 
All thee rebelling spirits who walk alone at night
Hear my proclamation and take now my hands
Let us together evoke and give rise
To this numinous circle

For we shalt create a black magical portal, 
An entrance for the great Ones beyond

Thus we must obey their summons
Or vainly we will fall in despair
For they are the keys of ascension
To the hidden gates of liberty

By injustice we are enslaved
In a curse of order and time
So adherents of the greatest Cause, 
Now let us to this circle give rise

An entrance for the great Ones to come, 
To strike into our cosmic world
An entrance for the great Ones beyond, 
For this is our endeavour of divinity

We were all entrapped
Within the demiurge's reflection
We were chained into blinding halls
Of the creation's cloaked labyrinth
Alas, it was the loss of divinity
The loss of divinity! 

""For me it is perpetual pain and shadow
And the dark night of the soul, 
And I have no voice to cry, to cry out with...""

Brethrens and sisters of the greatest Cause, 
All thee rebelling spirits who walk alone at night
Hear my proclamation and take now my hands
Let us together evoke and give rise
To this numinous circle
For we are ""the voice of awakening
In the eternal... the eternal night...""",The Loss and Endeavour of Divinity
Nox Aurea,"As thousands of burning eyes
Stared at me with mocking despise
From the silent distance of their cosmic thrones, 
In a night sky so cold and vastly dark

Entirely I questioned this space-time illusion
And refused the shackles of matter's intrusion
So I closed my eyes and travelled deep
Into other specters, so far from earth

Towards the void of spiritual tranquillity
I float among stars and nebula dust
Crossing all restraining limits, one by one
On my voyage through galactic aeons

I waken from an indistinct mirage
To dissolve all the chains of creation, 
The cosmic dreams of mind
Slowly do I now disperse
Into the abyss of Ain

Eternally I proceed, 
Into the black hole of my dream, 
To release myself from the circle of time

By my purified spirit's will to emerge
With the infinity of Nothing beyond
To transcend into the Absolute, 
Deus Absconditus... 

""I lived in this world of darkness, for myriads of years, 
No one ever knew that I was there...""

Towards the void of spiritual tranquillity
I float among stars and nebula dust
Crossing all restraining limits, one by one
On my voyage through galactic aeons",My Voyage Through Galactic Aeons
Nox Aurea,"My mind wanders beyond false boundaries, 
To my most treasured sanctum
A vast featureless landscape
Where the forces of my desires lingers

Here, I can no longer comprehend
The illusion of life
No empty shadows wanders, 
Thus there are no walls

The asperity of breathing seems to lighten
As I imagine the beautiful vision of an eclipse

The hymn of absolute eradication reaches my ears
This swan song fills my heart with joy

Desolate and in myself seeking the golden depth
Rapturously immersing
I long for the day I shalt escape this confinement
The day when my constraining flesh is abolished

My mind wanders beyond false boundaries, 
To my most treasured sanctum
The echoes have died, 
Their clear voices appeases my essence",The Shadowless Plains
Nox Aurea,"O' splendid Death, how I do long for Thee
Please, carry me through embellished gates
For the veracious reflection of my soul's mirror
Glisten bright in unconscious passion, 
The lust for eternal departure

For in my dreams, 
The heart's most beloved, 
I do breathe nevermore... 

In the distress of life I demand
The plagues from below to storm again, 
And so they swept through the world, 
Yearning for liberty
As I witnessed once in the mournful visions
I now behold the grandiose gate
To the vastly unknown

For this I do proclaim; to the grave I belong
Since all I perceive brings me anguish and doubt
For which poem in the world could portray
The woeful absurdity of inception's cause
From nothingness to sordid matter?

We do not belong to this stillborn world, 
But to the endless void, the void of it's grave... 

O' splendid Death, how I do long for Thee
Please, carry me through embellished gates
For the veracious reflection of my soul's mirror
Glisten bright in unconscious passion, 
The lust for eternal departure...",To the Grave I Belong
Noyz Narcos,"Aha
Check it out
Oh, oh, shhh!

Di fronte una giuria che mi si batte in batteria
Fotte con la robba mia
Crepa di dissenteria
Ah, ha gli occhi addosso guarda il mostro dentro a un logo rosso
È tutto nostro
Mi prendo più robba che posso
Io sto qua, tu dove stai quando non c'è
Tranquillità non ci sta, che ne sai di me
Non ce n'è uno che s'è fatto avanti
C'hanno I guanti di velluto se c'hanno a che fare col mio culo
Un figlio di puttana sveglio sa come succhiargli l'energia da dentro
Sta merda è un regno di cemento
E guarda come mi diverto, sono esperto di sta strada perché questa strada mi conosce
Dentro
E che ne sanno di come accendere un incendio
Di quanto tempo ci spendo man, datti tempo
Vi vende paranoie
Questa dark city che vi toglie I vestiti da bandito e vi da figli e moglie
Non me lo toglie quel poco che ho
Sa che ce l'ho stretto in mano
Ricucito nel cuscino del divano
Mo che tutti sanno come cazzo mi chiamo
Sono qua per dirvi quanto non vi amo e quanto non mi amo
Quante cazzate ci beviamo ed è normale che ti accanna
Il bambino a cui hai insegnato a camminare
Ed è normale che vi voglio sputtanare tutti
Che c'ho i ricordi brutti
Conto duecento lutti

Autodistruttivo
Colpa di come vivo
Dove e cosa vivo che mi rende sempre più cattivo
Dove un bambino trova spunti in punti di ritrovo
E non ci crede a quello che dicono loro!

Autodistruttivo
Colpa di come vivo
Dove e cosa vivo che mi rende sempre più cattivo
Dove un bambino trova spunti in punti di ritrovo
E non ci crede a quello che dicono loro!

Oh
Lama Opinel numero 15 sul tocco
Non dura troppo
Chiedi ai ragazzi nel mio blocco
Vogliamo tutto senza darti un cazzo
Stiamo ai piedi di un palazzo a non fa un cazzo
O in macchina a sdraiare il clacson
Siamo in trans in modo perenne
Sto mondo è un grosso verme
Finisce che domani ci lascio le penne
Un grosso salto dall'altezza delle antenne tanto sbaglio sempre
E già lo so quanto vale la gente
So che mente a me come a se stessa
So quando ce l'ha con me quando gli trucco la sua scommessa
Ce l'ho tutto in testa ed è solo lì che resta
Ecco perché non ho un contratto Virgin Universal
Musica truce vi cuce la bocca con un filo di ferro
Vi dona un coltello ed un motivo per averlo
Non e' bello come un ronzio nel cervello non sono ne' tuo zio ne' tuo fratello
Ciao bello
Checka
Vuoi il disagio: questa è La Mecca!
Truce Boys crew vendetta
La W sulla maglietta
Non ho più niente mo vado di fretta
Non voglio niente dalla gente sta città è gigante e mi sta stretta!

Autodistruttivo
Colpa di come vivo
Dove e cosa vivo che mi rende sempre più cattivo
Dove un bambino trova spunti in punti di ritrovo
E non ci crede a quello che dicono loro!

Autodistruttivo
Colpa di come vivo
Dove e cosa vivo che mi rende sempre più cattivo
Dove un bambino trova spunti in punti di ritrovo
E non ci crede a quello che dicono loro!",Autodistruttivo
Noyz Narcos,"Oh, accendi gli abbaglianti

Questa è Traffic Recordz
Eroina per gli stereo
E un ferro sulla nuca al cardinale in monastero
Filma Narcos Cole in tribunale
Col cappuccio anti puttane notte insanguinati giù dal davanzale
Residenza San Felice
La mia ronda lascia la mia testa sgombra e una profonda cicatrice
All'ombra di un fucile a caccia di Fenice in tute camouflage
E truceboys brigate mandate alla strage
""Vuoi l'amore io non ne so capace"" vige nel mio gruppo
Un pazzo col cappuccio in un corpo distrutto
Tutto quello che mi piace è brutto mi butto
Al lunapark con una pischella dark vestita a lutto
Di brutto accorcio distanza e contatto
Vogliono il mio cervello fatto
Faccio un patto col demonio
Non credo a quello che dicono loro
Fondo sangue e oro vedo nero e brucio corone d'alloro

Cole, Noyz: Truceboys nella yard
Motor psycho boy quello che non vuoi in città
Conto bio che fa sangue in bocca
Smoke alot-a (cotta) musica roccia
Sfoggia il trick della bic nella boccia
Bella zì per il click e la stronza in doccia
Non Marco, Cole e porto Cambogia
Un'altra goccia il mio cazzo nell'orgia
Già ma che vuoi? ho i teschi con le ossa
Suona Noyz l'impianto della bravo rossa
Forte a mezzanotte I falchi della notte
Coming soon cd per le teste rotte
Rap freestyle rimbocchiamo ai party
Se non ci sopporti suonaci più alti
Alla deriva la mia comitiva esclusiva
Vacanze di natale duemila hardcore Vanzina",Falchi Della Notte (Ft Cole)
Noyz Narcos,"Aha
Check it

Io che posso farci
Trovo solo frutti marci
Vuoi fermarci?
Stiamo giù in strada a farci
Chi ti manda?
L'asfalto sulle centottanta
Scandaglia
Sta città è terreno di battaglia
Secco
Non mi vendo l'alma
Brugheria nella stanza
Calma piatta fatta di sostanza, e qua
Apre la danza il rap trucido tu
Devi esse stupido
Il fan del Truceklan va al centro di recupero
Incassa
Da ste parti non ti passa
Non passano
Manco volanti da sta piazza
E non passa
Una brutalità per colpo di cassa
Truceklan ti piazza una webcam nella casa
Ahhh
Cambi strada cambi via
Prova a farti colla robba mia
Crepi dentro una corsia
Per tutte le persone stanche 
Tutti i soldi delle banche
Le guardie in gabbia e I magistrati anche.

Sta robba parla un altra lingua e parla chiaro
Parla come parla chi ha il potere come parla il denaro

Sta robba parla un altra lingua e parla chiaro
Parla come parla chi ha il potere come parla il denaro

E mo
Stammi a sentire perché è un mondo a sangue freddo e spire
Non dormire, e il finale mandamelo a dire
Qua
Arrivi fresco e te ne vai carogna
Nel mio teschio ho tanta merda che il tuo manco se la sogna
Quando io parlo oscura I timpani e ascolta
Sta gente vuole la mia merda io la vorrei morta
Bussa alla mia porta col sorriso e te ne vai a male
C'ho il cuore diviso in quattro parti e parte uguale e quando parte fa male
Vuoi provare questa merda cruda? 
Io la reggo bene, tu
Mi sa che non l'hai mai bevuta
Giù la strada è dei profeti dormono sulle panchine scrivono poemi
Con le microfine sopra le pareti, lo vedi?
Puoi gustare il sangue senza averlo avuto in bocca
Il tuo giudizio non mi tocca, me lo prendi in bocca
Cambia la tua faccia o te la cambia un sanpietrino in faccia
Sulla traccia T.KLAN la minaccia!

Sta robba parla un altra lingua e parla chiaro
Parla come parla chi ha il potere come parla il denaro.
Truceklan parla un altra lingua e parla chiaro
Parla come parla chi ha il potere come parla il denaro
Noyz Narcos parla un altra lingua e parla chiaro
Parla come parla chi ha il potere come parla il denaro
Don JOE parla un altra lingua e parla chiaro
Parla come parla chi ha il potere come parla il denaro",Parla Chiaro
Noyz Narcos,"Tieni alta la fiamma, like my fire
Devil non chiamare mamma trema roma sotto i piedi
Vuoi volare come un'aquila Steve Miller
Vedi un teschio in fiamme riflesso nelle pupille
Tristi sette coppia d'assi leggendari come Agassi nel 90 
Sopra al campo come in terra santa
Sopra il tempo come sul cemento, sempre a caccia
Difendi la faccia con le braccia alza la guardia
O a sti infami non l'ho mai inculati stanno dietro alla mia scia
Manco le volanti della polizia
Rimetto in ballo i players della capitale roma state of mind
Definizione de chi sta sul grind
Un circuito è chiuso in poche frange
Non si piange cassa miriamo agli euro casa notte astola
Asta la morte, asta che sento il click del ferro
Venite a dirme hello con questa merda ve sotterro
Nex e Noyz, ai miei live fanno ancora su fiori viola
Con le mani su come i secchioni a scuola
Con le mani su come una rapina
Con due pezzi di coca e un pezzo di siga
Vieni con noi Nex con Noyz
batteria di trevi siamo dope boys
Con le mani su come una rapina
Con un pezzo di coca e due pezzi di siga
Nex, t'insegno storia, do ripetizioni
Da un ripetitore sparo a ripetizione
Voi rapper troie dite
Minchia ancora, mentre gli altri ciucciano una minchia allora
Su queste strade storti come una chican, con la fedina sporca come la
Passiamo notti insonne come la tua amica
Facciamo soldi sporchi come la tua figa
Sono come la morte sempre puntuale
Non è che vi sputtanate che siete puttane
Porto il piede di porco per voi maiale
Non che dite puttanate è che siete a puttane
Ci vuoi morti ammazzati
I miei soldati sterminati tu pacca maruk illuminati
Metti un'altra x sulle facce di cazzo
Al nostro live la prossima strage di stato
Nex e Noyz: Con le mani su come una rapina
Con due pezzi di coca e un pezzo di siga
vieni con noi Nex con Noyz
In batteria di Trevi siamo Dope Boys
Con le mani su come una rapina
Con due pezzi di coca e un pezzo di siga
Vieni con noi Nex con Noyz
In batteria di trevi siamo Dope Boys",Dope Boys
