Band,Lyrics,Song
Metal Church,"Blind with dollars,
Bought and sold.
And you pay for everything in cold, hard cash.
Better read through the fine print, you sift through the ash.

In the hand, blood money.
In the sand, blood money.
She's worth the ransom.

He says, ""Do you accept my card,
Or can I pay for it now in cold, hard cash?""
I'm priceless, you're worthless, but it's not a bad match.

And I know you understand, it's blood money.
There's such a big demand, for blood money.
A hundred and fifty grand, blood money.
It's flowing under the land, like blood money.
He's worth the ransom.

She says, ""Why can't you get hot?""
Because you pay for this now in cold, hard cash.
You make the front page, I'm gonna bring back the lash.
Then I know you'll understand, it's blood money.
There's duch a big demand, for blood money.
A hundred and fifty grand, blood money.
It's flowing under the land, like blood money.",Blood Money
Metal Church,"Dreams of the dark embracing me, these thoughts I can't control
Searching for light to set me free, from my troubled soul
Good against evil battles in my mind, the fighting never stops
Man, I've struggled with temptation and sin, in my darkest thoughts
When will this nightmare ever stop, I'm waiting for the bomb to drop
I walked through the valley of the shadow of death, how did I survive

I stood at the flaming gates again, as the flames grew higher
What have I done to deserve this fate, what have I become
Though dark have been my dreams of late, I just need to be strong
I'm going down, its my last shot, I'm waiting for the bomb to drop

I'm on my knees and I'm praying for these dreams to cease,
I'm screaming at the sky to open up my eyes
I'm in too deep and I'm headed for eternal sleep,
I'm screaming at the sky, I'm running out of time",Bomb to Drop
Metal Church,"And when the strings are pulled again, the puppets dance like mortal men
Who carved in stone our future and our past
Shall we read the blood stained pages and take counsel with the sages
And hear the chanting of a mind's collapse

In my name, I will bring you from the cradle to the grave
From points unknown in senseless daze, watching as the fools parade
The tower bells are pounding like a drum
Glance back at a new world brave, the cradle has become the grave
And people praise the God they've stolen from

In this world we have false leaders, wearing the mask of the deceiver
They're seeking out the non-believers, and in these masks you'll never see us
You kill the anger, kill the pain, only empty souls remain
God forgive them, will they ever learn

Kings and pawns, emperors and fools, no man sleeps on this night
Bend my words into a twisted truth, no one gets out without a fight",Cradle to Grave
Metal Church,"You've got to live for the moment, you've got to go for the throat
You're given only one chance and you know that life's too short
Feel your pulse getting stronger, no fear in your eyes
Never showing weakness and you never compromise

The hero's soul, drifting forever
The hero's soul, always searching for better
Until the end of the road

Adversity is a challenge it's not something you ignore
And your life is such a struggle and your back's against the wall

Lost in swirling madness, lost without a home
Just rid yourself of torment and hit the open road
The journey through this life can be an unforgiving hell
Your loneliness is safety , as far as I can tell

You've put your best foot forward, you've taken two steps back
You're getting nowhere faster and now there's no turning back",Hero's Soul
Metal Church,"Straight into a vicious wind, this is where it all begins
You bare your soul one last time, laying everything on the line
The struggle of so many years, all the pain, all the tears
Still you're always pushing on, waiting for your day in the sun
We see with blood in our eyes, taking no prisoners
And leaving the weak ones behind

Years of rage made you insane, you've traveled through both fire and rain
Good or bad this is your life, standing on the edge of the knife
What makes you weak can make you strong, but in the end time marches on
So make your mark and make it now, you'll go down in history somehow
Now is the time, the time to rise

Staring at a vicious man, this is where it all began
Break the mirror one last time, laying everything on the line",Leave Them Behind
Metal Church,"I never was a man of wonder, nothing special in my eyes
Pedestrian of common streets, an angel in disguise
A childhood spent as any other, any other child
Would bring a great divide, and now these worlds collide
Now that many years have passed , these dreams intensify, 
No tools I use, no crystal ball

Yet I'm still mystified
Those sleepless nights by candlelight, in a room without a view
A voice I could not hear, it told me, ""Write it down you fool""
It spoke to me of many things no language can explain, 
I grabbed my crucifix left hanging
By it's golden chain

Never in my wildest dreams, conceive of what I heard, 
I filled the well with ink
And began writing every word, in the night

I've seen the mountains crumbling, the masses running scared, 
I wrote it down to warn you all
But you laughed and no one cared

You wrote it down in riddles, no one could understand, 
I'll lead you to your padded room
You prophet-crazy man

Please hear me and heed every word that I've said, if you kill me
You'll be the one's who'll be dead, dead and gone

Your locks and your bars, will hide all my scars, but you'll never leave this place
Not til you open your eyes and your ears, can you make sense of the things that you fear?
And all that you've heard, it sounds so absurd, I'll never speak again
Not til you open your eyes and your ears, this world shall pass away

Withdrawn from reality, I stare into space, 
Little did they know I held the answers to their fate
I didn't write in riddles, now you must understand, 
Someday you, oh never mind
I'm just a crazy man

They say I'm just a madman, am I just a madman, 
I feel I'm just a madman",Madman's Overture
Metal Church,"Lost, lost in a maze, can't rearrange, my mind is unclear
Fade, fade into black, but not fade away
Who should I turn to, where should I go, six feet too deep in the ground
How long can I take this, how long will it last
I can't stop re-living my past

Beyond the sunless sky, so far away, beyond the sunless sky
Torn, I've torn you in two, what can I do, I'm lost in confusion
Time, I've run out of time, the clock ticks away, just keeping time, an illusion
I wallow in the darkness, I suffer through the pain, ripping through the madness
Til life's been re-gained

I'm nothing but a shell of what I used to be
I'm washed upon the shore of my checkered past
No one would believe all the things I've seen
Deliver me from darkness, I'm fading fast
It's all been lies, time after time
There will be no more sunless skies",Sunless Sky
Metal Church,"Vacant eyes, a portrait of pain, every time I look at the world
Tell me why, we cannot bring change, we've flown to high on borrowed wings
What will tomorrow bring

Only time will tell, we're searching, to escape ourselves, before it's over
Guilt and lies, pave a road to nowhere, fear inside, everyday
But in the end, this web that we're caught in
Will release us, release us from pain
And things will change

We're looking for the rain to wash our shame away
We're waiting for the dawning of a new way
If things remain the same
We may not live to feel
To feel the winds of change",Time Will Tell
Metal Church,"You're caught in a vice by your own device, torment and pressure, a way of life
You felt the stardom and tasted the fruit, you claw your way back
It's all that you can do

Falling from grace, so many have done, get to the top and bask in the sun
Make some mistakes, it's part of the game, when you play it everything's to gain
The weight of the world upon your shoulders, it's the weight of the world
The struggle within archaic desire, claim your right and devour
All that surrounds you, all you can take, don't let your last
Be your last mistake

The pressure is building, the vice becomes tighter, 
Under the gun and into the fire
Burning and burning, no escape to be found
The weight of the world is keeping you down
The weight of the world upon your shoulders
The pressure is building, an unwilling soldier
The weight of the world is keeping you down
Oh, your world is crashing down to the ground",Weight of the World
Metal Church,"With banner high they ride to glory, a new beginning to an age-old story
Spreading fear with hateful eyes, then into the night they ride
In the end the same conclusion, a weathered world of disillusion
A war of words, a chain reaction, you can hear the millions cry
They look to the sky with fear in their eyes, they pray to their gods
And they pray to survive, closing their eyes, they dream to ride
On the wings of tomorrow

Beyond this realm of death and darkness, lies the key, someone to save them
To change their ways, to fight the good fight, they're hoping for the day
To the gods they pray for salvation, an angry call from a dying nation
They'll survive, they've seen it before, again their wings will soar
They look to the sky with faith as their guide, changing tomorrow
Before our demise, a rage deep inside, they live to fly
On the wings of tomorrow

They ride into the sky, into the crimson sky
Hoping one day that things will change
The strength of a nation the pride of mankind, we'll always be destined
To the end of time, until that day comes, they will live on,
To ride on the wings of tomorrow",Wings of Tomorrow
Metal Church,"In the empty spaces of the mind, that's here I store my past
A ghostly image that I fear has yet to be surpassed
I pray that I won't carry all the pain 'till the end

No direction from your guardian, the one who should protect
I'm innocent of their decisions, I wonder why dad left
Every night I hide in bed and plan to run away

A lonely child with battered eyes
No joy in innocence they cry
Always has to lie his way through life

I've fallen down while playing ball
But mom beat me up and down the hall
Just because she had one of those nights

Instinct to defend, where does it all end
How does a child get himself out of harm's way?
A lifelong price to pay

It's not that mommy hits that hurts me, it's when she goes away
Get home from school all by myself and won't see her for days
A kid deprived of love in life has no alternative in sight
He throws up barriers to get him through
A human life's a gift from God
Your conscience and your heart are gone
You're much to cruel to have a point of view

No one to turn to, oh, how dare you
How does a child get himself out of harm's way?
A price no one should pay

Can't you see the tears they're crying
Don't you care your kids are dying?
From the senseless torment that you put them through

There's different kinds of lies to tell
Abuse is from the pit of hell
A demon with a goal that is to kill

You better hear the words I say
Deliverance may be far away
You'll look like you have been run through the mill

Instinct to defend, where does it all end
How does a child get himself out of harm's way?
A lifelong price to pay",In Harm's Way [DVD]
Metal Church,"We come into this world to give and not to take
We stray the path intended further from the gates
We play with fire and we're always getting burned
When you walk on holy ground another lesson learned

Free again, free again I know
I can breathe again
Free again, free again I know
I can breathe again, I can breathe again

We're not alone, we're guided by a hand
We walk with angels, left footprints in the sand
My time is fading as I try to understand
The way I'm feeling, I bow to his command

Free again, free again I know
I can breathe again
Free again, free again I know
I can breathe again, I can breathe again
Oh I can breathe again, oh I can breathe again

The heart will mend with a touch upon the shoulder
Saying I'm alright, now that I've crossed over
Memories now that I am older
Saying I'm alright, now that I've crossed over

Free again, free again I know
I can breathe again
Free again, free again I know
I can breathe again, I can breathe again
Oh I can breathe again, oh I can breathe again
Oh I can breathe again, oh I can breathe again
I can breathe again, oh I can breathe again

",Breathe Again
Metal Church,"From way across the world to right here where we are
The screams can still be heard in the silence of the night
The disciples spread the word and spare the non-believers
A message has been burned into the minds of all

Throughout the years some come and some have gone
You have the ears that tell the right from wrong
This is the reason why we have gone on so long
This is the reason why we still belong, congregation

These walls that we have built hold many tales inside
The secrets of our lives are all for all to read
The workings of our mind, both brilliant and insane
Only you can understand we don't do it for the fame

Throughout the years some come and some have gone
You have the ears that tell the right from wrong
This is the reason why've have gone on so long
This is the reason why we still belong

Our eyes have seen a lot of things, our eyes have seen the world
Our thoughts have moved the masses and left them wanting more
Our life our own reality and we live it as we please
Spread the word to all that haven't heard, they take our place in history

Throughout the years some come and some have gone
You have the ears that tell the right from wrong
This is the reason why we've gone on so long
This is the reason why we still belong, congregation
Congregation, congregation, congregation

",Congregation
Metal Church,"A mystery of the universe, a tale of the dead
Far into the psyche and far until the end
The mind it often wonders about the few and far between
But in these lines I think you'll find that you will believe

Oh, far beyond the violent skies you can see a watchful eye
His presence always shifting like the empty hands of time
On broken wings he tries to sing his hateful lullaby
Nobody is listening to this dull pathetic cry

His death is mourned by no one, he is the shadowed one
Now he plots from below these deeds of a dead soul

Whispers in a wind storm carry through the night
Helpless victims everywhere, all have felt his plight
The scars he's left are memorable, he waits until they heal
Then he comes back again to seal the final deal

Oh, far beyond the violent skies you can see a watchful eye
His presence always shifting like the empty hands of time
On broken wings he tries to sing his hateful lullaby
Nobody is listening to this dull pathetic cry

His death is mourned by no one, he is the shadowed one
Now he plots from below these deeds of a dead soul
Deeds of a dead soul, deeds of a dead soul, deeds of a dead soul

Oh, far beyond the violent skies you can see a watchful eye
His presence always shifting like the empty hands of time
On broken wings he tries to sing his hateful lullaby
Nobody is listening to this dull pathetic cry

His death is mourned by no one, he is the shadowed one
Now he plots from below these deeds of a dead soul
Deeds of a dead soul, deeds of a dead soul, deeds of a dead soul

Deeds of a dead soul, deeds of a dead soul, deeds of a dead soul
Deeds of a dead soul, deeds of a dead soul, deeds of a dead soul

",Deeds of a Dead Soul
Metal Church,"As you stand on the edge of your life what are your last thoughts?
Do you remember when you were full of life?
Your judgment has been clouded oh for so many years
There is a lake you have created oh from all of the tears

Now meet your maker
Thou shall repent
Now meet your maker

Rebuilding the bridges we've burned from ashes and bone
The weight has been lifted, the weight of a stone
Beyond all repair we need to be free from the torture
And no life will be spared, we need to beware of the future

Now meet your maker
Thou shall repent
Now meet your maker

Walking this earth on borrowed time
A gift from heaven, a gift divine
Out of the shadows but far from the light
We're walking this earth on borrowed time

All we've got are memories, why change the past for naught?
Live inside those memories, they're soon to be forgot
The sands of time are fleeting, the hours pass by quickly
Take a hold of every moment and savor it intently

And when you reach the great beyond, you stand and count your blessings
You've lived a life full of pride, didn't let life break your stride
You carried on through think and thin and now is not your time
So fight for every breath and live the grand design

Walking this earth on borrowed time
A gift from heaven, a gift divine
Out of the shadows but far from the light
Walking this earth on borrowed time

Now meet your maker
Thou shall repent
Now meet your maker

",Meet Your Maker
Metal Church,"We've created a monster

Tomorrow is here today, ones and zeros pave the way
Nothing's real but looks the same
The future's looking far too bright but I can never sleep at night
New creations just a click away

Interaction from your chair, a social life not really there
No one is who they say they are
Files and folders gone too far, pull the wire from your arm
Disconnection makes you lose your mind

We've created a monster, it's taking us down
We've created a monster and we don't know how
We've created a monster nowhere to be found
We've created a monster

Never will you leave your home, never knowing you're alone
Shut in has become a way of life
Business at the speed of light, a fast connection will change your life
Have I lost it, have I gone too far?

We've created a monster, it's taking us down
We've created a monster and we don't know how
We've created a monster nowhere to be found

I'm on the run, I'm on the take, I bought into it but it's all fake
I lost myself, now who am I?
I am just a screen name and a new profile
I never dreamed that this would be the path I was meant to follow

I am in a trance, I am in a race, I am going nowhere in cyberspace
I lost myself, now who am I?
I am now addicted to a life on the inside
I never dreamed that this would be the path I was meant to follow

We've created a monster
We've created a monster
We've created a monster
Monster

",Monster
Metal Church,"Sneaking up behind you
Can you feel my breath upon your neck?
You won't see me coming
Just a spirit no one can detect

Look in my eyes, you'll never know
You turn your back and run away
You'll never see, just what I see
I am the dark that won't let go
I am shadow

Hiding in the corners
Silence is a weapon perfect
You will always find me
In the places you try to protect

In my disguise, a darkened glow
I'm right beside you every day
I guarantee, I'll never be
Another that you will outgrow
I am shadow
I am shadow

Sneaking up behind you
Can you feel my breath upon your neck?
You won't see me coming
Just a spirit no one can detect
I am shadow, shadow, shadow
I am shadow, shadow, shadow
I am shadow, shadow, shadow
I am shadow, shadow, shadow
I am shadow
I am shadow
I am shadow
I am shadow",Shadow
Metal Machine,"Yeah, slide to me
Won't you come away?
Don't worry baby, everything's okay

You can't run the game, if you don't know my name
I'll take you where you've never been before
There's something for you, a whole lot more
You ain't got to seek, everyone knows you're a freak

Slide, slide, slide
Yeah, baby baby, slide
Slide, slide, slide, slide
Why don't you slide?

Don't be afraid 'cause you gonna be laid
I need you now don't let me down
You're a low down lady, but your game is kinda shaky
[Incomprehensible] when you want to get down

Slide, slide, slide, slide
Slide, slide, slide, slide
Why don't you slide?

You can slide, don't think I'm on it
You can slide, don't think I'm on it
You can slide, don't think I'm on it
You can slide, don't think I'm on it

",Slide
Metal Mike Saunders,"The worst person I know, mother-in-law, mother-in-law
She worries me so, mother-in-law,mother-in-law
If she leaves us alone, we would have a happy home
Sent down from below
Mother-in-law, mother-in-law, mother-in-law, mother-in-law

Sin should be her name, mother-in-law, mother-in-law
To me, they're about the same, mother-in-law, mother-in-law
Every time I open my mouth, she steps in, tries to put me out
How could she stoop so low?
Mother-in-law, mother-in-law, mother-in-law, mother-in-law

I come home with my pay, mother-in-law, mother-in-law
She asks me what I make, mother-in-law, mother-in-law
She thinks her advice is a contribution
But if she will leave that will be a solution
And don't come back no more
Mother-in-law, mother-in-law, mother-in-law, mother-in-law

Sin should be her name,  mother-in-law, mother-in-law
To me, they're about the same, mother-in-law, mother-in-law
Every time I open my mouth, she steps in, tries to put me out
How could she stoop so low?
Mother-in-law, mother-in-law, mother-in-law, mother-in-law",Mother-In-Law
Metal Mike Saunders,"Tonight you're mine, completely
You give your soul so sweetly
Tonight the light of love is in your eyes
But will you love me tomorrow

Is this a lasting treasure
Or just a moment's pleasure
Can I believe the magic in your sighs
And will you still love me tomorrow

Tonight with words unspoken
You say that I'm the only one
But will my heart be broken
When the night meets the morning sun

I'd like to know if your love
Is a love I can be sure of
So tell me now and I won't ask again
Will you still love me tomorrow
Will you still love me tomorrow
Will you still love me tomorrow",Will You Love Me Tomorrow
Metal Molly,"Orange can be hard, sometimes she knows
Orange is the way the summer blows
Orange can be hard, orange can be hard, sometimes she knows
Transty can also love alone
Oranges can be hard, orange can be smart
Orange is the way the summer blows

Other fruits say oranges are blind
Still they get to slip into your mind
Orange are smart, orange can be hard, sometimes she knows
Transty can also love a lost
Orange can be hard, orange can be smart
Orange is the way the summer blows

Oranges are green
Have you seen, have you seen them climbing up the trees
Drifting, smiling, raving and still laughing, told the buzzinghoneybees
In the trees they get your tv, years and different torrensfactories, not me
Trapped into the garden they get caught up watching football ontv, tv

Orange can be hard, sometimes she knows
Transty can also love alone
Orange can be hard, orange can be smart
Orange is the way the summer blows",Orange
Metal Molly,"Plasticine for people, surgery
I'm not aware that you're not there
Plasticine for people, surgery
I'm not aware that you're not there

I get an eary feeling when they say I'm interactive
I still think it's hard to find, a finger for the hoax
Any kind of consciousness will surely be neglected
The kindergarten influences bother me the most

Tell me where my inner me has suffered from an overdone
Exposure, exposure, exposure, exposure
It's just because my inner you has me for you to double choose
I told her, I told her, I told her, I told her

Now I think it's time to get a ticket for the climax
Fully taped in PVC, wired to the bone
They made me made that I was reasonably tired
Took me to the nearest place were I could be stoned

Tell me where my inner me has suffered from an overdone
Exposure, exposure, exposure, exposure
It's just because my inner you has me for you to double choose
I told her, I told her, I told her, I told her

Plasticine for people, surgery
I'm not aware that you're not there
Plasticine for people, surgery
I'm not aware that you're not there

I get an eary feeling when they say I'm interactive
I still think it's hard to find, a finger for the hoax
Any kind of consiousness will surely be neglected
The kindergarten influences bother me the most",PVC
Metal Molly,"Give me a poem that day
was nothing left to say
As we go round and round
We go round and round
Flowers are all dead
Bleeding hard and head
As we go round and round
We go round and round
Again


I tried to be a friend
Spoiled it in the end
As we go round and round
We go round and round
Flowers are all dead
Bleeding hard and head
As we go round and round
We go round and round
Again",Round
Metal Molly,"There's a small supernova coming in, it's coming in
And everyone around me starts to swim
And when they fall count them all
There's a small supernova coming in
But after all they ain't that small, they're in the
Afternoon
But after all they ain't that small, they're in the
Afternoon
But after all they ain't that

There's a small supernova coming in, it's coming in
And everyone around me starts to swim
And when they fall count them all
There's a small supernova coming in
But after all they ain't that small, they're in the
Afternoon
But after all they ain't that small, they're in the
Afternoon
But after all they ain't that

Hello, we are, hello, we are
Hello, we are, hello, we are
Hello, we are, hello, we are

I've been inside this lonely place too
Can admit even now that you were wrong
.. alibi to make it so
To kill me

Hello, we are, hello, we are
Hello, we are, hello, we are
Hello, hello, hello, hello",Small Supernova
