Band,Lyrics,Song
Ray Charles,"Ah, you can talk about the pit, barbecue
The band was jumpin', the people too
Ah, mess around
They doin' the mess around
They doin' the mess around,
Everybody doin' the mess around

Ah, everybody was juiced, you can, bet your soul
They did the boogie-woogie, with a steady roll
They mess around
They doin' the mess around
They doin' the mess around,
Everybody doin' the mess around

Now, ah, when I say stop don't you move a peg
When I say go, just ah, shake your leg
And do the mess around
I declare, do the mess around
Yeah do the mess around,
Everybody's doin' the mess around

Now let me have it there boy

Now you got it boy

(Yeah, ah, mess around, go on mess around)
(Mess around, boy)

Now this band's goin' to play from, nine to one
Everybody here's gonna have some fun
Doin' the mess around
Ah, doin' the mess around
They doin' the mess around,
Everybody doin' the mess around

Now you see that girl, with that, diamond ring
She knows how to, shake that thing
Mess around
I declare, she can mess around
Ah, mess around,
Everybody do the mess around",Mess Around
Ray Charles,"Tell the truth
Tell the truth
Well, you know what you done to me,
You made me fall for you

Tell the truth
Tell the truth
Well you know you can make me do what you want me to

Loving you, feelings started
But, I'm goin' to stop it

If I could, I surely would
I would roll up around you
If I thought it would do any good

Why don't you tell the truth
Tell the truth
Well you know you can make me do what you want me to

Loving you, feelings started
But, I'm goin' to stop it

If I could, I surely would
I would roll up around you
If I thought it would do any good

Why don't you tell the truth
Tell the truth
Well you know you can make me do what you want me to

Whoa, come on, tell the truth, now
(tell the truth)
And I know, I know, baby
(tell the truth)
Every day, every night
(tell the truth)
Whoa, hold me tight
(tell the truth)
And I know, and I know
(tell the truth)
You 'oughta, you 'oughta
(tell the truth)
Stop Lying
(tell the truth)
Stop lying, whoa
(tell the truth)
Whoa
(tell the truth)
Whoa
(tell the truth)
Oh baby
(tell the truth)
Now tell the truth
(tell the truth)
Every day of your life, tell the truth little girl
(tell the truth)
What about that man you were with last night
(tell the truth)
I want to know
(tell the truth)
Come on baby
(tell the truth)
Hey hey
(tell the truth)
Every day of your life, you 'oughta
(tell the truth)",Tell the Truth
Ray Charles,"Hey mama, don't you treat me wrong
Come and love your daddy all night long
All right now, hey, hey, all right

See the girl with the diamond ring
She knows how to shake that thing
All right now, hey, hey, hey, hey

Tell your mama, tell your pa
I'm going to sing you back to Arkansas
Oh yes ma'am
You don't do right, don't do right

When you see me in misery, come on baby see about me
Now yeah, all right, all right
Aw play it boy

When you see me in misery, come on baby see about me
Now yeah, hey, hey, all right

See the girl with the red dress on
She can do the birdland all night long

Yeah yeah, what'd I say
All right
Well, tell me what'd I say, tell me what'd I say right now
Tell me what'd I say, tell me what'd I say right now
Tell me what'd I say, tell me what'd I say

And I wanna know
Baby I wanna know right now
And-a I wanna know
And I wanna know right now yeah
And-a I wanna know
Said I wanna know yeah

Hey, don't quit now! (c'mon honey)
Uh-uh Naw, What? What's that? I say, what's that?
One time? alright

Hey (hey) ho (ho) hey (hey) ho (ho) hey (hey) ho (ho)
Oh one more time (just one more time)
Say it one more time right now (just one more time)
Say it one more time now (just one more time)
Say it one more time yeah (just one more time)
Say it one more time (just one more time)
Say it one more time yeah (just one more time)

Hey (hey) ho (ho) hey (hey) ho (ho) hey (hey) ho (ho)
Ah! Make me feel so good (make me feel so good)
Make me feel so good now yeah (make me feel so good)
Woah! Baby (make me feel so good)
Make me feel so good yeah (make me feel so good)
Make me feel so good (make me feel so good)
Make me feel so good yeah (make me feel so good)
Huh (huh) ho (ho) huh (huh) ho (ho) huh (huh) ho (ho)
Awh it's all right (baby it's all right)
Said that it's all right right now (baby it's all right)
Said that it's all right (baby it's all right)
Said that it's all right yeah (baby it's all right)
Said that it's all right (baby it's all right)
Said that it's all right (baby it's all right)

Woah! Shake that thing now (baby shake that thing)
Baby shake that thing now now (baby shake that thing)
Baby shake that thing (baby shake that thing)
Baby shake that thing right now (baby shake that thing)
Baby shake that thing (baby shake that thing)
Baby shake that thing (baby shake that thing)
Woah! I feel all right now yeah (make me feel all right)
Said I feel all right now (make me feel all right)
Woooah! (make me feel all right)
Tell you I feel all right (make me feel all right)
Said I feel all right (make me feel all right)
Baby I feel all right (make me feel all right)",What'd I Say
Ray Charles,"You be my baby,
Don't give me no maybe,
I never, never make you cry,
You be my honey,
Give you all my money,
I will 'till the day I die,
Because I (never, never, never felt such a thrill),
And I(never, never, never felt this way upto),
Woah (kiss me, kiss me, kiss me can get my bill).

You've set my world,
Come closer girl,
You be my lover,
There's no one above ya,
I want everyone to know,
You look so tasty,
Like quick - cream pastry,
Never, never let you go,
Because I (always, always, always want you by my side),
Uh(always, always, always to keep you by my side),
You know(wanna, wanna, wanna make you be my bride),
Once you name the date,
Marry right away.

You know you please me,
Don't ever leave me,
I always want you near,
You know I need ya,
Come let me lead ya,
And make all your troubles disappear,
Because I (love you, love you, love you everyday),
Ah(pet you, pet you, pet you in my own),
You won't(ever, ever, ever need to go astray),
You understand,
Am I your man.

Yea baby you know it's alright,
Come on baby and love me tonight,
Whoa, baby I wanna talk to you,
I need you baby to see me through.",You Be My Baby
Ray Charles,"You better watch out
You better not cry
Better not pout
I'm telling you why
Santa Claus is coming to town

He's making a list, And checking it twice; Gonna find out Who's naughty
and nice. Santa Claus is coming to town

He sees you when you're sleeping
He knows when you're awake
He knows if you've been bad or good",Santa Claus Is Comin to Town
Ray Charles,"Winter nights, twinkling lights
And snowflakes falling to the ground
The air is filled with Christmas

Santa's sleigh, kids at play
Its that magic time of year
When love is all around us

And that magic seems
To reach right out and touch me again
Just like the years before
It's Christmas in my heart once more

It seems that time stands still for Christmas
It's time for laughter and cheer
A time for giving to others
And sharing our love for those we hold so dear

Too soon the season's over
As I face the New Year
This wish I make on every start may it be Christmas
Always Christmas in my heart

It seems that time stands still for Christmas
Its time for laughter and cheer
A time for giving to others
And sharing our love with those we hold so dear

Too soon the seasons over
And as I face the New Year
This wish I make on every start may it be Christmas
Always Christmas in my heart

Oh, oh, its just Christmas in my heart
Have a good time",Christmas in My Heart
Ray Charles,"You better watch out, you better not cry
You better not pout, I'm telling you why
Santa Claus is comin' to town (look at him)
He's making a list and checking it twice
He's gonna know who's been naughty or nice
Santa Claus is comin' to town
(Do you hear me, well listen)

He knows if you're sleeping
Yeah, He knows if you're awake
And He knows if you've been good or bad
So you better be good for goodness sake, yeah yeah

You better watch out, you better not cry
You better not pout, I'm telling you why
Santa Claus is coming to town
(Alright look up, here He comes)

I'll tell you
Well, He knows if you're sleeping
Yeah, He knows if you're awake
They tell me even though as if you're bad or good
So you better be good for goodness sake

Girls and boys
You better watch out, and you better not cry
You better not pout, I'm telling you why
Now Santa Claus is coming to town

You know it's suppose to be a secret
But I can't keep it just to myself
Santa is coming to town
Santa Claus is coming to town
Santa Claus, the man is coming to town
I must say just one more time here
Santa Claus is coming to town",Santa Claus Is Coming to Town
Ray Charles,"Christmas is the time of year
For being with the one's we love
Sharing so much joy and cheer
What a wonderful feelin'
Watching the one's we love
Having so much fun

I was sittin' by the fire side
Taking a walk through the snow
Listening to a children's choir
Singing songs about Jesus
The blessed way that he came to us
Why can't it remain
All through the year
Each day the same
Heyeah, that's what I wanna hear
It's truly amazin'
That spirit of Christmas

All the kin folk gather round
The lovely Christmas tree
Hearts are glowing full of joy
Sense the gifts that we're giving
And the love that we're living
Why can't it remain
Oh all through the year
Each day the same
that's what I wanna hear
I'll tell ya
It's truly amazin'
That spirit of Christmas

(Let me hear ya)
Why can't it remain
All through the year
Each day the same
That's what I wanna hear
Listen to me
It's truly amazin'
That spirit of Christmas
Oh it's truly amazin'
That spirit of Christmas
Ain't it so
It's truly amazin'
Yeah, that spirit of Christmas
Oh Christmas
Oh Christmas",That Spirit of Christmas
Ray Charles,"Little girls and little boys
Dream of worlds full of toys
This time of year
When Christmas is near

Evergreens are snowy white
Sleigh bells ring through the night
This time of the year
When Christmas is near

And somewhere near a steeple
People kneel and pray
And a choir sings
Carols of a Christmas Day
Mmm, can you hear me?

Santa Claus is on his way
With loads of joy on his sleigh
This time of the year
When Christmas is near",This Time of the Year
Ray Charles,"What child is this, who, laid to rest
On Mary's lap, is sleeping?
Whom angels greet with anthems sweet
While shepherds watch are keeping?

This, this is Christ the King
Whom shepherds guard and angels sing
Haste to bring him laud
The Babe, the Son of Mary",What Child Is This?
Ray Charles,"Sleigh bells ring, are you list'nin'?
In the lane, snow is glist'nin'
A beautiful sight, we're happy tonight
Walkin' in a winter wonderland

Gone away is the bluebird
Here to stay is a new bird
He sings a love song as we go along
Walkin' in a winter wonderland

In a meadow we can build a snowman
And pretend that he is Parson Brown
He'll say, ""Are you married?"", we'll say, ""no, man
But you can do the job when you're in town""

When it snows, ain't it thrillin'
Though your nose get a little chillin'?
We'll frolic and play the Eskimo way, walkin' in a winter wonderland

In a meadow we can build a snowman
And pretend that he is Parson Brown
He'll say, ""Are you married?"", we'll say, ""no, man
But you can do the job when you in town, brother""

Later on we'll conspire
As we dream by the fire
To face unafraid the plans that we made
Walkin' in a winter wonderland

Oh, walk on, mm-hmm
Let's frolic and play the Eskimo way, walkin' in a winter wonderland
Come on, walk it, hmm, get on",Winter Wonderland
Ray Charles,"The tropic moves sides of ships at sea
But doesn't matter if my thoughts are free
Cant you see what you're doing to me
The honeybee makes a sigh at me 
The birds above sing a song of love 
Though I have cried constantly
That's not the thing to do
This feeling has me dangling on a string
With no escape seemingly
Though I have thoughts with myself that I'm lost
So let it be
Let my favorite cloud
Pass over me
Forget about
The past with glee
So if you smile real soon
I'll hear angels singing
A tune
Can't you see darlin' what you're doing to me?",Can't You See Darling?
Ray Charles,"If I give you my love, what will you give in
Return, if I give you my love
Will you cause my heart to yearn, and will it bring
Me sadness, with so many tears
And will it bring me gladness, all through out the
Years

if I give you my word, will you give me your word
Too
If I vow to yours, promises me that you'll be true
Am I playing with fire, tell me are you concerned,
If I give you my love
What will you give in return

Am I playing with fire, tell me are you concerned
It I give you my love, what will you give in return",If I Give You My Love
Ray Charles,"A sentimental blues
Will worry you
And make you do
Things that you
Wouldn't do
Only when you
Hear these blues

A sentimental blues
Will wet your eye
You wonder why
You heave a sigh
You start to cry
Each time that you
Hear these blues

Sigh, sigh, sigh
And drool
Cry, cry, cry
You fool
Yes, I know that it's cool

A sentimental blues
Deep down inside
Will make you hide
Your foolish pride
A sentimental blues
Will make you lose
Your mind

Sigh, sigh, sigh
And drool
Cry, cry, cry
You fool
Yes, I know that it's cool

A sentimental blues
Deep down inside
Will make you hide
Your foolish pride
A sentimental blues
Will make you lose
Your mind",A Sentimental Blues
Ray Charles,"This love of mine, goes on and on
Though life is empty, since you have gone
You're always on my mind, though out of sight
It's lonesome through the day and all the night

I cry my heart my out, it's bound to break
Since nothin' matters, then let it break
I ask the sun and the moon, the stars that shine
What's to become of it, this love of mine?

I cry my heart my out, it's bound to break
Since nothin' matters, then let it break
I ask the sun and the moon, the stars that shine
What's to become of it, this love of mine?",This Love of Mine
Ray Charles,"Well now baby, tell me how do you do?
Ooo now baby, tell me how do you do?
Well I wanna say baby
I really got news for you

Well now baby, tell me what is your name?
Ooo now baby, tell me what is you name?
Well I'm in love with you baby
Supposin' you feel the same?

Well now baby, I really want you by my side
Ooo, now baby, swear I want you by my side
Well you in love, in the money
Keep your daddy satisfied

Well you finally mine, you really on the ball
Ooo, Lord by your by you're really on the ball
Well you know I start runnin'
Every time you call

Oh, Lord , babe
Rock, everybody rock, rock, rock
Everybody, jump, jump, jump
Everybody, wail, wail, wail
Everybody jump, jump, jump
Everybody, well are ya anybody

I said wail, wail
Oh, babe, oh, babe
Oh, babe, oh, babe
I believe in you when you say I do

Babe, talk about your baby you ought to be mine
Well, you can talk about your baby but you ought to be mine
Well she feels like an angel
And it ought to be an angel o' mine

Well, in the mornin' early in the morning
Oh, Lord in the evenin', do it in the mornin'
Well, early in the mornin'

",Early in the Morning
Ray Charles,"Well I have a feeling (I had a dream) things ain't going right (I had a dream)
Come over baby (I had a dream) let me tell you about my dream last night (I had a dream)
I dreamed someone else (I had a dream) was here with you (I had a dream)
Doing all the things (I had a dream) that I used to do (I had a dream)
Please don't let this dream come true (I had a dream) 
Tell me I'm not losing you (I had a dream)
Baby, say it was a dream (I had a dream, I had a dream)

Well, well you know I came home (I had a dream) and found you gone (I had a dream)
I never felt so (I had a dream) so all alone (I had a dream)
Oh with your voice (I had a dream) ringing in my ear (I had a dream)
I just could not hold (I had a dream) hold back my tear (I had a dream)
Please don't let it come true (I had a dream)
Tell me I'm not losing you (I had a dream)
Oh, say it was a dream (I had a dream, I had a dream)

Well, well, well it seems (I had a dream) that you love me no more (I had a dream)
I never felt (I had a dream) felt this way before (I had a dream)
You were so cold (I had a dream) I wonder why (I had a dream)
You didn't care (I had a dream) how much I cried (I had a dream)
Baby please don't let it come true (I had a dream) 
Won't you say that I'm not losing you (I had a dream).
Oh, say it was a dream (I had a dream, I had a dream)

Well, well, you know I begged you (I had a dream) to come back fast (I had a dream)
You know without you baby (I had a dream) I know I couldn't last (I had a dream)
Oh, but you would not listen (I had a dream) listen to my plea (I had a dream)
You turned around (I had a dream) and walked away from me (I had a dream)
Now you know you can't let it come true now (I had a dream). 
Tell me I'm not losing you (I had a dream). 
Won't you say it was a dream (I had a dream, I had a dream)",I Had a Dream
Ray Charles,"That big eight-wheeler runnin' down the track
Means your true lovin' daddy ain't acomin' back
Cause he's movin on, he's rollin on
You were flyin to high for my little ol' sky
So I'm movin' on

But some day baby when you've had you play
Your gonna want your daddy but your daddy will say
Keep movin' on, keep rollin' on
You were flyin to high for my little ol' sky
So I'm movin' on. Move on baby.

Mr. Farmer won't you please listen to me
Cause I gotta pretty momma in Tennessee
Keep rollin on, keep movin' on,
Please listen to me let this rattler free
And keep movin' on

Move on ol' son, move on
Well I told you baby from time to time
But you just wouldn't listen or pay me no mind
And now I'm movin' on, I'm rollin' on
I'm through with you, too bad you're blue
But I'm movin' on

Move on baby, move on
I said move on, I said move on,
I said move on, I said move on,
Well I'm through with you, too bad you're blue
I said move on, I said move on
I said move on, I said move on",I'm Movin' On
Ray Charles,"Well, now baby
Tell me how do you do?
Oh, now baby
Tell me how do you do?
Well, I wanna say baby
I really got news for you

Well, now baby
Tell me what is your name?
Oh, now baby
Tell me what is your name?
Well, I'm in love with you baby
Hope that you feel the same

Well, now baby
I really want you by my side
Oh, now baby
Swear I want you by my side
Well, you in love in the money
Keep your daddy satisfied

Well, you're finally mine
You're really on the ball
Oh, Lord by your by
You're really on the ball
Well, you know I start runnin'
Every time you've called

Oh, Lord, babe
Rock, everybody rock, rock, rock
Everybody jump, jump, jump
Everybody, wail, wail, wail
Everybody jump, jump, jump
Everybody, well are ya anybody

I said, wail, wail
(Wail, wail)
Oh, babe
(Oh, babe)
Oh, babe
(Oh, babe)

Oh, babe
(Oh, babe)
Oh, babe
(Oh, babe)

I believe in you when you say I do
Babe, talk about your baby
You ought to be mine

Well, you can talk about your baby
But you ought to be mine
Well, she feels like an angel
And it ought to be an angel o' mine

Well, in the mornin'
Early in the mornin'
Oh, Lord in the evenin'
Do it in the mornin'
Well, early in the mornin'",Jumpin' in the Mornin'
Ray Charles,"My bonnie lies over the ocean,
My bonnie lies over the sea,
My bonnie lies over the ocean, well, yeah
Why don't you bring
(Bring her back)
Whoa, bring her
(Bring her back)
Whoa, bring her
(Bring her back)
Bring her
(Bring her back)
You oughta bring back
Bring my bonnie back to me.
(My bonnie back to me)

I said bring back,
(Bring back)
bring her back, right now
(Bring back)
Come on, and bring back
Bring my Bonnie back to me
(Whoa) whoa (whoa) whoa (whoa) Whoa!
Bring
(Bring back)
Bring her back please, now
(Bring back)
Well, bring back
Bring my Bonnie back to me
(My bonnie back to me)

Last night as I lay on my pillow,
Last night as I lay on my bed,
Last night as I lay on my pillow, well, let me tell you now
You know I dreamed
(Yes I did)
Well I dreamed
(Yes I did)
Whoa I dreamed now
(Yes I did)
Whoa-oh I dreamed
(Yes I did)
You know I dreamed that
Dreamed my little Bonnie was dead.
(My little Bonnie was dead)

I said bring
(Bring back)
Oh-oh, sing it children
(Bring back)
Well, bring back
Bring my Bonnie back to me
(Whoa) whoa (whoa) whoa (whoa) Whoa!
(Bring back)
Whoa-oh, bring it back
(Bring back)
Please, bring her back right now
Bring back
Bring my Bonnie back to me
(My bonnie back to me)",My Bonnie
Ray Charles,"What kind of man are you
Why do I love you so?
What kind of man are you
Yeah, yeah, when you love me no more?

What kind of man are you
Why can't I let you go?
I wanna know, I wanna know
I wanna know, yes, about you

What kind of man are you?
I just can't satisfy
What kind of man are you?
Oh yeah, no matter how I try

What kind of man are you
Why do you tell me lies?
I wanna know, I wanna know
I wanna know, yes, about you

What kind of man are you?
I'm always left alone
What kind of man are you?
How long can this go on?

What kind of man are you?
Oh, help me somebody
You know right from wrong
I wanna know, I wanna know
I wanna know, yes, about you, oh yeah

",What Kind of Man Are You
Ray Charles,"Yes indeed, yes indeed
I've got that feeling in me, yes indeed
You will shout when it hits you, yes indeed
Yes, you'll shout when it hits you, yes indeed
When that spirit moves you, you will shout ""hallelujah!""
When it hits you, you'll holler, yes indeed
It comes out if it's in you, yes indeed
It makes you shout Jack, it sends you, yes indeed
When that jive starts jumpin' you will shout ""let me in there!""
When it hits you you'll holler, yes indeed
Yes you'll shout when it hits you, yes indeed
It comes out if it's in you yes indeed
Yes indeed, yes indeed
I've got that feeling in me, yes indeed
When that spirit moves you you will shout ""hallelujah!""
When it hits you, when it hits you
When it hits you, yes indeed","Yes, Indeed!"
Ray Charles,"Oh beautiful for heroes proved,
In liberating strife,
Who more than self, our country loved,
And mercy more than life,

America, America may God thy gold refine,
Til all success be nobleness
And every gain divined.

And you know when I was in school,
We used to sing it something like this, listen here:

Oh beautiful, for spacious skies,
For amber waves of grain,
For purple mountain majesties,
Above the fruited plain,

But now wait a minute, I'm talking about
America, sweet America
You know, God done shed his grace on thee,
He crowned thy good, yes he did, in brotherhood,
From sea to shining sea.

You know, I wish I had somebody to help me sing this
(America, America, God shed his grace on thee)
America, I love you America, you see,
My God he done shed his grace on thee,
And you oughta love him for it,
Cause he, he, he ,he crowned thy good,
He told me he would, with brotherhood,
(From sea to shining Sea).
Oh lord, oh lord, I thank you Lord
(Shining sea).",America the Beautiful
Ray Charles,"Born to lose, I've lived my life in vain
Every dream has only brought me pain
All my life I've always been so blue
Born to lose and now I'm losing you

Born to lose, it seems so hard to bear
When I wake and find that you're not there
You've grown tired and now you say we're through
Born to lose and now I'm losing you

Born to lose, I've lived my life in vain
Every dream has only brought me pain
All my life I've always been so blue
Born to lose and now I'm losing you

Born to lose and now I'm losing you",Born to Lose
Ray Charles,"My bills are all due and the baby needs shoes and I'm busted 
Cotton is down to a quarter a pound, but I'm busted 
I got a cow that went dry and a hen that won't lay 
A big stack of bills that gets bigger each day 
The county's gonna haul my belongings away cause I'm busted. 

I went to my brother to ask for a loan cause I was busted 
I hate to beg like a dog without his bone, but I'm busted 
My brother said there ain't a thing I can do, 
My wife and my kids are all down with the flu, 
And I was just thinking about calling on you 'cause I'm busted. 

Well, I am no thief, but a man can go wrong when he's busted 
The food that we canned last summer is gone and I'm busted 
The fields are all bare and the cotton won't grow, 
Me and my family got to pack up and go, 
But I'll make a living, just where I don't know cause I'm busted. 

I'm broke, no bread, I mean like nothing, 
 
 
",Busted
Ray Charles,"If your sweetheart, sends a letter, of goodbye
It's no secret, you'll feel better, if you cry
When wakened, from a bad dream, don't you sometimes think it's real
Well it's only, false emotion, that you feel

If your heartaches, seems to hang around, too long
And your blues, keep getting blue-er, with each song
Remember, sunshine can be found, behind a cloudy sky
So let your hair down now, and baby go on and cry

(If your heartaches seem to hang around too long)
(And your blues keep getting blue-er with each song)
Well remember, sunshine can be found, behind a cloudy sky
Why don't you let your hair down now, baby go on and cry

I said let your hair down, baby go on and cry.",Cry
