Band,Lyrics,Song
George Jones,"(Wa-wa-walking, wa-wa-walking)
I go out walkin' after midnight
Out in the moonlight
Just like we used to do, I'm always walkin'
After midnight, searchin' for you (wa-wa-walking, wa-wa-walking)

I walk for miles along the highway
Well, that's just my way
Of sayin' I love you, I'm always walkin'
After midnight, searchin' for you (wa-wa-walking, wa-wa-walking)

I stop to see a weepin' willow
Cryin' on his pillow
Maybe he's cryin' for me
And as the skies turn gloomy
Night winds whisper to me
I'm lonesome as I can be

I go out walkin' after midnight
Out in the moonlight
Just hopin' you may be somewhere a-walkin'
After midnight, searchin' for me (Wa-wa-walking, wa-wa-walking)

I stop to see a weepin' willow
Cryin' on his pillow
Maybe he's cryin' for me
And as the skies turn gloomy
Night winds whisper to me
I'm lonesome as I can be

I go out walkin' after midnight
Out in the moonlight
Just hopin' you may be somewhere a-walkin'
After midnight, searchin' for me (wa-wa-walking, wa-ooh-ah)",Walkin' After Midnight
George Jones,"A walkin' dream
I dreamed about you
A walkin' dream
Can't do without you

Lovely dream
Just can't forget you
'Cause your so dreamy, peach n' creamy
Walkin' dream

Now keep on a walkin'
Keep on a talkin'
And I'll do my best to make the rest
Of this lovely dream come true

A walkin' dream
I want you near me
Walkin' dream
Can't you hear me?

Lovely dream
Won't you love me?
'Cause your so lovey, turtle dovey
A walkin' dream

A walkin' dream
My heart is yearnin'
Walkin' dream
My lips are burnin'

Lovely dream
Of love I'm learnin'
'Cause your surprisin', tantilizin'
Walkin' dream

Now keep on a walkin'
Keep on a talkin'
And I'll do my best to make the rest
Of this lovely dream come true

A walkin' dream
I want you near me
A walkin' dream
Can't you hear me?

Lovely dream
Won't you love me?
'Cause your so lovey, turtle dovey
Walkin' dream
'Cause your so lovey, turtle dovey
Walkin' dream

",Walking Dream
George Jones,"If you told me that you love me, I would feel so proud
If you'd let me hold you honey, I'd holler out loud
I'll never love another even if I can
Well, come to me baby, I'm a one-woman man

A-won't you let me, baby, just a-kind of hang around?
I'll always love honey, and I'll never let you down
I'll never love another even if I can
Well, come to me baby, I'm a one-woman man

I'd climb the highest mountain if it reached a bigger sky
To prove that I love you, I'd jump off and fly
I'd even swim the ocean from shore to shore
To prove that I love you just a little bit more

A-won't you let me, baby, just a-kind of hang around?
I'll always love you honey, and I'll never let you down
I'll never love another even if I can
Well, come to me baby, I'm a one-woman man

If you told me that you love me I would feel so proud
If you'd let me hold you honey, I'd holler out loud
I'll never love another even if I can
Well, come to me baby, I'm a one-woman man

Won't you let me, baby, just a-kind of hang around
I'll always love honey, and I'll never let you down
I'll never love another even if I can
Well, come to me baby, I'm a one-woman man

Come to me baby, I'm a one-woman man",I'm A One-Woman Man
George Jones,"In a pawn shop in Chicago
On a sunny summer day
A couple gazes at the wedding rings
There on display

She smiles n' nods her head
As he says, ""Honey that's for you,
It's not much, but it's the best
That I can do.""

[Chorus]
Golden rings (golden ring) with one tiny little stone
Waiting there (waiting there) for someone to take you home
By itself (by itself) it's just a cold metallic thing
Only love can make a golden wedding ring

In a little wedding chapel later on that afternoon
An old upright piano plays that old familiar tune

Tears roll down her cheeks
And happy thoughts run through her head
As he whispers low, ""With this ring, I thee wed.""

[Chorus]

Ooo-ooo

In a small two room apartment 
As they fought their final round
He says, ""You won't admit it,
But I know you're leavin' town.""

She says, ""One thing's for certain,
I don't love you any more.""
And throws down the ring
As she walks out the door

[Chorus]

In a pawn shop in Chicago
On a sunny summer day
A couple gazes at the wedding rings
There on display,
Golden ring.",Golden Ring [Version]
George Jones,"There's just one place for me
Near you

It's like heaven to be
Near you

Times when we're apart
And I can't face my heart

Say you'll never stay
More than just two lips away

If my hours could be spent
Near you

I'd be more than content
Near you

Make my life worth while
By telling me that I'll
Spend the rest of my days
Near you

Near you near you
Make my life worth while
By telling me that I'll spend the rest of my days
Near you

Spend the rest of my days 
Near you",Near You [Version]
George Jones,"I just love that good old gospel singing
'I'll Fly Away' is my favorite song
I just love that good old time religion
This old world has gone without it much too long

Oh, how I love to sing and tell
When they ring those golden bells
And I just can't stand in one place
When they sing 'Amazing Grace'

I just love that good old country preaching
This old world has gone without it much too long

Yes, I love them good old fashioned gathering
Where all of God's children came to pray
And oh, how I really miss those old brush arbors
How I wish we had more of these days today

Oh, how I love to sing and tell",Old Fashioned Singing [Version]
George Jones,"Take me, take me to your darkest room
Close every window and bolt every door
The very first moment I heard your voice
I'd be in darkness no more

Take me to your most barren desert
A thousand miles from the nearest sea
The very moment I saw your smile
It would be like heaven to me

There's not any mountain to rugged to climb
No desert too barren to cross
Darlin', if you would just show a sign
Of love, I could bear with all loss

Take me to Siberia
And the coldest weather of the winter time
And it would be just like spring in California
As long as I knew you were mine

Yes, it would be just like spring in California
As long as I knew you were mine

Take me, take me",Take Me [Version]
George Jones,"Well, why don't you love me like you used to do?
How come you treat me like a worn out shoe?
My hair's still curly, my eyes are still blue
So why don't you love me like you used to do?

Can't have no lovin' like a huggin'
And a kissin' in a long, long while
We don't get nearer, further
Closer than a country mile

So why don't you spark me like you used to do
And say sweet nothings like we used to do?
I'm the same old trouble you've always been through
So why don't you love me like you used to do?

Well, why don't you be just like you used to be?
How come you find so many faults with me?
Somebody's changed, so let me give you a clue
Why don't you love me like you used to do?

Can't have no lovin' like a huggin'
And a kissin' in a long, long while
We don't get nearer, further
Closer than a country mile

So why don't you say the things you used to say?
What makes you treat me like a piece of clay?
My hair's still curly and my eyes are still blue
So why don't you love me like you used to do?

",Why Don't You Love Me (Like You Used to Do)
George Jones,"The seasons come, the seasons go
Get a little sunshine, rain and snow
Just the way that it was planned to be
But there's no seasons in my heart
While you play t by George Jones and Darrell Edwards
he leading part
Cause the flowers will bloom eternally

[Repeat: x2]
Your leaving, it will bring autumn sorrow
And my tears like withered leaves will fall
But spring, it could bring some glad tomorrow
Darling we could be happy after all",Seasons of My Heart [*]
George Jones,"Well, I have lived a lot and done my part of running 'round
And never did I think I'd let a sweet love get me down
But now I see how wrong I was, you're part of every plan
Perhaps I'll pay but come what may, my heart's at your command

Oh, this aching, breaking heart of mine is crazy over you
And I'm afraid to let you know I love you like I do
For if you knew how much I care, I know what you would do
You'd drop me like the others and go find somebody new

Last night I saw you, darling, in the arms of someone new
And I know that you don't love him, you just want to make me blue
I guess you think that hurting me will make me love you more
But someday from you, darling, this old heart will lock its door

Oh, this aching, breaking heart of mine is crazy over you
And I'm afraid to let you know I love you like I do
For if you knew how much I care, I know what you would do
You'd drop me like the others and go find somebody new",Aching Breaking Heart
George Jones & The Jones Boys,"Well, I used to sit at home and wonder why, why, why
All the happiness in life just passed me by
I didn't think in all the world there could ever be
One girl in a million who was meant for me.

Then along came you walkin' down the street
Then along came you, you knocked me off my feet.
I never thought I'd find a girl that ever would be true
Somewhere outta nowhere along came you.

I had just about forgotten how to smile
You could see my misery for a country mile
Used to being lonely surrendered to the blue
Then somehow outta nowhere along came you.

Then along came you walkin' down the street
Then along came you, you knocked me off my feet.
I never thought I'd find a girl that ever would be true
Somewhere outta nowhere along came you.

Then along came you walkin' down the street
Then along came you, you knocked me off my feet.
I never thought I'd find a girl that ever would be true
Somewhere outta nowhere along came you",Along Came You
George Jones & The Jones Boys,"Well, I really had a fall last night
I held all the pretty girl tight
I was feelin' single but seein' double
And wound up in a whole lotta trouble
The day I face a big fight
But I really had a fall last night

I came home from work this mornin'
My little womans was a-feelin' low
She told me what was on her mind
And she told me where I could go

Well, I didn't go where she told to to
'Cause the water was cold in the lake
There's something fishy 'bout this whole deal
I'm gonna see where I made a mistake

Well, I really had a fall last night
I held all the pretty girl tight
I was feelin' single but seein' double
And wound up in a whole lotta trouble
The day I face a big fight
But I really had a fall last night

Well, when I opened the door this mornin'
Like me the sun was high
I started walkin' the long way home
Just to think of an alibi

Well, I couldn't think of a doggon thing
That I hadn't already said
Guess I better play it by ear
For I'm already dead

Well, I really had a fall last night
I held all the pretty girl tight
I was feelin' single but seein' double
And wound up in a whole lotta trouble
The day I face a big fight
But I really had a fall last night","Feeling Single, Seeing Double"
George Jones & The Jones Boys,"I'M WASTING GOOD PAPER
WRITERS GEORGE JONES, EARL MONTGOMERY

I know I shouldn't do this but I will anyway
I'll write you this letter and I'll mail it today
I've told me you won't read it but I can't tell my mind
That I'm wasting good paper, a stamp and my time.
You make take what I'm writing as some sort of joke
For I said all this before in the last one I wrote
I know it won't be opened for you won't read one line
I'm just wasting good paper, a stamp and my time.
I sent you so many I can't count them all
And just like the others in the trash it will fall
I know you won't be wearing this name I now sign
I'm just wasting good paper, a stamp and my time.
(I sent you so many I can't count them all)
(And just like the others in the trash it will fall)
I know you won't be wearing this name I now sign
I'm just wasting good paper, a stamp and my time...



",I'm Wasting Good Paper
George Jones & The Jones Boys,"Ol' hearts the way our true love has been doin'
Just ripped and tears my pride right half in two
I know you're just as much ashamed as I am
So if you won't tell on me I won't tell on you.

Let's not breathe a word or they'll start saying
There they go the world's two greatest fools
Ol' heart there's not one doubt that were both strangers
So if you won't tell on me I won't tell on you.

Ol' heart I hope that no one will discover
The foolish things that her love made us do
We'd probably have to pack and leave the country
So if you won't tell on me I won't tell on you.

Let's not breath a word or they'll start saying
There they go the world's two greatest fools
Ol' heart there's not doubt that were both strangers
So if you won't tell on me I won't tell on you

No, if you won't tell on me I won't tell on you",If You Won't Tell on Me (I Won't Tell on You)
George Jones & The Jones Boys,"[Chorus]
Oh that little bitty teeny weeny thing they call the
Love bump
Nobody thinks about it until one day it just pops up
It all started with a little bitty kiss on her muff
It's a little bitty teeny weeny thing they call the
Love bump

Well I was a Casanova a real lady killer they say
Until I got a cold sore one that would not go away
Yeah I tried ointment on it but nothing was working
For me
My kissin' days are over thanks to little herpe

[Chorus]

Well I always thought that I had me a pretty good
Smile
But even with a mustache this really cramps my style
'Cause with every outbreak it's something I can't hide
No kissing for me the girls all go running by

[Chorus]

It's a little bitty teeny weeny thing they call the
Love bump",Love Bug
George Jones & The Jones Boys,"Take me, take me to your darkest room
Close every window and bolt every door
The very first moment I heard your voice
I'd be in darkness no more

Take me to your most barren desert
A thousand miles from the nearest sea
The very moment I saw your smile
It would be like heaven to me

There's not any mountain to rugged to climb
No desert too barren to cross
Darlin', if you would just show a sign
Of love, I could bear with all loss

Take me to Siberia
And the coldest weather of the winter time
And it would be just like spring in California
As long as I knew you were mine

Yes, it would be just like spring in California
As long as I knew you were mine

Take me, take me",Take Me
George Jones & The Jones Boys,"The faucet started drippin' in the kitchen
And last night your picture fell down from the wall
Today the boss said sorry, I can't use you anymore
And tonight the light bulb went out in the hall

[Chorus]
Things have gone to pieces since you left me
Nothing turns out, half-right now it seems
There ain't nothing in my pocket,
But three nickels and a [4] dime
But I'm holding to the pieces of my dream

Somebody threw a baseball through my window
And the arm fell off my favorite chair again
The man called me today and said he'd haul my things away
If I didn't get my payments made by ten",Things Have Gone to Pieces
George Kahn,"Somewhere over the rainbow, way up high
There's a land that I've heard of once in a lullaby.
Somewhere over the rainbow, skies are blue
And the dreams that you dare to dream,
Really do come true.

Someday I'll wish upon a star
And wake up where the clouds are far behind me.
Where troubles melt like lemon drops,
High above the chimney tops,
That's where you'll find me.

Somewhere over the rainbow, blue birds fly
Birds fly over the rainbow
Why then, oh why can't I?
If happy little bluebirds fly beyond the rainbow
Why, oh why can't I?

Somewhere over the rainbow, way up high
There's a land that I've heard of once in a lullaby.
Somewhere over the rainbow, skies are blue
And the dreams that you dare to dream,
Really do come true.

Someday I'll wish upon a star
And wake up where the clouds are far behind me.
Where troubles melt like lemon drops,
High above the chimney tops,
That's where you'll find me.

Somewhere over the rainbow, blue birds fly
Birds fly over the rainbow
Why then, oh why can't I?
If happy little bluebirds fly beyond the rainbow
Why, oh why can't I?",Over the Rainbow
George Kahn,"You got a smile so bright
You know you could have been a candle
I'm holding you so tight
You know you could have been a handle
The way you swept me off my feet
You know you could've been a broom
And babe you smell so sweet
You know you could've been some perfume

Well you could of been anything that you wanted to
I can tell
The way you do the things you do

As pretty as you are
You know you could've been a flower
If good looks were minutes
You know you could have been an hour
The way you stole my heart
You know you could have been a crook
And baby your so smart
You know you could have been a school book

Well you could of been anything that you wanted to
I can tell
The way you do the things you do

Well you could of been

You make my life so rich
You know you could've been some money
And baby you're so sweet
You know you could have been some honey

Well you could of been anything that you wanted to
I can tell
The way you do the things you do

Well you could of been

As pretty as you are
You know you could've been a flower
If good looks were minutes
You know you could have been an hour
The way you stole my heart
You know you could have been a crook
And baby your so smart
You know you could have been a school book

Well you could of been anything that you wanted to
I can tell
The way you do the things you do

Well you could of been",The Way You Do The Things You Do
George Kahn,"Everybody's got a thing 
But some don't know how to handle it 
Always reachin' out in vain 
Just taking the things not worth having but
 
Don't you worry 'bout a thing 
Don't you worry 'bout a thing, mama 
'Cause I'll be standing on the side 
When you check it out
 
They say your style of life's a drag 
And that you must go other places 
But just don't you feel too bad 
When you get fooled by smiling faces but 

Don't you worry 'bout a thing 
Don't you worry 'bout a thing, mama 
'Cause I'll be standing on the side 
When you check it out

When you get it off your trip 
Don't you worry 'bout a thing  
Don't you worry 'bout a thing 

Bam bambam bambam bambam
Bambambambam bambambambam
Bam bambam bambam bambam
Bambambambam bambambambam

Don't you worry 'bout a thing 
Don't you worry 'bout a thing, mama 
'Cause I'll be standing on the side 
When you check it out

When you get it off your trip 
Everybody needs a change 
A chance to check out the new 
But you're the only one to see 
The changes you take yourself through but

Don't you worry 'bout a thing 
Don't you worry 'bout a thing, pretty mama 
'Cause I'll be standing in the wings 
When you check it out 
Don't you worry 'bout a thing
Don't you worry 'bout a thing
Don't you worry 'bout a thing
Don't you worry 'bout a thing
Yeah
Bam bambam bambam bambam
Bambambambam bambambambam
Don't you worry 'bout a thing
Don't you worry 'bout a thing, sugar
Don't you worry 'bout a thing, mama
Don't you worry 'bout a thing
Don't worry, don't worry, don't worry
Don't you worry 'bout a thing, sugar
Don't you worry 'bout a thing
Don't you worry 'bout a thing
Don't you worry 'bout a thing",Don't You Worry 'Bout a Thing
George Kahn,"I bet you're wonderin' how I knew
'Bout your plans to make me blue
With some other guy you knew before 
Between the two of us guys 
You know I loved you more
It took me by surprise I must say 
When I found out yesterday 
Don't you know that I heard it through the grapevine
Not much longer would you be mine
Oh I heard it through the grapevine
Oh I'm just about to lose my mind
 
Honey, honey yeah.
I heard it through the grapevine 
Not much longer would you be mine baby
 
I know a man ain't supposed to cry 
But these tears I can't hold inside
Losin' you would end my life you see
'Cause you mean that much to me
You could have told me yourself 
That you loved some one else
Instead I heard it through the grapevine
Not much longer would you be mine
Oh, I heard it through the grapevine
And I'm just about to lose my mind
 
Honey, honey yeah
I heard it through the grapevine 
Not much longer would you be mine, baby
 
People say believe half of what you see
Son and none of what you hear
But I can't help but be confused
If it's true please tell me dear
Do you plan to let me go
For the other guy you loved before?

Don't you know I heard it through the grapevine 
Not much longer would you be mine, baby yeah
I heard it through the grapevine 
I'm just about to love my mind
Honey, honey, yeah
I heard it through the grapevine,
Not much longer would you be mine, baby yeah",I Heard It Through the Grapevine
George Kahn,"It seems like a dream, yet I know it happened
A man, a maid, a kiss, and then goodbye
Romance was the theme
And we were the players
I never think of this without a sigh
 
Lover, one lovely day
Love came, planning to stay
Green Dolphin Street supplied the setting
The setting for nights beyond forgetting
And through these moments apart memories live in my heart
When I recall the love I found on
I could kiss the ground on Green Dolphin Street
 
Lover, one lovely day
Love came, planning to stay
Green Dolphin Street supplied the setting
The setting for nights beyond forgetting
And through these moments apart memories live in my heart
When I recall the love I found on
On Green Dolphin Street
",On Green Dolphin Street
George Kahn,"Ah look at all the lonely people
Ah look at all the lonely people

Eleanor Rigby, picks up the rice
In the church where a wedding has been
Lives in a dream
Waits at the window, wearing the face 
That she keeps in a jar by the door
Who is it for

All the lonely people
Where do they all come from?
All the lonely people
Where do they all belong?

Father McKenzie, writing the words
Of a sermon that no one will hear
No one comes near
Look at him working, darning his socks
In the night when there's nobody there
What does he care

All the lonely people
Where do they all come from?
All the lonely people
Where do they all belong?

Ah look at all the lonely people
Ah look at all the lonely people

Eleanor Rigby, died in the church
And was buried along with her name
Nobody came
Father McKenzie, wiping the dirt
From his hands as he walks from the grave
No one was saved

All the lonely people
Where do they all come from?
All the lonely people
Where do they all belong?",Eleanor Rigby
George Kahumoku Jr.,"I want to go back to my little grass shack in Kealakekua, Hawaii
I want to be with all the kanes and wahines that I knew long ago
I can hear old guitars a playing, on the beach at Hoonaunau
I can hear the Hawaiians saying ""Komomai no kaua ika hale welakahao""
It won't be long 'til my ship will be sailing back to Kona
A grand old place that's always fair to see
I'm just a little Hawaiian and a homeside Island boy
I want to go back to my fish and poi
I want to go back to my little grass shack in Kealakekua, Hawaii
Where the Humuhumu, Nukunuku a puaa goes swimming by
Where the Humuhumu, Nukunuku a puaa goes swimming by
 
I want to go back to my little grass shack in Kealakekua, Hawaii
I want to be with all the kanes and wahines that I knew long ago
I can hear old guitars a playing, on the beach at Hoonaunau
I can hear the Hawaiians saying ""Komomai no kaua ika hale welakahao""
It won't be long 'til my ship will be sailing back to Kona
A grand old place that's always fair to see
I'm just a little Hawaiian and a homeside Island boy
I want to go back to my fish and poi
I want to go back to my little grass shack in Kealakekua, Hawaii
Where the Humuhumu, Nukunuku a puaa goes swimming by",My Little Grass Shack
