Band,Lyrics,Song
Merl Saunders,"Virgil Caine is the name, and I served on the Danville train
'Til Stoneman's cavalry came and it tore up the tracks again
In the winter of '65, we were hungry, just barely alive
By May tenth, Richmond had fell, it's a time I remember, oh so well

The Night They Drove Old Dixie Down, and all the bells were ringing
The Night They Drove Old Dixie Down, and all the people were singin'
They went

Back with my wife in Tennessee, when one day she called to me
""Say Virgil, quick, come see, there goes Robert E. Lee!""
Now I don't mind choppin' wood, and I don't care if my money's no good
Ya take what ya need and ya leave the rest
But they should never have taken the very best

The Night They Drove Old Dixie Down, and all the bells were ringing
The Night They Drove Old Dixie Down, and all the people were singin'
They went

Like my father before me, I will work the land
And like my brother up above me, who took a rebel stand
He was just eighteen, proud and brave, but a Yankee laid him in his grave
I swear by the mud below my feet, you can't raise a Caine back up when he's in defeat

The Night They Drove Old Dixie Down, when all the bells were ringing
The Night They Drove Old Dixie Down, and you could hear 'm all singin'
They went",The Night They Drove Old Dixie Down
Merl Saunders,"Wa-oo-oo, wa-oo-oo, 
Wa-oo wa-oo wa-oo wa-ay
Wa-oo-oo, wa-oo-oo, 
Wa-oo wa-oo wa-oo wa-ay

Sittin' by de ocean 
Me heart, she feel so sad, 
Sittin' by de ocean, 
Me heart, she feel so sad... 
Don't got de money 
To take me back to Trinidad. 

Fine calypso woman, 
She cook me shrimp and rice, 
Fine calypso woman, 
She cook me shrimp and rice
Dese yankee hot dogs 
Don't treat me stomach very nice.

In Trinidad, one dollar buy 
Papaya juice, banana pie, 
Six coconut, one female goat, 
An' plenty fish to fill de boat. 
One bushel bread, one barrel wine, 
An' all de town, she come to dine. 

But here is bad, one dollar buy 
Cup of coffee, ham on rye. 
Me throat she sick from necktie, 
Me feet hurt from shoes. 
Me pocket full of empty, 
I got Calypso blues.

Dese yankee girl give me big scare, 
Is black de root, is blonde de hair. 
Her eyelash false, her face is paint, 
And pads are where de girl she ain't

She jitterbug when she should waltz, 
I even think her name is false. 
But calypso girl is good a lot, 
Is what you see, is what she got. 

Sittin' by de ocean 
Me heart, she feel so sad, 
Sittin' by de ocean, 
Me heart, she feel so sad
Don't got de money 
To take me back to Trinidad. 

Wa-oo-oo, wa-oo-oo, 
Wa-oo wa-oo wa-oo wa-ay
Wa-oo-oo, wa-oo-oo, 
Wa-oo wa-oo wa-oo wa-ay",Calypso Blues
Merl Saunders,"I was born in Lil' Rock
Had a childhood sweetheart
We were always hand in hand
I was hightop shoes and shirt tails
Suzy was in pig tails
I know I loved her even then
You know my papa disapproved it
My mama boohooed it
But I told them time and time again
""Don't you know I was made to love her
Built a world all around her""
Yah! Hey, hey, hey
She's been my inspiration
Showed appreciation
For the love I gave her through the years
Like a sweet magnolia tree
My love blossomed tenderly
My life grew sweeter through the years
I know that my baby loves me
My baby needs me
That's why we made it through the years
I was made to love her
Worship and adore her
Hey, hey, hey
All through thick and thin
Our love just won't end
'Cause I love my baby, love my baby. Ah!
My baby loves me
My baby needs me
And I know I ain't going nowhere
I was knee high to a chicken
When that love bug bit me
I had the fever with each passing year
Oh, even if the mountain tumbles
If this whole world crumbles
By her side I'll still be standing there
'Cause I was made to love her
I was made to live for her, yeah!
Ah, I was made to love her
Built my world all around her
Hey, hey, hey
Oo baby, I was made to please her
You know Stevie ain't gonna leave her, no
Hey, hey, hey
Oo wee baby, my baby loves me
My baby needs me
Hey, hey, hey
Oo my baby loves me",I Was Made to Love Her [Live]
Merl Saunders,"I put a spell on you because you're mine
You better stop the things that you do
I ain't lyin', no, I ain't lyin'
I just can't stand it babe
The way you're always runnin' 'round
I just can't stand it, the way you always put me down
I put a spell on you because you're mine

I put a spell on you because you're mine
You better stop the things that you do
I ain't lyin', no, I ain't lyin'
I just can't stand it babe
The way you're always runnin' 'round
I just can't stand it, the way you always put me down
I put a spell on you because you're mine
I put a spell on you. I put a spell on you
I put a spell on you. I put a spell on you",I Put a Spell on You
Merl Saunders,"Money, who needs it
Let me live a life free and easy
Put a toothbrush in my hand
Let me be a travelling man
I'm a roadrunner, baby
Roadrunner
Roadrunner
I'm a road runner baby, 
Can't stay in one place too long 
I'm a road runner, 
You might look at me 
And I'll be gone 
Well you can love me if you wanna 
But I do declare 
When I get restless 
I got to move somewhere 
Yes, I'm a road runner baby, 
Anywhere is my home 
And I love the life I live 
And I'm gonna live the life I love 
Roadrunner baby 
Roadrunner Roadrunner 
Don't want no woman to tie me down 
Gotta be free baby to roam around 
All my life I've been like this 
You can love me at your own risk 
When the dust hits my shoes 
I got the urge to move 
'Cause I'm a road runner baby, 
Gotta keep on, keepin' on
 And I live the life I love 
And I'm gonna love the life I live 
Roadrunner baby
 Roadrunner Roadrunner",Roadrunner
Merl Saunders,"Sitting here in limbo, but I know it won't be long
Sitting here in limbo, like a bird without a song
Well they're putting up resistance
But I know my faith will lead me on

Sitting here in limbo, waiting for the dice to roll
Sitting here in limbo, got some time to search my soul
Well they're putting up resistance
But I know that my faith will lead me on

I don't know where life will lead me
But I know where I've been
I can't say what life will show me
But I know what I've seen
Tried my hand at love and friendship
But all that is passed and gone
This little boy is moving on

Sitting here in limbo waiting for the tide to flow
Sitting here in limbo knowing that I have to go
Well they're putting up resistance
But I know that my faith will lead me on

I don't know where life will lead me
But I know where I've been
I can't say what life will show me
But I know what I've seen
Tried my hand at love and friendship
But all that is passed and gone
This little boy is moving on

Sitting here in limbo waiting for the tide to flow
Sitting here in limbo knowing that I have to go
Well they're putting up resistance
But I know that my faith will lead me on

Sitting in limbo
Sitting in limbo",Sitting in Limbo
Merl Saunders,"I could give up my friends I know
And in return you could give up yours

Before we think, what would we do later on?
What kind of life would we have
Just in case we both were wrong?

I give up my woman you give your man
But it don't make sense to take the chance

Before we think, what would we do later on?
What kind of life would we have
Just in case we both were wrong?

Well love is a gamble, we know that's true
Why gamble on me? Why should I on you?

Before we think, what would we do later on?
What kind of life would we have
Just in case we both were wrong?",Think
Merl Saunders,"D Bm A
Tough Mama, meat shaking on your bones
D Bm A
I'm gonna take you down to the river and get you stoned.
Bm A
Papa's on the highway with that steel driving crew
Bm F#m Em G
Sister's in the big house her working days are through
See G A
Tough Mama, can I blow a little smoke on you?

Dark Beauty, Won't you move it on over and make some room?
It's my duty to bring you down to the field where the flowers bloom.
Ashes in the furnace, dust on the rise,
You came through it all the way, flyin' through the skies.
Dark Beauty With that long night's journey in your eyes.

Sweet Goddess, born of a blinding light and a changing wind,
Now, don't be modest, you know who you are and where you've been.
Jack the Cowboy went up north He's buried in your past.
The Lone Wolf went out drinking That was over pretty fast.
Sweet Goddess Your perfect stranger's comin' in at last.

Silver Angel, with the badge of the lonesome road sewed in your sleeve,
I'd be grateful if this golden ring you would receive. Today on the
Countryside it was a-hotter than a crotch, I stood alone upon the ridge
And all I did was watch. Sweet Goddess It must be time to carve another
Notch.

I'm crestfallen, the world of illusion is at my door,
I ain't haulin' any of my lambs to the marketplace anymore.
The prison walls are crumblin', there is no end in sight,
I've gained some recognition but I lost my appetite.
Dark Beauty Meet me at the border late tonight.




",Tough Mama
Merl Saunders,"Maybe you'll wanna give me kisses sweet
But only for one night with no repeat.
And maybe you'll go away and never call,
And a taste of honey is worse that none at all.
Oh little girl!

In that case I don't want nobody
I do believe that that would only break my heart
Oh, but if you feel like lovin' me
If you got the notion,
I second that emotion.
So, if you feel like giving me a lifetime of devotion
I second that emotion.

Maybe you'll think that love will tie you down
And you don't have the time to hang around.
Or maybe you'll think that love will make us fools,
And so it makes you wise to break the rules.
Oh little girl!

In that case I don't want nobody
I do believe that that would only break my heart
Oh, but if you feel like lovin' me
If you got the notion,
I second that emotion.
So, if you feel like giving me a lifetime of devotion
I second that emotion.

In that case I don't want nobody
I do believe that that would only break my heart
Oh, but if you feel like lovin' me
If you got the notion,
I second that emotion.
So, if you feel like giving me a lifetime of devotion
I second that emotion.",I Second That Emotion [#]
Merl Saunders,"Train I ride, sixteen coaches long
Train I ride, sixteen coaches long
Well, that long black train, got my baby and gone

Train, train, comin' round the bend
Train, train, comin' round the bend
Well, it took my baby, but it never will again
No, not again

Train, train, comin' down, down the line
Train, train, comin' down, down the line
Well, it's bringin' my baby, 'cause she's mine, all mine
She's mine, all mine

Train, train, comin' round, round the bend
Round, round the bend
Train, train, comin' round, round the bend
Round, round the bend
Well, it took my baby, but it never will again
Never will again

Whoo-oo-oo-oo-oo-hoo",Mystery Train
Merl Saunders,"Well, that's all right, mama
That's all right for you
That's all right mama, just anyway you do
Well, that's all right, that's all right
That's all right now mama, anyway you do
Mama she done told me
Papa done told me too
'Son, that gal your foolin' with
She ain't no good for you'
But, that's all right, that's all right
That's all right now mama, anyway you do
I'm leaving town, baby
I'm leaving town for sure
Well, then you won't be bothered with
Me hanging 'round your door
Well, that's all right, that's all right
That's all right now mama, anyway you do",That's Alright
Merle Evans,"Have yourself a merry little Christmas
Let your heart be light
From now on, our troubles will be out of sight
Have yourself a merry little Christmas
Make the Yuletide gay
From now on, our troubles will be miles away
Here we are as in olden days
Happy golden days of yore
Faithful friends who are dear to us
Gather near to us once more
Through the years we all will be together
If the fates allow
So hang a shining star upon the highest bough
And have yourself a merry little Christmas now
 
Have yourself a merry little Christmas
Let your heart be light
From now on, our troubles will be out of sight
Have yourself a merry little Christmas
Make the Yuletide gay

From now on, our troubles will be miles away
Here we are as in olden days
Happy golden days of yore
Faithful friends who are dear to us
Gather near to us once more
Through the years we all will be together
If the fates allow
So hang a shining star upon the highest bough
And have yourself a merry little Christmas now",Have Yourself a Merry Little Christmas
Merle Evans,"I just came back from a lovely trip along the Milky Way
Stopped off at the North Pole to spend a holiday
I called on dear old Santa Claus
To see what I could see
He took me to his workshop 
And told his plans to me, so
 
[Chorus]
You better watch out, you better not cry
Better not pout, I'm telling you why
Santa Claus is comin' to town
He's making a list and checking it twice
Gonna find out who's naughty and nice
Santa Claus is comin' to town
He sees you when you're sleepin'
He knows when you're a wake
He knows if you've been bad or good
So be good for goodness sake
Oh! You better watch out, you better not cry
Better not pout, I'm telling you why
Santa Claus is comin' to town
 
With little tin horns and little toy drums
Rooty toot toots and rummy tum tums
Santa Claus is comin' to town
And curly head dolls that toddle and coo
Elephants, boats, and kiddie cars too
Santa Claus is comin' to town
Then kids in Girl and Boy land will have a jubilee
They're gonna build a Toyland all around the Christmas tree
So! You better watch out, you better not cry
Better not pout, I'm telling you why
Santa Claus is comin' to town
 
Now Santa is a busy man, He has no time to play
He's got millions of stockings to fill on Christmas day
You'd better write your letter now
And mail it right away
Because he's getting ready
His reindeer's and his sleigh. So
 
[Chorus]
 
With little tin horns and little toy drums
Rooty toot toots and rummy tum tums
Santa Claus is comin' to town
And curly head dolls that toddle and coo
Elephants, boats, and kiddie cars too
Santa Claus is comin' to town
Then kids in Girl and Boy land will have a jubilee
They're gonna build a Toyland all around the Christmas tree
So! You better watch out, you better not cry
Better not pout, I'm telling you why
Santa Claus is comin' to town",Santa Claus Is Coming to Town
Merle Haggard,"I'm gonna break every heart I can 
I'd be a find-'em-and-fool-'em man
I'm gonna dedicate my whole life to this one plan
Well if I live and have enough time 
I'll get evil with the woman kind
I'm gonna break every heart I can in everyone I find
I'm gonna think of lot of good lies
I'm gonna laugh when a woman cries
I'm gonna have myself a style to recognize
I'm gonna travel all around the world 
I'd be a thread to the sweetest girl
I'm gonna break every heart I can 
And all my name ain't Merle

Well if I ever get around to you 
You gonna know about the things I do
They gonna tell about the harm 
I've done in the latest news
'Cause if I live and have enough time 
I'll get evil with the woman kind
I'm gonna break every heart 
I can in everyone I find
I'm gonna break every heart I can 
I'd be a love-'em-and-leave-'em man
I'm gonna dedicate my whole life to this one plan

And if I live and have I enough time 
I'll get evil with the woman kind
I'm gonna break every heart I can in everyone I find
I'm gonna break every heart I can in everyone I find",I'm Gonna Break Every Heart I Can
Merle Haggard,"There's a certain hill outside of town called Sam Hill (Sam Hill)
And a certain guy used to go there every day 
They said a certain girl lived up in Sam Hill (Sam Hill)
Aw, a pretty girl, not hep to city ways

This certain guy would come down the hill a smilin'
Headed back to town at the crack of dawn
And he had 'em all a wonderin' what he was doin' 
Yeah, wonderin' what in Sam Hill's goin' on

We knew this certain guy was not a goldminer (goldminer)
'Cause he never took a shovel or a pick 
He only took a little box of candy (candy)
And disappeared in Sam Hill mighty quick

We tried to follow him to his destination 
But he had a secret path and soon he was gone 
And he had us all a wonderin' what he was doin' 
Yeah, wonderin' what in Sam Hill's goin' on
(Wonderin' what in Sam Hill's going on)

I know that you have wondered too about Sam Hill (Sam Hill)
You've probably asked ""What in Sam Hill's goin' on?"" 
All I can say in answer to your question (huh?)
Is the goin's on are still goin' on

This certain guy's still takin' up his candy (candy)
He's 99 and all his youth is gone 
But he climbs that hill and still comes down a smilin' 
And we're wonderin' what in Sam Hill's goin' on 
Wish I knew 
What in Sam Hill's goin' on 
He won't tell us' 
What in Sam Hill's goin' on 
He just snickers 
What in Sam Hill's goin' on",Sam Hill
Merle Haggard,"Sing me a song of sadness
And sing it as blue as I feel
If a tear should appear it's because she's not here
Sing a sad song and sing it for me

She's unhappy with me 
She told me so
I'm unhappy without her
And I still love her so
Oh sing me a song of sadness
Pretend it's the end of the world
Sing it sweet and sing it low
And then I'll have to go sing a sad song
And sing it for me

Sing it sweet and sing it low
And then I'll have to go sing a sad song
And sing it for me",Sing a Sad Song
Merle Haggard,"Now, I won't think about tomorrow
When the happy times are gone away
And good times can't last forever
But the good times are here today

And I won't talk about believin'
If you won't beg me to stay
I wanna live just for the moment
And everything is going my way

And I won't think about tomorrow
When the happy times are gone away
The good times can't last forever
But the good times are here today

I'm not gonna save any money
I'm gonna spend every dime I can
And I'll buy you everything with money can buy
While the good times are here at hand

And I won't think about tomorrow
When the happy times are gone away
Well, the good times can't last forever
But the good times are here today",Good Times
Merle Haggard,"It may be down the south in Alabama
Or maybe just a little old one horse town
It could be on the back streets of Chicago
But if it's home it's still the greatest place around

Home's where the kid grows up and spends his younger days
Home is where I long to be no matter how far away

There may be an old sweetheart still there waitin'
Can't tell I might even find a few old friends
I know my mom and dad would like to see me
And know I want so much to go back home again

Home's where the kid grows up and spends his younger days
Home is where I long to be no matter how far away

It may be down the south in Alabama
Or maybe just a little old one horse town",Home Is Where a Kid Grows Up
Merle Haggard,"If you see my baby while making your rounds
In some crowded nightspot or cafe in town
Tell her I miss her and I'm still around
If you see my baby in this lonesome old town

Tell her to call me when she's all alone
'Cause I'm always waitin' by my telephone
I'd still worship the ground where she walks around
If you see my baby in this lonesome old town

And tell her to call me when she's all alone
'Cause I'm always waitin' by my telephone
I'd still worship the ground where she walks around
If you see my baby in this lonesome old town",If You See My Baby
Merle Haggard,"The girl I love so much just walked in the door
My past is present but she's not mine anymore
Did she stop by to hurt me or does she even know I'm here
My past is present, could it be that she still cares

For without her there's no future, she's close yet far away
I keep hoping that my tomorrows will catch up with yesterday
For time has stopped my world has stopped since she went away
My past is present, I just hope she's back to stay

For time has stopped my world has stopped since she went away
My past is present, I just hope she's back to stay",My Past Is Present
Merle Haggard,"Warm red wine you know that place where you take me some times
Where my caress have wings and fly right off my shoulder
Where I leave my cares behind and for a while find peace of mind

Help me friend of mine wine take me away
Wine take me away where I can lose myself
Take me where I won't even see the light of day
It's my life and I wanna live it it's my will and I wanna give it

Help me friend of mine wine take me away
When my life becomes a grime and when I'm weary and tired
Then I'll tell myself I need a short vacation
I gotta leave this lonely town and you're the quickest way I found
Help me friend of mine wine take me away
Wine take me away
Help me friend of mine wine take me away",Wine Take Me Away
Merle Haggard,"They were so much in love with life, happy in every way
But love the movie began with, some how got lost in the play
Like a fire burning out of control,
You got caught up in the actor's role,
And you cried on my shoulder when it came to an end

But that's all in the movies,
It won't happen to you and I
That's all in the movies so baby don't cry
It's all in the movies
It won't happen to us I know
It's all in the movies,
Just a bad picture show

That's all in the movies 
It won't happen to you and I
That's all in the movies so baby don't cry
It's all in the movies
It can happen to us I know
It's all in the movies,
Just a bad picture show",It's All in the Movies
Merle Haggard,"Big wheels rollin', big wheels rollin'
Movin' on.

Big wheels rollin', gotta keep 'em goin',
Big wheels rollin',
Movin' on.

The white line is the life line to a nation.
And men like Will and Sonny make it move.
Livin' like a gypsy, always on the go
Doin' what they best know how to do.

Jammin' gears has got to be a fever,
'Cause men become addicted to the grind.
It takes a special breed to be a truck drivin' man,
And a steady hand to pull that load behind.

Big wheels rollin', big wheels rollin'
Movin' on.",Movin' On
Merle Haggard,"I left the four lane highway took a blacktop seven miles
Down by the old country school I went to as a child
Two miles down a gravel road I could see the proud old home
A tribute to a way of life that's almost come and gone
The roots of my rasing run deep I come back for the strength that I need
And hope comes no matter how far down I sink the roots of my raising run deep

I pulled into the driveway Lord it sure was good to be there
And I could see that dad was asleep in his favorite chair
In his hand was a picture of mom and I remembered how close they were
So I just turned away I didn't want to wake him spoil his dreams of her

A christian mom who had the strength for life the way she did
Then to pull that apron off and do the Charleston for us kids
Dad a quiet man who's gentle voice was seldom heard
Who could borrow money at the bank simply on his word
The roots of my raisin' run deep I come back for the strength that I need
And hope comes no matter how far down I sink the roots of my raising run deep
The roots of my raising run deep",The Roots of My Raising
Merle Haggard,"I came close so close to failure 
I came close to living alone
I know the kids still love me and their mama 
But I came so close to losing my home

I felt small enough to drown in each teardrop
But big enough to admit I was wrong
When I think of what I've done the chill runs through me
'Cause I came so close to losing my home

I felt small enough to drown in each teardrop
But big enough to admit I was wrong
When I think of what I've done the chill runs through me
'Cause I came so close to losing my home
I came so close to losing my home",I Came So Close to Losing My Home
Merle Haggard,"I come home and I sat down by the door 
I just sat and dream my lonely life away
I just can't stand a thought that I won't see you anymore
I guess I die ten thousand times a day

If that soulful life comes to its end 
I ceased to live the night you went away
If you walk through that door then I'll start to live again
I guess I die ten thousand times a day

I pick up each thing you used to touch
I call to mine each tender word you say
If I've hurt you it's just because I love you much too much
I guess I die ten thousand times a day",I Die Ten Thousand Times a Day
Merle Haggard,"I showed her most of Tennessee that's all I could afford
I even thought of stealing so I could show her more
But she never did seem happy and I often heard her say
Hey I like it here, but I love Montego Bay

Oh I should have gone with her at least I wouldn't know
What about Montego Bay that makes it pull so strong
All I've got's old mem'ries of the way she used to say
Hey I like it here but, I love Montego Bay

Why couldn't I convince her why couldn't I make her see
There's no way Montego Bay needs her more than me
When she left she seemed so happy I can still hear her say
Hey I like it here, but I love Montego Bay

Why couldn't I convince her ?",Montego Bay
